ALTER SYSTEM SET merge_delay_interval='6s' server_type=yaodatasvr;
ALTER SYSTEM SET major_freeze_wait_time='6s' server_type=yaoadminsvr;
ALTER SYSTEM SET  min_major_freeze_interval='5s' server_type=yaotxnsvr;
ALTER SYSTEM SET min_merge_interval='5s' server_type=yaodatasvr;
ALTER SYSTEM SET  max_merge_thread_num='20' server_type=yaodatasvr;
alter system set balance_max_concurrent_migrate_num=30 server_type=yaoadminsvr;
alter system set balance_max_migrate_in_per_ds=6 server_type=yaoadminsvr;
alter system set balance_max_migrate_out_per_ds=6 server_type=yaoadminsvr;
alter system set max_migrate_task_count=6 server_type=yaodatasvr;
create table t5(c1 int primary key, c2 int default 10, c3 bigint default 100,c4 float default 1.11, c5 double default 2.22,
c6 datetime default '2017-09-11 15:36:01', c7 timestamp default '2016-08-12 11:36:01',
c8 date default '2017-09-11', c9 time default '15:36:01',c10 timestamp default 1503799330000000,
c11 varchar(20) default 'aaa', c12 bool default true, c13 bool default 1, c14 decimal(20,2) default 3.33,
c15 tinyint default 2, c16 smallint default 134, c17 mediumint default 178,
c19 real default 5.55, c20 char(5) default 'bbb', c21 binary(4) default '1111',c22 varbinary(4) default '0000');
desc t5;
Field	Type	Null	Key	Default	Extra
c1	int(10)	YES	PRI	NULL	
c2	int(10)	YES		10	
c3	bigint	YES		100	
c4	float	YES		1.11	
c5	double	YES		2.22	
c6	timestamp	YES		2017-09-11 15:36:01	
c7	timestamp	YES		2016-08-12 11:36:01	
c8	date	YES		2017-09-11	
c9	time	YES		15:36:01	
c10	timestamp	YES		1503799330000000	
c11	varchar(20)	YES		aaa	
c12	bool	YES		1	
c13	bool	YES		1	
c14	decimal(20,2)	YES		3.33	
c15	int(3)	YES		2	
c16	int(5)	YES		134	
c17	int(8)	YES		178	
c19	double	YES		5.55	
c20	varchar(5)	YES		bbb	
c21	varchar(4)	YES		1111	
c22	varchar(4)	YES		0000	
insert into t5(c1) values(1);
replace into t5(c1) values(2);
replace into t5(c1,c2) values(1,default);
replace into t5(c1,c2) values(2,default);
select * from t5;
c1	c2	c3	c4	c5	c6	c7	c8	c9	c10	c11	c12	c13	c14	c15	c16	c17	c19	c20	c21	c22
1	10	100	1.11	2.22	2017-09-11 15:36:01.000000	2016-08-12 11:36:01.000000	2017-09-11	15:36:01	2017-08-27 10:02:10.000000	aaa	1	1	3.33	2	134	178	5.55	bbb	1111	0000
2	10	100	1.11	2.22	2017-09-11 15:36:01.000000	2016-08-12 11:36:01.000000	2017-09-11	15:36:01	2017-08-27 10:02:10.000000	aaa	1	1	3.33	2	134	178	5.55	bbb	1111	0000
insert into t5 values(3, default, default, default, default, default, default, default, default, default, default, default, default, default, default, default, default, default, default, default, default);
alter table t5 alter column c2 drop default;
insert into t5 values(3, default, default, default, default, default, default, default, default, default, default, default, default, default, default, default, default, default, default, default, default);
ERROR HY000: YAO-5425: Field c2 doesn't have a default value
select * from t5;
c1	c2	c3	c4	c5	c6	c7	c8	c9	c10	c11	c12	c13	c14	c15	c16	c17	c19	c20	c21	c22
1	10	100	1.11	2.22	2017-09-11 15:36:01.000000	2016-08-12 11:36:01.000000	2017-09-11	15:36:01	2017-08-27 10:02:10.000000	aaa	1	1	3.33	2	134	178	5.55	bbb	1111	0000
2	10	100	1.11	2.22	2017-09-11 15:36:01.000000	2016-08-12 11:36:01.000000	2017-09-11	15:36:01	2017-08-27 10:02:10.000000	aaa	1	1	3.33	2	134	178	5.55	bbb	1111	0000
3	10	100	1.11	2.22	2017-09-11 15:36:01.000000	2016-08-12 11:36:01.000000	2017-09-11	15:36:01	2017-08-27 10:02:10.000000	aaa	1	1	3.33	2	134	178	5.55	bbb	1111	0000
update t5 set c3=99 where c1=1;
select * from t5;
c1	c2	c3	c4	c5	c6	c7	c8	c9	c10	c11	c12	c13	c14	c15	c16	c17	c19	c20	c21	c22
1	10	99	1.11	2.22	2017-09-11 15:36:01.000000	2016-08-12 11:36:01.000000	2017-09-11	15:36:01	2017-08-27 10:02:10.000000	aaa	1	1	3.33	2	134	178	5.55	bbb	1111	0000
2	10	100	1.11	2.22	2017-09-11 15:36:01.000000	2016-08-12 11:36:01.000000	2017-09-11	15:36:01	2017-08-27 10:02:10.000000	aaa	1	1	3.33	2	134	178	5.55	bbb	1111	0000
3	10	100	1.11	2.22	2017-09-11 15:36:01.000000	2016-08-12 11:36:01.000000	2017-09-11	15:36:01	2017-08-27 10:02:10.000000	aaa	1	1	3.33	2	134	178	5.55	bbb	1111	0000
update t5 set c3=default where c1=1;
select * from t5;
c1	c2	c3	c4	c5	c6	c7	c8	c9	c10	c11	c12	c13	c14	c15	c16	c17	c19	c20	c21	c22
1	10	100	1.11	2.22	2017-09-11 15:36:01.000000	2016-08-12 11:36:01.000000	2017-09-11	15:36:01	2017-08-27 10:02:10.000000	aaa	1	1	3.33	2	134	178	5.55	bbb	1111	0000
2	10	100	1.11	2.22	2017-09-11 15:36:01.000000	2016-08-12 11:36:01.000000	2017-09-11	15:36:01	2017-08-27 10:02:10.000000	aaa	1	1	3.33	2	134	178	5.55	bbb	1111	0000
3	10	100	1.11	2.22	2017-09-11 15:36:01.000000	2016-08-12 11:36:01.000000	2017-09-11	15:36:01	2017-08-27 10:02:10.000000	aaa	1	1	3.33	2	134	178	5.55	bbb	1111	0000
select * from t5;
c1	c2	c3	c4	c5	c6	c7	c8	c9	c10	c11	c12	c13	c14	c15	c16	c17	c19	c20	c21	c22
1	10	100	1.11	2.22	2017-09-11 15:36:01.000000	2016-08-12 11:36:01.000000	2017-09-11	15:36:01	2017-08-27 10:02:10.000000	aaa	1	1	3.33	2	134	178	5.55	bbb	1111	0000
2	10	100	1.11	2.22	2017-09-11 15:36:01.000000	2016-08-12 11:36:01.000000	2017-09-11	15:36:01	2017-08-27 10:02:10.000000	aaa	1	1	3.33	2	134	178	5.55	bbb	1111	0000
3	10	100	1.11	2.22	2017-09-11 15:36:01.000000	2016-08-12 11:36:01.000000	2017-09-11	15:36:01	2017-08-27 10:02:10.000000	aaa	1	1	3.33	2	134	178	5.55	bbb	1111	0000
drop table t5;
