ALTER SYSTEM SET merge_delay_interval='6s' server_type=yaodatasvr;
ALTER SYSTEM SET major_freeze_wait_time='6s' server_type=yaoadminsvr;
ALTER SYSTEM SET  min_major_freeze_interval='5s' server_type=yaotxnsvr;
ALTER SYSTEM SET min_merge_interval='5s' server_type=yaodatasvr;
ALTER SYSTEM SET  max_merge_thread_num='20' server_type=yaodatasvr;
alter system set balance_max_concurrent_migrate_num=30 server_type=yaoadminsvr;
alter system set balance_max_migrate_in_per_ds=6 server_type=yaoadminsvr;
alter system set balance_max_migrate_out_per_ds=6 server_type=yaoadminsvr;
alter system set max_migrate_task_count=6 server_type=yaodatasvr;
create table t6(c1 int primary key, c2 int default 10, c3 bigint default 100,c4 float default 1.11, c5 double default 2.22,
c6 datetime default '2017-09-11 15:36:01', c7 timestamp default '2016-08-12 11:36:01',
c8 date default '2017-09-11', c9 time default '15:36:01',c10 timestamp default 1503799330000000,
c11 varchar(20) default 'aaa', c12 bool default true, c13 bool default 1, c14 decimal(20,2) default 3.33,
c15 tinyint default 2, c16 smallint default 134, c17 mediumint default 178,
c19 real default 5.55, c20 char(5) default 'bbb', c21 binary(4) default '1111',c22 varbinary(4) default '0000');
insert into t6 values(1, default, default, default, default, default, default, default, default, default, default, default, default, default, default, default, default, default, default, default, default);
replace into t6 values(2, default, default, default, default, default, default, default, default, default, default, default, default, default, default, default, default, default, default, default, default);
insert into t6 values(3, 1, 1, 1, 1, '2017-09-11 00:00:00', '2017-09-11 00:00:00', '2017-11-24', '09:12:00', 1503799330000001, 'kxb', false, 0, 1.11, 3, 157, 257, 5.11, 'ccc', '0101', '1111');
ERROR HY000: YAO-2: Invalid argument
select * from t6;
c1	c2	c3	c4	c5	c6	c7	c8	c9	c10	c11	c12	c13	c14	c15	c16	c17	c19	c20	c21	c22
1	10	100	1.11	2.22	2017-09-11 15:36:01.000000	2016-08-12 11:36:01.000000	2017-09-11	15:36:01	2017-08-27 10:02:10.000000	aaa	1	1	3.33	2	134	178	5.55	bbb	1111	0000
2	10	100	1.11	2.22	2017-09-11 15:36:01.000000	2016-08-12 11:36:01.000000	2017-09-11	15:36:01	2017-08-27 10:02:10.000000	aaa	1	1	3.33	2	134	178	5.55	bbb	1111	0000
update t6 set c2=default, c3=default, c4=default, c5=default, c6=default, c7=default, c8=default, c9=default, c10=default, c11=default, c12=default, c13=default, c14=default, c15=default, c16=default, c17=default, c19=default, c20=default, c21=default where c1=3;
select * from t6;
c1	c2	c3	c4	c5	c6	c7	c8	c9	c10	c11	c12	c13	c14	c15	c16	c17	c19	c20	c21	c22
1	10	100	1.11	2.22	2017-09-11 15:36:01.000000	2016-08-12 11:36:01.000000	2017-09-11	15:36:01	2017-08-27 10:02:10.000000	aaa	1	1	3.33	2	134	178	5.55	bbb	1111	0000
2	10	100	1.11	2.22	2017-09-11 15:36:01.000000	2016-08-12 11:36:01.000000	2017-09-11	15:36:01	2017-08-27 10:02:10.000000	aaa	1	1	3.33	2	134	178	5.55	bbb	1111	0000
select * from t6;
c1	c2	c3	c4	c5	c6	c7	c8	c9	c10	c11	c12	c13	c14	c15	c16	c17	c19	c20	c21	c22
1	10	100	1.11	2.22	2017-09-11 15:36:01.000000	2016-08-12 11:36:01.000000	2017-09-11	15:36:01	2017-08-27 10:02:10.000000	aaa	1	1	3.33	2	134	178	5.55	bbb	1111	0000
2	10	100	1.11	2.22	2017-09-11 15:36:01.000000	2016-08-12 11:36:01.000000	2017-09-11	15:36:01	2017-08-27 10:02:10.000000	aaa	1	1	3.33	2	134	178	5.55	bbb	1111	0000
drop table t6;
