ALTER SYSTEM SET merge_delay_interval='6s' server_type=yaodatasvr;
ALTER SYSTEM SET major_freeze_wait_time='6s' server_type=yaoadminsvr;
ALTER SYSTEM SET  min_major_freeze_interval='5s' server_type=yaotxnsvr;
ALTER SYSTEM SET min_merge_interval='5s' server_type=yaodatasvr;
ALTER SYSTEM SET  max_merge_thread_num='20' server_type=yaodatasvr;
drop table if exists t1;
drop table if exists t1,t2;
create table t1(c1 int auto_increment, c2 int, primary key(c1));
insert into t1 values(NULL),(NULL);
ERROR HY000: YAO-5007: too few value, value num[2], column num[1]
insert into t1 values(NULL,1),(NULL,2);
ERROR 23000: YAO-5024: Duplicate entry 'null:' for key 'PRIMARY'
insert into t1 values(1,2,3);
ERROR HY000: YAO-5007: too many value, value num[2], column num[3]
insert into t1 values(null,2);
update t1 set c2=3 where c1=null;
update t1 set c2=2 where c1=1;
select * from t1;
c1	c2
NULL	2
drop table t1;
create table t1(c1 int primary key, c2 int);
insert into t1 values(1,1),(2,2);
update t1 set c2=0 where c1=1;
select * from t1;
c1	c2
1	0
2	2
update t1 set c2=0 where c1=2 and c2=1;
select * from t1;
c1	c2
1	0
2	2
update t1 set c2=0 where c1=2 and c2=2;
select * from t1;
c1	c2
1	0
2	0
drop table t1;
create table t1(c1 varchar(30) primary key, c2 varchar(30));
insert into t1 values(1,1),(2,2);
update t1 set c2=0 where c1=1;
select * from t1;
c1	c2
1	0
2	2
update t1 set c2=0 where c1=2 and c2=1;
select * from t1;
c1	c2
1	0
2	2
update t1 set c2=0 where c1=2 and c2=2;
select * from t1;
c1	c2
1	0
2	0
drop table t1;
create table t1(c1 int primary key, c2 int, c3 int);
insert into t1 values(1,1,1),(2,1,1),(3,NULL,NULL),(4,1,1);
update t1 set c2=0 where c1=1;
update t1 set c2=2 where c1=1 and c2=0;
update t1 set c2=3 where c1=1 and c2=0;
update t1 set c2=0 where c1=2 or c2=1;
update t1 set c2=0 where c1=2 and c2=1;
update t1 set c2=0 where c1=3 and c2=NULL;
update t1 set c2=0 where c1=3 and c2 is NULL;
update t1 set c2=NULL where c1=3 and c2=0;
update t1 set c2=0 where c1=4 and (c2=2 or c2=3);
update t1 set c2=0 where c1=4 and (c2=2 or c2=1);
update t1 set c2=10 where c1=4 and (c2=2 or c2=0);
select * from t1;
c1	c2	c3
1	2	1
2	0	1
3	NULL	NULL
4	10	1
drop table t1;
create table t1(c1 int primary key,c2 int,c3 int);
insert into t1 values(1,2,3);
insert into t1 values(1,2);
ERROR HY000: YAO-5007: too few value, value num[3], column num[2]
insert into t1(c1,c2) values(3);
ERROR HY000: YAO-5007: too few value, value num[2], column num[1]
create table t2(c1 int primary key,c2 int,c3 int);
insert into t2 values(5,6,7);
insert into t1 select c1,c3 from t2;
ERROR HY000: YAO-5007: select values are not match insert columns
