ALTER SYSTEM SET merge_delay_interval='6s' server_type=yaodatasvr;
ALTER SYSTEM SET major_freeze_wait_time='6s' server_type=yaoadminsvr;
ALTER SYSTEM SET  min_major_freeze_interval='5s' server_type=yaotxnsvr;
ALTER SYSTEM SET min_merge_interval='5s' server_type=yaodatasvr;
ALTER SYSTEM SET  max_merge_thread_num='20' server_type=yaodatasvr;
alter system set balance_max_concurrent_migrate_num=30 server_type=yaoadminsvr;
alter system set balance_max_migrate_in_per_ds=6 server_type=yaoadminsvr;
alter system set balance_max_migrate_out_per_ds=6 server_type=yaoadminsvr;
alter system set max_migrate_task_count=6 server_type=yaodatasvr;
create database rowkey_database;
using database rowkey_database;
create table if not exists t1(id1 int,id2 bigint, id3 datetime, id4 varchar(30), id5 bool, id6 decimal(10,1), id7 double, id8 float, id9 int, col1 int, col2 bigint, col3 datetime, col4 varchar(30), col5 bool, col6 decimal(10,1), col7 double, col8 float, primary key(id1,id2,id3,id4,id5,id6,id7,id8,id9));
create table if not exists t2(id1 int,id2 bigint, id3 datetime, id4 varchar(30), id5 bool, id6 decimal(10,1), id7 double, id8 float, id9 int, col1 int, col2 bigint, col3 datetime, col4 varchar(30), col5 bool, col6 decimal(10,1), col7 double, col8 float, primary key(id1,id2,id3,id4,id5,id6,id7,id8,id9));
create table if not exists t3(id1 int,id2 bigint, id3 datetime, id4 varchar(30), id5 bool, id6 decimal(10,1), id7 double, id8 float, id9 int, col1 int, col2 bigint, col3 datetime, col4 varchar(30), col5 bool, col6 decimal(10,1), col7 double, col8 float, primary key(id1,id2,id3,id4,id5,id6,id7,id8,id9));
create table if not exists t4(id1 int,id2 bigint, id3 datetime, id4 varchar(30), id5 bool, id6 decimal(10,1), id7 double, id8 float, id9 int, col1 int, col2 bigint, col3 datetime, col4 varchar(30), col5 bool, col6 decimal(10,1), col7 double, col8 float, primary key(id1,id2,id3,id4,id5,id6,id7,id8,id9));
create table if not exists t5(id1 int,id2 bigint, id3 datetime, id4 varchar(30), id5 bool, id6 decimal(10,1), id7 double, id8 float, id9 int, col1 int, col2 bigint, col3 datetime, col4 varchar(30), col5 bool, col6 decimal(10,1), col7 double, col8 float, primary key(id1,id2,id3,id4,id5,id6,id7,id8,id9));
create table if not exists t6(id1 int,id2 bigint, id3 datetime, id4 varchar(30), id5 bool, id6 decimal(10,1), id7 double, id8 float, id9 int, col1 int, col2 bigint, col3 datetime, col4 varchar(30), col5 bool, col6 decimal(10,1), col7 double, col8 float, primary key(id1,id2,id3,id4,id5,id6,id7,id8,id9));
create table if not exists t7(id1 int,id2 bigint, id3 datetime, id4 varchar(30), id5 bool, id6 decimal(10,1), id7 double, id8 float, id9 int, col1 int, col2 bigint, col3 datetime, col4 varchar(30), col5 bool, col6 decimal(10,1), col7 double, col8 float, primary key(id1,id2,id3,id4,id5,id6,id7,id8,id9));
create table if not exists t8(id1 int,id2 bigint, id3 datetime, id4 varchar(30), id5 bool, id6 decimal(10,1), id7 double, id8 float, id9 int, col1 int, col2 bigint, col3 datetime, col4 varchar(30), col5 bool, col6 decimal(10,1), col7 double, col8 float, primary key(id1,id2,id3,id4,id5,id6,id7,id8,id9));
create table t9(id1 int primary key,col1 int);
create table t10(id1 int primary key,col1 int);
create table t11(id1 int primary key,col1 int);
create table t12(id1 int primary key,col1 int);
create table t13(id1 int,id2 int,col1 int,col2 int,primary key(id1,id2));
create table t14(id1 int primary key,col1 int);
create table t15(id1 int primary key,col1 int);
create table t16(id1 int primary key,col1 int);
create table t17(id1 int,id2 int,col1 int,col2 int,primary key(id1,id2));
create table t18(id1 int primary key,col1 int);
create index i1 on t1(col1,col2,col3);
create index i2 on t2(col1,col2,col3);
create index i3 on t3(col1,col2,col3);
create index i4 on t4(col1,col2,col3);
create index i5 on t5(col1,col2,col3);
create index i6 on t6(col1,col2,col3);
create index i7 on t7(col1,col2,col3);
create index i8 on t8(col1,col2,col3);
create index i9 on t9(col1);
create index i10 on t10(col1);
create index i11 on t11(col1);
create index i12 on t12(col1);
create index i13 on t13(col1);
create index i14 on t14(col1);
create index i15 on t15(col1);
create index i16 on t16(col1);
create index i17 on t17(col1);
create index i18 on t18(col1);
"merge"
major_freeze...
merge: DONE
show index on t1;
index_name	status	index_type
__3001__idx__i1	1	0
replace into t1 values(0, 1, '1000-10-10 10:10:10', 'aaa', true, 1.1, 2.2, 3.3, 1, 2, 3, '1000-10-10 10:10:10', 'bbb', true, 1.1, 2.2, 3.3);
update t1 set id1=9,id2=9,id3='1111-11-11 11:11:11',id4='000',id5=0,id6=0.0,id7=0.0,id8=0.0,id9=0, col1=0,col2=0,col3='1111-11-11 11:11:11',col4='000',col5=0,col6=0.0,col7=0.0,col8=0.0 where id1=0 and id2=1 and id3='1000-10-10 10:10:10' and id4='aaa' and id5=true and id6=1.1 and id7=2.2 and id8='3.3' and id9=1;
select * from t1;
id1	id2	id3	id4	id5	id6	id7	id8	id9	col1	col2	col3	col4	col5	col6	col7	col8
9	9	1111-11-11 11:11:11.000000	000	0	0	0	0	0	0	0	1111-11-11 11:11:11.000000	000	0	0	0	0
drop table if exists t1;
show index on t2;
index_name	status	index_type
__3002__idx__i2	1	0
replace into t2 values(0, 1, '1000-10-10 10:10:10', 'aaa', true, 1.1, 2.2, 3.3, 1, 2, 3, '1000-10-10 10:10:10', 'bbb', true, 1.1, 2.2, 3.3);
replace into t2 values(1, 1, '1000-10-10 10:10:10', 'aaa', true, 1.1, 2.2, 3.3, 1, 2, 3, '1000-10-10 10:10:10', 'bbb', true, 1.1, 2.2, 3.3);
replace into t2 values(2, 1, '1000-10-10 10:10:10', 'aaa', true, 1.1, 2.2, 3.3, 1, 2, 3, '1000-10-10 10:10:10', 'bbb', true, 1.1, 2.2, 3.3);
update t2 set id1=9,id2=9,id3='1111-11-11 11:11:11',id4='000',id5=0,id6=0.0,id7=0.0,id8=0.0,id9=0, col1=0,col2=0,col3='1111-11-11 11:11:11',col4='000',col5=0,col6=0.0,col7=0.0,col8=0.0 where id1>=0;
ERROR 25S03: YAO-119: Duplicated primary key, error code = -5024
select * from t2;
id1	id2	id3	id4	id5	id6	id7	id8	id9	col1	col2	col3	col4	col5	col6	col7	col8
0	1	1000-10-10 10:10:10.000000	aaa	1	1.1	2.2	3.3	1	2	3	1000-10-10 10:10:10.000000	bbb	1	1.1	2.2	3.3
1	1	1000-10-10 10:10:10.000000	aaa	1	1.1	2.2	3.3	1	2	3	1000-10-10 10:10:10.000000	bbb	1	1.1	2.2	3.3
2	1	1000-10-10 10:10:10.000000	aaa	1	1.1	2.2	3.3	1	2	3	1000-10-10 10:10:10.000000	bbb	1	1.1	2.2	3.3
drop table if exists t2;
show index on t3;
index_name	status	index_type
__3003__idx__i3	1	0
replace into t3 values(0, 1, '1000-10-10 10:10:10', 'aaa', true, 1.1, 2.2, 3.3, 1, 2, 3, '1000-10-10 10:10:10', 'bbb', true, 1.1, 2.2, 3.3);
update t3 set id1=id1+9,id2=id2+9,id3='1111-11-11 11:11:11',id5=id5+10,id6=id6+10.0,id7=id7+10.0,id8=id8+10.0,id9=id9+10, col1=col1+0,col2=col2+0,col3='1111-11-11 11:11:11',col5=col5+10,col6=col6+10.0,col7=col7+10.0,col8=col8+10.0 where id1=0 and id2=1 and id3='1000-10-10 10:10:10' and id4='aaa' and id5=true and id6=1.1 and id7=2.2 and id8='3.3' and id9=1;
select * from t3;
id1	id2	id3	id4	id5	id6	id7	id8	id9	col1	col2	col3	col4	col5	col6	col7	col8
9	10	1111-11-11 11:11:11.000000	aaa	1	11.1	12.2	13.3	11	2	3	1111-11-11 11:11:11.000000	bbb	1	11.1	12.2	13.3
drop table if exists t3;
show index on t4;
index_name	status	index_type
__3004__idx__i4	1	0
replace into t4 values(0, 1, '1000-10-10 10:10:10', 'aaa', true, 1.1, 2.2, 3.3, 1, 2, 3, '1000-10-10 10:10:10', 'bbb', true, 1.1, 2.2, 3.3);
replace into t4 values(1, 1, '1000-10-10 10:10:10', 'aaa', true, 1.1, 2.2, 3.3, 1, 2, 3, '1000-10-10 10:10:10', 'bbb', true, 1.1, 2.2, 3.3);
replace into t4 values(2, 1, '1000-10-10 10:10:10', 'aaa', true, 1.1, 2.2, 3.3, 1, 2, 3, '1000-10-10 10:10:10', 'bbb', true, 1.1, 2.2, 3.3);
update t4 set id1=id1+9,id2=id2+9,id3='1111-11-11 11:11:11',id5=id5+10,id6=id6+10.0,id7=id7+10.0,id8=id8+10.0,id9=id9+10, col1=col1+0,col2=col2+0,col3='1111-11-11 11:11:11',col5=col5+10,col6=col6+10.0,col7=col7+10.0,col8=col8+10.0 where id1>=0;
select * from t4;
id1	id2	id3	id4	id5	id6	id7	id8	id9	col1	col2	col3	col4	col5	col6	col7	col8
9	10	1111-11-11 11:11:11.000000	aaa	1	11.1	12.2	13.3	11	2	3	1111-11-11 11:11:11.000000	bbb	1	11.1	12.2	13.3
10	10	1111-11-11 11:11:11.000000	aaa	1	11.1	12.2	13.3	11	2	3	1111-11-11 11:11:11.000000	bbb	1	11.1	12.2	13.3
11	10	1111-11-11 11:11:11.000000	aaa	1	11.1	12.2	13.3	11	2	3	1111-11-11 11:11:11.000000	bbb	1	11.1	12.2	13.3
drop table if exists t4;
show index on t5;
index_name	status	index_type
__3005__idx__i5	1	0
replace into t5 values(0, 1, '1000-10-10 10:10:10', 'aaa', true, 1.1, 2.2, 3.3, 1, 2, 3, '1000-10-10 10:10:10', 'bbb', true, 1.1, 2.2, 3.3);
update t5 set id1=id1+9,id2=id2+9,id3='1111-11-11 11:11:11',id4='ccc',id5=id5+10,id6=id6+10.0,id7=id7+10.0,id8=id8+10.0,id9=id9+10 where id1=0 and id2=1 and id3='1000-10-10 10:10:10' and id4='aaa' and id5=true and id6=1.1 and id7=2.2 and id8='3.3' and id9=1;
select * from t5;
id1	id2	id3	id4	id5	id6	id7	id8	id9	col1	col2	col3	col4	col5	col6	col7	col8
9	10	1111-11-11 11:11:11.000000	ccc	1	11.1	12.2	13.3	11	2	3	1000-10-10 10:10:10.000000	bbb	1	1.1	2.2	3.3
drop table if exists t5;
show index on t6;
index_name	status	index_type
__3006__idx__i6	1	0
replace into t6 values(0, 1, '1000-10-10 10:10:10', 'aaa', true, 1.1, 2.2, 3.3, 1, 2, 3, '1000-10-10 10:10:10', 'bbb', true, 1.1, 2.2, 3.3);
replace into t6 values(1, 1, '1000-10-10 10:10:10', 'aaa', true, 1.1, 2.2, 3.3, 1, 2, 3, '1000-10-10 10:10:10', 'bbb', true, 1.1, 2.2, 3.3);
replace into t6 values(2, 1, '1000-10-10 10:10:10', 'aaa', true, 1.1, 2.2, 3.3, 1, 2, 3, '1000-10-10 10:10:10', 'bbb', true, 1.1, 2.2, 3.3);
update t6 set id1=id1+9,id2=id2+9,id3='1111-11-11 11:11:11',id4='ccc',id5=id5+10,id6=id6+10.0,id7=id7+10.0,id8=id8+10.0,id9=id9+10 where id1>=0;
select * from t6;
id1	id2	id3	id4	id5	id6	id7	id8	id9	col1	col2	col3	col4	col5	col6	col7	col8
9	10	1111-11-11 11:11:11.000000	ccc	1	11.1	12.2	13.3	11	2	3	1000-10-10 10:10:10.000000	bbb	1	1.1	2.2	3.3
10	10	1111-11-11 11:11:11.000000	ccc	1	11.1	12.2	13.3	11	2	3	1000-10-10 10:10:10.000000	bbb	1	1.1	2.2	3.3
11	10	1111-11-11 11:11:11.000000	ccc	1	11.1	12.2	13.3	11	2	3	1000-10-10 10:10:10.000000	bbb	1	1.1	2.2	3.3
drop table if exists t6;
show index on t7;
index_name	status	index_type
__3007__idx__i7	1	0
replace into t7 values(0, 1, '1000-10-10 10:10:10', 'aaa', true, 1.1, 2.2, 3.3, 1, 2, 3, '1000-10-10 10:10:10', 'bbb', true, 1.1, 2.2, 3.3);
update t7 set id1=9,id3='1111-11-11 11:11:11',id5=0,id7=0.0,id9=0,col2=0,col4='000',col6=0.0,col8=0.0 where id1=0 and id2=1 and id3='1000-10-10 10:10:10' and id4='aaa' and id5=true and id6=1.1 and id7=2.2 and id8='3.3' and id9=1;
select * from t7;
id1	id2	id3	id4	id5	id6	id7	id8	id9	col1	col2	col3	col4	col5	col6	col7	col8
9	1	1111-11-11 11:11:11.000000	aaa	0	1.1	0	3.3	0	2	0	1000-10-10 10:10:10.000000	000	1	0	2.2	0
drop table if exists t7;
show index on t8;
index_name	status	index_type
__3008__idx__i8	1	0
replace into t8 values(0, 1, '1000-10-10 10:10:10', 'aaa', true, 1.1, 2.2, 3.3, 1, 2, 3, '1000-10-10 10:10:10', 'bbb', true, 1.1, 2.2, 3.3);
replace into t8 values(1, 1, '1000-10-10 10:10:10', 'aaa', true, 1.1, 2.2, 3.3, 1, 2, 3, '1000-10-10 10:10:10', 'bbb', true, 1.1, 2.2, 3.3);
replace into t8 values(2, 1, '1000-10-10 10:10:10', 'aaa', true, 1.1, 2.2, 3.3, 1, 2, 3, '1000-10-10 10:10:10', 'bbb', true, 1.1, 2.2, 3.3);
update t8 set id1=9,id3='1111-11-11 11:11:11',id5=0,id7=0.0,id9=0,col2=0,col4='000',col6=0.0,col8=0.0 where id1>=0;
ERROR 25S03: YAO-119: Duplicated primary key, error code = -5024
select * from t8;
id1	id2	id3	id4	id5	id6	id7	id8	id9	col1	col2	col3	col4	col5	col6	col7	col8
0	1	1000-10-10 10:10:10.000000	aaa	1	1.1	2.2	3.3	1	2	3	1000-10-10 10:10:10.000000	bbb	1	1.1	2.2	3.3
1	1	1000-10-10 10:10:10.000000	aaa	1	1.1	2.2	3.3	1	2	3	1000-10-10 10:10:10.000000	bbb	1	1.1	2.2	3.3
2	1	1000-10-10 10:10:10.000000	aaa	1	1.1	2.2	3.3	1	2	3	1000-10-10 10:10:10.000000	bbb	1	1.1	2.2	3.3
drop table if exists t8;
show index on t9;
index_name	status	index_type
__3009__idx__i9	1	0
replace into t9 values(0, 0);
replace into t9 values(1, 0);
update t9 set id1=0,col1=1 where id1=0;
select * from t9;
id1	col1
0	1
1	0
drop table if exists t9;
show index on t10;
index_name	status	index_type
__3010__idx__i10	1	0
replace into t10 values(0, 0);
replace into t10 values(1, 0);
replace into t10 values(2, 0);
update t10 set id1=col1 where id1>=0;
ERROR 25S03: YAO-119: Duplicated primary key, error code = -5024
select * from t10;
id1	col1
0	0
1	0
2	0
drop table if exists t10;
show index on t11;
index_name	status	index_type
__3011__idx__i11	1	0
replace into t11 values(0, 0);
update t11 set id1=id1+1, id1=2, col1=1 where id1=0;
select * from t11;
id1	col1
2	1
drop table if exists t11;
show index on t12;
index_name	status	index_type
__3012__idx__i12	1	0
replace into t12 values(0, 0);
replace into t12 values(1, 0);
replace into t12 values(2, 0);
update t12 set id1=id1+10, id1=10 where id1>=0;
ERROR 25S03: YAO-119: Duplicated primary key, error code = -5024
select * from t12;
id1	col1
0	0
1	0
2	0
drop table if exists t12;
show index on t13;
index_name	status	index_type
__3013__idx__i13	1	0
replace into t13 values(0, 0, 0, 0);
replace into t13 values(1, 0, 0, 0);
replace into t13 values(2, 0, 0, 0);
update t13 set id1=id1+0, col1=1 where id1>=0;
select * from t13;
id1	id2	col1	col2
0	0	1	0
1	0	1	0
2	0	1	0
drop table if exists t13;
show index on t14;
index_name	status	index_type
__3014__idx__i14	1	0
create sequence seq;
replace into t14 values(0, 0);
replace into t14 values(1, 0);
replace into t14 values(2, 0);
update t14 set id1=col1+nextval for seq where id1>=0;
ERROR HY000: YAO-163: The function is NOT support for update rowkey
select * from t14;
id1	col1
0	0
1	0
2	0
drop sequence seq;
drop table if exists t14;
show index on t15;
index_name	status	index_type
__3015__idx__i15	1	0
create sequence seq;
replace into t15 values(0, 0);
update t15 set id1=id1+1,id1=2,col1=nextval for seq where id1=0;
ERROR HY000: YAO-163: The function is NOT support for update rowkey
select * from t15;
id1	col1
0	0
drop sequence seq;
drop table if exists t15;
show index on t16;
index_name	status	index_type
__3016__idx__i16	1	0
create sequence seq;
replace into t16 values(0, 0);
replace into t16 values(1, 0);
replace into t16 values(2, 0);
update t16 set id1=nextval for seq where id1>=0;
ERROR HY000: YAO-163: The function is NOT support for update rowkey
select * from t16;
id1	col1
0	0
1	0
2	0
drop sequence seq;
drop table if exists t16;
show index on t17;
index_name	status	index_type
__3017__idx__i17	1	0
create sequence seq;
replace into t17 values(0, 0, 0, 0);
replace into t17 values(1, 0, 0, 0);
replace into t17 values(2, 0, 0, 0);
update t17 set id1=id1+0,col1=nextval for seq where id1>=0;
ERROR HY000: YAO-163: The function is NOT support for update rowkey
select * from t17;
id1	id2	col1	col2
0	0	0	0
1	0	0	0
2	0	0	0
drop sequence seq;
drop table if exists t17;
show index on t18;
index_name	status	index_type
__3018__idx__i18	1	0
create sequence seq;
select nextval for seq;
nextval for seq
1
replace into t18 values(1,1);
update t18 set id1=nextval for seq where col1=prevval for seq;
ERROR HY000: YAO-163: The function is NOT support for update rowkey
select * from t18;
id1	col1
1	1
drop sequence seq;
drop table if exists t18;
