ALTER SYSTEM SET merge_delay_interval='6s' server_type=yaodatasvr;
ALTER SYSTEM SET major_freeze_wait_time='6s' server_type=yaoadminsvr;
ALTER SYSTEM SET  min_major_freeze_interval='5s' server_type=yaotxnsvr;
ALTER SYSTEM SET min_merge_interval='5s' server_type=yaodatasvr;
ALTER SYSTEM SET  max_merge_thread_num='20' server_type=yaodatasvr;
create database statistics_info;
using database statistics_info;
set yao_enable_query_optimizer=true;
create table t1(c1 int,c2 datetime,c3 varchar(20),c4 int,c5 datetime,c6 varchar(20),c7 decimal(10, 1), c8 double, c9 float, primary key(c1,c2,c3));
insert into t1 values (0,'1000-10-10 10:10:10', 'aaa', 3, '1000-10-10 10:10:10', 'bbb', 1.1, 2.2, 3.3);
insert into t1 values (1,'1000-10-10 10:10:10', 'aaa', 4, '1000-10-10 10:10:11', 'ccc', 1.2, 2.3, 3.4);
insert into t1 values (2,'1000-10-10 10:10:10', 'aaa', 5, '1000-10-10 10:10:12', 'ddd', 1.3, 2.4, 3.5);
insert into t1 values (3,'1000-10-10 10:10:10', 'aaa', 6, '1000-10-10 10:10:13', 'eee', 1.4, 2.5, 3.6);
insert into t1 values (4,'1000-10-10 10:10:10', 'aaa', 7, '1000-10-10 10:10:14', 'fff', 1.5, 2.6, 3.7);
insert into t1 values (5,'1000-10-10 10:10:10', 'aaa', 8, '1000-10-10 10:10:15', 'ggg', 1.6, 2.7, 3.8);
insert into t1 values (6,'1000-10-10 10:10:10', 'aaa', 9, '1000-10-10 10:10:16', 'hhh', 1.7, 2.8, 3.9);
insert into t1 values (7,'1000-10-10 10:10:10', 'aaa', 10, '1000-10-10 10:10:17', 'iii', 1.8, 2.9, 4.0);
insert into t1 values (8,'1000-10-10 10:10:10', 'aaa', 11, '1000-10-10 10:10:18', 'jjj', 1.9, 3.0, 4.1);
insert into t1 values (9,'1000-10-10 10:10:10', 'aaa', 12, '1000-10-10 10:10:19', 'kkk', 2.0, 3.1, 4.2);
insert into t1 values (10,'1000-10-10 10:10:10', 'aaa', 11, '1000-10-10 10:10:19', 'kkk', 2.0, 3.1, 4.2);
create table t2(c1 int,c2 datetime,c3 varchar(20),c4 int,c5 datetime,c6 varchar(20),c7 decimal(10, 1), c8 double, c9 float, primary key(c1));
insert into t2 values (1,'2020-03-13 10:10:10', 'aaa', 6, '1000-10-10 10:10:13', 'eee', 1.4, 2.5, 3.6);
insert into t2 values (2,'2020-03-13 10:10:10', 'aaa', 7, '1000-10-10 10:10:14', 'fff', 1.5, 2.6, 3.7);
insert into t2 values (3,'2020-03-12 10:10:10', 'aaa', 8, '1000-10-10 10:10:15', 'ggg', 1.6, 2.7, 3.8);
insert into t2 values (4,'2020-03-12 10:10:10', 'aaa', 9, '1000-10-10 10:10:16', 'hhh', 1.7, 2.8, 3.9);
insert into t2 values (5,'2020-03-10 10:10:10', 'aaa', 10, '1000-10-10 10:10:17', 'iii', 1.8, 2.9, 4.0);
create index i4 on t1(c4) storing(c6, c9);
create index i4 on t2(c4) storing(c6, c9);
“merge”
major_freeze...
merge: DONE
delete from __all_udi_monitor_list;
gather statistics __3001__idx__i4(c4);
select * from __all_udi_monitor_list;
table_id	column_id	LOAD	UDI
3003	19	0	0
Okay
select * from __all_statistic_info;
table_id	column_id	start_key	version	type	row_count	different_num	size	info	min_max
3003	19	MIN	2	16	11	10	158718	31121101918171615141112	312
delete from __all_udi_monitor_list;
gather statistics __3001__idx__i4(c4,c6,c9);
select * from __all_udi_monitor_list;
table_id	column_id	LOAD	UDI
3003	19	0	0
3003	21	0	0
3003	24	0	0
Okay
select * from __all_statistic_info;
table_id	column_id	start_key	version	type	row_count	different_num	size	info	min_max
3003	19	MIN	2	16	11	10	158718	31121101918171615141112	312
3003	21	MIN	2	6	11	10	158718	bbb1jjj1iii1hhh1ggg1fff1eee1ddd1ccc1kkk2	bbbkkk
3003	24	MIN	2	2	11	10	158718	3.314.11413.913.813.713.613.513.414.22	3.34.2
delete from __all_udi_monitor_list;
gather statistics __3001__idx__i4(c4);
gather statistics __3002__idx__i4(c4);
select * from __all_udi_monitor_list;
table_id	column_id	LOAD	UDI
3003	19	0	0
3004	19	0	0
Okay
select * from __all_statistic_info;
table_id	column_id	start_key	version	type	row_count	different_num	size	info	min_max
3003	19	MIN	2	16	11	10	158718	31121101918171615141112	312
3003	21	MIN	2	6	11	10	158718	bbb1jjj1iii1hhh1ggg1fff1eee1ddd1ccc1kkk2	bbbkkk
3003	24	MIN	2	2	11	10	158718	3.314.11413.913.813.713.613.513.414.22	3.34.2
3004	19	MIN	2	16	5	5	158320	61101918171	610
delete from __all_udi_monitor_list;
gather statistics __3001__idx__i4(c4,c6,c9);
gather statistics __3002__idx__i4(c4,c6,c9);
select * from __all_udi_monitor_list;
table_id	column_id	LOAD	UDI
3003	19	0	0
3003	21	0	0
3003	24	0	0
3004	19	0	0
3004	21	0	0
3004	24	0	0
Okay
select * from __all_statistic_info;
table_id	column_id	start_key	version	type	row_count	different_num	size	info	min_max
3003	19	MIN	2	16	11	10	158718	31121101918171615141112	312
3003	21	MIN	2	6	11	10	158718	bbb1jjj1iii1hhh1ggg1fff1eee1ddd1ccc1kkk2	bbbkkk
3003	24	MIN	2	2	11	10	158718	3.314.11413.913.813.713.613.513.414.22	3.34.2
3004	19	MIN	2	16	5	5	158320	61101918171	610
3004	21	MIN	2	6	5	5	158320	eee1iii1hhh1ggg1fff1	eeeiii
3004	24	MIN	2	2	5	5	158320	3.61413.913.813.71	3.64
drop table if exists t1;
drop table if exists t2;
drop database statistics_info;
