ALTER SYSTEM SET merge_delay_interval='6s' server_type=yaodatasvr;
ALTER SYSTEM SET major_freeze_wait_time='6s' server_type=yaoadminsvr;
ALTER SYSTEM SET  min_major_freeze_interval='5s' server_type=yaotxnsvr;
ALTER SYSTEM SET min_merge_interval='5s' server_type=yaodatasvr;
ALTER SYSTEM SET  max_merge_thread_num='20' server_type=yaodatasvr;
alter system set balance_max_concurrent_migrate_num=30 server_type=yaoadminsvr;
alter system set balance_max_migrate_in_per_ds=6 server_type=yaoadminsvr;
alter system set balance_max_migrate_out_per_ds=6 server_type=yaoadminsvr;
alter system set max_migrate_task_count=6 server_type=yaodatasvr;
drop table if exists t1,t2;
set global yao_query_timeout=30000000;
create table t1(c1 int,c2 decimal(3,2),c3 double,c4 datetime,c5 bool,c6 real,c7 varchar(20),c8 decimal(4,3),c9 int,primary key(c1,c2));
insert into t1 values(1,1.23,1.234587,'2015-05-05 12:00:00',1,1.2324,'subeima',3.125,1),(2,1.23,1.234587,'2015-05-05 12:00:00',1,1.2334324,'su2343a',1.659,5),(3,1.21,1.2345344,'2085-02-28 18:00:00',1,1.2324,'hellokitty',5.987,2);
select * from t1;
c1	c2	c3	c4	c5	c6	c7	c8	c9
1	1.23	1.234587	2015-05-05 12:00:00.000000	1	1.2324	subeima	3.125	1
2	1.23	1.234587	2015-05-05 12:00:00.000000	1	1.2334324	su2343a	1.659	5
3	1.21	1.2345344	2085-02-28 18:00:00.000000	1	1.2324	hellokitty	5.987	2
create index index0 on t1(c6,c3,c8) storing(c9,c5,c4);
create index index1 on t1(c4,c9,c2,c6,c5);
create index index2 on t1(c8,c2,c3,c1) storing(c9,c5,c6,c4);
create index index3 on t1(c6,c9,c1,c3) storing(c7,c5,c8);
create index index4 on t1(c8,c3,c6,c2) storing(c4,c7,c5);
"merge"
major_freeze...
merge: DONE
show index on t1;
index_name	status	index_type
__3001__idx__index0	1	0
__3001__idx__index1	1	0
__3001__idx__index2	1	0
__3001__idx__index3	1	0
__3001__idx__index4	1	0
__3001__idx__index0
select * from __3001__idx__index0;
c1	c2	c3	c4	c5	c6	c8	c9
3	1.21	1.2345344	2085-02-28 18:00:00.000000	1	1.2324	5.987	2
1	1.23	1.234587	2015-05-05 12:00:00.000000	1	1.2324	3.125	1
2	1.23	1.234587	2015-05-05 12:00:00.000000	1	1.2334324	1.659	5
select * from __3001__idx__index1;
c1	c2	c4	c5	c6	c9	yao_virtual_col
1	1.23	2015-05-05 12:00:00.000000	1	1.2324	1	NULL
2	1.23	2015-05-05 12:00:00.000000	1	1.2334324	5	NULL
3	1.21	2085-02-28 18:00:00.000000	1	1.2324	2	NULL
select * from __3001__idx__index2;
c1	c2	c3	c4	c5	c6	c8	c9
2	1.23	1.234587	2015-05-05 12:00:00.000000	1	1.2334324	1.659	5
1	1.23	1.234587	2015-05-05 12:00:00.000000	1	1.2324	3.125	1
3	1.21	1.2345344	2085-02-28 18:00:00.000000	1	1.2324	5.987	2
select * from __3001__idx__index3;
c1	c2	c3	c5	c6	c7	c8	c9
1	1.23	1.234587	1	1.2324	subeima	3.125	1
3	1.21	1.2345344	1	1.2324	hellokitty	5.987	2
2	1.23	1.234587	1	1.2334324	su2343a	1.659	5
select * from __3001__idx__index4;
c1	c2	c3	c4	c5	c6	c7	c8
2	1.23	1.234587	2015-05-05 12:00:00.000000	1	1.2334324	su2343a	1.659
1	1.23	1.234587	2015-05-05 12:00:00.000000	1	1.2324	subeima	3.125
3	1.21	1.2345344	2085-02-28 18:00:00.000000	1	1.2324	hellokitty	5.987
update t1 set c9=12 where c1=1 and c2=1.23;
select * from t1;
c1	c2	c3	c4	c5	c6	c7	c8	c9
1	1.23	1.234587	2015-05-05 12:00:00.000000	1	1.2324	subeima	3.125	12
2	1.23	1.234587	2015-05-05 12:00:00.000000	1	1.2334324	su2343a	1.659	5
3	1.21	1.2345344	2085-02-28 18:00:00.000000	1	1.2324	hellokitty	5.987	2
select * from __3001__idx__index0;
c1	c2	c3	c4	c5	c6	c8	c9
3	1.21	1.2345344	2085-02-28 18:00:00.000000	1	1.2324	5.987	2
1	1.23	1.234587	2015-05-05 12:00:00.000000	1	1.2324	3.125	12
2	1.23	1.234587	2015-05-05 12:00:00.000000	1	1.2334324	1.659	5
select * from __3001__idx__index1;
c1	c2	c4	c5	c6	c9	yao_virtual_col
2	1.23	2015-05-05 12:00:00.000000	1	1.2334324	5	NULL
1	1.23	2015-05-05 12:00:00.000000	1	1.2324	12	NULL
3	1.21	2085-02-28 18:00:00.000000	1	1.2324	2	NULL
select * from __3001__idx__index2;
c1	c2	c3	c4	c5	c6	c8	c9
2	1.23	1.234587	2015-05-05 12:00:00.000000	1	1.2334324	1.659	5
1	1.23	1.234587	2015-05-05 12:00:00.000000	1	1.2324	3.125	12
3	1.21	1.2345344	2085-02-28 18:00:00.000000	1	1.2324	5.987	2
select * from __3001__idx__index3;
c1	c2	c3	c5	c6	c7	c8	c9
3	1.21	1.2345344	1	1.2324	hellokitty	5.987	2
1	1.23	1.234587	1	1.2324	subeima	3.125	12
2	1.23	1.234587	1	1.2334324	su2343a	1.659	5
select * from __3001__idx__index4;
c1	c2	c3	c4	c5	c6	c7	c8
2	1.23	1.234587	2015-05-05 12:00:00.000000	1	1.2334324	su2343a	1.659
1	1.23	1.234587	2015-05-05 12:00:00.000000	1	1.2324	subeima	3.125
3	1.21	1.2345344	2085-02-28 18:00:00.000000	1	1.2324	hellokitty	5.987
update t1 set c4='5045-01-08 15:00:55' where c1=1 and c2=1.23;
select * from t1;
c1	c2	c3	c4	c5	c6	c7	c8	c9
1	1.23	1.234587	5045-01-08 15:00:55.000000	1	1.2324	subeima	3.125	12
2	1.23	1.234587	2015-05-05 12:00:00.000000	1	1.2334324	su2343a	1.659	5
3	1.21	1.2345344	2085-02-28 18:00:00.000000	1	1.2324	hellokitty	5.987	2
select * from __3001__idx__index0;
c1	c2	c3	c4	c5	c6	c8	c9
3	1.21	1.2345344	2085-02-28 18:00:00.000000	1	1.2324	5.987	2
1	1.23	1.234587	5045-01-08 15:00:55.000000	1	1.2324	3.125	12
2	1.23	1.234587	2015-05-05 12:00:00.000000	1	1.2334324	1.659	5
select * from __3001__idx__index1;
c1	c2	c4	c5	c6	c9	yao_virtual_col
2	1.23	2015-05-05 12:00:00.000000	1	1.2334324	5	NULL
3	1.21	2085-02-28 18:00:00.000000	1	1.2324	2	NULL
1	1.23	5045-01-08 15:00:55.000000	1	1.2324	12	NULL
select * from __3001__idx__index2;
c1	c2	c3	c4	c5	c6	c8	c9
2	1.23	1.234587	2015-05-05 12:00:00.000000	1	1.2334324	1.659	5
1	1.23	1.234587	5045-01-08 15:00:55.000000	1	1.2324	3.125	12
3	1.21	1.2345344	2085-02-28 18:00:00.000000	1	1.2324	5.987	2
select * from __3001__idx__index3;
c1	c2	c3	c5	c6	c7	c8	c9
3	1.21	1.2345344	1	1.2324	hellokitty	5.987	2
1	1.23	1.234587	1	1.2324	subeima	3.125	12
2	1.23	1.234587	1	1.2334324	su2343a	1.659	5
select * from __3001__idx__index4;
c1	c2	c3	c4	c5	c6	c7	c8
2	1.23	1.234587	2015-05-05 12:00:00.000000	1	1.2334324	su2343a	1.659
1	1.23	1.234587	5045-01-08 15:00:55.000000	1	1.2324	subeima	3.125
3	1.21	1.2345344	2085-02-28 18:00:00.000000	1	1.2324	hellokitty	5.987
update t1 set c8=1.1 where c1=1 and c2=1.23;
select * from t1;
c1	c2	c3	c4	c5	c6	c7	c8	c9
1	1.23	1.234587	5045-01-08 15:00:55.000000	1	1.2324	subeima	1.1	12
2	1.23	1.234587	2015-05-05 12:00:00.000000	1	1.2334324	su2343a	1.659	5
3	1.21	1.2345344	2085-02-28 18:00:00.000000	1	1.2324	hellokitty	5.987	2
select * from __3001__idx__index0;
c1	c2	c3	c4	c5	c6	c8	c9
3	1.21	1.2345344	2085-02-28 18:00:00.000000	1	1.2324	5.987	2
1	1.23	1.234587	5045-01-08 15:00:55.000000	1	1.2324	1.1	12
2	1.23	1.234587	2015-05-05 12:00:00.000000	1	1.2334324	1.659	5
select * from __3001__idx__index1;
c1	c2	c4	c5	c6	c9	yao_virtual_col
2	1.23	2015-05-05 12:00:00.000000	1	1.2334324	5	NULL
3	1.21	2085-02-28 18:00:00.000000	1	1.2324	2	NULL
1	1.23	5045-01-08 15:00:55.000000	1	1.2324	12	NULL
select * from __3001__idx__index2;
c1	c2	c3	c4	c5	c6	c8	c9
1	1.23	1.234587	5045-01-08 15:00:55.000000	1	1.2324	1.1	12
2	1.23	1.234587	2015-05-05 12:00:00.000000	1	1.2334324	1.659	5
3	1.21	1.2345344	2085-02-28 18:00:00.000000	1	1.2324	5.987	2
select * from __3001__idx__index3;
c1	c2	c3	c5	c6	c7	c8	c9
3	1.21	1.2345344	1	1.2324	hellokitty	5.987	2
1	1.23	1.234587	1	1.2324	subeima	1.1	12
2	1.23	1.234587	1	1.2334324	su2343a	1.659	5
select * from __3001__idx__index4;
c1	c2	c3	c4	c5	c6	c7	c8
1	1.23	1.234587	5045-01-08 15:00:55.000000	1	1.2324	subeima	1.1
2	1.23	1.234587	2015-05-05 12:00:00.000000	1	1.2334324	su2343a	1.659
3	1.21	1.2345344	2085-02-28 18:00:00.000000	1	1.2324	hellokitty	5.987
update t1 set c7='ontime' where c1=1 and c2=1.23;
select * from t1;
c1	c2	c3	c4	c5	c6	c7	c8	c9
1	1.23	1.234587	5045-01-08 15:00:55.000000	1	1.2324	ontime	1.1	12
2	1.23	1.234587	2015-05-05 12:00:00.000000	1	1.2334324	su2343a	1.659	5
3	1.21	1.2345344	2085-02-28 18:00:00.000000	1	1.2324	hellokitty	5.987	2
select * from __3001__idx__index0;
c1	c2	c3	c4	c5	c6	c8	c9
3	1.21	1.2345344	2085-02-28 18:00:00.000000	1	1.2324	5.987	2
1	1.23	1.234587	5045-01-08 15:00:55.000000	1	1.2324	1.1	12
2	1.23	1.234587	2015-05-05 12:00:00.000000	1	1.2334324	1.659	5
select * from __3001__idx__index1;
c1	c2	c4	c5	c6	c9	yao_virtual_col
2	1.23	2015-05-05 12:00:00.000000	1	1.2334324	5	NULL
3	1.21	2085-02-28 18:00:00.000000	1	1.2324	2	NULL
1	1.23	5045-01-08 15:00:55.000000	1	1.2324	12	NULL
select * from __3001__idx__index2;
c1	c2	c3	c4	c5	c6	c8	c9
1	1.23	1.234587	5045-01-08 15:00:55.000000	1	1.2324	1.1	12
2	1.23	1.234587	2015-05-05 12:00:00.000000	1	1.2334324	1.659	5
3	1.21	1.2345344	2085-02-28 18:00:00.000000	1	1.2324	5.987	2
select * from __3001__idx__index3;
c1	c2	c3	c5	c6	c7	c8	c9
3	1.21	1.2345344	1	1.2324	hellokitty	5.987	2
1	1.23	1.234587	1	1.2324	ontime	1.1	12
2	1.23	1.234587	1	1.2334324	su2343a	1.659	5
select * from __3001__idx__index4;
c1	c2	c3	c4	c5	c6	c7	c8
1	1.23	1.234587	5045-01-08 15:00:55.000000	1	1.2324	ontime	1.1
2	1.23	1.234587	2015-05-05 12:00:00.000000	1	1.2334324	su2343a	1.659
3	1.21	1.2345344	2085-02-28 18:00:00.000000	1	1.2324	hellokitty	5.987
update t1 set c3=1.5698 where c1=1 and c2=1.23;
select * from t1;
c1	c2	c3	c4	c5	c6	c7	c8	c9
1	1.23	1.5698	5045-01-08 15:00:55.000000	1	1.2324	ontime	1.1	12
2	1.23	1.234587	2015-05-05 12:00:00.000000	1	1.2334324	su2343a	1.659	5
3	1.21	1.2345344	2085-02-28 18:00:00.000000	1	1.2324	hellokitty	5.987	2
select * from __3001__idx__index0;
c1	c2	c3	c4	c5	c6	c8	c9
3	1.21	1.2345344	2085-02-28 18:00:00.000000	1	1.2324	5.987	2
1	1.23	1.5698	5045-01-08 15:00:55.000000	1	1.2324	1.1	12
2	1.23	1.234587	2015-05-05 12:00:00.000000	1	1.2334324	1.659	5
select * from __3001__idx__index1;
c1	c2	c4	c5	c6	c9	yao_virtual_col
2	1.23	2015-05-05 12:00:00.000000	1	1.2334324	5	NULL
3	1.21	2085-02-28 18:00:00.000000	1	1.2324	2	NULL
1	1.23	5045-01-08 15:00:55.000000	1	1.2324	12	NULL
select * from __3001__idx__index2;
c1	c2	c3	c4	c5	c6	c8	c9
1	1.23	1.5698	5045-01-08 15:00:55.000000	1	1.2324	1.1	12
2	1.23	1.234587	2015-05-05 12:00:00.000000	1	1.2334324	1.659	5
3	1.21	1.2345344	2085-02-28 18:00:00.000000	1	1.2324	5.987	2
select * from __3001__idx__index3;
c1	c2	c3	c5	c6	c7	c8	c9
3	1.21	1.2345344	1	1.2324	hellokitty	5.987	2
1	1.23	1.5698	1	1.2324	ontime	1.1	12
2	1.23	1.234587	1	1.2334324	su2343a	1.659	5
select * from __3001__idx__index4;
c1	c2	c3	c4	c5	c6	c7	c8
1	1.23	1.5698	5045-01-08 15:00:55.000000	1	1.2324	ontime	1.1
2	1.23	1.234587	2015-05-05 12:00:00.000000	1	1.2334324	su2343a	1.659
3	1.21	1.2345344	2085-02-28 18:00:00.000000	1	1.2324	hellokitty	5.987
update t1 set c9=7*8 where c1=2 and c2=1.23;
select * from t1;
c1	c2	c3	c4	c5	c6	c7	c8	c9
1	1.23	1.5698	5045-01-08 15:00:55.000000	1	1.2324	ontime	1.1	12
2	1.23	1.234587	2015-05-05 12:00:00.000000	1	1.2334324	su2343a	1.659	56
3	1.21	1.2345344	2085-02-28 18:00:00.000000	1	1.2324	hellokitty	5.987	2
select * from __3001__idx__index0;
c1	c2	c3	c4	c5	c6	c8	c9
3	1.21	1.2345344	2085-02-28 18:00:00.000000	1	1.2324	5.987	2
1	1.23	1.5698	5045-01-08 15:00:55.000000	1	1.2324	1.1	12
2	1.23	1.234587	2015-05-05 12:00:00.000000	1	1.2334324	1.659	56
select * from __3001__idx__index1;
c1	c2	c4	c5	c6	c9	yao_virtual_col
2	1.23	2015-05-05 12:00:00.000000	1	1.2334324	56	NULL
3	1.21	2085-02-28 18:00:00.000000	1	1.2324	2	NULL
1	1.23	5045-01-08 15:00:55.000000	1	1.2324	12	NULL
select * from __3001__idx__index2;
c1	c2	c3	c4	c5	c6	c8	c9
1	1.23	1.5698	5045-01-08 15:00:55.000000	1	1.2324	1.1	12
2	1.23	1.234587	2015-05-05 12:00:00.000000	1	1.2334324	1.659	56
3	1.21	1.2345344	2085-02-28 18:00:00.000000	1	1.2324	5.987	2
select * from __3001__idx__index3;
c1	c2	c3	c5	c6	c7	c8	c9
3	1.21	1.2345344	1	1.2324	hellokitty	5.987	2
1	1.23	1.5698	1	1.2324	ontime	1.1	12
2	1.23	1.234587	1	1.2334324	su2343a	1.659	56
select * from __3001__idx__index4;
c1	c2	c3	c4	c5	c6	c7	c8
1	1.23	1.5698	5045-01-08 15:00:55.000000	1	1.2324	ontime	1.1
2	1.23	1.234587	2015-05-05 12:00:00.000000	1	1.2334324	su2343a	1.659
3	1.21	1.2345344	2085-02-28 18:00:00.000000	1	1.2324	hellokitty	5.987
update t1 set c3=1.235*12.54 where c1=2 and c2=1.23;
select * from t1;
c1	c2	c3	c4	c5	c6	c7	c8	c9
1	1.23	1.5698	5045-01-08 15:00:55.000000	1	1.2324	ontime	1.1	12
2	1.23	15.4869	2015-05-05 12:00:00.000000	1	1.2334324	su2343a	1.659	56
3	1.21	1.2345344	2085-02-28 18:00:00.000000	1	1.2324	hellokitty	5.987	2
select * from __3001__idx__index0;
c1	c2	c3	c4	c5	c6	c8	c9
3	1.21	1.2345344	2085-02-28 18:00:00.000000	1	1.2324	5.987	2
1	1.23	1.5698	5045-01-08 15:00:55.000000	1	1.2324	1.1	12
2	1.23	15.4869	2015-05-05 12:00:00.000000	1	1.2334324	1.659	56
select * from __3001__idx__index1;
c1	c2	c4	c5	c6	c9	yao_virtual_col
2	1.23	2015-05-05 12:00:00.000000	1	1.2334324	56	NULL
3	1.21	2085-02-28 18:00:00.000000	1	1.2324	2	NULL
1	1.23	5045-01-08 15:00:55.000000	1	1.2324	12	NULL
select * from __3001__idx__index2;
c1	c2	c3	c4	c5	c6	c8	c9
1	1.23	1.5698	5045-01-08 15:00:55.000000	1	1.2324	1.1	12
2	1.23	15.4869	2015-05-05 12:00:00.000000	1	1.2334324	1.659	56
3	1.21	1.2345344	2085-02-28 18:00:00.000000	1	1.2324	5.987	2
select * from __3001__idx__index3;
c1	c2	c3	c5	c6	c7	c8	c9
3	1.21	1.2345344	1	1.2324	hellokitty	5.987	2
1	1.23	1.5698	1	1.2324	ontime	1.1	12
2	1.23	15.4869	1	1.2334324	su2343a	1.659	56
select * from __3001__idx__index4;
c1	c2	c3	c4	c5	c6	c7	c8
1	1.23	1.5698	5045-01-08 15:00:55.000000	1	1.2324	ontime	1.1
2	1.23	15.4869	2015-05-05 12:00:00.000000	1	1.2334324	su2343a	1.659
3	1.21	1.2345344	2085-02-28 18:00:00.000000	1	1.2324	hellokitty	5.987
update t1 set c6=8/15.28 where c1=2 and c2=1.23;
select * from t1;
c1	c2	c3	c4	c5	c6	c7	c8	c9
1	1.23	1.5698	5045-01-08 15:00:55.000000	1	1.2324	ontime	1.1	12
2	1.23	15.4869	2015-05-05 12:00:00.000000	1	0.5236	su2343a	1.659	56
3	1.21	1.2345344	2085-02-28 18:00:00.000000	1	1.2324	hellokitty	5.987	2
select * from __3001__idx__index0;
c1	c2	c3	c4	c5	c6	c8	c9
2	1.23	15.4869	2015-05-05 12:00:00.000000	1	0.5236	1.659	56
3	1.21	1.2345344	2085-02-28 18:00:00.000000	1	1.2324	5.987	2
1	1.23	1.5698	5045-01-08 15:00:55.000000	1	1.2324	1.1	12
select * from __3001__idx__index1;
c1	c2	c4	c5	c6	c9	yao_virtual_col
2	1.23	2015-05-05 12:00:00.000000	1	0.5236	56	NULL
3	1.21	2085-02-28 18:00:00.000000	1	1.2324	2	NULL
1	1.23	5045-01-08 15:00:55.000000	1	1.2324	12	NULL
select * from __3001__idx__index2;
c1	c2	c3	c4	c5	c6	c8	c9
1	1.23	1.5698	5045-01-08 15:00:55.000000	1	1.2324	1.1	12
2	1.23	15.4869	2015-05-05 12:00:00.000000	1	0.5236	1.659	56
3	1.21	1.2345344	2085-02-28 18:00:00.000000	1	1.2324	5.987	2
select * from __3001__idx__index3;
c1	c2	c3	c5	c6	c7	c8	c9
2	1.23	15.4869	1	0.5236	su2343a	1.659	56
3	1.21	1.2345344	1	1.2324	hellokitty	5.987	2
1	1.23	1.5698	1	1.2324	ontime	1.1	12
select * from __3001__idx__index4;
c1	c2	c3	c4	c5	c6	c7	c8
1	1.23	1.5698	5045-01-08 15:00:55.000000	1	1.2324	ontime	1.1
2	1.23	15.4869	2015-05-05 12:00:00.000000	1	0.5236	su2343a	1.659
3	1.21	1.2345344	2085-02-28 18:00:00.000000	1	1.2324	hellokitty	5.987
update t1 set c8=5/9 where c1=2 and c2=1.23;
select * from t1;
c1	c2	c3	c4	c5	c6	c7	c8	c9
1	1.23	1.5698	5045-01-08 15:00:55.000000	1	1.2324	ontime	1.1	12
2	1.23	15.4869	2015-05-05 12:00:00.000000	1	0.5236	su2343a	0.555	56
3	1.21	1.2345344	2085-02-28 18:00:00.000000	1	1.2324	hellokitty	5.987	2
select * from __3001__idx__index0;
c1	c2	c3	c4	c5	c6	c8	c9
2	1.23	15.4869	2015-05-05 12:00:00.000000	1	0.5236	0.555	56
3	1.21	1.2345344	2085-02-28 18:00:00.000000	1	1.2324	5.987	2
1	1.23	1.5698	5045-01-08 15:00:55.000000	1	1.2324	1.1	12
select * from __3001__idx__index1;
c1	c2	c4	c5	c6	c9	yao_virtual_col
2	1.23	2015-05-05 12:00:00.000000	1	0.5236	56	NULL
3	1.21	2085-02-28 18:00:00.000000	1	1.2324	2	NULL
1	1.23	5045-01-08 15:00:55.000000	1	1.2324	12	NULL
select * from __3001__idx__index2;
c1	c2	c3	c4	c5	c6	c8	c9
2	1.23	15.4869	2015-05-05 12:00:00.000000	1	0.5236	0.555	56
1	1.23	1.5698	5045-01-08 15:00:55.000000	1	1.2324	1.1	12
3	1.21	1.2345344	2085-02-28 18:00:00.000000	1	1.2324	5.987	2
select * from __3001__idx__index3;
c1	c2	c3	c5	c6	c7	c8	c9
2	1.23	15.4869	1	0.5236	su2343a	0.555	56
3	1.21	1.2345344	1	1.2324	hellokitty	5.987	2
1	1.23	1.5698	1	1.2324	ontime	1.1	12
select * from __3001__idx__index4;
c1	c2	c3	c4	c5	c6	c7	c8
2	1.23	15.4869	2015-05-05 12:00:00.000000	1	0.5236	su2343a	0.555
1	1.23	1.5698	5045-01-08 15:00:55.000000	1	1.2324	ontime	1.1
3	1.21	1.2345344	2085-02-28 18:00:00.000000	1	1.2324	hellokitty	5.987
update t1 set c9=c1+8 where c1=3 and c2=1.21;
select * from t1;
c1	c2	c3	c4	c5	c6	c7	c8	c9
1	1.23	1.5698	5045-01-08 15:00:55.000000	1	1.2324	ontime	1.1	12
2	1.23	15.4869	2015-05-05 12:00:00.000000	1	0.5236	su2343a	0.555	56
3	1.21	1.2345344	2085-02-28 18:00:00.000000	1	1.2324	hellokitty	5.987	11
select * from __3001__idx__index0;
c1	c2	c3	c4	c5	c6	c8	c9
2	1.23	15.4869	2015-05-05 12:00:00.000000	1	0.5236	0.555	56
3	1.21	1.2345344	2085-02-28 18:00:00.000000	1	1.2324	5.987	11
1	1.23	1.5698	5045-01-08 15:00:55.000000	1	1.2324	1.1	12
select * from __3001__idx__index1;
c1	c2	c4	c5	c6	c9	yao_virtual_col
2	1.23	2015-05-05 12:00:00.000000	1	0.5236	56	NULL
3	1.21	2085-02-28 18:00:00.000000	1	1.2324	11	NULL
1	1.23	5045-01-08 15:00:55.000000	1	1.2324	12	NULL
select * from __3001__idx__index2;
c1	c2	c3	c4	c5	c6	c8	c9
2	1.23	15.4869	2015-05-05 12:00:00.000000	1	0.5236	0.555	56
1	1.23	1.5698	5045-01-08 15:00:55.000000	1	1.2324	1.1	12
3	1.21	1.2345344	2085-02-28 18:00:00.000000	1	1.2324	5.987	11
select * from __3001__idx__index3;
c1	c2	c3	c5	c6	c7	c8	c9
2	1.23	15.4869	1	0.5236	su2343a	0.555	56
3	1.21	1.2345344	1	1.2324	hellokitty	5.987	11
1	1.23	1.5698	1	1.2324	ontime	1.1	12
select * from __3001__idx__index4;
c1	c2	c3	c4	c5	c6	c7	c8
2	1.23	15.4869	2015-05-05 12:00:00.000000	1	0.5236	su2343a	0.555
1	1.23	1.5698	5045-01-08 15:00:55.000000	1	1.2324	ontime	1.1
3	1.21	1.2345344	2085-02-28 18:00:00.000000	1	1.2324	hellokitty	5.987
update t1 set c8=c2+18 where c1=3 and c2=1.21;
ERROR HY000: YAO-58: Overflow occurred during convert decimal(4,2) to decimal(4,3) for table[test.t1] column[c8]
select * from t1;
c1	c2	c3	c4	c5	c6	c7	c8	c9
1	1.23	1.5698	5045-01-08 15:00:55.000000	1	1.2324	ontime	1.1	12
2	1.23	15.4869	2015-05-05 12:00:00.000000	1	0.5236	su2343a	0.555	56
3	1.21	1.2345344	2085-02-28 18:00:00.000000	1	1.2324	hellokitty	5.987	11
select * from __3001__idx__index0;
c1	c2	c3	c4	c5	c6	c8	c9
2	1.23	15.4869	2015-05-05 12:00:00.000000	1	0.5236	0.555	56
3	1.21	1.2345344	2085-02-28 18:00:00.000000	1	1.2324	5.987	11
1	1.23	1.5698	5045-01-08 15:00:55.000000	1	1.2324	1.1	12
select * from __3001__idx__index1;
c1	c2	c4	c5	c6	c9	yao_virtual_col
2	1.23	2015-05-05 12:00:00.000000	1	0.5236	56	NULL
3	1.21	2085-02-28 18:00:00.000000	1	1.2324	11	NULL
1	1.23	5045-01-08 15:00:55.000000	1	1.2324	12	NULL
select * from __3001__idx__index2;
c1	c2	c3	c4	c5	c6	c8	c9
2	1.23	15.4869	2015-05-05 12:00:00.000000	1	0.5236	0.555	56
1	1.23	1.5698	5045-01-08 15:00:55.000000	1	1.2324	1.1	12
3	1.21	1.2345344	2085-02-28 18:00:00.000000	1	1.2324	5.987	11
select * from __3001__idx__index3;
c1	c2	c3	c5	c6	c7	c8	c9
2	1.23	15.4869	1	0.5236	su2343a	0.555	56
3	1.21	1.2345344	1	1.2324	hellokitty	5.987	11
1	1.23	1.5698	1	1.2324	ontime	1.1	12
select * from __3001__idx__index4;
c1	c2	c3	c4	c5	c6	c7	c8
2	1.23	15.4869	2015-05-05 12:00:00.000000	1	0.5236	su2343a	0.555
1	1.23	1.5698	5045-01-08 15:00:55.000000	1	1.2324	ontime	1.1
3	1.21	1.2345344	2085-02-28 18:00:00.000000	1	1.2324	hellokitty	5.987
update t1 set c6=c3*5.396 where c1=3 and c2=1.21;
select * from t1;
c1	c2	c3	c4	c5	c6	c7	c8	c9
1	1.23	1.5698	5045-01-08 15:00:55.000000	1	1.2324	ontime	1.1	12
2	1.23	15.4869	2015-05-05 12:00:00.000000	1	0.5236	su2343a	0.555	56
3	1.21	1.2345344	2085-02-28 18:00:00.000000	1	6.6615476224	hellokitty	5.987	11
select * from __3001__idx__index0;
c1	c2	c3	c4	c5	c6	c8	c9
2	1.23	15.4869	2015-05-05 12:00:00.000000	1	0.5236	0.555	56
1	1.23	1.5698	5045-01-08 15:00:55.000000	1	1.2324	1.1	12
3	1.21	1.2345344	2085-02-28 18:00:00.000000	1	6.6615476224	5.987	11
select * from __3001__idx__index1;
c1	c2	c4	c5	c6	c9	yao_virtual_col
2	1.23	2015-05-05 12:00:00.000000	1	0.5236	56	NULL
3	1.21	2085-02-28 18:00:00.000000	1	6.6615476224	11	NULL
1	1.23	5045-01-08 15:00:55.000000	1	1.2324	12	NULL
select * from __3001__idx__index2;
c1	c2	c3	c4	c5	c6	c8	c9
2	1.23	15.4869	2015-05-05 12:00:00.000000	1	0.5236	0.555	56
1	1.23	1.5698	5045-01-08 15:00:55.000000	1	1.2324	1.1	12
3	1.21	1.2345344	2085-02-28 18:00:00.000000	1	6.6615476224	5.987	11
select * from __3001__idx__index3;
c1	c2	c3	c5	c6	c7	c8	c9
2	1.23	15.4869	1	0.5236	su2343a	0.555	56
1	1.23	1.5698	1	1.2324	ontime	1.1	12
3	1.21	1.2345344	1	6.6615476224	hellokitty	5.987	11
select * from __3001__idx__index4;
c1	c2	c3	c4	c5	c6	c7	c8
2	1.23	15.4869	2015-05-05 12:00:00.000000	1	0.5236	su2343a	0.555
1	1.23	1.5698	5045-01-08 15:00:55.000000	1	1.2324	ontime	1.1
3	1.21	1.2345344	2085-02-28 18:00:00.000000	1	6.6615476224	hellokitty	5.987
update t1 set c9=122,c3=7.86 where c1=1 and c2=1.23;
select * from t1;
c1	c2	c3	c4	c5	c6	c7	c8	c9
1	1.23	7.86	5045-01-08 15:00:55.000000	1	1.2324	ontime	1.1	122
2	1.23	15.4869	2015-05-05 12:00:00.000000	1	0.5236	su2343a	0.555	56
3	1.21	1.2345344	2085-02-28 18:00:00.000000	1	6.6615476224	hellokitty	5.987	11
select * from __3001__idx__index0;
c1	c2	c3	c4	c5	c6	c8	c9
2	1.23	15.4869	2015-05-05 12:00:00.000000	1	0.5236	0.555	56
1	1.23	7.86	5045-01-08 15:00:55.000000	1	1.2324	1.1	122
3	1.21	1.2345344	2085-02-28 18:00:00.000000	1	6.6615476224	5.987	11
select * from __3001__idx__index1;
c1	c2	c4	c5	c6	c9	yao_virtual_col
2	1.23	2015-05-05 12:00:00.000000	1	0.5236	56	NULL
3	1.21	2085-02-28 18:00:00.000000	1	6.6615476224	11	NULL
1	1.23	5045-01-08 15:00:55.000000	1	1.2324	122	NULL
select * from __3001__idx__index2;
c1	c2	c3	c4	c5	c6	c8	c9
2	1.23	15.4869	2015-05-05 12:00:00.000000	1	0.5236	0.555	56
1	1.23	7.86	5045-01-08 15:00:55.000000	1	1.2324	1.1	122
3	1.21	1.2345344	2085-02-28 18:00:00.000000	1	6.6615476224	5.987	11
select * from __3001__idx__index3;
c1	c2	c3	c5	c6	c7	c8	c9
2	1.23	15.4869	1	0.5236	su2343a	0.555	56
1	1.23	7.86	1	1.2324	ontime	1.1	122
3	1.21	1.2345344	1	6.6615476224	hellokitty	5.987	11
select * from __3001__idx__index4;
c1	c2	c3	c4	c5	c6	c7	c8
2	1.23	15.4869	2015-05-05 12:00:00.000000	1	0.5236	su2343a	0.555
1	1.23	7.86	5045-01-08 15:00:55.000000	1	1.2324	ontime	1.1
3	1.21	1.2345344	2085-02-28 18:00:00.000000	1	6.6615476224	hellokitty	5.987
update t1 set c4='4445-01-08 12:00:55' where c1=1 and c2=1.23;
select * from t1;
c1	c2	c3	c4	c5	c6	c7	c8	c9
1	1.23	7.86	4445-01-08 12:00:55.000000	1	1.2324	ontime	1.1	122
2	1.23	15.4869	2015-05-05 12:00:00.000000	1	0.5236	su2343a	0.555	56
3	1.21	1.2345344	2085-02-28 18:00:00.000000	1	6.6615476224	hellokitty	5.987	11
select * from __3001__idx__index0;
c1	c2	c3	c4	c5	c6	c8	c9
2	1.23	15.4869	2015-05-05 12:00:00.000000	1	0.5236	0.555	56
1	1.23	7.86	4445-01-08 12:00:55.000000	1	1.2324	1.1	122
3	1.21	1.2345344	2085-02-28 18:00:00.000000	1	6.6615476224	5.987	11
select * from __3001__idx__index1;
c1	c2	c4	c5	c6	c9	yao_virtual_col
2	1.23	2015-05-05 12:00:00.000000	1	0.5236	56	NULL
3	1.21	2085-02-28 18:00:00.000000	1	6.6615476224	11	NULL
1	1.23	4445-01-08 12:00:55.000000	1	1.2324	122	NULL
select * from __3001__idx__index2;
c1	c2	c3	c4	c5	c6	c8	c9
2	1.23	15.4869	2015-05-05 12:00:00.000000	1	0.5236	0.555	56
1	1.23	7.86	4445-01-08 12:00:55.000000	1	1.2324	1.1	122
3	1.21	1.2345344	2085-02-28 18:00:00.000000	1	6.6615476224	5.987	11
select * from __3001__idx__index3;
c1	c2	c3	c5	c6	c7	c8	c9
2	1.23	15.4869	1	0.5236	su2343a	0.555	56
1	1.23	7.86	1	1.2324	ontime	1.1	122
3	1.21	1.2345344	1	6.6615476224	hellokitty	5.987	11
select * from __3001__idx__index4;
c1	c2	c3	c4	c5	c6	c7	c8
2	1.23	15.4869	2015-05-05 12:00:00.000000	1	0.5236	su2343a	0.555
1	1.23	7.86	4445-01-08 12:00:55.000000	1	1.2324	ontime	1.1
3	1.21	1.2345344	2085-02-28 18:00:00.000000	1	6.6615476224	hellokitty	5.987
update t1 set c8=1.131,c6=7.892 where c1=1 and c2=1.23;
select * from t1;
c1	c2	c3	c4	c5	c6	c7	c8	c9
1	1.23	7.86	4445-01-08 12:00:55.000000	1	7.892	ontime	1.131	122
2	1.23	15.4869	2015-05-05 12:00:00.000000	1	0.5236	su2343a	0.555	56
3	1.21	1.2345344	2085-02-28 18:00:00.000000	1	6.6615476224	hellokitty	5.987	11
select * from __3001__idx__index0;
c1	c2	c3	c4	c5	c6	c8	c9
2	1.23	15.4869	2015-05-05 12:00:00.000000	1	0.5236	0.555	56
3	1.21	1.2345344	2085-02-28 18:00:00.000000	1	6.6615476224	5.987	11
1	1.23	7.86	4445-01-08 12:00:55.000000	1	7.892	1.131	122
select * from __3001__idx__index1;
c1	c2	c4	c5	c6	c9	yao_virtual_col
2	1.23	2015-05-05 12:00:00.000000	1	0.5236	56	NULL
3	1.21	2085-02-28 18:00:00.000000	1	6.6615476224	11	NULL
1	1.23	4445-01-08 12:00:55.000000	1	7.892	122	NULL
select * from __3001__idx__index2;
c1	c2	c3	c4	c5	c6	c8	c9
2	1.23	15.4869	2015-05-05 12:00:00.000000	1	0.5236	0.555	56
1	1.23	7.86	4445-01-08 12:00:55.000000	1	7.892	1.131	122
3	1.21	1.2345344	2085-02-28 18:00:00.000000	1	6.6615476224	5.987	11
select * from __3001__idx__index3;
c1	c2	c3	c5	c6	c7	c8	c9
2	1.23	15.4869	1	0.5236	su2343a	0.555	56
3	1.21	1.2345344	1	6.6615476224	hellokitty	5.987	11
1	1.23	7.86	1	7.892	ontime	1.131	122
select * from __3001__idx__index4;
c1	c2	c3	c4	c5	c6	c7	c8
2	1.23	15.4869	2015-05-05 12:00:00.000000	1	0.5236	su2343a	0.555
1	1.23	7.86	4445-01-08 12:00:55.000000	1	7.892	ontime	1.131
3	1.21	1.2345344	2085-02-28 18:00:00.000000	1	6.6615476224	hellokitty	5.987
update t1 set c7='alittlegril',c8=4.554 where c1=1 and c2=1.23;
select * from t1;
c1	c2	c3	c4	c5	c6	c7	c8	c9
1	1.23	7.86	4445-01-08 12:00:55.000000	1	7.892	alittlegril	4.554	122
2	1.23	15.4869	2015-05-05 12:00:00.000000	1	0.5236	su2343a	0.555	56
3	1.21	1.2345344	2085-02-28 18:00:00.000000	1	6.6615476224	hellokitty	5.987	11
select * from __3001__idx__index0;
c1	c2	c3	c4	c5	c6	c8	c9
2	1.23	15.4869	2015-05-05 12:00:00.000000	1	0.5236	0.555	56
3	1.21	1.2345344	2085-02-28 18:00:00.000000	1	6.6615476224	5.987	11
1	1.23	7.86	4445-01-08 12:00:55.000000	1	7.892	4.554	122
select * from __3001__idx__index1;
c1	c2	c4	c5	c6	c9	yao_virtual_col
2	1.23	2015-05-05 12:00:00.000000	1	0.5236	56	NULL
3	1.21	2085-02-28 18:00:00.000000	1	6.6615476224	11	NULL
1	1.23	4445-01-08 12:00:55.000000	1	7.892	122	NULL
select * from __3001__idx__index2;
c1	c2	c3	c4	c5	c6	c8	c9
2	1.23	15.4869	2015-05-05 12:00:00.000000	1	0.5236	0.555	56
1	1.23	7.86	4445-01-08 12:00:55.000000	1	7.892	4.554	122
3	1.21	1.2345344	2085-02-28 18:00:00.000000	1	6.6615476224	5.987	11
select * from __3001__idx__index3;
c1	c2	c3	c5	c6	c7	c8	c9
2	1.23	15.4869	1	0.5236	su2343a	0.555	56
3	1.21	1.2345344	1	6.6615476224	hellokitty	5.987	11
1	1.23	7.86	1	7.892	alittlegril	4.554	122
select * from __3001__idx__index4;
c1	c2	c3	c4	c5	c6	c7	c8
2	1.23	15.4869	2015-05-05 12:00:00.000000	1	0.5236	su2343a	0.555
1	1.23	7.86	4445-01-08 12:00:55.000000	1	7.892	alittlegril	4.554
3	1.21	1.2345344	2085-02-28 18:00:00.000000	1	6.6615476224	hellokitty	5.987
update t1 set c3=3.38565,c6=8.66842 where c1=1 and c2=1.23;
select * from t1;
c1	c2	c3	c4	c5	c6	c7	c8	c9
1	1.23	3.38565	4445-01-08 12:00:55.000000	1	8.66842	alittlegril	4.554	122
2	1.23	15.4869	2015-05-05 12:00:00.000000	1	0.5236	su2343a	0.555	56
3	1.21	1.2345344	2085-02-28 18:00:00.000000	1	6.6615476224	hellokitty	5.987	11
select * from __3001__idx__index0;
c1	c2	c3	c4	c5	c6	c8	c9
2	1.23	15.4869	2015-05-05 12:00:00.000000	1	0.5236	0.555	56
3	1.21	1.2345344	2085-02-28 18:00:00.000000	1	6.6615476224	5.987	11
1	1.23	3.38565	4445-01-08 12:00:55.000000	1	8.66842	4.554	122
select * from __3001__idx__index1;
c1	c2	c4	c5	c6	c9	yao_virtual_col
2	1.23	2015-05-05 12:00:00.000000	1	0.5236	56	NULL
3	1.21	2085-02-28 18:00:00.000000	1	6.6615476224	11	NULL
1	1.23	4445-01-08 12:00:55.000000	1	8.66842	122	NULL
select * from __3001__idx__index2;
c1	c2	c3	c4	c5	c6	c8	c9
2	1.23	15.4869	2015-05-05 12:00:00.000000	1	0.5236	0.555	56
1	1.23	3.38565	4445-01-08 12:00:55.000000	1	8.66842	4.554	122
3	1.21	1.2345344	2085-02-28 18:00:00.000000	1	6.6615476224	5.987	11
select * from __3001__idx__index3;
c1	c2	c3	c5	c6	c7	c8	c9
2	1.23	15.4869	1	0.5236	su2343a	0.555	56
3	1.21	1.2345344	1	6.6615476224	hellokitty	5.987	11
1	1.23	3.38565	1	8.66842	alittlegril	4.554	122
select * from __3001__idx__index4;
c1	c2	c3	c4	c5	c6	c7	c8
2	1.23	15.4869	2015-05-05 12:00:00.000000	1	0.5236	su2343a	0.555
1	1.23	3.38565	4445-01-08 12:00:55.000000	1	8.66842	alittlegril	4.554
3	1.21	1.2345344	2085-02-28 18:00:00.000000	1	6.6615476224	hellokitty	5.987
update t1 set c9=9/7,c3=4.56*7.89 where c1=2 and c2=1.23;
select * from t1;
c1	c2	c3	c4	c5	c6	c7	c8	c9
1	1.23	3.38565	4445-01-08 12:00:55.000000	1	8.66842	alittlegril	4.554	122
2	1.23	35.9784	2015-05-05 12:00:00.000000	1	0.5236	su2343a	0.555	1
3	1.21	1.2345344	2085-02-28 18:00:00.000000	1	6.6615476224	hellokitty	5.987	11
select * from __3001__idx__index0;
c1	c2	c3	c4	c5	c6	c8	c9
2	1.23	35.9784	2015-05-05 12:00:00.000000	1	0.5236	0.555	1
3	1.21	1.2345344	2085-02-28 18:00:00.000000	1	6.6615476224	5.987	11
1	1.23	3.38565	4445-01-08 12:00:55.000000	1	8.66842	4.554	122
select * from __3001__idx__index1;
c1	c2	c4	c5	c6	c9	yao_virtual_col
2	1.23	2015-05-05 12:00:00.000000	1	0.5236	1	NULL
3	1.21	2085-02-28 18:00:00.000000	1	6.6615476224	11	NULL
1	1.23	4445-01-08 12:00:55.000000	1	8.66842	122	NULL
select * from __3001__idx__index2;
c1	c2	c3	c4	c5	c6	c8	c9
2	1.23	35.9784	2015-05-05 12:00:00.000000	1	0.5236	0.555	1
1	1.23	3.38565	4445-01-08 12:00:55.000000	1	8.66842	4.554	122
3	1.21	1.2345344	2085-02-28 18:00:00.000000	1	6.6615476224	5.987	11
select * from __3001__idx__index3;
c1	c2	c3	c5	c6	c7	c8	c9
2	1.23	35.9784	1	0.5236	su2343a	0.555	1
3	1.21	1.2345344	1	6.6615476224	hellokitty	5.987	11
1	1.23	3.38565	1	8.66842	alittlegril	4.554	122
select * from __3001__idx__index4;
c1	c2	c3	c4	c5	c6	c7	c8
2	1.23	35.9784	2015-05-05 12:00:00.000000	1	0.5236	su2343a	0.555
1	1.23	3.38565	4445-01-08 12:00:55.000000	1	8.66842	alittlegril	4.554
3	1.21	1.2345344	2085-02-28 18:00:00.000000	1	6.6615476224	hellokitty	5.987
update t1 set c3=1.2365655*12.54,c6=7.58/9.5412 where c1=2 and c2=1.23;
select * from t1;
c1	c2	c3	c4	c5	c6	c7	c8	c9
1	1.23	3.38565	4445-01-08 12:00:55.000000	1	8.66842	alittlegril	4.554	122
2	1.23	15.50653137	2015-05-05 12:00:00.000000	1	0.794449	su2343a	0.555	1
3	1.21	1.2345344	2085-02-28 18:00:00.000000	1	6.6615476224	hellokitty	5.987	11
select * from __3001__idx__index0;
c1	c2	c3	c4	c5	c6	c8	c9
2	1.23	15.50653137	2015-05-05 12:00:00.000000	1	0.794449	0.555	1
3	1.21	1.2345344	2085-02-28 18:00:00.000000	1	6.6615476224	5.987	11
1	1.23	3.38565	4445-01-08 12:00:55.000000	1	8.66842	4.554	122
select * from __3001__idx__index1;
c1	c2	c4	c5	c6	c9	yao_virtual_col
2	1.23	2015-05-05 12:00:00.000000	1	0.794449	1	NULL
3	1.21	2085-02-28 18:00:00.000000	1	6.6615476224	11	NULL
1	1.23	4445-01-08 12:00:55.000000	1	8.66842	122	NULL
select * from __3001__idx__index2;
c1	c2	c3	c4	c5	c6	c8	c9
2	1.23	15.50653137	2015-05-05 12:00:00.000000	1	0.794449	0.555	1
1	1.23	3.38565	4445-01-08 12:00:55.000000	1	8.66842	4.554	122
3	1.21	1.2345344	2085-02-28 18:00:00.000000	1	6.6615476224	5.987	11
select * from __3001__idx__index3;
c1	c2	c3	c5	c6	c7	c8	c9
2	1.23	15.50653137	1	0.794449	su2343a	0.555	1
3	1.21	1.2345344	1	6.6615476224	hellokitty	5.987	11
1	1.23	3.38565	1	8.66842	alittlegril	4.554	122
select * from __3001__idx__index4;
c1	c2	c3	c4	c5	c6	c7	c8
2	1.23	15.50653137	2015-05-05 12:00:00.000000	1	0.794449	su2343a	0.555
1	1.23	3.38565	4445-01-08 12:00:55.000000	1	8.66842	alittlegril	4.554
3	1.21	1.2345344	2085-02-28 18:00:00.000000	1	6.6615476224	hellokitty	5.987
update t1 set c6=8/18,c5=8-8 where c1=2 and c2=1.23;
select * from t1;
c1	c2	c3	c4	c5	c6	c7	c8	c9
1	1.23	3.38565	4445-01-08 12:00:55.000000	1	8.66842	alittlegril	4.554	122
2	1.23	15.50653137	2015-05-05 12:00:00.000000	0	0.4444	su2343a	0.555	1
3	1.21	1.2345344	2085-02-28 18:00:00.000000	1	6.6615476224	hellokitty	5.987	11
select * from __3001__idx__index0;
c1	c2	c3	c4	c5	c6	c8	c9
2	1.23	15.50653137	2015-05-05 12:00:00.000000	0	0.4444	0.555	1
3	1.21	1.2345344	2085-02-28 18:00:00.000000	1	6.6615476224	5.987	11
1	1.23	3.38565	4445-01-08 12:00:55.000000	1	8.66842	4.554	122
select * from __3001__idx__index1;
c1	c2	c4	c5	c6	c9	yao_virtual_col
2	1.23	2015-05-05 12:00:00.000000	0	0.4444	1	NULL
3	1.21	2085-02-28 18:00:00.000000	1	6.6615476224	11	NULL
1	1.23	4445-01-08 12:00:55.000000	1	8.66842	122	NULL
select * from __3001__idx__index2;
c1	c2	c3	c4	c5	c6	c8	c9
2	1.23	15.50653137	2015-05-05 12:00:00.000000	0	0.4444	0.555	1
1	1.23	3.38565	4445-01-08 12:00:55.000000	1	8.66842	4.554	122
3	1.21	1.2345344	2085-02-28 18:00:00.000000	1	6.6615476224	5.987	11
select * from __3001__idx__index3;
c1	c2	c3	c5	c6	c7	c8	c9
2	1.23	15.50653137	0	0.4444	su2343a	0.555	1
3	1.21	1.2345344	1	6.6615476224	hellokitty	5.987	11
1	1.23	3.38565	1	8.66842	alittlegril	4.554	122
select * from __3001__idx__index4;
c1	c2	c3	c4	c5	c6	c7	c8
2	1.23	15.50653137	2015-05-05 12:00:00.000000	0	0.4444	su2343a	0.555
1	1.23	3.38565	4445-01-08 12:00:55.000000	1	8.66842	alittlegril	4.554
3	1.21	1.2345344	2085-02-28 18:00:00.000000	1	6.6615476224	hellokitty	5.987
update t1 set c8=4569/9,c9=87*554 where c1=2 and c2=1.23;
ERROR HY000: YAO-58: Overflow occurred during convert decimal(8,4) to decimal(4,3) for table[test.t1] column[c8]
select * from t1;
c1	c2	c3	c4	c5	c6	c7	c8	c9
1	1.23	3.38565	4445-01-08 12:00:55.000000	1	8.66842	alittlegril	4.554	122
2	1.23	15.50653137	2015-05-05 12:00:00.000000	0	0.4444	su2343a	0.555	1
3	1.21	1.2345344	2085-02-28 18:00:00.000000	1	6.6615476224	hellokitty	5.987	11
select * from __3001__idx__index0;
c1	c2	c3	c4	c5	c6	c8	c9
2	1.23	15.50653137	2015-05-05 12:00:00.000000	0	0.4444	0.555	1
3	1.21	1.2345344	2085-02-28 18:00:00.000000	1	6.6615476224	5.987	11
1	1.23	3.38565	4445-01-08 12:00:55.000000	1	8.66842	4.554	122
select * from __3001__idx__index1;
c1	c2	c4	c5	c6	c9	yao_virtual_col
2	1.23	2015-05-05 12:00:00.000000	0	0.4444	1	NULL
3	1.21	2085-02-28 18:00:00.000000	1	6.6615476224	11	NULL
1	1.23	4445-01-08 12:00:55.000000	1	8.66842	122	NULL
select * from __3001__idx__index2;
c1	c2	c3	c4	c5	c6	c8	c9
2	1.23	15.50653137	2015-05-05 12:00:00.000000	0	0.4444	0.555	1
1	1.23	3.38565	4445-01-08 12:00:55.000000	1	8.66842	4.554	122
3	1.21	1.2345344	2085-02-28 18:00:00.000000	1	6.6615476224	5.987	11
select * from __3001__idx__index3;
c1	c2	c3	c5	c6	c7	c8	c9
2	1.23	15.50653137	0	0.4444	su2343a	0.555	1
3	1.21	1.2345344	1	6.6615476224	hellokitty	5.987	11
1	1.23	3.38565	1	8.66842	alittlegril	4.554	122
select * from __3001__idx__index4;
c1	c2	c3	c4	c5	c6	c7	c8
2	1.23	15.50653137	2015-05-05 12:00:00.000000	0	0.4444	su2343a	0.555
1	1.23	3.38565	4445-01-08 12:00:55.000000	1	8.66842	alittlegril	4.554
3	1.21	1.2345344	2085-02-28 18:00:00.000000	1	6.6615476224	hellokitty	5.987
update t1 set c9=c1+123,c6=c3-5.941 where c1=2 and c2=1.23;
select * from t1;
c1	c2	c3	c4	c5	c6	c7	c8	c9
1	1.23	3.38565	4445-01-08 12:00:55.000000	1	8.66842	alittlegril	4.554	122
2	1.23	15.50653137	2015-05-05 12:00:00.000000	0	9.565531369999999	su2343a	0.555	125
3	1.21	1.2345344	2085-02-28 18:00:00.000000	1	6.6615476224	hellokitty	5.987	11
select * from __3001__idx__index0;
c1	c2	c3	c4	c5	c6	c8	c9
3	1.21	1.2345344	2085-02-28 18:00:00.000000	1	6.6615476224	5.987	11
1	1.23	3.38565	4445-01-08 12:00:55.000000	1	8.66842	4.554	122
2	1.23	15.50653137	2015-05-05 12:00:00.000000	0	9.565531369999999	0.555	125
select * from __3001__idx__index1;
c1	c2	c4	c5	c6	c9	yao_virtual_col
2	1.23	2015-05-05 12:00:00.000000	0	9.565531369999999	125	NULL
3	1.21	2085-02-28 18:00:00.000000	1	6.6615476224	11	NULL
1	1.23	4445-01-08 12:00:55.000000	1	8.66842	122	NULL
select * from __3001__idx__index2;
c1	c2	c3	c4	c5	c6	c8	c9
2	1.23	15.50653137	2015-05-05 12:00:00.000000	0	9.565531369999999	0.555	125
1	1.23	3.38565	4445-01-08 12:00:55.000000	1	8.66842	4.554	122
3	1.21	1.2345344	2085-02-28 18:00:00.000000	1	6.6615476224	5.987	11
select * from __3001__idx__index3;
c1	c2	c3	c5	c6	c7	c8	c9
3	1.21	1.2345344	1	6.6615476224	hellokitty	5.987	11
1	1.23	3.38565	1	8.66842	alittlegril	4.554	122
2	1.23	15.50653137	0	9.565531369999999	su2343a	0.555	125
select * from __3001__idx__index4;
c1	c2	c3	c4	c5	c6	c7	c8
2	1.23	15.50653137	2015-05-05 12:00:00.000000	0	9.565531369999999	su2343a	0.555
1	1.23	3.38565	4445-01-08 12:00:55.000000	1	8.66842	alittlegril	4.554
3	1.21	1.2345344	2085-02-28 18:00:00.000000	1	6.6615476224	hellokitty	5.987
update t1 set c8=c2+7.981,c3=c6*5.6561 where c1=2 and c2=1.23;
select * from t1;
c1	c2	c3	c4	c5	c6	c7	c8	c9
1	1.23	3.38565	4445-01-08 12:00:55.000000	1	8.66842	alittlegril	4.554	122
2	1.23	54.103601981857	2015-05-05 12:00:00.000000	0	9.565531369999999	su2343a	9.211	125
3	1.21	1.2345344	2085-02-28 18:00:00.000000	1	6.6615476224	hellokitty	5.987	11
select * from __3001__idx__index0;
c1	c2	c3	c4	c5	c6	c8	c9
3	1.21	1.2345344	2085-02-28 18:00:00.000000	1	6.6615476224	5.987	11
1	1.23	3.38565	4445-01-08 12:00:55.000000	1	8.66842	4.554	122
2	1.23	54.103601981857	2015-05-05 12:00:00.000000	0	9.565531369999999	9.211	125
select * from __3001__idx__index1;
c1	c2	c4	c5	c6	c9	yao_virtual_col
2	1.23	2015-05-05 12:00:00.000000	0	9.565531369999999	125	NULL
3	1.21	2085-02-28 18:00:00.000000	1	6.6615476224	11	NULL
1	1.23	4445-01-08 12:00:55.000000	1	8.66842	122	NULL
select * from __3001__idx__index2;
c1	c2	c3	c4	c5	c6	c8	c9
1	1.23	3.38565	4445-01-08 12:00:55.000000	1	8.66842	4.554	122
3	1.21	1.2345344	2085-02-28 18:00:00.000000	1	6.6615476224	5.987	11
2	1.23	54.103601981857	2015-05-05 12:00:00.000000	0	9.565531369999999	9.211	125
select * from __3001__idx__index3;
c1	c2	c3	c5	c6	c7	c8	c9
3	1.21	1.2345344	1	6.6615476224	hellokitty	5.987	11
1	1.23	3.38565	1	8.66842	alittlegril	4.554	122
2	1.23	54.103601981857	0	9.565531369999999	su2343a	9.211	125
select * from __3001__idx__index4;
c1	c2	c3	c4	c5	c6	c7	c8
1	1.23	3.38565	4445-01-08 12:00:55.000000	1	8.66842	alittlegril	4.554
3	1.21	1.2345344	2085-02-28 18:00:00.000000	1	6.6615476224	hellokitty	5.987
2	1.23	54.103601981857	2015-05-05 12:00:00.000000	0	9.565531369999999	su2343a	9.211
update t1 set c6=c3*4354.96 where c1=2 and c2=1.23;
select * from t1;
c1	c2	c3	c4	c5	c6	c7	c8	c9
1	1.23	3.38565	4445-01-08 12:00:55.000000	1	8.66842	alittlegril	4.554	122
2	1.23	54.103601981857	2015-05-05 12:00:00.000000	0	235619.02248690795	su2343a	9.211	125
3	1.21	1.2345344	2085-02-28 18:00:00.000000	1	6.6615476224	hellokitty	5.987	11
select * from __3001__idx__index0;
c1	c2	c3	c4	c5	c6	c8	c9
3	1.21	1.2345344	2085-02-28 18:00:00.000000	1	6.6615476224	5.987	11
1	1.23	3.38565	4445-01-08 12:00:55.000000	1	8.66842	4.554	122
2	1.23	54.103601981857	2015-05-05 12:00:00.000000	0	235619.02248690795	9.211	125
select * from __3001__idx__index1;
c1	c2	c4	c5	c6	c9	yao_virtual_col
2	1.23	2015-05-05 12:00:00.000000	0	235619.02248690795	125	NULL
3	1.21	2085-02-28 18:00:00.000000	1	6.6615476224	11	NULL
1	1.23	4445-01-08 12:00:55.000000	1	8.66842	122	NULL
select * from __3001__idx__index2;
c1	c2	c3	c4	c5	c6	c8	c9
1	1.23	3.38565	4445-01-08 12:00:55.000000	1	8.66842	4.554	122
3	1.21	1.2345344	2085-02-28 18:00:00.000000	1	6.6615476224	5.987	11
2	1.23	54.103601981857	2015-05-05 12:00:00.000000	0	235619.02248690795	9.211	125
select * from __3001__idx__index3;
c1	c2	c3	c5	c6	c7	c8	c9
3	1.21	1.2345344	1	6.6615476224	hellokitty	5.987	11
1	1.23	3.38565	1	8.66842	alittlegril	4.554	122
2	1.23	54.103601981857	0	235619.02248690795	su2343a	9.211	125
select * from __3001__idx__index4;
c1	c2	c3	c4	c5	c6	c7	c8
1	1.23	3.38565	4445-01-08 12:00:55.000000	1	8.66842	alittlegril	4.554
3	1.21	1.2345344	2085-02-28 18:00:00.000000	1	6.6615476224	hellokitty	5.987
2	1.23	54.103601981857	2015-05-05 12:00:00.000000	0	235619.02248690795	su2343a	9.211
set autocommit=0;
update t1 set c9=88 where c1=1 and c2=1.23;
select * from t1;
c1	c2	c3	c4	c5	c6	c7	c8	c9
1	1.23	3.38565	4445-01-08 12:00:55.000000	1	8.66842	alittlegril	4.554	88
2	1.23	54.103601981857	2015-05-05 12:00:00.000000	0	235619.02248690795	su2343a	9.211	125
3	1.21	1.2345344	2085-02-28 18:00:00.000000	1	6.6615476224	hellokitty	5.987	11
select * from __3001__idx__index0;
c1	c2	c3	c4	c5	c6	c8	c9
3	1.21	1.2345344	2085-02-28 18:00:00.000000	1	6.6615476224	5.987	11
1	1.23	3.38565	4445-01-08 12:00:55.000000	1	8.66842	4.554	88
2	1.23	54.103601981857	2015-05-05 12:00:00.000000	0	235619.02248690795	9.211	125
select * from __3001__idx__index1;
c1	c2	c4	c5	c6	c9	yao_virtual_col
2	1.23	2015-05-05 12:00:00.000000	0	235619.02248690795	125	NULL
3	1.21	2085-02-28 18:00:00.000000	1	6.6615476224	11	NULL
1	1.23	4445-01-08 12:00:55.000000	1	8.66842	88	NULL
select * from __3001__idx__index2;
c1	c2	c3	c4	c5	c6	c8	c9
1	1.23	3.38565	4445-01-08 12:00:55.000000	1	8.66842	4.554	88
3	1.21	1.2345344	2085-02-28 18:00:00.000000	1	6.6615476224	5.987	11
2	1.23	54.103601981857	2015-05-05 12:00:00.000000	0	235619.02248690795	9.211	125
select * from __3001__idx__index3;
c1	c2	c3	c5	c6	c7	c8	c9
3	1.21	1.2345344	1	6.6615476224	hellokitty	5.987	11
1	1.23	3.38565	1	8.66842	alittlegril	4.554	88
2	1.23	54.103601981857	0	235619.02248690795	su2343a	9.211	125
select * from __3001__idx__index4;
c1	c2	c3	c4	c5	c6	c7	c8
1	1.23	3.38565	4445-01-08 12:00:55.000000	1	8.66842	alittlegril	4.554
3	1.21	1.2345344	2085-02-28 18:00:00.000000	1	6.6615476224	hellokitty	5.987
2	1.23	54.103601981857	2015-05-05 12:00:00.000000	0	235619.02248690795	su2343a	9.211
commit;
select * from t1;
c1	c2	c3	c4	c5	c6	c7	c8	c9
1	1.23	3.38565	4445-01-08 12:00:55.000000	1	8.66842	alittlegril	4.554	88
2	1.23	54.103601981857	2015-05-05 12:00:00.000000	0	235619.02248690795	su2343a	9.211	125
3	1.21	1.2345344	2085-02-28 18:00:00.000000	1	6.6615476224	hellokitty	5.987	11
select * from __3001__idx__index0;
c1	c2	c3	c4	c5	c6	c8	c9
3	1.21	1.2345344	2085-02-28 18:00:00.000000	1	6.6615476224	5.987	11
1	1.23	3.38565	4445-01-08 12:00:55.000000	1	8.66842	4.554	88
2	1.23	54.103601981857	2015-05-05 12:00:00.000000	0	235619.02248690795	9.211	125
select * from __3001__idx__index1;
c1	c2	c4	c5	c6	c9	yao_virtual_col
2	1.23	2015-05-05 12:00:00.000000	0	235619.02248690795	125	NULL
3	1.21	2085-02-28 18:00:00.000000	1	6.6615476224	11	NULL
1	1.23	4445-01-08 12:00:55.000000	1	8.66842	88	NULL
select * from __3001__idx__index2;
c1	c2	c3	c4	c5	c6	c8	c9
1	1.23	3.38565	4445-01-08 12:00:55.000000	1	8.66842	4.554	88
3	1.21	1.2345344	2085-02-28 18:00:00.000000	1	6.6615476224	5.987	11
2	1.23	54.103601981857	2015-05-05 12:00:00.000000	0	235619.02248690795	9.211	125
select * from __3001__idx__index3;
c1	c2	c3	c5	c6	c7	c8	c9
3	1.21	1.2345344	1	6.6615476224	hellokitty	5.987	11
1	1.23	3.38565	1	8.66842	alittlegril	4.554	88
2	1.23	54.103601981857	0	235619.02248690795	su2343a	9.211	125
select * from __3001__idx__index4;
c1	c2	c3	c4	c5	c6	c7	c8
1	1.23	3.38565	4445-01-08 12:00:55.000000	1	8.66842	alittlegril	4.554
3	1.21	1.2345344	2085-02-28 18:00:00.000000	1	6.6615476224	hellokitty	5.987
2	1.23	54.103601981857	2015-05-05 12:00:00.000000	0	235619.02248690795	su2343a	9.211
update t1 set c4='2011-02-13' where c1=1 and c2=1.23;
select * from t1;
c1	c2	c3	c4	c5	c6	c7	c8	c9
1	1.23	3.38565	2011-02-13 00:00:00.000000	1	8.66842	alittlegril	4.554	88
2	1.23	54.103601981857	2015-05-05 12:00:00.000000	0	235619.02248690795	su2343a	9.211	125
3	1.21	1.2345344	2085-02-28 18:00:00.000000	1	6.6615476224	hellokitty	5.987	11
select * from __3001__idx__index0;
c1	c2	c3	c4	c5	c6	c8	c9
3	1.21	1.2345344	2085-02-28 18:00:00.000000	1	6.6615476224	5.987	11
1	1.23	3.38565	2011-02-13 00:00:00.000000	1	8.66842	4.554	88
2	1.23	54.103601981857	2015-05-05 12:00:00.000000	0	235619.02248690795	9.211	125
select * from __3001__idx__index1;
c1	c2	c4	c5	c6	c9	yao_virtual_col
1	1.23	2011-02-13 00:00:00.000000	1	8.66842	88	NULL
2	1.23	2015-05-05 12:00:00.000000	0	235619.02248690795	125	NULL
3	1.21	2085-02-28 18:00:00.000000	1	6.6615476224	11	NULL
select * from __3001__idx__index2;
c1	c2	c3	c4	c5	c6	c8	c9
1	1.23	3.38565	2011-02-13 00:00:00.000000	1	8.66842	4.554	88
3	1.21	1.2345344	2085-02-28 18:00:00.000000	1	6.6615476224	5.987	11
2	1.23	54.103601981857	2015-05-05 12:00:00.000000	0	235619.02248690795	9.211	125
select * from __3001__idx__index3;
c1	c2	c3	c5	c6	c7	c8	c9
3	1.21	1.2345344	1	6.6615476224	hellokitty	5.987	11
1	1.23	3.38565	1	8.66842	alittlegril	4.554	88
2	1.23	54.103601981857	0	235619.02248690795	su2343a	9.211	125
select * from __3001__idx__index4;
c1	c2	c3	c4	c5	c6	c7	c8
1	1.23	3.38565	2011-02-13 00:00:00.000000	1	8.66842	alittlegril	4.554
3	1.21	1.2345344	2085-02-28 18:00:00.000000	1	6.6615476224	hellokitty	5.987
2	1.23	54.103601981857	2015-05-05 12:00:00.000000	0	235619.02248690795	su2343a	9.211
commit;
select * from t1;
c1	c2	c3	c4	c5	c6	c7	c8	c9
1	1.23	3.38565	2011-02-13 00:00:00.000000	1	8.66842	alittlegril	4.554	88
2	1.23	54.103601981857	2015-05-05 12:00:00.000000	0	235619.02248690795	su2343a	9.211	125
3	1.21	1.2345344	2085-02-28 18:00:00.000000	1	6.6615476224	hellokitty	5.987	11
select * from __3001__idx__index0;
c1	c2	c3	c4	c5	c6	c8	c9
3	1.21	1.2345344	2085-02-28 18:00:00.000000	1	6.6615476224	5.987	11
1	1.23	3.38565	2011-02-13 00:00:00.000000	1	8.66842	4.554	88
2	1.23	54.103601981857	2015-05-05 12:00:00.000000	0	235619.02248690795	9.211	125
select * from __3001__idx__index1;
c1	c2	c4	c5	c6	c9	yao_virtual_col
1	1.23	2011-02-13 00:00:00.000000	1	8.66842	88	NULL
2	1.23	2015-05-05 12:00:00.000000	0	235619.02248690795	125	NULL
3	1.21	2085-02-28 18:00:00.000000	1	6.6615476224	11	NULL
select * from __3001__idx__index2;
c1	c2	c3	c4	c5	c6	c8	c9
1	1.23	3.38565	2011-02-13 00:00:00.000000	1	8.66842	4.554	88
3	1.21	1.2345344	2085-02-28 18:00:00.000000	1	6.6615476224	5.987	11
2	1.23	54.103601981857	2015-05-05 12:00:00.000000	0	235619.02248690795	9.211	125
select * from __3001__idx__index3;
c1	c2	c3	c5	c6	c7	c8	c9
3	1.21	1.2345344	1	6.6615476224	hellokitty	5.987	11
1	1.23	3.38565	1	8.66842	alittlegril	4.554	88
2	1.23	54.103601981857	0	235619.02248690795	su2343a	9.211	125
select * from __3001__idx__index4;
c1	c2	c3	c4	c5	c6	c7	c8
1	1.23	3.38565	2011-02-13 00:00:00.000000	1	8.66842	alittlegril	4.554
3	1.21	1.2345344	2085-02-28 18:00:00.000000	1	6.6615476224	hellokitty	5.987
2	1.23	54.103601981857	2015-05-05 12:00:00.000000	0	235619.02248690795	su2343a	9.211
update t1 set c8=9.654 where c1=1 and c2=1.23;
select * from t1;
c1	c2	c3	c4	c5	c6	c7	c8	c9
1	1.23	3.38565	2011-02-13 00:00:00.000000	1	8.66842	alittlegril	9.654	88
2	1.23	54.103601981857	2015-05-05 12:00:00.000000	0	235619.02248690795	su2343a	9.211	125
3	1.21	1.2345344	2085-02-28 18:00:00.000000	1	6.6615476224	hellokitty	5.987	11
select * from __3001__idx__index0;
c1	c2	c3	c4	c5	c6	c8	c9
3	1.21	1.2345344	2085-02-28 18:00:00.000000	1	6.6615476224	5.987	11
1	1.23	3.38565	2011-02-13 00:00:00.000000	1	8.66842	9.654	88
2	1.23	54.103601981857	2015-05-05 12:00:00.000000	0	235619.02248690795	9.211	125
select * from __3001__idx__index1;
c1	c2	c4	c5	c6	c9	yao_virtual_col
1	1.23	2011-02-13 00:00:00.000000	1	8.66842	88	NULL
2	1.23	2015-05-05 12:00:00.000000	0	235619.02248690795	125	NULL
3	1.21	2085-02-28 18:00:00.000000	1	6.6615476224	11	NULL
select * from __3001__idx__index2;
c1	c2	c3	c4	c5	c6	c8	c9
3	1.21	1.2345344	2085-02-28 18:00:00.000000	1	6.6615476224	5.987	11
2	1.23	54.103601981857	2015-05-05 12:00:00.000000	0	235619.02248690795	9.211	125
1	1.23	3.38565	2011-02-13 00:00:00.000000	1	8.66842	9.654	88
select * from __3001__idx__index3;
c1	c2	c3	c5	c6	c7	c8	c9
3	1.21	1.2345344	1	6.6615476224	hellokitty	5.987	11
1	1.23	3.38565	1	8.66842	alittlegril	9.654	88
2	1.23	54.103601981857	0	235619.02248690795	su2343a	9.211	125
select * from __3001__idx__index4;
c1	c2	c3	c4	c5	c6	c7	c8
3	1.21	1.2345344	2085-02-28 18:00:00.000000	1	6.6615476224	hellokitty	5.987
2	1.23	54.103601981857	2015-05-05 12:00:00.000000	0	235619.02248690795	su2343a	9.211
1	1.23	3.38565	2011-02-13 00:00:00.000000	1	8.66842	alittlegril	9.654
commit;
select * from t1;
c1	c2	c3	c4	c5	c6	c7	c8	c9
1	1.23	3.38565	2011-02-13 00:00:00.000000	1	8.66842	alittlegril	9.654	88
2	1.23	54.103601981857	2015-05-05 12:00:00.000000	0	235619.02248690795	su2343a	9.211	125
3	1.21	1.2345344	2085-02-28 18:00:00.000000	1	6.6615476224	hellokitty	5.987	11
select * from __3001__idx__index0;
c1	c2	c3	c4	c5	c6	c8	c9
3	1.21	1.2345344	2085-02-28 18:00:00.000000	1	6.6615476224	5.987	11
1	1.23	3.38565	2011-02-13 00:00:00.000000	1	8.66842	9.654	88
2	1.23	54.103601981857	2015-05-05 12:00:00.000000	0	235619.02248690795	9.211	125
select * from __3001__idx__index1;
c1	c2	c4	c5	c6	c9	yao_virtual_col
1	1.23	2011-02-13 00:00:00.000000	1	8.66842	88	NULL
2	1.23	2015-05-05 12:00:00.000000	0	235619.02248690795	125	NULL
3	1.21	2085-02-28 18:00:00.000000	1	6.6615476224	11	NULL
select * from __3001__idx__index2;
c1	c2	c3	c4	c5	c6	c8	c9
3	1.21	1.2345344	2085-02-28 18:00:00.000000	1	6.6615476224	5.987	11
2	1.23	54.103601981857	2015-05-05 12:00:00.000000	0	235619.02248690795	9.211	125
1	1.23	3.38565	2011-02-13 00:00:00.000000	1	8.66842	9.654	88
select * from __3001__idx__index3;
c1	c2	c3	c5	c6	c7	c8	c9
3	1.21	1.2345344	1	6.6615476224	hellokitty	5.987	11
1	1.23	3.38565	1	8.66842	alittlegril	9.654	88
2	1.23	54.103601981857	0	235619.02248690795	su2343a	9.211	125
select * from __3001__idx__index4;
c1	c2	c3	c4	c5	c6	c7	c8
3	1.21	1.2345344	2085-02-28 18:00:00.000000	1	6.6615476224	hellokitty	5.987
2	1.23	54.103601981857	2015-05-05 12:00:00.000000	0	235619.02248690795	su2343a	9.211
1	1.23	3.38565	2011-02-13 00:00:00.000000	1	8.66842	alittlegril	9.654
update t1 set c7='during ' where c1=1 and c2=1.23;
select * from t1;
c1	c2	c3	c4	c5	c6	c7	c8	c9
1	1.23	3.38565	2011-02-13 00:00:00.000000	1	8.66842	during 	9.654	88
2	1.23	54.103601981857	2015-05-05 12:00:00.000000	0	235619.02248690795	su2343a	9.211	125
3	1.21	1.2345344	2085-02-28 18:00:00.000000	1	6.6615476224	hellokitty	5.987	11
select * from __3001__idx__index0;
c1	c2	c3	c4	c5	c6	c8	c9
3	1.21	1.2345344	2085-02-28 18:00:00.000000	1	6.6615476224	5.987	11
1	1.23	3.38565	2011-02-13 00:00:00.000000	1	8.66842	9.654	88
2	1.23	54.103601981857	2015-05-05 12:00:00.000000	0	235619.02248690795	9.211	125
select * from __3001__idx__index1;
c1	c2	c4	c5	c6	c9	yao_virtual_col
1	1.23	2011-02-13 00:00:00.000000	1	8.66842	88	NULL
2	1.23	2015-05-05 12:00:00.000000	0	235619.02248690795	125	NULL
3	1.21	2085-02-28 18:00:00.000000	1	6.6615476224	11	NULL
select * from __3001__idx__index2;
c1	c2	c3	c4	c5	c6	c8	c9
3	1.21	1.2345344	2085-02-28 18:00:00.000000	1	6.6615476224	5.987	11
2	1.23	54.103601981857	2015-05-05 12:00:00.000000	0	235619.02248690795	9.211	125
1	1.23	3.38565	2011-02-13 00:00:00.000000	1	8.66842	9.654	88
select * from __3001__idx__index3;
c1	c2	c3	c5	c6	c7	c8	c9
3	1.21	1.2345344	1	6.6615476224	hellokitty	5.987	11
1	1.23	3.38565	1	8.66842	during 	9.654	88
2	1.23	54.103601981857	0	235619.02248690795	su2343a	9.211	125
select * from __3001__idx__index4;
c1	c2	c3	c4	c5	c6	c7	c8
3	1.21	1.2345344	2085-02-28 18:00:00.000000	1	6.6615476224	hellokitty	5.987
2	1.23	54.103601981857	2015-05-05 12:00:00.000000	0	235619.02248690795	su2343a	9.211
1	1.23	3.38565	2011-02-13 00:00:00.000000	1	8.66842	during 	9.654
commit;
select * from t1;
c1	c2	c3	c4	c5	c6	c7	c8	c9
1	1.23	3.38565	2011-02-13 00:00:00.000000	1	8.66842	during 	9.654	88
2	1.23	54.103601981857	2015-05-05 12:00:00.000000	0	235619.02248690795	su2343a	9.211	125
3	1.21	1.2345344	2085-02-28 18:00:00.000000	1	6.6615476224	hellokitty	5.987	11
select * from __3001__idx__index0;
c1	c2	c3	c4	c5	c6	c8	c9
3	1.21	1.2345344	2085-02-28 18:00:00.000000	1	6.6615476224	5.987	11
1	1.23	3.38565	2011-02-13 00:00:00.000000	1	8.66842	9.654	88
2	1.23	54.103601981857	2015-05-05 12:00:00.000000	0	235619.02248690795	9.211	125
select * from __3001__idx__index1;
c1	c2	c4	c5	c6	c9	yao_virtual_col
1	1.23	2011-02-13 00:00:00.000000	1	8.66842	88	NULL
2	1.23	2015-05-05 12:00:00.000000	0	235619.02248690795	125	NULL
3	1.21	2085-02-28 18:00:00.000000	1	6.6615476224	11	NULL
select * from __3001__idx__index2;
c1	c2	c3	c4	c5	c6	c8	c9
3	1.21	1.2345344	2085-02-28 18:00:00.000000	1	6.6615476224	5.987	11
2	1.23	54.103601981857	2015-05-05 12:00:00.000000	0	235619.02248690795	9.211	125
1	1.23	3.38565	2011-02-13 00:00:00.000000	1	8.66842	9.654	88
select * from __3001__idx__index3;
c1	c2	c3	c5	c6	c7	c8	c9
3	1.21	1.2345344	1	6.6615476224	hellokitty	5.987	11
1	1.23	3.38565	1	8.66842	during 	9.654	88
2	1.23	54.103601981857	0	235619.02248690795	su2343a	9.211	125
select * from __3001__idx__index4;
c1	c2	c3	c4	c5	c6	c7	c8
3	1.21	1.2345344	2085-02-28 18:00:00.000000	1	6.6615476224	hellokitty	5.987
2	1.23	54.103601981857	2015-05-05 12:00:00.000000	0	235619.02248690795	su2343a	9.211
1	1.23	3.38565	2011-02-13 00:00:00.000000	1	8.66842	during 	9.654
update t1 set c3=5.89 where c1=1 and c2=1.23;
select * from t1;
c1	c2	c3	c4	c5	c6	c7	c8	c9
1	1.23	5.89	2011-02-13 00:00:00.000000	1	8.66842	during 	9.654	88
2	1.23	54.103601981857	2015-05-05 12:00:00.000000	0	235619.02248690795	su2343a	9.211	125
3	1.21	1.2345344	2085-02-28 18:00:00.000000	1	6.6615476224	hellokitty	5.987	11
select * from __3001__idx__index0;
c1	c2	c3	c4	c5	c6	c8	c9
3	1.21	1.2345344	2085-02-28 18:00:00.000000	1	6.6615476224	5.987	11
1	1.23	5.89	2011-02-13 00:00:00.000000	1	8.66842	9.654	88
2	1.23	54.103601981857	2015-05-05 12:00:00.000000	0	235619.02248690795	9.211	125
select * from __3001__idx__index1;
c1	c2	c4	c5	c6	c9	yao_virtual_col
1	1.23	2011-02-13 00:00:00.000000	1	8.66842	88	NULL
2	1.23	2015-05-05 12:00:00.000000	0	235619.02248690795	125	NULL
3	1.21	2085-02-28 18:00:00.000000	1	6.6615476224	11	NULL
select * from __3001__idx__index2;
c1	c2	c3	c4	c5	c6	c8	c9
3	1.21	1.2345344	2085-02-28 18:00:00.000000	1	6.6615476224	5.987	11
2	1.23	54.103601981857	2015-05-05 12:00:00.000000	0	235619.02248690795	9.211	125
1	1.23	5.89	2011-02-13 00:00:00.000000	1	8.66842	9.654	88
select * from __3001__idx__index3;
c1	c2	c3	c5	c6	c7	c8	c9
3	1.21	1.2345344	1	6.6615476224	hellokitty	5.987	11
1	1.23	5.89	1	8.66842	during 	9.654	88
2	1.23	54.103601981857	0	235619.02248690795	su2343a	9.211	125
select * from __3001__idx__index4;
c1	c2	c3	c4	c5	c6	c7	c8
3	1.21	1.2345344	2085-02-28 18:00:00.000000	1	6.6615476224	hellokitty	5.987
2	1.23	54.103601981857	2015-05-05 12:00:00.000000	0	235619.02248690795	su2343a	9.211
1	1.23	5.89	2011-02-13 00:00:00.000000	1	8.66842	during 	9.654
commit;
select * from t1;
c1	c2	c3	c4	c5	c6	c7	c8	c9
1	1.23	5.89	2011-02-13 00:00:00.000000	1	8.66842	during 	9.654	88
2	1.23	54.103601981857	2015-05-05 12:00:00.000000	0	235619.02248690795	su2343a	9.211	125
3	1.21	1.2345344	2085-02-28 18:00:00.000000	1	6.6615476224	hellokitty	5.987	11
select * from __3001__idx__index0;
c1	c2	c3	c4	c5	c6	c8	c9
3	1.21	1.2345344	2085-02-28 18:00:00.000000	1	6.6615476224	5.987	11
1	1.23	5.89	2011-02-13 00:00:00.000000	1	8.66842	9.654	88
2	1.23	54.103601981857	2015-05-05 12:00:00.000000	0	235619.02248690795	9.211	125
select * from __3001__idx__index1;
c1	c2	c4	c5	c6	c9	yao_virtual_col
1	1.23	2011-02-13 00:00:00.000000	1	8.66842	88	NULL
2	1.23	2015-05-05 12:00:00.000000	0	235619.02248690795	125	NULL
3	1.21	2085-02-28 18:00:00.000000	1	6.6615476224	11	NULL
select * from __3001__idx__index2;
c1	c2	c3	c4	c5	c6	c8	c9
3	1.21	1.2345344	2085-02-28 18:00:00.000000	1	6.6615476224	5.987	11
2	1.23	54.103601981857	2015-05-05 12:00:00.000000	0	235619.02248690795	9.211	125
1	1.23	5.89	2011-02-13 00:00:00.000000	1	8.66842	9.654	88
select * from __3001__idx__index3;
c1	c2	c3	c5	c6	c7	c8	c9
3	1.21	1.2345344	1	6.6615476224	hellokitty	5.987	11
1	1.23	5.89	1	8.66842	during 	9.654	88
2	1.23	54.103601981857	0	235619.02248690795	su2343a	9.211	125
select * from __3001__idx__index4;
c1	c2	c3	c4	c5	c6	c7	c8
3	1.21	1.2345344	2085-02-28 18:00:00.000000	1	6.6615476224	hellokitty	5.987
2	1.23	54.103601981857	2015-05-05 12:00:00.000000	0	235619.02248690795	su2343a	9.211
1	1.23	5.89	2011-02-13 00:00:00.000000	1	8.66842	during 	9.654
update t1 set c9=9*5 where c1=2 and c2=1.23;
select * from t1;
c1	c2	c3	c4	c5	c6	c7	c8	c9
1	1.23	5.89	2011-02-13 00:00:00.000000	1	8.66842	during 	9.654	88
2	1.23	54.103601981857	2015-05-05 12:00:00.000000	0	235619.02248690795	su2343a	9.211	45
3	1.21	1.2345344	2085-02-28 18:00:00.000000	1	6.6615476224	hellokitty	5.987	11
select * from __3001__idx__index0;
c1	c2	c3	c4	c5	c6	c8	c9
3	1.21	1.2345344	2085-02-28 18:00:00.000000	1	6.6615476224	5.987	11
1	1.23	5.89	2011-02-13 00:00:00.000000	1	8.66842	9.654	88
2	1.23	54.103601981857	2015-05-05 12:00:00.000000	0	235619.02248690795	9.211	45
select * from __3001__idx__index1;
c1	c2	c4	c5	c6	c9	yao_virtual_col
1	1.23	2011-02-13 00:00:00.000000	1	8.66842	88	NULL
2	1.23	2015-05-05 12:00:00.000000	0	235619.02248690795	45	NULL
3	1.21	2085-02-28 18:00:00.000000	1	6.6615476224	11	NULL
select * from __3001__idx__index2;
c1	c2	c3	c4	c5	c6	c8	c9
3	1.21	1.2345344	2085-02-28 18:00:00.000000	1	6.6615476224	5.987	11
2	1.23	54.103601981857	2015-05-05 12:00:00.000000	0	235619.02248690795	9.211	45
1	1.23	5.89	2011-02-13 00:00:00.000000	1	8.66842	9.654	88
select * from __3001__idx__index3;
c1	c2	c3	c5	c6	c7	c8	c9
3	1.21	1.2345344	1	6.6615476224	hellokitty	5.987	11
1	1.23	5.89	1	8.66842	during 	9.654	88
2	1.23	54.103601981857	0	235619.02248690795	su2343a	9.211	45
select * from __3001__idx__index4;
c1	c2	c3	c4	c5	c6	c7	c8
3	1.21	1.2345344	2085-02-28 18:00:00.000000	1	6.6615476224	hellokitty	5.987
2	1.23	54.103601981857	2015-05-05 12:00:00.000000	0	235619.02248690795	su2343a	9.211
1	1.23	5.89	2011-02-13 00:00:00.000000	1	8.66842	during 	9.654
commit;
select * from t1;
c1	c2	c3	c4	c5	c6	c7	c8	c9
1	1.23	5.89	2011-02-13 00:00:00.000000	1	8.66842	during 	9.654	88
2	1.23	54.103601981857	2015-05-05 12:00:00.000000	0	235619.02248690795	su2343a	9.211	45
3	1.21	1.2345344	2085-02-28 18:00:00.000000	1	6.6615476224	hellokitty	5.987	11
select * from __3001__idx__index0;
c1	c2	c3	c4	c5	c6	c8	c9
3	1.21	1.2345344	2085-02-28 18:00:00.000000	1	6.6615476224	5.987	11
1	1.23	5.89	2011-02-13 00:00:00.000000	1	8.66842	9.654	88
2	1.23	54.103601981857	2015-05-05 12:00:00.000000	0	235619.02248690795	9.211	45
select * from __3001__idx__index1;
c1	c2	c4	c5	c6	c9	yao_virtual_col
1	1.23	2011-02-13 00:00:00.000000	1	8.66842	88	NULL
2	1.23	2015-05-05 12:00:00.000000	0	235619.02248690795	45	NULL
3	1.21	2085-02-28 18:00:00.000000	1	6.6615476224	11	NULL
select * from __3001__idx__index2;
c1	c2	c3	c4	c5	c6	c8	c9
3	1.21	1.2345344	2085-02-28 18:00:00.000000	1	6.6615476224	5.987	11
2	1.23	54.103601981857	2015-05-05 12:00:00.000000	0	235619.02248690795	9.211	45
1	1.23	5.89	2011-02-13 00:00:00.000000	1	8.66842	9.654	88
select * from __3001__idx__index3;
c1	c2	c3	c5	c6	c7	c8	c9
3	1.21	1.2345344	1	6.6615476224	hellokitty	5.987	11
1	1.23	5.89	1	8.66842	during 	9.654	88
2	1.23	54.103601981857	0	235619.02248690795	su2343a	9.211	45
select * from __3001__idx__index4;
c1	c2	c3	c4	c5	c6	c7	c8
3	1.21	1.2345344	2085-02-28 18:00:00.000000	1	6.6615476224	hellokitty	5.987
2	1.23	54.103601981857	2015-05-05 12:00:00.000000	0	235619.02248690795	su2343a	9.211
1	1.23	5.89	2011-02-13 00:00:00.000000	1	8.66842	during 	9.654
update t1 set c3=8*12.54 where c1=2 and c2=1.23;
select * from t1;
c1	c2	c3	c4	c5	c6	c7	c8	c9
1	1.23	5.89	2011-02-13 00:00:00.000000	1	8.66842	during 	9.654	88
2	1.23	100.32	2015-05-05 12:00:00.000000	0	235619.02248690795	su2343a	9.211	45
3	1.21	1.2345344	2085-02-28 18:00:00.000000	1	6.6615476224	hellokitty	5.987	11
select * from __3001__idx__index0;
c1	c2	c3	c4	c5	c6	c8	c9
3	1.21	1.2345344	2085-02-28 18:00:00.000000	1	6.6615476224	5.987	11
1	1.23	5.89	2011-02-13 00:00:00.000000	1	8.66842	9.654	88
2	1.23	100.32	2015-05-05 12:00:00.000000	0	235619.02248690795	9.211	45
select * from __3001__idx__index1;
c1	c2	c4	c5	c6	c9	yao_virtual_col
1	1.23	2011-02-13 00:00:00.000000	1	8.66842	88	NULL
2	1.23	2015-05-05 12:00:00.000000	0	235619.02248690795	45	NULL
3	1.21	2085-02-28 18:00:00.000000	1	6.6615476224	11	NULL
select * from __3001__idx__index2;
c1	c2	c3	c4	c5	c6	c8	c9
3	1.21	1.2345344	2085-02-28 18:00:00.000000	1	6.6615476224	5.987	11
2	1.23	100.32	2015-05-05 12:00:00.000000	0	235619.02248690795	9.211	45
1	1.23	5.89	2011-02-13 00:00:00.000000	1	8.66842	9.654	88
select * from __3001__idx__index3;
c1	c2	c3	c5	c6	c7	c8	c9
3	1.21	1.2345344	1	6.6615476224	hellokitty	5.987	11
1	1.23	5.89	1	8.66842	during 	9.654	88
2	1.23	100.32	0	235619.02248690795	su2343a	9.211	45
select * from __3001__idx__index4;
c1	c2	c3	c4	c5	c6	c7	c8
3	1.21	1.2345344	2085-02-28 18:00:00.000000	1	6.6615476224	hellokitty	5.987
2	1.23	100.32	2015-05-05 12:00:00.000000	0	235619.02248690795	su2343a	9.211
1	1.23	5.89	2011-02-13 00:00:00.000000	1	8.66842	during 	9.654
commit;
select * from t1;
c1	c2	c3	c4	c5	c6	c7	c8	c9
1	1.23	5.89	2011-02-13 00:00:00.000000	1	8.66842	during 	9.654	88
2	1.23	100.32	2015-05-05 12:00:00.000000	0	235619.02248690795	su2343a	9.211	45
3	1.21	1.2345344	2085-02-28 18:00:00.000000	1	6.6615476224	hellokitty	5.987	11
select * from __3001__idx__index0;
c1	c2	c3	c4	c5	c6	c8	c9
3	1.21	1.2345344	2085-02-28 18:00:00.000000	1	6.6615476224	5.987	11
1	1.23	5.89	2011-02-13 00:00:00.000000	1	8.66842	9.654	88
2	1.23	100.32	2015-05-05 12:00:00.000000	0	235619.02248690795	9.211	45
select * from __3001__idx__index1;
c1	c2	c4	c5	c6	c9	yao_virtual_col
1	1.23	2011-02-13 00:00:00.000000	1	8.66842	88	NULL
2	1.23	2015-05-05 12:00:00.000000	0	235619.02248690795	45	NULL
3	1.21	2085-02-28 18:00:00.000000	1	6.6615476224	11	NULL
select * from __3001__idx__index2;
c1	c2	c3	c4	c5	c6	c8	c9
3	1.21	1.2345344	2085-02-28 18:00:00.000000	1	6.6615476224	5.987	11
2	1.23	100.32	2015-05-05 12:00:00.000000	0	235619.02248690795	9.211	45
1	1.23	5.89	2011-02-13 00:00:00.000000	1	8.66842	9.654	88
select * from __3001__idx__index3;
c1	c2	c3	c5	c6	c7	c8	c9
3	1.21	1.2345344	1	6.6615476224	hellokitty	5.987	11
1	1.23	5.89	1	8.66842	during 	9.654	88
2	1.23	100.32	0	235619.02248690795	su2343a	9.211	45
select * from __3001__idx__index4;
c1	c2	c3	c4	c5	c6	c7	c8
3	1.21	1.2345344	2085-02-28 18:00:00.000000	1	6.6615476224	hellokitty	5.987
2	1.23	100.32	2015-05-05 12:00:00.000000	0	235619.02248690795	su2343a	9.211
1	1.23	5.89	2011-02-13 00:00:00.000000	1	8.66842	during 	9.654
update t1 set c6=89/3 where c1=2 and c2=1.23;
select * from t1;
c1	c2	c3	c4	c5	c6	c7	c8	c9
1	1.23	5.89	2011-02-13 00:00:00.000000	1	8.66842	during 	9.654	88
2	1.23	100.32	2015-05-05 12:00:00.000000	0	29.6667	su2343a	9.211	45
3	1.21	1.2345344	2085-02-28 18:00:00.000000	1	6.6615476224	hellokitty	5.987	11
select * from __3001__idx__index0;
c1	c2	c3	c4	c5	c6	c8	c9
3	1.21	1.2345344	2085-02-28 18:00:00.000000	1	6.6615476224	5.987	11
1	1.23	5.89	2011-02-13 00:00:00.000000	1	8.66842	9.654	88
2	1.23	100.32	2015-05-05 12:00:00.000000	0	29.6667	9.211	45
select * from __3001__idx__index1;
c1	c2	c4	c5	c6	c9	yao_virtual_col
1	1.23	2011-02-13 00:00:00.000000	1	8.66842	88	NULL
2	1.23	2015-05-05 12:00:00.000000	0	29.6667	45	NULL
3	1.21	2085-02-28 18:00:00.000000	1	6.6615476224	11	NULL
select * from __3001__idx__index2;
c1	c2	c3	c4	c5	c6	c8	c9
3	1.21	1.2345344	2085-02-28 18:00:00.000000	1	6.6615476224	5.987	11
2	1.23	100.32	2015-05-05 12:00:00.000000	0	29.6667	9.211	45
1	1.23	5.89	2011-02-13 00:00:00.000000	1	8.66842	9.654	88
select * from __3001__idx__index3;
c1	c2	c3	c5	c6	c7	c8	c9
3	1.21	1.2345344	1	6.6615476224	hellokitty	5.987	11
1	1.23	5.89	1	8.66842	during 	9.654	88
2	1.23	100.32	0	29.6667	su2343a	9.211	45
select * from __3001__idx__index4;
c1	c2	c3	c4	c5	c6	c7	c8
3	1.21	1.2345344	2085-02-28 18:00:00.000000	1	6.6615476224	hellokitty	5.987
2	1.23	100.32	2015-05-05 12:00:00.000000	0	29.6667	su2343a	9.211
1	1.23	5.89	2011-02-13 00:00:00.000000	1	8.66842	during 	9.654
commit;
select * from t1;
c1	c2	c3	c4	c5	c6	c7	c8	c9
1	1.23	5.89	2011-02-13 00:00:00.000000	1	8.66842	during 	9.654	88
2	1.23	100.32	2015-05-05 12:00:00.000000	0	29.6667	su2343a	9.211	45
3	1.21	1.2345344	2085-02-28 18:00:00.000000	1	6.6615476224	hellokitty	5.987	11
select * from __3001__idx__index0;
c1	c2	c3	c4	c5	c6	c8	c9
3	1.21	1.2345344	2085-02-28 18:00:00.000000	1	6.6615476224	5.987	11
1	1.23	5.89	2011-02-13 00:00:00.000000	1	8.66842	9.654	88
2	1.23	100.32	2015-05-05 12:00:00.000000	0	29.6667	9.211	45
select * from __3001__idx__index1;
c1	c2	c4	c5	c6	c9	yao_virtual_col
1	1.23	2011-02-13 00:00:00.000000	1	8.66842	88	NULL
2	1.23	2015-05-05 12:00:00.000000	0	29.6667	45	NULL
3	1.21	2085-02-28 18:00:00.000000	1	6.6615476224	11	NULL
select * from __3001__idx__index2;
c1	c2	c3	c4	c5	c6	c8	c9
3	1.21	1.2345344	2085-02-28 18:00:00.000000	1	6.6615476224	5.987	11
2	1.23	100.32	2015-05-05 12:00:00.000000	0	29.6667	9.211	45
1	1.23	5.89	2011-02-13 00:00:00.000000	1	8.66842	9.654	88
select * from __3001__idx__index3;
c1	c2	c3	c5	c6	c7	c8	c9
3	1.21	1.2345344	1	6.6615476224	hellokitty	5.987	11
1	1.23	5.89	1	8.66842	during 	9.654	88
2	1.23	100.32	0	29.6667	su2343a	9.211	45
select * from __3001__idx__index4;
c1	c2	c3	c4	c5	c6	c7	c8
3	1.21	1.2345344	2085-02-28 18:00:00.000000	1	6.6615476224	hellokitty	5.987
2	1.23	100.32	2015-05-05 12:00:00.000000	0	29.6667	su2343a	9.211
1	1.23	5.89	2011-02-13 00:00:00.000000	1	8.66842	during 	9.654
update t1 set c8=87/9 where c1=2 and c2=1.23;
select * from t1;
c1	c2	c3	c4	c5	c6	c7	c8	c9
1	1.23	5.89	2011-02-13 00:00:00.000000	1	8.66842	during 	9.654	88
2	1.23	100.32	2015-05-05 12:00:00.000000	0	29.6667	su2343a	9.666	45
3	1.21	1.2345344	2085-02-28 18:00:00.000000	1	6.6615476224	hellokitty	5.987	11
select * from __3001__idx__index0;
c1	c2	c3	c4	c5	c6	c8	c9
3	1.21	1.2345344	2085-02-28 18:00:00.000000	1	6.6615476224	5.987	11
1	1.23	5.89	2011-02-13 00:00:00.000000	1	8.66842	9.654	88
2	1.23	100.32	2015-05-05 12:00:00.000000	0	29.6667	9.666	45
select * from __3001__idx__index1;
c1	c2	c4	c5	c6	c9	yao_virtual_col
1	1.23	2011-02-13 00:00:00.000000	1	8.66842	88	NULL
2	1.23	2015-05-05 12:00:00.000000	0	29.6667	45	NULL
3	1.21	2085-02-28 18:00:00.000000	1	6.6615476224	11	NULL
select * from __3001__idx__index2;
c1	c2	c3	c4	c5	c6	c8	c9
3	1.21	1.2345344	2085-02-28 18:00:00.000000	1	6.6615476224	5.987	11
1	1.23	5.89	2011-02-13 00:00:00.000000	1	8.66842	9.654	88
2	1.23	100.32	2015-05-05 12:00:00.000000	0	29.6667	9.666	45
select * from __3001__idx__index3;
c1	c2	c3	c5	c6	c7	c8	c9
3	1.21	1.2345344	1	6.6615476224	hellokitty	5.987	11
1	1.23	5.89	1	8.66842	during 	9.654	88
2	1.23	100.32	0	29.6667	su2343a	9.666	45
select * from __3001__idx__index4;
c1	c2	c3	c4	c5	c6	c7	c8
3	1.21	1.2345344	2085-02-28 18:00:00.000000	1	6.6615476224	hellokitty	5.987
1	1.23	5.89	2011-02-13 00:00:00.000000	1	8.66842	during 	9.654
2	1.23	100.32	2015-05-05 12:00:00.000000	0	29.6667	su2343a	9.666
commit;
select * from t1;
c1	c2	c3	c4	c5	c6	c7	c8	c9
1	1.23	5.89	2011-02-13 00:00:00.000000	1	8.66842	during 	9.654	88
2	1.23	100.32	2015-05-05 12:00:00.000000	0	29.6667	su2343a	9.666	45
3	1.21	1.2345344	2085-02-28 18:00:00.000000	1	6.6615476224	hellokitty	5.987	11
select * from __3001__idx__index0;
c1	c2	c3	c4	c5	c6	c8	c9
3	1.21	1.2345344	2085-02-28 18:00:00.000000	1	6.6615476224	5.987	11
1	1.23	5.89	2011-02-13 00:00:00.000000	1	8.66842	9.654	88
2	1.23	100.32	2015-05-05 12:00:00.000000	0	29.6667	9.666	45
select * from __3001__idx__index1;
c1	c2	c4	c5	c6	c9	yao_virtual_col
1	1.23	2011-02-13 00:00:00.000000	1	8.66842	88	NULL
2	1.23	2015-05-05 12:00:00.000000	0	29.6667	45	NULL
3	1.21	2085-02-28 18:00:00.000000	1	6.6615476224	11	NULL
select * from __3001__idx__index2;
c1	c2	c3	c4	c5	c6	c8	c9
3	1.21	1.2345344	2085-02-28 18:00:00.000000	1	6.6615476224	5.987	11
1	1.23	5.89	2011-02-13 00:00:00.000000	1	8.66842	9.654	88
2	1.23	100.32	2015-05-05 12:00:00.000000	0	29.6667	9.666	45
select * from __3001__idx__index3;
c1	c2	c3	c5	c6	c7	c8	c9
3	1.21	1.2345344	1	6.6615476224	hellokitty	5.987	11
1	1.23	5.89	1	8.66842	during 	9.654	88
2	1.23	100.32	0	29.6667	su2343a	9.666	45
select * from __3001__idx__index4;
c1	c2	c3	c4	c5	c6	c7	c8
3	1.21	1.2345344	2085-02-28 18:00:00.000000	1	6.6615476224	hellokitty	5.987
1	1.23	5.89	2011-02-13 00:00:00.000000	1	8.66842	during 	9.654
2	1.23	100.32	2015-05-05 12:00:00.000000	0	29.6667	su2343a	9.666
update t1 set c9=c1*88 where c1=2 and c2=1.23;
select * from t1;
c1	c2	c3	c4	c5	c6	c7	c8	c9
1	1.23	5.89	2011-02-13 00:00:00.000000	1	8.66842	during 	9.654	88
2	1.23	100.32	2015-05-05 12:00:00.000000	0	29.6667	su2343a	9.666	176
3	1.21	1.2345344	2085-02-28 18:00:00.000000	1	6.6615476224	hellokitty	5.987	11
select * from __3001__idx__index0;
c1	c2	c3	c4	c5	c6	c8	c9
3	1.21	1.2345344	2085-02-28 18:00:00.000000	1	6.6615476224	5.987	11
1	1.23	5.89	2011-02-13 00:00:00.000000	1	8.66842	9.654	88
2	1.23	100.32	2015-05-05 12:00:00.000000	0	29.6667	9.666	176
select * from __3001__idx__index1;
c1	c2	c4	c5	c6	c9	yao_virtual_col
1	1.23	2011-02-13 00:00:00.000000	1	8.66842	88	NULL
2	1.23	2015-05-05 12:00:00.000000	0	29.6667	176	NULL
3	1.21	2085-02-28 18:00:00.000000	1	6.6615476224	11	NULL
select * from __3001__idx__index2;
c1	c2	c3	c4	c5	c6	c8	c9
3	1.21	1.2345344	2085-02-28 18:00:00.000000	1	6.6615476224	5.987	11
1	1.23	5.89	2011-02-13 00:00:00.000000	1	8.66842	9.654	88
2	1.23	100.32	2015-05-05 12:00:00.000000	0	29.6667	9.666	176
select * from __3001__idx__index3;
c1	c2	c3	c5	c6	c7	c8	c9
3	1.21	1.2345344	1	6.6615476224	hellokitty	5.987	11
1	1.23	5.89	1	8.66842	during 	9.654	88
2	1.23	100.32	0	29.6667	su2343a	9.666	176
select * from __3001__idx__index4;
c1	c2	c3	c4	c5	c6	c7	c8
3	1.21	1.2345344	2085-02-28 18:00:00.000000	1	6.6615476224	hellokitty	5.987
1	1.23	5.89	2011-02-13 00:00:00.000000	1	8.66842	during 	9.654
2	1.23	100.32	2015-05-05 12:00:00.000000	0	29.6667	su2343a	9.666
commit;
select * from t1;
c1	c2	c3	c4	c5	c6	c7	c8	c9
1	1.23	5.89	2011-02-13 00:00:00.000000	1	8.66842	during 	9.654	88
2	1.23	100.32	2015-05-05 12:00:00.000000	0	29.6667	su2343a	9.666	176
3	1.21	1.2345344	2085-02-28 18:00:00.000000	1	6.6615476224	hellokitty	5.987	11
select * from __3001__idx__index0;
c1	c2	c3	c4	c5	c6	c8	c9
3	1.21	1.2345344	2085-02-28 18:00:00.000000	1	6.6615476224	5.987	11
1	1.23	5.89	2011-02-13 00:00:00.000000	1	8.66842	9.654	88
2	1.23	100.32	2015-05-05 12:00:00.000000	0	29.6667	9.666	176
select * from __3001__idx__index1;
c1	c2	c4	c5	c6	c9	yao_virtual_col
1	1.23	2011-02-13 00:00:00.000000	1	8.66842	88	NULL
2	1.23	2015-05-05 12:00:00.000000	0	29.6667	176	NULL
3	1.21	2085-02-28 18:00:00.000000	1	6.6615476224	11	NULL
select * from __3001__idx__index2;
c1	c2	c3	c4	c5	c6	c8	c9
3	1.21	1.2345344	2085-02-28 18:00:00.000000	1	6.6615476224	5.987	11
1	1.23	5.89	2011-02-13 00:00:00.000000	1	8.66842	9.654	88
2	1.23	100.32	2015-05-05 12:00:00.000000	0	29.6667	9.666	176
select * from __3001__idx__index3;
c1	c2	c3	c5	c6	c7	c8	c9
3	1.21	1.2345344	1	6.6615476224	hellokitty	5.987	11
1	1.23	5.89	1	8.66842	during 	9.654	88
2	1.23	100.32	0	29.6667	su2343a	9.666	176
select * from __3001__idx__index4;
c1	c2	c3	c4	c5	c6	c7	c8
3	1.21	1.2345344	2085-02-28 18:00:00.000000	1	6.6615476224	hellokitty	5.987
1	1.23	5.89	2011-02-13 00:00:00.000000	1	8.66842	during 	9.654
2	1.23	100.32	2015-05-05 12:00:00.000000	0	29.6667	su2343a	9.666
update t1 set c8=c2+4.56 where c1=2 and c2=1.23;
select * from t1;
c1	c2	c3	c4	c5	c6	c7	c8	c9
1	1.23	5.89	2011-02-13 00:00:00.000000	1	8.66842	during 	9.654	88
2	1.23	100.32	2015-05-05 12:00:00.000000	0	29.6667	su2343a	5.79	176
3	1.21	1.2345344	2085-02-28 18:00:00.000000	1	6.6615476224	hellokitty	5.987	11
select * from __3001__idx__index0;
c1	c2	c3	c4	c5	c6	c8	c9
3	1.21	1.2345344	2085-02-28 18:00:00.000000	1	6.6615476224	5.987	11
1	1.23	5.89	2011-02-13 00:00:00.000000	1	8.66842	9.654	88
2	1.23	100.32	2015-05-05 12:00:00.000000	0	29.6667	5.79	176
select * from __3001__idx__index1;
c1	c2	c4	c5	c6	c9	yao_virtual_col
1	1.23	2011-02-13 00:00:00.000000	1	8.66842	88	NULL
2	1.23	2015-05-05 12:00:00.000000	0	29.6667	176	NULL
3	1.21	2085-02-28 18:00:00.000000	1	6.6615476224	11	NULL
select * from __3001__idx__index2;
c1	c2	c3	c4	c5	c6	c8	c9
2	1.23	100.32	2015-05-05 12:00:00.000000	0	29.6667	5.79	176
3	1.21	1.2345344	2085-02-28 18:00:00.000000	1	6.6615476224	5.987	11
1	1.23	5.89	2011-02-13 00:00:00.000000	1	8.66842	9.654	88
select * from __3001__idx__index3;
c1	c2	c3	c5	c6	c7	c8	c9
3	1.21	1.2345344	1	6.6615476224	hellokitty	5.987	11
1	1.23	5.89	1	8.66842	during 	9.654	88
2	1.23	100.32	0	29.6667	su2343a	5.79	176
select * from __3001__idx__index4;
c1	c2	c3	c4	c5	c6	c7	c8
2	1.23	100.32	2015-05-05 12:00:00.000000	0	29.6667	su2343a	5.79
3	1.21	1.2345344	2085-02-28 18:00:00.000000	1	6.6615476224	hellokitty	5.987
1	1.23	5.89	2011-02-13 00:00:00.000000	1	8.66842	during 	9.654
commit;
select * from t1;
c1	c2	c3	c4	c5	c6	c7	c8	c9
1	1.23	5.89	2011-02-13 00:00:00.000000	1	8.66842	during 	9.654	88
2	1.23	100.32	2015-05-05 12:00:00.000000	0	29.6667	su2343a	5.79	176
3	1.21	1.2345344	2085-02-28 18:00:00.000000	1	6.6615476224	hellokitty	5.987	11
select * from __3001__idx__index0;
c1	c2	c3	c4	c5	c6	c8	c9
3	1.21	1.2345344	2085-02-28 18:00:00.000000	1	6.6615476224	5.987	11
1	1.23	5.89	2011-02-13 00:00:00.000000	1	8.66842	9.654	88
2	1.23	100.32	2015-05-05 12:00:00.000000	0	29.6667	5.79	176
select * from __3001__idx__index1;
c1	c2	c4	c5	c6	c9	yao_virtual_col
1	1.23	2011-02-13 00:00:00.000000	1	8.66842	88	NULL
2	1.23	2015-05-05 12:00:00.000000	0	29.6667	176	NULL
3	1.21	2085-02-28 18:00:00.000000	1	6.6615476224	11	NULL
select * from __3001__idx__index2;
c1	c2	c3	c4	c5	c6	c8	c9
2	1.23	100.32	2015-05-05 12:00:00.000000	0	29.6667	5.79	176
3	1.21	1.2345344	2085-02-28 18:00:00.000000	1	6.6615476224	5.987	11
1	1.23	5.89	2011-02-13 00:00:00.000000	1	8.66842	9.654	88
select * from __3001__idx__index3;
c1	c2	c3	c5	c6	c7	c8	c9
3	1.21	1.2345344	1	6.6615476224	hellokitty	5.987	11
1	1.23	5.89	1	8.66842	during 	9.654	88
2	1.23	100.32	0	29.6667	su2343a	5.79	176
select * from __3001__idx__index4;
c1	c2	c3	c4	c5	c6	c7	c8
2	1.23	100.32	2015-05-05 12:00:00.000000	0	29.6667	su2343a	5.79
3	1.21	1.2345344	2085-02-28 18:00:00.000000	1	6.6615476224	hellokitty	5.987
1	1.23	5.89	2011-02-13 00:00:00.000000	1	8.66842	during 	9.654
update t1 set c6=c3*5.396 where c1=2 and c2=1.23;
select * from t1;
c1	c2	c3	c4	c5	c6	c7	c8	c9
1	1.23	5.89	2011-02-13 00:00:00.000000	1	8.66842	during 	9.654	88
2	1.23	100.32	2015-05-05 12:00:00.000000	0	541.3267199999999	su2343a	5.79	176
3	1.21	1.2345344	2085-02-28 18:00:00.000000	1	6.6615476224	hellokitty	5.987	11
select * from __3001__idx__index0;
c1	c2	c3	c4	c5	c6	c8	c9
3	1.21	1.2345344	2085-02-28 18:00:00.000000	1	6.6615476224	5.987	11
1	1.23	5.89	2011-02-13 00:00:00.000000	1	8.66842	9.654	88
2	1.23	100.32	2015-05-05 12:00:00.000000	0	541.3267199999999	5.79	176
select * from __3001__idx__index1;
c1	c2	c4	c5	c6	c9	yao_virtual_col
1	1.23	2011-02-13 00:00:00.000000	1	8.66842	88	NULL
2	1.23	2015-05-05 12:00:00.000000	0	541.3267199999999	176	NULL
3	1.21	2085-02-28 18:00:00.000000	1	6.6615476224	11	NULL
select * from __3001__idx__index2;
c1	c2	c3	c4	c5	c6	c8	c9
2	1.23	100.32	2015-05-05 12:00:00.000000	0	541.3267199999999	5.79	176
3	1.21	1.2345344	2085-02-28 18:00:00.000000	1	6.6615476224	5.987	11
1	1.23	5.89	2011-02-13 00:00:00.000000	1	8.66842	9.654	88
select * from __3001__idx__index3;
c1	c2	c3	c5	c6	c7	c8	c9
3	1.21	1.2345344	1	6.6615476224	hellokitty	5.987	11
1	1.23	5.89	1	8.66842	during 	9.654	88
2	1.23	100.32	0	541.3267199999999	su2343a	5.79	176
select * from __3001__idx__index4;
c1	c2	c3	c4	c5	c6	c7	c8
2	1.23	100.32	2015-05-05 12:00:00.000000	0	541.3267199999999	su2343a	5.79
3	1.21	1.2345344	2085-02-28 18:00:00.000000	1	6.6615476224	hellokitty	5.987
1	1.23	5.89	2011-02-13 00:00:00.000000	1	8.66842	during 	9.654
commit;
select * from t1;
c1	c2	c3	c4	c5	c6	c7	c8	c9
1	1.23	5.89	2011-02-13 00:00:00.000000	1	8.66842	during 	9.654	88
2	1.23	100.32	2015-05-05 12:00:00.000000	0	541.3267199999999	su2343a	5.79	176
3	1.21	1.2345344	2085-02-28 18:00:00.000000	1	6.6615476224	hellokitty	5.987	11
select * from __3001__idx__index0;
c1	c2	c3	c4	c5	c6	c8	c9
3	1.21	1.2345344	2085-02-28 18:00:00.000000	1	6.6615476224	5.987	11
1	1.23	5.89	2011-02-13 00:00:00.000000	1	8.66842	9.654	88
2	1.23	100.32	2015-05-05 12:00:00.000000	0	541.3267199999999	5.79	176
select * from __3001__idx__index1;
c1	c2	c4	c5	c6	c9	yao_virtual_col
1	1.23	2011-02-13 00:00:00.000000	1	8.66842	88	NULL
2	1.23	2015-05-05 12:00:00.000000	0	541.3267199999999	176	NULL
3	1.21	2085-02-28 18:00:00.000000	1	6.6615476224	11	NULL
select * from __3001__idx__index2;
c1	c2	c3	c4	c5	c6	c8	c9
2	1.23	100.32	2015-05-05 12:00:00.000000	0	541.3267199999999	5.79	176
3	1.21	1.2345344	2085-02-28 18:00:00.000000	1	6.6615476224	5.987	11
1	1.23	5.89	2011-02-13 00:00:00.000000	1	8.66842	9.654	88
select * from __3001__idx__index3;
c1	c2	c3	c5	c6	c7	c8	c9
3	1.21	1.2345344	1	6.6615476224	hellokitty	5.987	11
1	1.23	5.89	1	8.66842	during 	9.654	88
2	1.23	100.32	0	541.3267199999999	su2343a	5.79	176
select * from __3001__idx__index4;
c1	c2	c3	c4	c5	c6	c7	c8
2	1.23	100.32	2015-05-05 12:00:00.000000	0	541.3267199999999	su2343a	5.79
3	1.21	1.2345344	2085-02-28 18:00:00.000000	1	6.6615476224	hellokitty	5.987
1	1.23	5.89	2011-02-13 00:00:00.000000	1	8.66842	during 	9.654
update t1 set c9=1,c3=0 where c1=1 and c2=1.23;
select * from t1;
c1	c2	c3	c4	c5	c6	c7	c8	c9
1	1.23	0	2011-02-13 00:00:00.000000	1	8.66842	during 	9.654	1
2	1.23	100.32	2015-05-05 12:00:00.000000	0	541.3267199999999	su2343a	5.79	176
3	1.21	1.2345344	2085-02-28 18:00:00.000000	1	6.6615476224	hellokitty	5.987	11
select * from __3001__idx__index0;
c1	c2	c3	c4	c5	c6	c8	c9
3	1.21	1.2345344	2085-02-28 18:00:00.000000	1	6.6615476224	5.987	11
1	1.23	0	2011-02-13 00:00:00.000000	1	8.66842	9.654	1
2	1.23	100.32	2015-05-05 12:00:00.000000	0	541.3267199999999	5.79	176
select * from __3001__idx__index1;
c1	c2	c4	c5	c6	c9	yao_virtual_col
1	1.23	2011-02-13 00:00:00.000000	1	8.66842	1	NULL
2	1.23	2015-05-05 12:00:00.000000	0	541.3267199999999	176	NULL
3	1.21	2085-02-28 18:00:00.000000	1	6.6615476224	11	NULL
select * from __3001__idx__index2;
c1	c2	c3	c4	c5	c6	c8	c9
2	1.23	100.32	2015-05-05 12:00:00.000000	0	541.3267199999999	5.79	176
3	1.21	1.2345344	2085-02-28 18:00:00.000000	1	6.6615476224	5.987	11
1	1.23	0	2011-02-13 00:00:00.000000	1	8.66842	9.654	1
select * from __3001__idx__index3;
c1	c2	c3	c5	c6	c7	c8	c9
3	1.21	1.2345344	1	6.6615476224	hellokitty	5.987	11
1	1.23	0	1	8.66842	during 	9.654	1
2	1.23	100.32	0	541.3267199999999	su2343a	5.79	176
select * from __3001__idx__index4;
c1	c2	c3	c4	c5	c6	c7	c8
2	1.23	100.32	2015-05-05 12:00:00.000000	0	541.3267199999999	su2343a	5.79
3	1.21	1.2345344	2085-02-28 18:00:00.000000	1	6.6615476224	hellokitty	5.987
1	1.23	0	2011-02-13 00:00:00.000000	1	8.66842	during 	9.654
commit;
select * from t1;
c1	c2	c3	c4	c5	c6	c7	c8	c9
1	1.23	0	2011-02-13 00:00:00.000000	1	8.66842	during 	9.654	1
2	1.23	100.32	2015-05-05 12:00:00.000000	0	541.3267199999999	su2343a	5.79	176
3	1.21	1.2345344	2085-02-28 18:00:00.000000	1	6.6615476224	hellokitty	5.987	11
select * from __3001__idx__index0;
c1	c2	c3	c4	c5	c6	c8	c9
3	1.21	1.2345344	2085-02-28 18:00:00.000000	1	6.6615476224	5.987	11
1	1.23	0	2011-02-13 00:00:00.000000	1	8.66842	9.654	1
2	1.23	100.32	2015-05-05 12:00:00.000000	0	541.3267199999999	5.79	176
select * from __3001__idx__index1;
c1	c2	c4	c5	c6	c9	yao_virtual_col
1	1.23	2011-02-13 00:00:00.000000	1	8.66842	1	NULL
2	1.23	2015-05-05 12:00:00.000000	0	541.3267199999999	176	NULL
3	1.21	2085-02-28 18:00:00.000000	1	6.6615476224	11	NULL
select * from __3001__idx__index2;
c1	c2	c3	c4	c5	c6	c8	c9
2	1.23	100.32	2015-05-05 12:00:00.000000	0	541.3267199999999	5.79	176
3	1.21	1.2345344	2085-02-28 18:00:00.000000	1	6.6615476224	5.987	11
1	1.23	0	2011-02-13 00:00:00.000000	1	8.66842	9.654	1
select * from __3001__idx__index3;
c1	c2	c3	c5	c6	c7	c8	c9
3	1.21	1.2345344	1	6.6615476224	hellokitty	5.987	11
1	1.23	0	1	8.66842	during 	9.654	1
2	1.23	100.32	0	541.3267199999999	su2343a	5.79	176
select * from __3001__idx__index4;
c1	c2	c3	c4	c5	c6	c7	c8
2	1.23	100.32	2015-05-05 12:00:00.000000	0	541.3267199999999	su2343a	5.79
3	1.21	1.2345344	2085-02-28 18:00:00.000000	1	6.6615476224	hellokitty	5.987
1	1.23	0	2011-02-13 00:00:00.000000	1	8.66842	during 	9.654
update t1 set c4='4445-01-08 12:00:55' ,c5=0 where c1=1 and c2=1.23;
select * from t1;
c1	c2	c3	c4	c5	c6	c7	c8	c9
1	1.23	0	4445-01-08 12:00:55.000000	0	8.66842	during 	9.654	1
2	1.23	100.32	2015-05-05 12:00:00.000000	0	541.3267199999999	su2343a	5.79	176
3	1.21	1.2345344	2085-02-28 18:00:00.000000	1	6.6615476224	hellokitty	5.987	11
select * from __3001__idx__index0;
c1	c2	c3	c4	c5	c6	c8	c9
3	1.21	1.2345344	2085-02-28 18:00:00.000000	1	6.6615476224	5.987	11
1	1.23	0	4445-01-08 12:00:55.000000	0	8.66842	9.654	1
2	1.23	100.32	2015-05-05 12:00:00.000000	0	541.3267199999999	5.79	176
select * from __3001__idx__index1;
c1	c2	c4	c5	c6	c9	yao_virtual_col
2	1.23	2015-05-05 12:00:00.000000	0	541.3267199999999	176	NULL
3	1.21	2085-02-28 18:00:00.000000	1	6.6615476224	11	NULL
1	1.23	4445-01-08 12:00:55.000000	0	8.66842	1	NULL
select * from __3001__idx__index2;
c1	c2	c3	c4	c5	c6	c8	c9
2	1.23	100.32	2015-05-05 12:00:00.000000	0	541.3267199999999	5.79	176
3	1.21	1.2345344	2085-02-28 18:00:00.000000	1	6.6615476224	5.987	11
1	1.23	0	4445-01-08 12:00:55.000000	0	8.66842	9.654	1
select * from __3001__idx__index3;
c1	c2	c3	c5	c6	c7	c8	c9
3	1.21	1.2345344	1	6.6615476224	hellokitty	5.987	11
1	1.23	0	0	8.66842	during 	9.654	1
2	1.23	100.32	0	541.3267199999999	su2343a	5.79	176
select * from __3001__idx__index4;
c1	c2	c3	c4	c5	c6	c7	c8
2	1.23	100.32	2015-05-05 12:00:00.000000	0	541.3267199999999	su2343a	5.79
3	1.21	1.2345344	2085-02-28 18:00:00.000000	1	6.6615476224	hellokitty	5.987
1	1.23	0	4445-01-08 12:00:55.000000	0	8.66842	during 	9.654
commit;
select * from t1;
c1	c2	c3	c4	c5	c6	c7	c8	c9
1	1.23	0	4445-01-08 12:00:55.000000	0	8.66842	during 	9.654	1
2	1.23	100.32	2015-05-05 12:00:00.000000	0	541.3267199999999	su2343a	5.79	176
3	1.21	1.2345344	2085-02-28 18:00:00.000000	1	6.6615476224	hellokitty	5.987	11
select * from __3001__idx__index0;
c1	c2	c3	c4	c5	c6	c8	c9
3	1.21	1.2345344	2085-02-28 18:00:00.000000	1	6.6615476224	5.987	11
1	1.23	0	4445-01-08 12:00:55.000000	0	8.66842	9.654	1
2	1.23	100.32	2015-05-05 12:00:00.000000	0	541.3267199999999	5.79	176
select * from __3001__idx__index1;
c1	c2	c4	c5	c6	c9	yao_virtual_col
2	1.23	2015-05-05 12:00:00.000000	0	541.3267199999999	176	NULL
3	1.21	2085-02-28 18:00:00.000000	1	6.6615476224	11	NULL
1	1.23	4445-01-08 12:00:55.000000	0	8.66842	1	NULL
select * from __3001__idx__index2;
c1	c2	c3	c4	c5	c6	c8	c9
2	1.23	100.32	2015-05-05 12:00:00.000000	0	541.3267199999999	5.79	176
3	1.21	1.2345344	2085-02-28 18:00:00.000000	1	6.6615476224	5.987	11
1	1.23	0	4445-01-08 12:00:55.000000	0	8.66842	9.654	1
select * from __3001__idx__index3;
c1	c2	c3	c5	c6	c7	c8	c9
3	1.21	1.2345344	1	6.6615476224	hellokitty	5.987	11
1	1.23	0	0	8.66842	during 	9.654	1
2	1.23	100.32	0	541.3267199999999	su2343a	5.79	176
select * from __3001__idx__index4;
c1	c2	c3	c4	c5	c6	c7	c8
2	1.23	100.32	2015-05-05 12:00:00.000000	0	541.3267199999999	su2343a	5.79
3	1.21	1.2345344	2085-02-28 18:00:00.000000	1	6.6615476224	hellokitty	5.987
1	1.23	0	4445-01-08 12:00:55.000000	0	8.66842	during 	9.654
update t1 set c8=1.131,c6=7.892 where c1=1 and c2=1.23;
select * from t1;
c1	c2	c3	c4	c5	c6	c7	c8	c9
1	1.23	0	4445-01-08 12:00:55.000000	0	7.892	during 	1.131	1
2	1.23	100.32	2015-05-05 12:00:00.000000	0	541.3267199999999	su2343a	5.79	176
3	1.21	1.2345344	2085-02-28 18:00:00.000000	1	6.6615476224	hellokitty	5.987	11
select * from __3001__idx__index0;
c1	c2	c3	c4	c5	c6	c8	c9
3	1.21	1.2345344	2085-02-28 18:00:00.000000	1	6.6615476224	5.987	11
1	1.23	0	4445-01-08 12:00:55.000000	0	7.892	1.131	1
2	1.23	100.32	2015-05-05 12:00:00.000000	0	541.3267199999999	5.79	176
select * from __3001__idx__index1;
c1	c2	c4	c5	c6	c9	yao_virtual_col
2	1.23	2015-05-05 12:00:00.000000	0	541.3267199999999	176	NULL
3	1.21	2085-02-28 18:00:00.000000	1	6.6615476224	11	NULL
1	1.23	4445-01-08 12:00:55.000000	0	7.892	1	NULL
select * from __3001__idx__index2;
c1	c2	c3	c4	c5	c6	c8	c9
1	1.23	0	4445-01-08 12:00:55.000000	0	7.892	1.131	1
2	1.23	100.32	2015-05-05 12:00:00.000000	0	541.3267199999999	5.79	176
3	1.21	1.2345344	2085-02-28 18:00:00.000000	1	6.6615476224	5.987	11
select * from __3001__idx__index3;
c1	c2	c3	c5	c6	c7	c8	c9
3	1.21	1.2345344	1	6.6615476224	hellokitty	5.987	11
1	1.23	0	0	7.892	during 	1.131	1
2	1.23	100.32	0	541.3267199999999	su2343a	5.79	176
select * from __3001__idx__index4;
c1	c2	c3	c4	c5	c6	c7	c8
1	1.23	0	4445-01-08 12:00:55.000000	0	7.892	during 	1.131
2	1.23	100.32	2015-05-05 12:00:00.000000	0	541.3267199999999	su2343a	5.79
3	1.21	1.2345344	2085-02-28 18:00:00.000000	1	6.6615476224	hellokitty	5.987
commit;
select * from t1;
c1	c2	c3	c4	c5	c6	c7	c8	c9
1	1.23	0	4445-01-08 12:00:55.000000	0	7.892	during 	1.131	1
2	1.23	100.32	2015-05-05 12:00:00.000000	0	541.3267199999999	su2343a	5.79	176
3	1.21	1.2345344	2085-02-28 18:00:00.000000	1	6.6615476224	hellokitty	5.987	11
select * from __3001__idx__index0;
c1	c2	c3	c4	c5	c6	c8	c9
3	1.21	1.2345344	2085-02-28 18:00:00.000000	1	6.6615476224	5.987	11
1	1.23	0	4445-01-08 12:00:55.000000	0	7.892	1.131	1
2	1.23	100.32	2015-05-05 12:00:00.000000	0	541.3267199999999	5.79	176
select * from __3001__idx__index1;
c1	c2	c4	c5	c6	c9	yao_virtual_col
2	1.23	2015-05-05 12:00:00.000000	0	541.3267199999999	176	NULL
3	1.21	2085-02-28 18:00:00.000000	1	6.6615476224	11	NULL
1	1.23	4445-01-08 12:00:55.000000	0	7.892	1	NULL
select * from __3001__idx__index2;
c1	c2	c3	c4	c5	c6	c8	c9
1	1.23	0	4445-01-08 12:00:55.000000	0	7.892	1.131	1
2	1.23	100.32	2015-05-05 12:00:00.000000	0	541.3267199999999	5.79	176
3	1.21	1.2345344	2085-02-28 18:00:00.000000	1	6.6615476224	5.987	11
select * from __3001__idx__index3;
c1	c2	c3	c5	c6	c7	c8	c9
3	1.21	1.2345344	1	6.6615476224	hellokitty	5.987	11
1	1.23	0	0	7.892	during 	1.131	1
2	1.23	100.32	0	541.3267199999999	su2343a	5.79	176
select * from __3001__idx__index4;
c1	c2	c3	c4	c5	c6	c7	c8
1	1.23	0	4445-01-08 12:00:55.000000	0	7.892	during 	1.131
2	1.23	100.32	2015-05-05 12:00:00.000000	0	541.3267199999999	su2343a	5.79
3	1.21	1.2345344	2085-02-28 18:00:00.000000	1	6.6615476224	hellokitty	5.987
update t1 set c7='alittlegril',c8=4.554 where c1=1 and c2=1.23;
select * from t1;
c1	c2	c3	c4	c5	c6	c7	c8	c9
1	1.23	0	4445-01-08 12:00:55.000000	0	7.892	alittlegril	4.554	1
2	1.23	100.32	2015-05-05 12:00:00.000000	0	541.3267199999999	su2343a	5.79	176
3	1.21	1.2345344	2085-02-28 18:00:00.000000	1	6.6615476224	hellokitty	5.987	11
select * from __3001__idx__index0;
c1	c2	c3	c4	c5	c6	c8	c9
3	1.21	1.2345344	2085-02-28 18:00:00.000000	1	6.6615476224	5.987	11
1	1.23	0	4445-01-08 12:00:55.000000	0	7.892	4.554	1
2	1.23	100.32	2015-05-05 12:00:00.000000	0	541.3267199999999	5.79	176
select * from __3001__idx__index1;
c1	c2	c4	c5	c6	c9	yao_virtual_col
2	1.23	2015-05-05 12:00:00.000000	0	541.3267199999999	176	NULL
3	1.21	2085-02-28 18:00:00.000000	1	6.6615476224	11	NULL
1	1.23	4445-01-08 12:00:55.000000	0	7.892	1	NULL
select * from __3001__idx__index2;
c1	c2	c3	c4	c5	c6	c8	c9
1	1.23	0	4445-01-08 12:00:55.000000	0	7.892	4.554	1
2	1.23	100.32	2015-05-05 12:00:00.000000	0	541.3267199999999	5.79	176
3	1.21	1.2345344	2085-02-28 18:00:00.000000	1	6.6615476224	5.987	11
select * from __3001__idx__index3;
c1	c2	c3	c5	c6	c7	c8	c9
3	1.21	1.2345344	1	6.6615476224	hellokitty	5.987	11
1	1.23	0	0	7.892	alittlegril	4.554	1
2	1.23	100.32	0	541.3267199999999	su2343a	5.79	176
select * from __3001__idx__index4;
c1	c2	c3	c4	c5	c6	c7	c8
1	1.23	0	4445-01-08 12:00:55.000000	0	7.892	alittlegril	4.554
2	1.23	100.32	2015-05-05 12:00:00.000000	0	541.3267199999999	su2343a	5.79
3	1.21	1.2345344	2085-02-28 18:00:00.000000	1	6.6615476224	hellokitty	5.987
commit;
select * from t1;
c1	c2	c3	c4	c5	c6	c7	c8	c9
1	1.23	0	4445-01-08 12:00:55.000000	0	7.892	alittlegril	4.554	1
2	1.23	100.32	2015-05-05 12:00:00.000000	0	541.3267199999999	su2343a	5.79	176
3	1.21	1.2345344	2085-02-28 18:00:00.000000	1	6.6615476224	hellokitty	5.987	11
select * from __3001__idx__index0;
c1	c2	c3	c4	c5	c6	c8	c9
3	1.21	1.2345344	2085-02-28 18:00:00.000000	1	6.6615476224	5.987	11
1	1.23	0	4445-01-08 12:00:55.000000	0	7.892	4.554	1
2	1.23	100.32	2015-05-05 12:00:00.000000	0	541.3267199999999	5.79	176
select * from __3001__idx__index1;
c1	c2	c4	c5	c6	c9	yao_virtual_col
2	1.23	2015-05-05 12:00:00.000000	0	541.3267199999999	176	NULL
3	1.21	2085-02-28 18:00:00.000000	1	6.6615476224	11	NULL
1	1.23	4445-01-08 12:00:55.000000	0	7.892	1	NULL
select * from __3001__idx__index2;
c1	c2	c3	c4	c5	c6	c8	c9
1	1.23	0	4445-01-08 12:00:55.000000	0	7.892	4.554	1
2	1.23	100.32	2015-05-05 12:00:00.000000	0	541.3267199999999	5.79	176
3	1.21	1.2345344	2085-02-28 18:00:00.000000	1	6.6615476224	5.987	11
select * from __3001__idx__index3;
c1	c2	c3	c5	c6	c7	c8	c9
3	1.21	1.2345344	1	6.6615476224	hellokitty	5.987	11
1	1.23	0	0	7.892	alittlegril	4.554	1
2	1.23	100.32	0	541.3267199999999	su2343a	5.79	176
select * from __3001__idx__index4;
c1	c2	c3	c4	c5	c6	c7	c8
1	1.23	0	4445-01-08 12:00:55.000000	0	7.892	alittlegril	4.554
2	1.23	100.32	2015-05-05 12:00:00.000000	0	541.3267199999999	su2343a	5.79
3	1.21	1.2345344	2085-02-28 18:00:00.000000	1	6.6615476224	hellokitty	5.987
update t1 set c3=3.38565,c6=8.66842 where c1=1 and c2=1.23;
select * from t1;
c1	c2	c3	c4	c5	c6	c7	c8	c9
1	1.23	3.38565	4445-01-08 12:00:55.000000	0	8.66842	alittlegril	4.554	1
2	1.23	100.32	2015-05-05 12:00:00.000000	0	541.3267199999999	su2343a	5.79	176
3	1.21	1.2345344	2085-02-28 18:00:00.000000	1	6.6615476224	hellokitty	5.987	11
select * from __3001__idx__index0;
c1	c2	c3	c4	c5	c6	c8	c9
3	1.21	1.2345344	2085-02-28 18:00:00.000000	1	6.6615476224	5.987	11
1	1.23	3.38565	4445-01-08 12:00:55.000000	0	8.66842	4.554	1
2	1.23	100.32	2015-05-05 12:00:00.000000	0	541.3267199999999	5.79	176
select * from __3001__idx__index1;
c1	c2	c4	c5	c6	c9	yao_virtual_col
2	1.23	2015-05-05 12:00:00.000000	0	541.3267199999999	176	NULL
3	1.21	2085-02-28 18:00:00.000000	1	6.6615476224	11	NULL
1	1.23	4445-01-08 12:00:55.000000	0	8.66842	1	NULL
select * from __3001__idx__index2;
c1	c2	c3	c4	c5	c6	c8	c9
1	1.23	3.38565	4445-01-08 12:00:55.000000	0	8.66842	4.554	1
2	1.23	100.32	2015-05-05 12:00:00.000000	0	541.3267199999999	5.79	176
3	1.21	1.2345344	2085-02-28 18:00:00.000000	1	6.6615476224	5.987	11
select * from __3001__idx__index3;
c1	c2	c3	c5	c6	c7	c8	c9
3	1.21	1.2345344	1	6.6615476224	hellokitty	5.987	11
1	1.23	3.38565	0	8.66842	alittlegril	4.554	1
2	1.23	100.32	0	541.3267199999999	su2343a	5.79	176
select * from __3001__idx__index4;
c1	c2	c3	c4	c5	c6	c7	c8
1	1.23	3.38565	4445-01-08 12:00:55.000000	0	8.66842	alittlegril	4.554
2	1.23	100.32	2015-05-05 12:00:00.000000	0	541.3267199999999	su2343a	5.79
3	1.21	1.2345344	2085-02-28 18:00:00.000000	1	6.6615476224	hellokitty	5.987
commit;
select * from t1;
c1	c2	c3	c4	c5	c6	c7	c8	c9
1	1.23	3.38565	4445-01-08 12:00:55.000000	0	8.66842	alittlegril	4.554	1
2	1.23	100.32	2015-05-05 12:00:00.000000	0	541.3267199999999	su2343a	5.79	176
3	1.21	1.2345344	2085-02-28 18:00:00.000000	1	6.6615476224	hellokitty	5.987	11
select * from __3001__idx__index0;
c1	c2	c3	c4	c5	c6	c8	c9
3	1.21	1.2345344	2085-02-28 18:00:00.000000	1	6.6615476224	5.987	11
1	1.23	3.38565	4445-01-08 12:00:55.000000	0	8.66842	4.554	1
2	1.23	100.32	2015-05-05 12:00:00.000000	0	541.3267199999999	5.79	176
select * from __3001__idx__index1;
c1	c2	c4	c5	c6	c9	yao_virtual_col
2	1.23	2015-05-05 12:00:00.000000	0	541.3267199999999	176	NULL
3	1.21	2085-02-28 18:00:00.000000	1	6.6615476224	11	NULL
1	1.23	4445-01-08 12:00:55.000000	0	8.66842	1	NULL
select * from __3001__idx__index2;
c1	c2	c3	c4	c5	c6	c8	c9
1	1.23	3.38565	4445-01-08 12:00:55.000000	0	8.66842	4.554	1
2	1.23	100.32	2015-05-05 12:00:00.000000	0	541.3267199999999	5.79	176
3	1.21	1.2345344	2085-02-28 18:00:00.000000	1	6.6615476224	5.987	11
select * from __3001__idx__index3;
c1	c2	c3	c5	c6	c7	c8	c9
3	1.21	1.2345344	1	6.6615476224	hellokitty	5.987	11
1	1.23	3.38565	0	8.66842	alittlegril	4.554	1
2	1.23	100.32	0	541.3267199999999	su2343a	5.79	176
select * from __3001__idx__index4;
c1	c2	c3	c4	c5	c6	c7	c8
1	1.23	3.38565	4445-01-08 12:00:55.000000	0	8.66842	alittlegril	4.554
2	1.23	100.32	2015-05-05 12:00:00.000000	0	541.3267199999999	su2343a	5.79
3	1.21	1.2345344	2085-02-28 18:00:00.000000	1	6.6615476224	hellokitty	5.987
update t1 set c9=9/7,c3=4.56*7.89 where c1=2 and c2=1.23;
select * from t1;
c1	c2	c3	c4	c5	c6	c7	c8	c9
1	1.23	3.38565	4445-01-08 12:00:55.000000	0	8.66842	alittlegril	4.554	1
2	1.23	35.9784	2015-05-05 12:00:00.000000	0	541.3267199999999	su2343a	5.79	1
3	1.21	1.2345344	2085-02-28 18:00:00.000000	1	6.6615476224	hellokitty	5.987	11
select * from __3001__idx__index0;
c1	c2	c3	c4	c5	c6	c8	c9
3	1.21	1.2345344	2085-02-28 18:00:00.000000	1	6.6615476224	5.987	11
1	1.23	3.38565	4445-01-08 12:00:55.000000	0	8.66842	4.554	1
2	1.23	35.9784	2015-05-05 12:00:00.000000	0	541.3267199999999	5.79	1
select * from __3001__idx__index1;
c1	c2	c4	c5	c6	c9	yao_virtual_col
2	1.23	2015-05-05 12:00:00.000000	0	541.3267199999999	1	NULL
3	1.21	2085-02-28 18:00:00.000000	1	6.6615476224	11	NULL
1	1.23	4445-01-08 12:00:55.000000	0	8.66842	1	NULL
select * from __3001__idx__index2;
c1	c2	c3	c4	c5	c6	c8	c9
1	1.23	3.38565	4445-01-08 12:00:55.000000	0	8.66842	4.554	1
2	1.23	35.9784	2015-05-05 12:00:00.000000	0	541.3267199999999	5.79	1
3	1.21	1.2345344	2085-02-28 18:00:00.000000	1	6.6615476224	5.987	11
select * from __3001__idx__index3;
c1	c2	c3	c5	c6	c7	c8	c9
3	1.21	1.2345344	1	6.6615476224	hellokitty	5.987	11
1	1.23	3.38565	0	8.66842	alittlegril	4.554	1
2	1.23	35.9784	0	541.3267199999999	su2343a	5.79	1
select * from __3001__idx__index4;
c1	c2	c3	c4	c5	c6	c7	c8
1	1.23	3.38565	4445-01-08 12:00:55.000000	0	8.66842	alittlegril	4.554
2	1.23	35.9784	2015-05-05 12:00:00.000000	0	541.3267199999999	su2343a	5.79
3	1.21	1.2345344	2085-02-28 18:00:00.000000	1	6.6615476224	hellokitty	5.987
commit;
select * from t1;
c1	c2	c3	c4	c5	c6	c7	c8	c9
1	1.23	3.38565	4445-01-08 12:00:55.000000	0	8.66842	alittlegril	4.554	1
2	1.23	35.9784	2015-05-05 12:00:00.000000	0	541.3267199999999	su2343a	5.79	1
3	1.21	1.2345344	2085-02-28 18:00:00.000000	1	6.6615476224	hellokitty	5.987	11
select * from __3001__idx__index0;
c1	c2	c3	c4	c5	c6	c8	c9
3	1.21	1.2345344	2085-02-28 18:00:00.000000	1	6.6615476224	5.987	11
1	1.23	3.38565	4445-01-08 12:00:55.000000	0	8.66842	4.554	1
2	1.23	35.9784	2015-05-05 12:00:00.000000	0	541.3267199999999	5.79	1
select * from __3001__idx__index1;
c1	c2	c4	c5	c6	c9	yao_virtual_col
2	1.23	2015-05-05 12:00:00.000000	0	541.3267199999999	1	NULL
3	1.21	2085-02-28 18:00:00.000000	1	6.6615476224	11	NULL
1	1.23	4445-01-08 12:00:55.000000	0	8.66842	1	NULL
select * from __3001__idx__index2;
c1	c2	c3	c4	c5	c6	c8	c9
1	1.23	3.38565	4445-01-08 12:00:55.000000	0	8.66842	4.554	1
2	1.23	35.9784	2015-05-05 12:00:00.000000	0	541.3267199999999	5.79	1
3	1.21	1.2345344	2085-02-28 18:00:00.000000	1	6.6615476224	5.987	11
select * from __3001__idx__index3;
c1	c2	c3	c5	c6	c7	c8	c9
3	1.21	1.2345344	1	6.6615476224	hellokitty	5.987	11
1	1.23	3.38565	0	8.66842	alittlegril	4.554	1
2	1.23	35.9784	0	541.3267199999999	su2343a	5.79	1
select * from __3001__idx__index4;
c1	c2	c3	c4	c5	c6	c7	c8
1	1.23	3.38565	4445-01-08 12:00:55.000000	0	8.66842	alittlegril	4.554
2	1.23	35.9784	2015-05-05 12:00:00.000000	0	541.3267199999999	su2343a	5.79
3	1.21	1.2345344	2085-02-28 18:00:00.000000	1	6.6615476224	hellokitty	5.987
update t1 set c3=1.2365655*12.54,c6=7.58/9.5412 where c1=2 and c2=1.23;
select * from t1;
c1	c2	c3	c4	c5	c6	c7	c8	c9
1	1.23	3.38565	4445-01-08 12:00:55.000000	0	8.66842	alittlegril	4.554	1
2	1.23	15.50653137	2015-05-05 12:00:00.000000	0	0.794449	su2343a	5.79	1
3	1.21	1.2345344	2085-02-28 18:00:00.000000	1	6.6615476224	hellokitty	5.987	11
select * from __3001__idx__index0;
c1	c2	c3	c4	c5	c6	c8	c9
2	1.23	15.50653137	2015-05-05 12:00:00.000000	0	0.794449	5.79	1
3	1.21	1.2345344	2085-02-28 18:00:00.000000	1	6.6615476224	5.987	11
1	1.23	3.38565	4445-01-08 12:00:55.000000	0	8.66842	4.554	1
select * from __3001__idx__index1;
c1	c2	c4	c5	c6	c9	yao_virtual_col
2	1.23	2015-05-05 12:00:00.000000	0	0.794449	1	NULL
3	1.21	2085-02-28 18:00:00.000000	1	6.6615476224	11	NULL
1	1.23	4445-01-08 12:00:55.000000	0	8.66842	1	NULL
select * from __3001__idx__index2;
c1	c2	c3	c4	c5	c6	c8	c9
1	1.23	3.38565	4445-01-08 12:00:55.000000	0	8.66842	4.554	1
2	1.23	15.50653137	2015-05-05 12:00:00.000000	0	0.794449	5.79	1
3	1.21	1.2345344	2085-02-28 18:00:00.000000	1	6.6615476224	5.987	11
select * from __3001__idx__index3;
c1	c2	c3	c5	c6	c7	c8	c9
2	1.23	15.50653137	0	0.794449	su2343a	5.79	1
3	1.21	1.2345344	1	6.6615476224	hellokitty	5.987	11
1	1.23	3.38565	0	8.66842	alittlegril	4.554	1
select * from __3001__idx__index4;
c1	c2	c3	c4	c5	c6	c7	c8
1	1.23	3.38565	4445-01-08 12:00:55.000000	0	8.66842	alittlegril	4.554
2	1.23	15.50653137	2015-05-05 12:00:00.000000	0	0.794449	su2343a	5.79
3	1.21	1.2345344	2085-02-28 18:00:00.000000	1	6.6615476224	hellokitty	5.987
commit;
select * from t1;
c1	c2	c3	c4	c5	c6	c7	c8	c9
1	1.23	3.38565	4445-01-08 12:00:55.000000	0	8.66842	alittlegril	4.554	1
2	1.23	15.50653137	2015-05-05 12:00:00.000000	0	0.794449	su2343a	5.79	1
3	1.21	1.2345344	2085-02-28 18:00:00.000000	1	6.6615476224	hellokitty	5.987	11
select * from __3001__idx__index0;
c1	c2	c3	c4	c5	c6	c8	c9
2	1.23	15.50653137	2015-05-05 12:00:00.000000	0	0.794449	5.79	1
3	1.21	1.2345344	2085-02-28 18:00:00.000000	1	6.6615476224	5.987	11
1	1.23	3.38565	4445-01-08 12:00:55.000000	0	8.66842	4.554	1
select * from __3001__idx__index1;
c1	c2	c4	c5	c6	c9	yao_virtual_col
2	1.23	2015-05-05 12:00:00.000000	0	0.794449	1	NULL
3	1.21	2085-02-28 18:00:00.000000	1	6.6615476224	11	NULL
1	1.23	4445-01-08 12:00:55.000000	0	8.66842	1	NULL
select * from __3001__idx__index2;
c1	c2	c3	c4	c5	c6	c8	c9
1	1.23	3.38565	4445-01-08 12:00:55.000000	0	8.66842	4.554	1
2	1.23	15.50653137	2015-05-05 12:00:00.000000	0	0.794449	5.79	1
3	1.21	1.2345344	2085-02-28 18:00:00.000000	1	6.6615476224	5.987	11
select * from __3001__idx__index3;
c1	c2	c3	c5	c6	c7	c8	c9
2	1.23	15.50653137	0	0.794449	su2343a	5.79	1
3	1.21	1.2345344	1	6.6615476224	hellokitty	5.987	11
1	1.23	3.38565	0	8.66842	alittlegril	4.554	1
select * from __3001__idx__index4;
c1	c2	c3	c4	c5	c6	c7	c8
1	1.23	3.38565	4445-01-08 12:00:55.000000	0	8.66842	alittlegril	4.554
2	1.23	15.50653137	2015-05-05 12:00:00.000000	0	0.794449	su2343a	5.79
3	1.21	1.2345344	2085-02-28 18:00:00.000000	1	6.6615476224	hellokitty	5.987
update t1 set c6=8/18,c5=8-8 where c1=2 and c2=1.23;
select * from t1;
c1	c2	c3	c4	c5	c6	c7	c8	c9
1	1.23	3.38565	4445-01-08 12:00:55.000000	0	8.66842	alittlegril	4.554	1
2	1.23	15.50653137	2015-05-05 12:00:00.000000	0	0.4444	su2343a	5.79	1
3	1.21	1.2345344	2085-02-28 18:00:00.000000	1	6.6615476224	hellokitty	5.987	11
select * from __3001__idx__index0;
c1	c2	c3	c4	c5	c6	c8	c9
2	1.23	15.50653137	2015-05-05 12:00:00.000000	0	0.4444	5.79	1
3	1.21	1.2345344	2085-02-28 18:00:00.000000	1	6.6615476224	5.987	11
1	1.23	3.38565	4445-01-08 12:00:55.000000	0	8.66842	4.554	1
select * from __3001__idx__index1;
c1	c2	c4	c5	c6	c9	yao_virtual_col
2	1.23	2015-05-05 12:00:00.000000	0	0.4444	1	NULL
3	1.21	2085-02-28 18:00:00.000000	1	6.6615476224	11	NULL
1	1.23	4445-01-08 12:00:55.000000	0	8.66842	1	NULL
select * from __3001__idx__index2;
c1	c2	c3	c4	c5	c6	c8	c9
1	1.23	3.38565	4445-01-08 12:00:55.000000	0	8.66842	4.554	1
2	1.23	15.50653137	2015-05-05 12:00:00.000000	0	0.4444	5.79	1
3	1.21	1.2345344	2085-02-28 18:00:00.000000	1	6.6615476224	5.987	11
select * from __3001__idx__index3;
c1	c2	c3	c5	c6	c7	c8	c9
2	1.23	15.50653137	0	0.4444	su2343a	5.79	1
3	1.21	1.2345344	1	6.6615476224	hellokitty	5.987	11
1	1.23	3.38565	0	8.66842	alittlegril	4.554	1
select * from __3001__idx__index4;
c1	c2	c3	c4	c5	c6	c7	c8
1	1.23	3.38565	4445-01-08 12:00:55.000000	0	8.66842	alittlegril	4.554
2	1.23	15.50653137	2015-05-05 12:00:00.000000	0	0.4444	su2343a	5.79
3	1.21	1.2345344	2085-02-28 18:00:00.000000	1	6.6615476224	hellokitty	5.987
commit;
select * from t1;
c1	c2	c3	c4	c5	c6	c7	c8	c9
1	1.23	3.38565	4445-01-08 12:00:55.000000	0	8.66842	alittlegril	4.554	1
2	1.23	15.50653137	2015-05-05 12:00:00.000000	0	0.4444	su2343a	5.79	1
3	1.21	1.2345344	2085-02-28 18:00:00.000000	1	6.6615476224	hellokitty	5.987	11
select * from __3001__idx__index0;
c1	c2	c3	c4	c5	c6	c8	c9
2	1.23	15.50653137	2015-05-05 12:00:00.000000	0	0.4444	5.79	1
3	1.21	1.2345344	2085-02-28 18:00:00.000000	1	6.6615476224	5.987	11
1	1.23	3.38565	4445-01-08 12:00:55.000000	0	8.66842	4.554	1
select * from __3001__idx__index1;
c1	c2	c4	c5	c6	c9	yao_virtual_col
2	1.23	2015-05-05 12:00:00.000000	0	0.4444	1	NULL
3	1.21	2085-02-28 18:00:00.000000	1	6.6615476224	11	NULL
1	1.23	4445-01-08 12:00:55.000000	0	8.66842	1	NULL
select * from __3001__idx__index2;
c1	c2	c3	c4	c5	c6	c8	c9
1	1.23	3.38565	4445-01-08 12:00:55.000000	0	8.66842	4.554	1
2	1.23	15.50653137	2015-05-05 12:00:00.000000	0	0.4444	5.79	1
3	1.21	1.2345344	2085-02-28 18:00:00.000000	1	6.6615476224	5.987	11
select * from __3001__idx__index3;
c1	c2	c3	c5	c6	c7	c8	c9
2	1.23	15.50653137	0	0.4444	su2343a	5.79	1
3	1.21	1.2345344	1	6.6615476224	hellokitty	5.987	11
1	1.23	3.38565	0	8.66842	alittlegril	4.554	1
select * from __3001__idx__index4;
c1	c2	c3	c4	c5	c6	c7	c8
1	1.23	3.38565	4445-01-08 12:00:55.000000	0	8.66842	alittlegril	4.554
2	1.23	15.50653137	2015-05-05 12:00:00.000000	0	0.4444	su2343a	5.79
3	1.21	1.2345344	2085-02-28 18:00:00.000000	1	6.6615476224	hellokitty	5.987
update t1 set c8=4569/9,c9=87*554 where c1=2 and c2=1.23;
ERROR HY000: YAO-58: Overflow occurred during convert decimal(8,4) to decimal(4,3) for table[test.t1] column[c8]
select * from t1;
c1	c2	c3	c4	c5	c6	c7	c8	c9
1	1.23	3.38565	4445-01-08 12:00:55.000000	0	8.66842	alittlegril	4.554	1
2	1.23	15.50653137	2015-05-05 12:00:00.000000	0	0.4444	su2343a	5.79	1
3	1.21	1.2345344	2085-02-28 18:00:00.000000	1	6.6615476224	hellokitty	5.987	11
select * from __3001__idx__index0;
c1	c2	c3	c4	c5	c6	c8	c9
2	1.23	15.50653137	2015-05-05 12:00:00.000000	0	0.4444	5.79	1
3	1.21	1.2345344	2085-02-28 18:00:00.000000	1	6.6615476224	5.987	11
1	1.23	3.38565	4445-01-08 12:00:55.000000	0	8.66842	4.554	1
select * from __3001__idx__index1;
c1	c2	c4	c5	c6	c9	yao_virtual_col
2	1.23	2015-05-05 12:00:00.000000	0	0.4444	1	NULL
3	1.21	2085-02-28 18:00:00.000000	1	6.6615476224	11	NULL
1	1.23	4445-01-08 12:00:55.000000	0	8.66842	1	NULL
select * from __3001__idx__index2;
c1	c2	c3	c4	c5	c6	c8	c9
1	1.23	3.38565	4445-01-08 12:00:55.000000	0	8.66842	4.554	1
2	1.23	15.50653137	2015-05-05 12:00:00.000000	0	0.4444	5.79	1
3	1.21	1.2345344	2085-02-28 18:00:00.000000	1	6.6615476224	5.987	11
select * from __3001__idx__index3;
c1	c2	c3	c5	c6	c7	c8	c9
2	1.23	15.50653137	0	0.4444	su2343a	5.79	1
3	1.21	1.2345344	1	6.6615476224	hellokitty	5.987	11
1	1.23	3.38565	0	8.66842	alittlegril	4.554	1
select * from __3001__idx__index4;
c1	c2	c3	c4	c5	c6	c7	c8
1	1.23	3.38565	4445-01-08 12:00:55.000000	0	8.66842	alittlegril	4.554
2	1.23	15.50653137	2015-05-05 12:00:00.000000	0	0.4444	su2343a	5.79
3	1.21	1.2345344	2085-02-28 18:00:00.000000	1	6.6615476224	hellokitty	5.987
commit;
select * from t1;
c1	c2	c3	c4	c5	c6	c7	c8	c9
1	1.23	3.38565	4445-01-08 12:00:55.000000	0	8.66842	alittlegril	4.554	1
2	1.23	15.50653137	2015-05-05 12:00:00.000000	0	0.4444	su2343a	5.79	1
3	1.21	1.2345344	2085-02-28 18:00:00.000000	1	6.6615476224	hellokitty	5.987	11
select * from __3001__idx__index0;
c1	c2	c3	c4	c5	c6	c8	c9
2	1.23	15.50653137	2015-05-05 12:00:00.000000	0	0.4444	5.79	1
3	1.21	1.2345344	2085-02-28 18:00:00.000000	1	6.6615476224	5.987	11
1	1.23	3.38565	4445-01-08 12:00:55.000000	0	8.66842	4.554	1
select * from __3001__idx__index1;
c1	c2	c4	c5	c6	c9	yao_virtual_col
2	1.23	2015-05-05 12:00:00.000000	0	0.4444	1	NULL
3	1.21	2085-02-28 18:00:00.000000	1	6.6615476224	11	NULL
1	1.23	4445-01-08 12:00:55.000000	0	8.66842	1	NULL
select * from __3001__idx__index2;
c1	c2	c3	c4	c5	c6	c8	c9
1	1.23	3.38565	4445-01-08 12:00:55.000000	0	8.66842	4.554	1
2	1.23	15.50653137	2015-05-05 12:00:00.000000	0	0.4444	5.79	1
3	1.21	1.2345344	2085-02-28 18:00:00.000000	1	6.6615476224	5.987	11
select * from __3001__idx__index3;
c1	c2	c3	c5	c6	c7	c8	c9
2	1.23	15.50653137	0	0.4444	su2343a	5.79	1
3	1.21	1.2345344	1	6.6615476224	hellokitty	5.987	11
1	1.23	3.38565	0	8.66842	alittlegril	4.554	1
select * from __3001__idx__index4;
c1	c2	c3	c4	c5	c6	c7	c8
1	1.23	3.38565	4445-01-08 12:00:55.000000	0	8.66842	alittlegril	4.554
2	1.23	15.50653137	2015-05-05 12:00:00.000000	0	0.4444	su2343a	5.79
3	1.21	1.2345344	2085-02-28 18:00:00.000000	1	6.6615476224	hellokitty	5.987
update t1 set c9=c1+123,c6=c3-5.941 where c1=2 and c2=1.23;
select * from t1;
c1	c2	c3	c4	c5	c6	c7	c8	c9
1	1.23	3.38565	4445-01-08 12:00:55.000000	0	8.66842	alittlegril	4.554	1
2	1.23	15.50653137	2015-05-05 12:00:00.000000	0	9.565531369999999	su2343a	5.79	125
3	1.21	1.2345344	2085-02-28 18:00:00.000000	1	6.6615476224	hellokitty	5.987	11
select * from __3001__idx__index0;
c1	c2	c3	c4	c5	c6	c8	c9
3	1.21	1.2345344	2085-02-28 18:00:00.000000	1	6.6615476224	5.987	11
1	1.23	3.38565	4445-01-08 12:00:55.000000	0	8.66842	4.554	1
2	1.23	15.50653137	2015-05-05 12:00:00.000000	0	9.565531369999999	5.79	125
select * from __3001__idx__index1;
c1	c2	c4	c5	c6	c9	yao_virtual_col
2	1.23	2015-05-05 12:00:00.000000	0	9.565531369999999	125	NULL
3	1.21	2085-02-28 18:00:00.000000	1	6.6615476224	11	NULL
1	1.23	4445-01-08 12:00:55.000000	0	8.66842	1	NULL
select * from __3001__idx__index2;
c1	c2	c3	c4	c5	c6	c8	c9
1	1.23	3.38565	4445-01-08 12:00:55.000000	0	8.66842	4.554	1
2	1.23	15.50653137	2015-05-05 12:00:00.000000	0	9.565531369999999	5.79	125
3	1.21	1.2345344	2085-02-28 18:00:00.000000	1	6.6615476224	5.987	11
select * from __3001__idx__index3;
c1	c2	c3	c5	c6	c7	c8	c9
3	1.21	1.2345344	1	6.6615476224	hellokitty	5.987	11
1	1.23	3.38565	0	8.66842	alittlegril	4.554	1
2	1.23	15.50653137	0	9.565531369999999	su2343a	5.79	125
select * from __3001__idx__index4;
c1	c2	c3	c4	c5	c6	c7	c8
1	1.23	3.38565	4445-01-08 12:00:55.000000	0	8.66842	alittlegril	4.554
2	1.23	15.50653137	2015-05-05 12:00:00.000000	0	9.565531369999999	su2343a	5.79
3	1.21	1.2345344	2085-02-28 18:00:00.000000	1	6.6615476224	hellokitty	5.987
commit;
select * from t1;
c1	c2	c3	c4	c5	c6	c7	c8	c9
1	1.23	3.38565	4445-01-08 12:00:55.000000	0	8.66842	alittlegril	4.554	1
2	1.23	15.50653137	2015-05-05 12:00:00.000000	0	9.565531369999999	su2343a	5.79	125
3	1.21	1.2345344	2085-02-28 18:00:00.000000	1	6.6615476224	hellokitty	5.987	11
select * from __3001__idx__index0;
c1	c2	c3	c4	c5	c6	c8	c9
3	1.21	1.2345344	2085-02-28 18:00:00.000000	1	6.6615476224	5.987	11
1	1.23	3.38565	4445-01-08 12:00:55.000000	0	8.66842	4.554	1
2	1.23	15.50653137	2015-05-05 12:00:00.000000	0	9.565531369999999	5.79	125
select * from __3001__idx__index1;
c1	c2	c4	c5	c6	c9	yao_virtual_col
2	1.23	2015-05-05 12:00:00.000000	0	9.565531369999999	125	NULL
3	1.21	2085-02-28 18:00:00.000000	1	6.6615476224	11	NULL
1	1.23	4445-01-08 12:00:55.000000	0	8.66842	1	NULL
select * from __3001__idx__index2;
c1	c2	c3	c4	c5	c6	c8	c9
1	1.23	3.38565	4445-01-08 12:00:55.000000	0	8.66842	4.554	1
2	1.23	15.50653137	2015-05-05 12:00:00.000000	0	9.565531369999999	5.79	125
3	1.21	1.2345344	2085-02-28 18:00:00.000000	1	6.6615476224	5.987	11
select * from __3001__idx__index3;
c1	c2	c3	c5	c6	c7	c8	c9
3	1.21	1.2345344	1	6.6615476224	hellokitty	5.987	11
1	1.23	3.38565	0	8.66842	alittlegril	4.554	1
2	1.23	15.50653137	0	9.565531369999999	su2343a	5.79	125
select * from __3001__idx__index4;
c1	c2	c3	c4	c5	c6	c7	c8
1	1.23	3.38565	4445-01-08 12:00:55.000000	0	8.66842	alittlegril	4.554
2	1.23	15.50653137	2015-05-05 12:00:00.000000	0	9.565531369999999	su2343a	5.79
3	1.21	1.2345344	2085-02-28 18:00:00.000000	1	6.6615476224	hellokitty	5.987
update t1 set c8=c2+7.981,c3=c6*5.6561 where c1=2 and c2=1.23;
select * from t1;
c1	c2	c3	c4	c5	c6	c7	c8	c9
1	1.23	3.38565	4445-01-08 12:00:55.000000	0	8.66842	alittlegril	4.554	1
2	1.23	54.103601981857	2015-05-05 12:00:00.000000	0	9.565531369999999	su2343a	9.211	125
3	1.21	1.2345344	2085-02-28 18:00:00.000000	1	6.6615476224	hellokitty	5.987	11
select * from __3001__idx__index0;
c1	c2	c3	c4	c5	c6	c8	c9
3	1.21	1.2345344	2085-02-28 18:00:00.000000	1	6.6615476224	5.987	11
1	1.23	3.38565	4445-01-08 12:00:55.000000	0	8.66842	4.554	1
2	1.23	54.103601981857	2015-05-05 12:00:00.000000	0	9.565531369999999	9.211	125
select * from __3001__idx__index1;
c1	c2	c4	c5	c6	c9	yao_virtual_col
2	1.23	2015-05-05 12:00:00.000000	0	9.565531369999999	125	NULL
3	1.21	2085-02-28 18:00:00.000000	1	6.6615476224	11	NULL
1	1.23	4445-01-08 12:00:55.000000	0	8.66842	1	NULL
select * from __3001__idx__index2;
c1	c2	c3	c4	c5	c6	c8	c9
1	1.23	3.38565	4445-01-08 12:00:55.000000	0	8.66842	4.554	1
3	1.21	1.2345344	2085-02-28 18:00:00.000000	1	6.6615476224	5.987	11
2	1.23	54.103601981857	2015-05-05 12:00:00.000000	0	9.565531369999999	9.211	125
select * from __3001__idx__index3;
c1	c2	c3	c5	c6	c7	c8	c9
3	1.21	1.2345344	1	6.6615476224	hellokitty	5.987	11
1	1.23	3.38565	0	8.66842	alittlegril	4.554	1
2	1.23	54.103601981857	0	9.565531369999999	su2343a	9.211	125
select * from __3001__idx__index4;
c1	c2	c3	c4	c5	c6	c7	c8
1	1.23	3.38565	4445-01-08 12:00:55.000000	0	8.66842	alittlegril	4.554
3	1.21	1.2345344	2085-02-28 18:00:00.000000	1	6.6615476224	hellokitty	5.987
2	1.23	54.103601981857	2015-05-05 12:00:00.000000	0	9.565531369999999	su2343a	9.211
commit;
select * from t1;
c1	c2	c3	c4	c5	c6	c7	c8	c9
1	1.23	3.38565	4445-01-08 12:00:55.000000	0	8.66842	alittlegril	4.554	1
2	1.23	54.103601981857	2015-05-05 12:00:00.000000	0	9.565531369999999	su2343a	9.211	125
3	1.21	1.2345344	2085-02-28 18:00:00.000000	1	6.6615476224	hellokitty	5.987	11
select * from __3001__idx__index0;
c1	c2	c3	c4	c5	c6	c8	c9
3	1.21	1.2345344	2085-02-28 18:00:00.000000	1	6.6615476224	5.987	11
1	1.23	3.38565	4445-01-08 12:00:55.000000	0	8.66842	4.554	1
2	1.23	54.103601981857	2015-05-05 12:00:00.000000	0	9.565531369999999	9.211	125
select * from __3001__idx__index1;
c1	c2	c4	c5	c6	c9	yao_virtual_col
2	1.23	2015-05-05 12:00:00.000000	0	9.565531369999999	125	NULL
3	1.21	2085-02-28 18:00:00.000000	1	6.6615476224	11	NULL
1	1.23	4445-01-08 12:00:55.000000	0	8.66842	1	NULL
select * from __3001__idx__index2;
c1	c2	c3	c4	c5	c6	c8	c9
1	1.23	3.38565	4445-01-08 12:00:55.000000	0	8.66842	4.554	1
3	1.21	1.2345344	2085-02-28 18:00:00.000000	1	6.6615476224	5.987	11
2	1.23	54.103601981857	2015-05-05 12:00:00.000000	0	9.565531369999999	9.211	125
select * from __3001__idx__index3;
c1	c2	c3	c5	c6	c7	c8	c9
3	1.21	1.2345344	1	6.6615476224	hellokitty	5.987	11
1	1.23	3.38565	0	8.66842	alittlegril	4.554	1
2	1.23	54.103601981857	0	9.565531369999999	su2343a	9.211	125
select * from __3001__idx__index4;
c1	c2	c3	c4	c5	c6	c7	c8
1	1.23	3.38565	4445-01-08 12:00:55.000000	0	8.66842	alittlegril	4.554
3	1.21	1.2345344	2085-02-28 18:00:00.000000	1	6.6615476224	hellokitty	5.987
2	1.23	54.103601981857	2015-05-05 12:00:00.000000	0	9.565531369999999	su2343a	9.211
update t1 set c6=c3*4354.96 where c1=2 and c2=1.23;
select * from t1;
c1	c2	c3	c4	c5	c6	c7	c8	c9
1	1.23	3.38565	4445-01-08 12:00:55.000000	0	8.66842	alittlegril	4.554	1
2	1.23	54.103601981857	2015-05-05 12:00:00.000000	0	235619.02248690795	su2343a	9.211	125
3	1.21	1.2345344	2085-02-28 18:00:00.000000	1	6.6615476224	hellokitty	5.987	11
select * from __3001__idx__index0;
c1	c2	c3	c4	c5	c6	c8	c9
3	1.21	1.2345344	2085-02-28 18:00:00.000000	1	6.6615476224	5.987	11
1	1.23	3.38565	4445-01-08 12:00:55.000000	0	8.66842	4.554	1
2	1.23	54.103601981857	2015-05-05 12:00:00.000000	0	235619.02248690795	9.211	125
select * from __3001__idx__index1;
c1	c2	c4	c5	c6	c9	yao_virtual_col
2	1.23	2015-05-05 12:00:00.000000	0	235619.02248690795	125	NULL
3	1.21	2085-02-28 18:00:00.000000	1	6.6615476224	11	NULL
1	1.23	4445-01-08 12:00:55.000000	0	8.66842	1	NULL
select * from __3001__idx__index2;
c1	c2	c3	c4	c5	c6	c8	c9
1	1.23	3.38565	4445-01-08 12:00:55.000000	0	8.66842	4.554	1
3	1.21	1.2345344	2085-02-28 18:00:00.000000	1	6.6615476224	5.987	11
2	1.23	54.103601981857	2015-05-05 12:00:00.000000	0	235619.02248690795	9.211	125
select * from __3001__idx__index3;
c1	c2	c3	c5	c6	c7	c8	c9
3	1.21	1.2345344	1	6.6615476224	hellokitty	5.987	11
1	1.23	3.38565	0	8.66842	alittlegril	4.554	1
2	1.23	54.103601981857	0	235619.02248690795	su2343a	9.211	125
select * from __3001__idx__index4;
c1	c2	c3	c4	c5	c6	c7	c8
1	1.23	3.38565	4445-01-08 12:00:55.000000	0	8.66842	alittlegril	4.554
3	1.21	1.2345344	2085-02-28 18:00:00.000000	1	6.6615476224	hellokitty	5.987
2	1.23	54.103601981857	2015-05-05 12:00:00.000000	0	235619.02248690795	su2343a	9.211
commit;
select * from t1;
c1	c2	c3	c4	c5	c6	c7	c8	c9
1	1.23	3.38565	4445-01-08 12:00:55.000000	0	8.66842	alittlegril	4.554	1
2	1.23	54.103601981857	2015-05-05 12:00:00.000000	0	235619.02248690795	su2343a	9.211	125
3	1.21	1.2345344	2085-02-28 18:00:00.000000	1	6.6615476224	hellokitty	5.987	11
select * from __3001__idx__index0;
c1	c2	c3	c4	c5	c6	c8	c9
3	1.21	1.2345344	2085-02-28 18:00:00.000000	1	6.6615476224	5.987	11
1	1.23	3.38565	4445-01-08 12:00:55.000000	0	8.66842	4.554	1
2	1.23	54.103601981857	2015-05-05 12:00:00.000000	0	235619.02248690795	9.211	125
select * from __3001__idx__index1;
c1	c2	c4	c5	c6	c9	yao_virtual_col
2	1.23	2015-05-05 12:00:00.000000	0	235619.02248690795	125	NULL
3	1.21	2085-02-28 18:00:00.000000	1	6.6615476224	11	NULL
1	1.23	4445-01-08 12:00:55.000000	0	8.66842	1	NULL
select * from __3001__idx__index2;
c1	c2	c3	c4	c5	c6	c8	c9
1	1.23	3.38565	4445-01-08 12:00:55.000000	0	8.66842	4.554	1
3	1.21	1.2345344	2085-02-28 18:00:00.000000	1	6.6615476224	5.987	11
2	1.23	54.103601981857	2015-05-05 12:00:00.000000	0	235619.02248690795	9.211	125
select * from __3001__idx__index3;
c1	c2	c3	c5	c6	c7	c8	c9
3	1.21	1.2345344	1	6.6615476224	hellokitty	5.987	11
1	1.23	3.38565	0	8.66842	alittlegril	4.554	1
2	1.23	54.103601981857	0	235619.02248690795	su2343a	9.211	125
select * from __3001__idx__index4;
c1	c2	c3	c4	c5	c6	c7	c8
1	1.23	3.38565	4445-01-08 12:00:55.000000	0	8.66842	alittlegril	4.554
3	1.21	1.2345344	2085-02-28 18:00:00.000000	1	6.6615476224	hellokitty	5.987
2	1.23	54.103601981857	2015-05-05 12:00:00.000000	0	235619.02248690795	su2343a	9.211
drop table t1;
