drop table if exists t1,t2,t3,t4;
create table t1(pk int primary key, a int) partition by range(pk)(partition r0 values less than(5), partition r1 values less than(10), partition r2 values less than(15),partition r3 values less than maxvalue);
insert into t1 values(1,1);
insert into t1 values(2,1);
begin;
delete from t1 where pk=1;
select * from t1;
pk	a
2	1
begin;
delete from t1 where pk=2;
select * from t1;
pk	a
1	1
commit;
commit;
select * from t1;
pk	a
insert into t1 values(1,1),(2,1);
begin;
delete from t1 where pk=1;
begin;
delete from t1 where pk=1;
ERROR HY000: YAO-5049: Exclusive lock conflict 'int32:1' for key 'PRIMARY'
ROLLBACK;
commit;
select * from t1;
pk	a
2	1
insert into t1 values(1,1);
begin;
delete from t1 where pk=1;
expect (1,1),(2,1)
select * from t1;
pk	a
2	1
commit;
expect (2,1)
select * from t1;
pk	a
2	1
begin;
--delete a non-exist row
delete from t1 where pk=1;
commit;
expect (2,1)
select * from t1;
pk	a
2	1
drop table t1;
create table t1(pk int primary key, a int) partition by range(pk)(partition r0 values less than(5), partition r1 values less than(10), partition r2 values less than maxvalue);
insert into t1 values(1,1),(2,1),(3,1),(4,1);
begin;
delete from t1 where pk=1;
delete from t1 where pk=2;
begin;
delete from t1 where pk=3;
delete from t1 where pk=4;
delete from t1 where pk=1;
ERROR HY000: YAO-5049: Exclusive lock conflict 'int32:1' for key 'PRIMARY'
ROLLBACK;
select * from t1;
pk	a
1	1
2	1
3	1
4	1
commit;
expect (3,1),(4,1)
select * from t1;
pk	a
3	1
4	1
drop table t1;
create table t1(f1 int, f2 int, a int, primary key(f1,f2)) partition by list(f1) (partition q0 values in (1,3), partition q1 values in (2,4,5));
insert into t1 values(1,1,1),(1,2,1),(2,1,1),(2,2,1);
begin;
delete from t1 where f1=1 and f2=1;
begin;
delete from t1 where f1=1 and f2=2;
commit;
commit;
expect (2,1,1),(2,2,1)
select * from t1;
f1	f2	a
2	1	1
2	2	1
drop table t1;
