drop table if exists t1,t2,t3,t4;
create table t1(id int primary key, money1 int) partition by list(id)(partition q0 values in(1,3), partition q1 values in(2,4,5));
insert into t1(id,money1) values(1,100);
create table t2(id int primary key, money1 int);
insert into t2(id,money1) values(1,100);
select id,money1 from t1;
id	money1
1	100
select id,money1 from t2;
id	money1
1	100
id1 - 100 id2 + 100
begin;
update t1 set money1=money1-100 where id=1;
update t2 set money1=money1+100 where id=1;
commit;
select id,money1 from t1;
id	money1
1	0
select id,money1 from t2;
id	money1
1	200
drop table t1;
drop table t2;
create table t1(id int primary key, money1 int) partition by range(id)(partition r0 values less than(5), partition r1 values less than (10), partition r2 values less than maxvalue);
insert into t1(id,money1) values(1,100);
create table t2(id int primary key, money1 int);
insert into t2(id,money1) values(1,100);
select id,money1 from t1;
id	money1
1	100
select id,money1 from t2;
id	money1
1	100
id1 - 100 id2 + 100
begin;
update t1 set money1=money1-100 where id=1;
update t2 set money1=money1+100 where id=1;
ERROR HY000: MySQL server has gone away
commit;
ERROR HY000: MySQL server has gone away
select id,money1 from t1;
id	money1
1	100
select id,money1 from t2;
id	money1
1	100
drop table t1;
drop table t2;
