ALTER SYSTEM SET merge_delay_interval='6s' server_type=yaodatasvr;
ALTER SYSTEM SET major_freeze_wait_time='6s' server_type=yaoadminsvr;
ALTER SYSTEM SET  min_major_freeze_interval='5s' server_type=yaotxnsvr;
ALTER SYSTEM SET min_merge_interval='5s' server_type=yaodatasvr;
ALTER SYSTEM SET  max_merge_thread_num='20' server_type=yaodatasvr;
create table t1(c1 int,c2 int,c3 int,c4 int,c5 int,primary key(c1,c2));
create table t2(c1 int,c2 int,c3 int,c4 int,c5 int,primary key(c1,c2));
create table t3(c1 int,c2 int,c3 int,c4 int,c5 int,primary key(c1,c2));
create index i1 on t3(c2) storing(c3);
create index i2 on t3(c4);
create table t4(c1 int,c2 int,c3 int,c4 int,c5 int,primary key(c1,c2));
create index i1 on t4(c2) storing(c3);
create index i2 on t4(c4);
insert into t1 values(1,1,30,40,50);
insert into t1 values(10,10,30,40,50);
insert into t1 values(20,20,30,40,50);
insert into t3 values(1,1,30,40,50);
insert into t3 values(10,10,30,40,50);
insert into t3 values(20,20,30,40,50);
"merge"
major_freeze...
replace into t1 values(10,10,10,10,10);
replace into t1 values(30,30,10,10,10);
replace into t1 values(40,40,10,10,10);
replace into t1 values(50,50,10,10,10);
replace into t3 values(10,10,10,10,10);
replace into t3 values(30,30,10,10,10);
replace into t3 values(40,40,10,10,10);
replace into t3 values(50,50,10,10,10);
update t1 set c1 = 100, c2 = 100 where c1 = 10 and c2 =10;
update t1 set c1 = 10, c2 = 10 where c1 = 100 and c2 =100;
update t1 set c1 = 100, c2 = 100 where c1 = 10 and c2 =10;
update t1 set c1 = 10, c2 = 10 where c1 = 100 and c2 =100;
update t1 set c1 = 100, c2 = 100 where c1 = 10 and c2 =10;
update t1 set c1 = 10, c2 = 10 where c1 = 100 and c2 =100;
update t1 set c1 = 100, c2 = 100 where c1 = 10 and c2 =10;
update t1 set c1 = 10, c2 = 10 where c1 = 100 and c2 =100;
update t1 set c3 = 20,c4 = 20,c5 = 20 where c1 = 20 and c2 = 20;
update t3 set c1 = 100, c2 = 100 where c1 = 10 and c2 =10;
update t3 set c1 = 10, c2 = 10 where c1 = 100 and c2 =100;
update t3 set c1 = 100, c2 = 100 where c1 = 10 and c2 =10;
update t3 set c1 = 10, c2 = 10 where c1 = 100 and c2 =100;
update t3 set c1 = 100, c2 = 100 where c1 = 10 and c2 =10;
update t3 set c1 = 10, c2 = 10 where c1 = 100 and c2 =100;
update t3 set c1 = 100, c2 = 100 where c1 = 10 and c2 =10;
update t3 set c1 = 10, c2 = 10 where c1 = 100 and c2 =100;
update t3 set c3 = 20,c4 = 20,c5 = 20 where c1 = 20 and c2 = 20;
update t3 set c3 = 100;
update t3 set c4 = 40 where c1 = 40 and c2 = 40;
update t3 set c5 = 50 where c1 = 50 and c2 = 50;
delete from t1 where c1 = 30 and c2 = 30;
delete from t3 where c1 = 30 and c2 = 30;
select * from t1;
c1	c2	c3	c4	c5
1	1	30	40	50
10	10	10	10	10
20	20	20	20	20
40	40	10	10	10
50	50	10	10	10
select * from t1 where c1 = 1 and c2 = 1;
c1	c2	c3	c4	c5
1	1	30	40	50
select * from t1 where c1 = 10 and c2 = 10;
c1	c2	c3	c4	c5
10	10	10	10	10
select * from t1 where c1 = 20 and c2 = 20;
c1	c2	c3	c4	c5
20	20	20	20	20
select * from t1 where c1 = 30 and c2 = 30;
c1	c2	c3	c4	c5
select * from t1 where c1 = 40 and c2 = 40;
c1	c2	c3	c4	c5
40	40	10	10	10
select * from t1 where c1 = 50 and c2 = 50;
c1	c2	c3	c4	c5
50	50	10	10	10
select * from t2;
c1	c2	c3	c4	c5
select * from t3;
c1	c2	c3	c4	c5
1	1	100	40	50
10	10	100	10	10
20	20	100	20	20
40	40	100	40	10
50	50	100	10	50
select * from t3 where c1 = 1 and c2 = 1;
c1	c2	c3	c4	c5
1	1	100	40	50
select * from t3 where c1 = 10 and c2 = 10;
c1	c2	c3	c4	c5
10	10	100	10	10
select * from t3 where c1 = 20 and c2 = 20;
c1	c2	c3	c4	c5
20	20	100	20	20
select * from t3 where c1 = 30 and c2 = 30;
c1	c2	c3	c4	c5
select * from t3 where c1 = 40 and c2 = 40;
c1	c2	c3	c4	c5
40	40	100	40	10
select * from t3 where c1 = 50 and c2 = 50;
c1	c2	c3	c4	c5
50	50	100	10	50
select * from t4;
c1	c2	c3	c4	c5
"merge"
major_freeze...
truncate table t1,t3;
select * from t1;
c1	c2	c3	c4	c5
select * from t1 where c1 = 10 and c2 = 10;
c1	c2	c3	c4	c5
select * from t1 where c1 = 20 and c2 = 20;
c1	c2	c3	c4	c5
select * from t1 where c1 = 30 and c2 = 30;
c1	c2	c3	c4	c5
select * from t1 where c1 = 40 and c2 = 40;
c1	c2	c3	c4	c5
select * from t1 where c1 = 50 and c2 = 50;
c1	c2	c3	c4	c5
select * from t2;
c1	c2	c3	c4	c5
select * from t3;
c1	c2	c3	c4	c5
select * from t3 where c1 = 10 and c2 = 10;
c1	c2	c3	c4	c5
select * from t3 where c1 = 20 and c2 = 20;
c1	c2	c3	c4	c5
select * from t3 where c1 = 30 and c2 = 30;
c1	c2	c3	c4	c5
select * from t3 where c1 = 40 and c2 = 40;
c1	c2	c3	c4	c5
select * from t3 where c1 = 50 and c2 = 50;
c1	c2	c3	c4	c5
select * from t4;
c1	c2	c3	c4	c5
"merge"
minor_freeze...
"merge"
major_freeze...
truncate table t1,t3;
select * from t1;
c1	c2	c3	c4	c5
select * from t1 where c1 = 1 and c2 = 1;
c1	c2	c3	c4	c5
select * from t1 where c1 = 10 and c2 = 10;
c1	c2	c3	c4	c5
select * from t1 where c1 = 20 and c2 = 20;
c1	c2	c3	c4	c5
select * from t1 where c1 = 30 and c2 = 30;
c1	c2	c3	c4	c5
select * from t1 where c1 = 40 and c2 = 40;
c1	c2	c3	c4	c5
select * from t1 where c1 = 50 and c2 = 50;
c1	c2	c3	c4	c5
select * from t2;
c1	c2	c3	c4	c5
select * from t3;
c1	c2	c3	c4	c5
select * from t3 where c1 = 1 and c2 = 1;
c1	c2	c3	c4	c5
select * from t3 where c1 = 10 and c2 = 10;
c1	c2	c3	c4	c5
select * from t3 where c1 = 20 and c2 = 20;
c1	c2	c3	c4	c5
select * from t3 where c1 = 30 and c2 = 30;
c1	c2	c3	c4	c5
select * from t3 where c1 = 40 and c2 = 40;
c1	c2	c3	c4	c5
select * from t3 where c1 = 50 and c2 = 50;
c1	c2	c3	c4	c5
select * from t4;
c1	c2	c3	c4	c5
insert into t1 values(10,10,30,40,50);
insert into t1 values(20,20,30,40,50);
insert into t3 values(10,10,30,40,50);
insert into t3 values(20,20,30,40,50);
replace into t1 values(10,10,10,10,10);
replace into t1 values(30,30,10,10,10);
replace into t1 values(40,40,10,10,10);
replace into t1 values(50,50,10,10,10);
replace into t3 values(10,10,10,10,10);
replace into t3 values(30,30,10,10,10);
replace into t3 values(40,40,10,10,10);
replace into t3 values(50,50,10,10,10);
update t1 set c1 = 100, c2 = 100 where c1 = 10 and c2 =10;
update t1 set c1 = 10, c2 = 10 where c1 = 100 and c2 =100;
update t1 set c1 = 100, c2 = 100 where c1 = 10 and c2 =10;
update t1 set c1 = 10, c2 = 10 where c1 = 100 and c2 =100;
update t1 set c1 = 100, c2 = 100 where c1 = 10 and c2 =10;
update t1 set c1 = 10, c2 = 10 where c1 = 100 and c2 =100;
update t1 set c1 = 100, c2 = 100 where c1 = 10 and c2 =10;
update t1 set c1 = 10, c2 = 10 where c1 = 100 and c2 =100;
update t1 set c3 = 20,c4 = 20,c5 = 20 where c1 = 20 and c2 = 20;
update t3 set c1 = 100, c2 = 100 where c1 = 10 and c2 =10;
update t3 set c1 = 10, c2 = 10 where c1 = 100 and c2 =100;
update t3 set c1 = 100, c2 = 100 where c1 = 10 and c2 =10;
update t3 set c1 = 10, c2 = 10 where c1 = 100 and c2 =100;
update t3 set c1 = 100, c2 = 100 where c1 = 10 and c2 =10;
update t3 set c1 = 10, c2 = 10 where c1 = 100 and c2 =100;
update t3 set c1 = 100, c2 = 100 where c1 = 10 and c2 =10;
update t3 set c1 = 10, c2 = 10 where c1 = 100 and c2 =100;
update t3 set c3 = 20,c4 = 20,c5 = 20 where c1 = 20 and c2 = 20;
update t3 set c3 = 100;
update t3 set c4 = 40 where c1 = 40 and c2 = 40;
update t3 set c5 = 50 where c1 = 50 and c2 = 50;
delete from t1 where c1 = 30 and c2 = 30;
delete from t3 where c1 = 30 and c2 = 30;
truncate table t1,t3;
select * from t1;
c1	c2	c3	c4	c5
select * from t1 where c1 = 1 and c2 = 1;
c1	c2	c3	c4	c5
select * from t1 where c1 = 10 and c2 = 10;
c1	c2	c3	c4	c5
select * from t1 where c1 = 20 and c2 = 20;
c1	c2	c3	c4	c5
select * from t1 where c1 = 30 and c2 = 30;
c1	c2	c3	c4	c5
select * from t1 where c1 = 40 and c2 = 40;
c1	c2	c3	c4	c5
select * from t1 where c1 = 50 and c2 = 50;
c1	c2	c3	c4	c5
select * from t2;
c1	c2	c3	c4	c5
select * from t3;
c1	c2	c3	c4	c5
select * from t3 where c1 = 1 and c2 = 1;
c1	c2	c3	c4	c5
select * from t3 where c1 = 10 and c2 = 10;
c1	c2	c3	c4	c5
select * from t3 where c1 = 20 and c2 = 20;
c1	c2	c3	c4	c5
select * from t3 where c1 = 30 and c2 = 30;
c1	c2	c3	c4	c5
select * from t3 where c1 = 40 and c2 = 40;
c1	c2	c3	c4	c5
select * from t3 where c1 = 50 and c2 = 50;
c1	c2	c3	c4	c5
select * from t4;
c1	c2	c3	c4	c5
insert into t1 values(10,10,30,40,50);
insert into t1 values(20,20,30,40,50);
insert into t3 values(10,10,30,40,50);
insert into t3 values(20,20,30,40,50);
replace into t1 values(10,10,10,10,10);
replace into t1 values(30,30,10,10,10);
replace into t1 values(40,40,10,10,10);
replace into t1 values(50,50,10,10,10);
replace into t3 values(10,10,10,10,10);
replace into t3 values(30,30,10,10,10);
replace into t3 values(40,40,10,10,10);
replace into t3 values(50,50,10,10,10);
update t1 set c1 = 100, c2 = 100 where c1 = 10 and c2 =10;
update t1 set c1 = 10, c2 = 10 where c1 = 100 and c2 =100;
update t1 set c1 = 100, c2 = 100 where c1 = 10 and c2 =10;
update t1 set c1 = 10, c2 = 10 where c1 = 100 and c2 =100;
update t1 set c1 = 100, c2 = 100 where c1 = 10 and c2 =10;
update t1 set c1 = 10, c2 = 10 where c1 = 100 and c2 =100;
update t1 set c1 = 100, c2 = 100 where c1 = 10 and c2 =10;
update t1 set c1 = 10, c2 = 10 where c1 = 100 and c2 =100;
update t1 set c3 = 20,c4 = 20,c5 = 20 where c1 = 20 and c2 = 20;
update t3 set c1 = 100, c2 = 100 where c1 = 10 and c2 =10;
update t3 set c1 = 10, c2 = 10 where c1 = 100 and c2 =100;
update t3 set c1 = 100, c2 = 100 where c1 = 10 and c2 =10;
update t3 set c1 = 10, c2 = 10 where c1 = 100 and c2 =100;
update t3 set c1 = 100, c2 = 100 where c1 = 10 and c2 =10;
update t3 set c1 = 10, c2 = 10 where c1 = 100 and c2 =100;
update t3 set c1 = 100, c2 = 100 where c1 = 10 and c2 =10;
update t3 set c1 = 10, c2 = 10 where c1 = 100 and c2 =100;
update t3 set c3 = 20,c4 = 20,c5 = 20 where c1 = 20 and c2 = 20;
update t3 set c3 = 100;
update t3 set c4 = 40 where c1 = 40 and c2 = 40;
update t3 set c5 = 50 where c1 = 50 and c2 = 50;
delete from t1 where c1 = 30 and c2 = 30;
delete from t3 where c1 = 30 and c2 = 30;
truncate table t1,t3;
select * from t1;
c1	c2	c3	c4	c5
select * from t1 where c1 = 1 and c2 = 1;
c1	c2	c3	c4	c5
select * from t1 where c1 = 10 and c2 = 10;
c1	c2	c3	c4	c5
select * from t1 where c1 = 20 and c2 = 20;
c1	c2	c3	c4	c5
select * from t1 where c1 = 30 and c2 = 30;
c1	c2	c3	c4	c5
select * from t1 where c1 = 40 and c2 = 40;
c1	c2	c3	c4	c5
select * from t1 where c1 = 50 and c2 = 50;
c1	c2	c3	c4	c5
select * from t2;
c1	c2	c3	c4	c5
select * from t3;
c1	c2	c3	c4	c5
select * from t3 where c1 = 1 and c2 = 1;
c1	c2	c3	c4	c5
select * from t3 where c1 = 10 and c2 = 10;
c1	c2	c3	c4	c5
select * from t3 where c1 = 20 and c2 = 20;
c1	c2	c3	c4	c5
select * from t3 where c1 = 30 and c2 = 30;
c1	c2	c3	c4	c5
select * from t3 where c1 = 40 and c2 = 40;
c1	c2	c3	c4	c5
select * from t3 where c1 = 50 and c2 = 50;
c1	c2	c3	c4	c5
select * from t4;
c1	c2	c3	c4	c5
insert into t1 values(10,10,30,40,50);
insert into t1 values(20,20,30,40,50);
insert into t3 values(10,10,30,40,50);
insert into t3 values(20,20,30,40,50);
replace into t1 values(10,10,10,10,10);
replace into t1 values(30,30,10,10,10);
replace into t1 values(40,40,10,10,10);
replace into t1 values(50,50,10,10,10);
replace into t3 values(10,10,10,10,10);
replace into t3 values(30,30,10,10,10);
replace into t3 values(40,40,10,10,10);
replace into t3 values(50,50,10,10,10);
update t1 set c1 = 100, c2 = 100 where c1 = 10 and c2 =10;
update t1 set c1 = 10, c2 = 10 where c1 = 100 and c2 =100;
update t1 set c1 = 100, c2 = 100 where c1 = 10 and c2 =10;
update t1 set c1 = 10, c2 = 10 where c1 = 100 and c2 =100;
update t1 set c1 = 100, c2 = 100 where c1 = 10 and c2 =10;
update t1 set c1 = 10, c2 = 10 where c1 = 100 and c2 =100;
update t1 set c1 = 100, c2 = 100 where c1 = 10 and c2 =10;
update t1 set c1 = 10, c2 = 10 where c1 = 100 and c2 =100;
update t1 set c3 = 20,c4 = 20,c5 = 20 where c1 = 20 and c2 = 20;
update t3 set c1 = 100, c2 = 100 where c1 = 10 and c2 =10;
update t3 set c1 = 10, c2 = 10 where c1 = 100 and c2 =100;
update t3 set c1 = 100, c2 = 100 where c1 = 10 and c2 =10;
update t3 set c1 = 10, c2 = 10 where c1 = 100 and c2 =100;
update t3 set c1 = 100, c2 = 100 where c1 = 10 and c2 =10;
update t3 set c1 = 10, c2 = 10 where c1 = 100 and c2 =100;
update t3 set c1 = 100, c2 = 100 where c1 = 10 and c2 =10;
update t3 set c1 = 10, c2 = 10 where c1 = 100 and c2 =100;
update t3 set c3 = 20,c4 = 20,c5 = 20 where c1 = 20 and c2 = 20;
update t3 set c3 = 100;
update t3 set c4 = 40 where c1 = 40 and c2 = 40;
update t3 set c5 = 50 where c1 = 50 and c2 = 50;
delete from t1 where c1 = 30 and c2 = 30;
delete from t3 where c1 = 30 and c2 = 30;
truncate table t1,t3;
select * from t1;
c1	c2	c3	c4	c5
select * from t1 where c1 = 1 and c2 = 1;
c1	c2	c3	c4	c5
select * from t1 where c1 = 10 and c2 = 10;
c1	c2	c3	c4	c5
select * from t1 where c1 = 20 and c2 = 20;
c1	c2	c3	c4	c5
select * from t1 where c1 = 30 and c2 = 30;
c1	c2	c3	c4	c5
select * from t1 where c1 = 40 and c2 = 40;
c1	c2	c3	c4	c5
select * from t1 where c1 = 50 and c2 = 50;
c1	c2	c3	c4	c5
select * from t2;
c1	c2	c3	c4	c5
select * from t3;
c1	c2	c3	c4	c5
select * from t3 where c1 = 1 and c2 = 1;
c1	c2	c3	c4	c5
select * from t3 where c1 = 10 and c2 = 10;
c1	c2	c3	c4	c5
select * from t3 where c1 = 20 and c2 = 20;
c1	c2	c3	c4	c5
select * from t3 where c1 = 30 and c2 = 30;
c1	c2	c3	c4	c5
select * from t3 where c1 = 40 and c2 = 40;
c1	c2	c3	c4	c5
select * from t3 where c1 = 50 and c2 = 50;
c1	c2	c3	c4	c5
select * from t4;
c1	c2	c3	c4	c5
insert into t1 values(10,10,30,40,50);
insert into t1 values(20,20,30,40,50);
insert into t3 values(10,10,30,40,50);
insert into t3 values(20,20,30,40,50);
replace into t1 values(10,10,10,10,10);
replace into t1 values(30,30,10,10,10);
replace into t1 values(40,40,10,10,10);
replace into t1 values(50,50,10,10,10);
replace into t3 values(10,10,10,10,10);
replace into t3 values(30,30,10,10,10);
replace into t3 values(40,40,10,10,10);
replace into t3 values(50,50,10,10,10);
update t1 set c1 = 100, c2 = 100 where c1 = 10 and c2 =10;
update t1 set c1 = 10, c2 = 10 where c1 = 100 and c2 =100;
update t1 set c1 = 100, c2 = 100 where c1 = 10 and c2 =10;
update t1 set c1 = 10, c2 = 10 where c1 = 100 and c2 =100;
update t1 set c1 = 100, c2 = 100 where c1 = 10 and c2 =10;
update t1 set c1 = 10, c2 = 10 where c1 = 100 and c2 =100;
update t1 set c1 = 100, c2 = 100 where c1 = 10 and c2 =10;
update t1 set c1 = 10, c2 = 10 where c1 = 100 and c2 =100;
update t1 set c3 = 20,c4 = 20,c5 = 20 where c1 = 20 and c2 = 20;
update t3 set c1 = 100, c2 = 100 where c1 = 10 and c2 =10;
update t3 set c1 = 10, c2 = 10 where c1 = 100 and c2 =100;
update t3 set c1 = 100, c2 = 100 where c1 = 10 and c2 =10;
update t3 set c1 = 10, c2 = 10 where c1 = 100 and c2 =100;
update t3 set c1 = 100, c2 = 100 where c1 = 10 and c2 =10;
update t3 set c1 = 10, c2 = 10 where c1 = 100 and c2 =100;
update t3 set c1 = 100, c2 = 100 where c1 = 10 and c2 =10;
update t3 set c1 = 10, c2 = 10 where c1 = 100 and c2 =100;
update t3 set c3 = 20,c4 = 20,c5 = 20 where c1 = 20 and c2 = 20;
update t3 set c3 = 100;
update t3 set c4 = 40 where c1 = 40 and c2 = 40;
update t3 set c5 = 50 where c1 = 50 and c2 = 50;
delete from t1 where c1 = 30 and c2 = 30;
delete from t3 where c1 = 30 and c2 = 30;
truncate table t1,t3;
select * from t1;
c1	c2	c3	c4	c5
select * from t1 where c1 = 1 and c2 = 1;
c1	c2	c3	c4	c5
select * from t1 where c1 = 10 and c2 = 10;
c1	c2	c3	c4	c5
select * from t1 where c1 = 20 and c2 = 20;
c1	c2	c3	c4	c5
select * from t1 where c1 = 30 and c2 = 30;
c1	c2	c3	c4	c5
select * from t1 where c1 = 40 and c2 = 40;
c1	c2	c3	c4	c5
select * from t1 where c1 = 50 and c2 = 50;
c1	c2	c3	c4	c5
select * from t2;
c1	c2	c3	c4	c5
select * from t3;
c1	c2	c3	c4	c5
select * from t3 where c1 = 1 and c2 = 1;
c1	c2	c3	c4	c5
select * from t3 where c1 = 10 and c2 = 10;
c1	c2	c3	c4	c5
select * from t3 where c1 = 20 and c2 = 20;
c1	c2	c3	c4	c5
select * from t3 where c1 = 30 and c2 = 30;
c1	c2	c3	c4	c5
select * from t3 where c1 = 40 and c2 = 40;
c1	c2	c3	c4	c5
select * from t3 where c1 = 50 and c2 = 50;
c1	c2	c3	c4	c5
select * from t4;
c1	c2	c3	c4	c5
insert into t1 values(10,10,30,40,50);
insert into t1 values(20,20,30,40,50);
insert into t3 values(10,10,30,40,50);
insert into t3 values(20,20,30,40,50);
replace into t1 values(10,10,10,10,10);
replace into t1 values(30,30,10,10,10);
replace into t1 values(40,40,10,10,10);
replace into t1 values(50,50,10,10,10);
replace into t3 values(10,10,10,10,10);
replace into t3 values(30,30,10,10,10);
replace into t3 values(40,40,10,10,10);
replace into t3 values(50,50,10,10,10);
update t1 set c1 = 100, c2 = 100 where c1 = 10 and c2 =10;
update t1 set c1 = 10, c2 = 10 where c1 = 100 and c2 =100;
update t1 set c1 = 100, c2 = 100 where c1 = 10 and c2 =10;
update t1 set c1 = 10, c2 = 10 where c1 = 100 and c2 =100;
update t1 set c1 = 100, c2 = 100 where c1 = 10 and c2 =10;
update t1 set c1 = 10, c2 = 10 where c1 = 100 and c2 =100;
update t1 set c1 = 100, c2 = 100 where c1 = 10 and c2 =10;
update t1 set c1 = 10, c2 = 10 where c1 = 100 and c2 =100;
update t1 set c3 = 20,c4 = 20,c5 = 20 where c1 = 20 and c2 = 20;
update t3 set c1 = 100, c2 = 100 where c1 = 10 and c2 =10;
update t3 set c1 = 10, c2 = 10 where c1 = 100 and c2 =100;
update t3 set c1 = 100, c2 = 100 where c1 = 10 and c2 =10;
update t3 set c1 = 10, c2 = 10 where c1 = 100 and c2 =100;
update t3 set c1 = 100, c2 = 100 where c1 = 10 and c2 =10;
update t3 set c1 = 10, c2 = 10 where c1 = 100 and c2 =100;
update t3 set c1 = 100, c2 = 100 where c1 = 10 and c2 =10;
update t3 set c1 = 10, c2 = 10 where c1 = 100 and c2 =100;
update t3 set c3 = 20,c4 = 20,c5 = 20 where c1 = 20 and c2 = 20;
update t3 set c3 = 100;
update t3 set c4 = 40 where c1 = 40 and c2 = 40;
update t3 set c5 = 50 where c1 = 50 and c2 = 50;
delete from t1 where c1 = 30 and c2 = 30;
delete from t3 where c1 = 30 and c2 = 30;
truncate table t1,t3;
select * from t1;
c1	c2	c3	c4	c5
select * from t1 where c1 = 1 and c2 = 1;
c1	c2	c3	c4	c5
select * from t1 where c1 = 10 and c2 = 10;
c1	c2	c3	c4	c5
select * from t1 where c1 = 20 and c2 = 20;
c1	c2	c3	c4	c5
select * from t1 where c1 = 30 and c2 = 30;
c1	c2	c3	c4	c5
select * from t1 where c1 = 40 and c2 = 40;
c1	c2	c3	c4	c5
select * from t1 where c1 = 50 and c2 = 50;
c1	c2	c3	c4	c5
select * from t2;
c1	c2	c3	c4	c5
select * from t3;
c1	c2	c3	c4	c5
select * from t3 where c1 = 1 and c2 = 1;
c1	c2	c3	c4	c5
select * from t3 where c1 = 10 and c2 = 10;
c1	c2	c3	c4	c5
select * from t3 where c1 = 20 and c2 = 20;
c1	c2	c3	c4	c5
select * from t3 where c1 = 30 and c2 = 30;
c1	c2	c3	c4	c5
select * from t3 where c1 = 40 and c2 = 40;
c1	c2	c3	c4	c5
select * from t3 where c1 = 50 and c2 = 50;
c1	c2	c3	c4	c5
select * from t4;
c1	c2	c3	c4	c5
insert into t1 values(10,10,30,40,50);
insert into t1 values(20,20,30,40,50);
insert into t3 values(10,10,30,40,50);
insert into t3 values(20,20,30,40,50);
replace into t1 values(10,10,10,10,10);
replace into t1 values(30,30,10,10,10);
replace into t1 values(40,40,10,10,10);
replace into t1 values(50,50,10,10,10);
replace into t3 values(10,10,10,10,10);
replace into t3 values(30,30,10,10,10);
replace into t3 values(40,40,10,10,10);
replace into t3 values(50,50,10,10,10);
update t1 set c1 = 100, c2 = 100 where c1 = 10 and c2 =10;
update t1 set c1 = 10, c2 = 10 where c1 = 100 and c2 =100;
update t1 set c1 = 100, c2 = 100 where c1 = 10 and c2 =10;
update t1 set c1 = 10, c2 = 10 where c1 = 100 and c2 =100;
update t1 set c1 = 100, c2 = 100 where c1 = 10 and c2 =10;
update t1 set c1 = 10, c2 = 10 where c1 = 100 and c2 =100;
update t1 set c1 = 100, c2 = 100 where c1 = 10 and c2 =10;
update t1 set c1 = 10, c2 = 10 where c1 = 100 and c2 =100;
update t1 set c3 = 20,c4 = 20,c5 = 20 where c1 = 20 and c2 = 20;
update t3 set c1 = 100, c2 = 100 where c1 = 10 and c2 =10;
update t3 set c1 = 10, c2 = 10 where c1 = 100 and c2 =100;
update t3 set c1 = 100, c2 = 100 where c1 = 10 and c2 =10;
update t3 set c1 = 10, c2 = 10 where c1 = 100 and c2 =100;
update t3 set c1 = 100, c2 = 100 where c1 = 10 and c2 =10;
update t3 set c1 = 10, c2 = 10 where c1 = 100 and c2 =100;
update t3 set c1 = 100, c2 = 100 where c1 = 10 and c2 =10;
update t3 set c1 = 10, c2 = 10 where c1 = 100 and c2 =100;
update t3 set c3 = 20,c4 = 20,c5 = 20 where c1 = 20 and c2 = 20;
update t3 set c3 = 100;
update t3 set c4 = 40 where c1 = 40 and c2 = 40;
update t3 set c5 = 50 where c1 = 50 and c2 = 50;
delete from t1 where c1 = 30 and c2 = 30;
delete from t3 where c1 = 30 and c2 = 30;
truncate table t1,t3;
select * from t1;
c1	c2	c3	c4	c5
select * from t1 where c1 = 1 and c2 = 1;
c1	c2	c3	c4	c5
select * from t1 where c1 = 10 and c2 = 10;
c1	c2	c3	c4	c5
select * from t1 where c1 = 20 and c2 = 20;
c1	c2	c3	c4	c5
select * from t1 where c1 = 30 and c2 = 30;
c1	c2	c3	c4	c5
select * from t1 where c1 = 40 and c2 = 40;
c1	c2	c3	c4	c5
select * from t1 where c1 = 50 and c2 = 50;
c1	c2	c3	c4	c5
select * from t2;
c1	c2	c3	c4	c5
select * from t3;
c1	c2	c3	c4	c5
select * from t3 where c1 = 1 and c2 = 1;
c1	c2	c3	c4	c5
select * from t3 where c1 = 10 and c2 = 10;
c1	c2	c3	c4	c5
select * from t3 where c1 = 20 and c2 = 20;
c1	c2	c3	c4	c5
select * from t3 where c1 = 30 and c2 = 30;
c1	c2	c3	c4	c5
select * from t3 where c1 = 40 and c2 = 40;
c1	c2	c3	c4	c5
select * from t3 where c1 = 50 and c2 = 50;
c1	c2	c3	c4	c5
select * from t4;
c1	c2	c3	c4	c5
"merge"
minor_freeze...
insert into t1 values(10,10,30,40,50);
insert into t1 values(20,20,30,40,50);
insert into t3 values(10,10,30,40,50);
insert into t3 values(20,20,30,40,50);
replace into t1 values(10,10,10,10,10);
replace into t1 values(30,30,10,10,10);
replace into t1 values(40,40,10,10,10);
replace into t1 values(50,50,10,10,10);
replace into t3 values(10,10,10,10,10);
replace into t3 values(30,30,10,10,10);
replace into t3 values(40,40,10,10,10);
replace into t3 values(50,50,10,10,10);
update t1 set c1 = 100, c2 = 100 where c1 = 10 and c2 =10;
update t1 set c1 = 10, c2 = 10 where c1 = 100 and c2 =100;
update t1 set c1 = 100, c2 = 100 where c1 = 10 and c2 =10;
update t1 set c1 = 10, c2 = 10 where c1 = 100 and c2 =100;
update t1 set c1 = 100, c2 = 100 where c1 = 10 and c2 =10;
update t1 set c1 = 10, c2 = 10 where c1 = 100 and c2 =100;
update t1 set c1 = 100, c2 = 100 where c1 = 10 and c2 =10;
update t1 set c1 = 10, c2 = 10 where c1 = 100 and c2 =100;
update t1 set c3 = 20,c4 = 20,c5 = 20 where c1 = 20 and c2 = 20;
update t3 set c1 = 100, c2 = 100 where c1 = 10 and c2 =10;
update t3 set c1 = 10, c2 = 10 where c1 = 100 and c2 =100;
update t3 set c1 = 100, c2 = 100 where c1 = 10 and c2 =10;
update t3 set c1 = 10, c2 = 10 where c1 = 100 and c2 =100;
update t3 set c1 = 100, c2 = 100 where c1 = 10 and c2 =10;
update t3 set c1 = 10, c2 = 10 where c1 = 100 and c2 =100;
update t3 set c1 = 100, c2 = 100 where c1 = 10 and c2 =10;
update t3 set c1 = 10, c2 = 10 where c1 = 100 and c2 =100;
update t3 set c3 = 20,c4 = 20,c5 = 20 where c1 = 20 and c2 = 20;
update t3 set c3 = 100;
update t3 set c4 = 40 where c1 = 40 and c2 = 40;
update t3 set c5 = 50 where c1 = 50 and c2 = 50;
delete from t1 where c1 = 30 and c2 = 30;
delete from t3 where c1 = 30 and c2 = 30;
"merge"
minor_freeze...
insert into t1 values(100,100,30,40,50);
insert into t1 values(200,200,30,40,50);
insert into t3 values(100,100,30,40,50);
insert into t3 values(200,200,30,40,50);
truncate table t1,t3;
select * from t1;
c1	c2	c3	c4	c5
select * from t1 where c1 = 1 and c2 = 1;
c1	c2	c3	c4	c5
select * from t1 where c1 = 10 and c2 = 10;
c1	c2	c3	c4	c5
select * from t1 where c1 = 20 and c2 = 20;
c1	c2	c3	c4	c5
select * from t1 where c1 = 30 and c2 = 30;
c1	c2	c3	c4	c5
select * from t1 where c1 = 40 and c2 = 40;
c1	c2	c3	c4	c5
select * from t1 where c1 = 50 and c2 = 50;
c1	c2	c3	c4	c5
select * from t2;
c1	c2	c3	c4	c5
select * from t3;
c1	c2	c3	c4	c5
select * from t3 where c1 = 1 and c2 = 1;
c1	c2	c3	c4	c5
select * from t3 where c1 = 10 and c2 = 10;
c1	c2	c3	c4	c5
select * from t3 where c1 = 20 and c2 = 20;
c1	c2	c3	c4	c5
select * from t3 where c1 = 30 and c2 = 30;
c1	c2	c3	c4	c5
select * from t3 where c1 = 40 and c2 = 40;
c1	c2	c3	c4	c5
select * from t3 where c1 = 50 and c2 = 50;
c1	c2	c3	c4	c5
select * from t4;
c1	c2	c3	c4	c5
"merge"
major_freeze...
select * from t1;
c1	c2	c3	c4	c5
select * from t1 where c1 = 1 and c2 = 1;
c1	c2	c3	c4	c5
select * from t1 where c1 = 2 and c2 = 2;
c1	c2	c3	c4	c5
select * from t1 where c1 = 3 and c2 = 3;
c1	c2	c3	c4	c5
select * from t1 where c1 = 10 and c2 = 10;
c1	c2	c3	c4	c5
select * from t1 where c1 = 20 and c2 = 20;
c1	c2	c3	c4	c5
select * from t1 where c1 = 30 and c2 = 30;
c1	c2	c3	c4	c5
select * from t1 where c1 = 40 and c2 = 40;
c1	c2	c3	c4	c5
select * from t1 where c1 = 50 and c2 = 50;
c1	c2	c3	c4	c5
select * from t2;
c1	c2	c3	c4	c5
select * from t3;
c1	c2	c3	c4	c5
select * from t3 where c1 = 1 and c2 = 1;
c1	c2	c3	c4	c5
select * from t3 where c1 = 2 and c2 = 2;
c1	c2	c3	c4	c5
select * from t3 where c1 = 3 and c2 = 3;
c1	c2	c3	c4	c5
select * from t3 where c1 = 10 and c2 = 10;
c1	c2	c3	c4	c5
select * from t3 where c1 = 20 and c2 = 20;
c1	c2	c3	c4	c5
select * from t3 where c1 = 30 and c2 = 30;
c1	c2	c3	c4	c5
select * from t3 where c1 = 40 and c2 = 40;
c1	c2	c3	c4	c5
select * from t3 where c1 = 50 and c2 = 50;
c1	c2	c3	c4	c5
select * from t4;
c1	c2	c3	c4	c5
