ALTER SYSTEM SET merge_delay_interval='6s' server_type=yaodatasvr;
ALTER SYSTEM SET major_freeze_wait_time='6s' server_type=yaoadminsvr;
ALTER SYSTEM SET  min_major_freeze_interval='5s' server_type=yaotxnsvr;
ALTER SYSTEM SET min_merge_interval='5s' server_type=yaodatasvr;
ALTER SYSTEM SET  max_merge_thread_num='20' server_type=yaodatasvr;
alter system set balance_max_concurrent_migrate_num=30 server_type=yaoadminsvr;
alter system set balance_max_migrate_in_per_ds=6 server_type=yaoadminsvr;
alter system set balance_max_migrate_out_per_ds=6 server_type=yaoadminsvr;
alter system set max_migrate_task_count=6 server_type=yaodatasvr;
drop table if exists list1,list2;
create table list1(c1 int,c2 varchar(20),c3 decimal(10,5),c4 int,primary key(c1)) partition by list(c1) (partition q0 values in(1,3),partition q1 values in(2,4));
show table rules;
table_id	start_version	table_name	partition_type	prefix_name	rule_name	par_list
3001	2	list1	1	list1#q0,list1#q1	__list@3001	c1
replace into list1 values(1,'a',1,1),(2,'b',2,2),(3,'c',3,3),(4,'d',4,4);
insert into list1 values(5,'e',5,5);
ERROR HY000: YAO-5702: Table has no partition for given value.
create index idx1 on list1(c1);
create index idx2 on list1(c2);
create index idx3 on list1(c3);
alter system set min_drop_cache_wait_time='300s' server_type=yaodatasvr;
create table list2(c1 int,c2 decimal(10,5),c3 varchar(20),c4 int,c5 int,c6 int,c7 decimal(10,5),c8 varchar(20),primary key(c1,c2,c3)) partition by list(c1) (partition q0 values in(1,3),partition q1 values in(2,4));
show table rules;
table_id	start_version	table_name	partition_type	prefix_name	rule_name	par_list
3001	2	list1	1	list1#q0,list1#q1	__list@3001	c1
3005	2	list2	1	list2#q0,list2#q1	__list@3005	c1
replace into list2 values(1,1.11,'a',1,1,1,1,1),(2,2.22,'b',2,2,2,2,2),(3,3.33,'c',3,3,3,3,3),(4,4.44,'b',4,4,4,4,4);
insert into list2 values(5,5.55,'e',5,5,5,5,5);
ERROR HY000: YAO-5702: Table has no partition for given value.
create index idx2 on list2(c5) storing(c6,c4);
create index idx3 on list2(c2,c3) storing(c4,c5);
merge
major_freeze...
__3001__idx__idx1
__3001__idx__idx2
__3001__idx__idx3
__3005__idx__idx2
__3005__idx__idx3
show index on list1;
index_name	status	index_type
__3001__idx__idx1	1	0
__3001__idx__idx2	1	0
__3001__idx__idx3	1	0
show index on list2;
index_name	status	index_type
__3005__idx__idx2	1	0
__3005__idx__idx3	1	0
replace into list1 values(1,'a',1,1),(2,'b',2,2),(3,'c',3,3),(4,'d',4,4);
delete from list1 where c1 > 100;
select * from __3001__idx__idx1;
c1	yao_virtual_col
1	NULL
2	NULL
3	NULL
4	NULL
select * from __3001__idx__idx2;
c1	c2	yao_virtual_col
1	a	NULL
2	b	NULL
3	c	NULL
4	d	NULL
select * from __3001__idx__idx3;
c1	c3	yao_virtual_col
1	1	NULL
2	2	NULL
3	3	NULL
4	4	NULL
replace into list1 values(1,'a',1,1),(2,'b',2,2),(3,'c',3,3),(4,'d',4,4);
delete from list1 where c1 = 1;
select * from __3001__idx__idx1;
c1	yao_virtual_col
2	NULL
3	NULL
4	NULL
select * from __3001__idx__idx2;
c1	c2	yao_virtual_col
2	b	NULL
3	c	NULL
4	d	NULL
select * from __3001__idx__idx3;
c1	c3	yao_virtual_col
2	2	NULL
3	3	NULL
4	4	NULL
replace into list1 values(1,'a',1,1),(2,'b',2,2),(3,'c',3,3),(4,'d',4,4);
delete from list1 where c1 > 1;
select * from __3001__idx__idx1;
c1	yao_virtual_col
1	NULL
select * from __3001__idx__idx2;
c1	c2	yao_virtual_col
1	a	NULL
select * from __3001__idx__idx3;
c1	c3	yao_virtual_col
1	1	NULL
replace into list1 values(1,'a',1,1),(2,'b',2,2),(3,'c',3,3),(4,'d',4,4);
delete from list1 where c1 = 1 OR c1 = 2 OR c1 = 3 OR c1 = 4 OR c1 = 5;
select * from __3001__idx__idx1;
c1	yao_virtual_col
select * from __3001__idx__idx2;
c1	c2	yao_virtual_col
select * from __3001__idx__idx3;
c1	c3	yao_virtual_col
replace into list1 values(1,'a',1,1),(2,'b',2,2),(3,'c',3,3),(4,'d',4,4);
delete from list1 where c1 = 1 and c1 = 1 and c1 = 1 and c1 = 1 and c1 = 1;
ERROR HY000: YAO-145: Failed to add column desc, err=-145
select * from __3001__idx__idx1;
c1	yao_virtual_col
1	NULL
2	NULL
3	NULL
4	NULL
select * from __3001__idx__idx2;
c1	c2	yao_virtual_col
1	a	NULL
2	b	NULL
3	c	NULL
4	d	NULL
select * from __3001__idx__idx3;
c1	c3	yao_virtual_col
1	1	NULL
2	2	NULL
3	3	NULL
4	4	NULL
replace into list1 values(1,'a',1,1),(2,'b',2,2),(3,'c',3,3),(4,'d',4,4);
delete from list1 where c1 = 1 and c1 = 2 and c1 = 3 and c1 = 4 and c1 = 5;
ERROR HY000: YAO-145: Failed to add column desc, err=-145
select * from __3001__idx__idx1;
c1	yao_virtual_col
1	NULL
2	NULL
3	NULL
4	NULL
select * from __3001__idx__idx2;
c1	c2	yao_virtual_col
1	a	NULL
2	b	NULL
3	c	NULL
4	d	NULL
select * from __3001__idx__idx3;
c1	c3	yao_virtual_col
1	1	NULL
2	2	NULL
3	3	NULL
4	4	NULL
replace into list1 values(1,'a',1,1),(2,'b',2,2),(3,'c',3,3),(4,'d',4,4);
delete from list1 where c1 = 1 or c1 = 2 and c1 = 3 or c1 = 4 and c1 = 5;
select * from __3001__idx__idx1;
c1	yao_virtual_col
2	NULL
3	NULL
4	NULL
select * from __3001__idx__idx2;
c1	c2	yao_virtual_col
2	b	NULL
3	c	NULL
4	d	NULL
select * from __3001__idx__idx3;
c1	c3	yao_virtual_col
2	2	NULL
3	3	NULL
4	4	NULL
replace into list1 values(1,'a',1,1),(2,'b',2,2),(3,'c',3,3),(4,'d',4,4);
delete from list1 where c1 between 1 and 1;
select * from __3001__idx__idx1;
c1	yao_virtual_col
2	NULL
3	NULL
4	NULL
select * from __3001__idx__idx2;
c1	c2	yao_virtual_col
2	b	NULL
3	c	NULL
4	d	NULL
select * from __3001__idx__idx3;
c1	c3	yao_virtual_col
2	2	NULL
3	3	NULL
4	4	NULL
replace into list1 values(1,'a',1,1),(2,'b',2,2),(3,'c',3,3),(4,'d',4,4);
delete from list1 where c1 between 3 and 4;
select * from __3001__idx__idx1;
c1	yao_virtual_col
1	NULL
2	NULL
select * from __3001__idx__idx2;
c1	c2	yao_virtual_col
1	a	NULL
2	b	NULL
select * from __3001__idx__idx3;
c1	c3	yao_virtual_col
1	1	NULL
2	2	NULL
replace into list1 values(1,'a',1,1),(2,'b',2,2),(3,'c',3,3),(4,'d',4,4);
delete from list1 where c1 IN (10,11,12,13,14,15);
select * from __3001__idx__idx1;
c1	yao_virtual_col
1	NULL
2	NULL
3	NULL
4	NULL
select * from __3001__idx__idx2;
c1	c2	yao_virtual_col
1	a	NULL
2	b	NULL
3	c	NULL
4	d	NULL
select * from __3001__idx__idx3;
c1	c3	yao_virtual_col
1	1	NULL
2	2	NULL
3	3	NULL
4	4	NULL
replace into list1 values(1,'a',1,1),(2,'b',2,2),(3,'c',3,3),(4,'d',4,4);
delete from list1 where c1 IN (1);
select * from __3001__idx__idx1;
c1	yao_virtual_col
2	NULL
3	NULL
4	NULL
select * from __3001__idx__idx2;
c1	c2	yao_virtual_col
2	b	NULL
3	c	NULL
4	d	NULL
select * from __3001__idx__idx3;
c1	c3	yao_virtual_col
2	2	NULL
3	3	NULL
4	4	NULL
replace into list1 values(1,'a',1,1),(2,'b',2,2),(3,'c',3,3),(4,'d',4,4);
delete from list1 where c1 IN (2);
select * from __3001__idx__idx1;
c1	yao_virtual_col
1	NULL
3	NULL
4	NULL
select * from __3001__idx__idx2;
c1	c2	yao_virtual_col
1	a	NULL
3	c	NULL
4	d	NULL
select * from __3001__idx__idx3;
c1	c3	yao_virtual_col
1	1	NULL
3	3	NULL
4	4	NULL
replace into list1 values(1,'a',1,1),(2,'b',2,2),(3,'c',3,3),(4,'d',4,4);
delete from list1 where c1 IN (1,2,3,4,5,6,7,8,9,10);
select * from __3001__idx__idx1;
c1	yao_virtual_col
select * from __3001__idx__idx2;
c1	c2	yao_virtual_col
select * from __3001__idx__idx3;
c1	c3	yao_virtual_col
replace into list1 values(1,'a',1,1),(2,'b',2,2),(3,'c',3,3),(4,'d',4,4);
delete from list1 where c1 * 2 + 1 > 3;
select * from __3001__idx__idx1;
c1	yao_virtual_col
1	NULL
select * from __3001__idx__idx2;
c1	c2	yao_virtual_col
1	a	NULL
select * from __3001__idx__idx3;
c1	c3	yao_virtual_col
1	1	NULL
replace into list1 values(1,'a',1,1),(2,'b',2,2),(3,'c',3,3),(4,'d',4,4);
delete from list1 where c1 / 2 - 1 > 1;
select * from __3001__idx__idx1;
c1	yao_virtual_col
1	NULL
2	NULL
3	NULL
4	NULL
select * from __3001__idx__idx2;
c1	c2	yao_virtual_col
1	a	NULL
2	b	NULL
3	c	NULL
4	d	NULL
select * from __3001__idx__idx3;
c1	c3	yao_virtual_col
1	1	NULL
2	2	NULL
3	3	NULL
4	4	NULL
replace into list1 values(1,'a',1,1),(2,'b',2,2),(3,'c',3,3),(4,'d',4,4);
delete from list1 where c1 * 2 / 3 * 5 % 4 + 1 > 8;
select * from __3001__idx__idx1;
c1	yao_virtual_col
1	NULL
2	NULL
3	NULL
4	NULL
select * from __3001__idx__idx2;
c1	c2	yao_virtual_col
1	a	NULL
2	b	NULL
3	c	NULL
4	d	NULL
select * from __3001__idx__idx3;
c1	c3	yao_virtual_col
1	1	NULL
2	2	NULL
3	3	NULL
4	4	NULL
replace into list1 values(1,'a',1,1),(2,'b',2,2),(3,'c',3,3),(4,'d',4,4);
delete from list1 where (c1 * 2 / 3 * 5) MOD 3 + 1 > 8;
select * from __3001__idx__idx1;
c1	yao_virtual_col
1	NULL
2	NULL
3	NULL
4	NULL
select * from __3001__idx__idx2;
c1	c2	yao_virtual_col
1	a	NULL
2	b	NULL
3	c	NULL
4	d	NULL
select * from __3001__idx__idx3;
c1	c3	yao_virtual_col
1	1	NULL
2	2	NULL
3	3	NULL
4	4	NULL
replace into list1 values(1,'a',1,1),(2,'b',2,2),(3,'c',3,3),(4,'d',4,4);
replace into list1 values(1,'a',1,1),(2,'b',2,2),(3,'c',3,3),(4,'d',4,4);
delete from list1 where c3 > 100;
select * from __3001__idx__idx1;
c1	yao_virtual_col
1	NULL
2	NULL
3	NULL
4	NULL
select * from __3001__idx__idx2;
c1	c2	yao_virtual_col
1	a	NULL
2	b	NULL
3	c	NULL
4	d	NULL
select * from __3001__idx__idx3;
c1	c3	yao_virtual_col
1	1	NULL
2	2	NULL
3	3	NULL
4	4	NULL
replace into list1 values(1,'a',1,1),(2,'b',2,2),(3,'c',3,3),(4,'d',4,4);
delete from list1 where c3 = 1;
select * from __3001__idx__idx1;
c1	yao_virtual_col
2	NULL
3	NULL
4	NULL
select * from __3001__idx__idx2;
c1	c2	yao_virtual_col
2	b	NULL
3	c	NULL
4	d	NULL
select * from __3001__idx__idx3;
c1	c3	yao_virtual_col
2	2	NULL
3	3	NULL
4	4	NULL
replace into list1 values(1,'a',1,1),(2,'b',2,2),(3,'c',3,3),(4,'d',4,4);
delete from list1 where c3 > 1;
select * from __3001__idx__idx1;
c1	yao_virtual_col
1	NULL
select * from __3001__idx__idx2;
c1	c2	yao_virtual_col
1	a	NULL
select * from __3001__idx__idx3;
c1	c3	yao_virtual_col
1	1	NULL
replace into list1 values(1,'a',1,1),(2,'b',2,2),(3,'c',3,3),(4,'d',4,4);
delete from list1 where c3 = 1 OR c3 = 2 OR c3 = 3 OR c3 = 4 OR c3 = 5;
select * from __3001__idx__idx1;
c1	yao_virtual_col
select * from __3001__idx__idx2;
c1	c2	yao_virtual_col
select * from __3001__idx__idx3;
c1	c3	yao_virtual_col
replace into list1 values(1,'a',1,1),(2,'b',2,2),(3,'c',3,3),(4,'d',4,4);
delete from list1 where c3 = 1 and c3 = 1 and c3 = 1 and c3 = 1 and c3 = 1;
select * from __3001__idx__idx1;
c1	yao_virtual_col
2	NULL
3	NULL
4	NULL
select * from __3001__idx__idx2;
c1	c2	yao_virtual_col
2	b	NULL
3	c	NULL
4	d	NULL
select * from __3001__idx__idx3;
c1	c3	yao_virtual_col
2	2	NULL
3	3	NULL
4	4	NULL
replace into list1 values(1,'a',1,1),(2,'b',2,2),(3,'c',3,3),(4,'d',4,4);
delete from list1 where c3 = 1 and c3 = 2 and c3 = 3 and c3 = 4 and c3 = 5;
select * from __3001__idx__idx1;
c1	yao_virtual_col
1	NULL
2	NULL
3	NULL
4	NULL
select * from __3001__idx__idx2;
c1	c2	yao_virtual_col
1	a	NULL
2	b	NULL
3	c	NULL
4	d	NULL
select * from __3001__idx__idx3;
c1	c3	yao_virtual_col
1	1	NULL
2	2	NULL
3	3	NULL
4	4	NULL
replace into list1 values(1,'a',1,1),(2,'b',2,2),(3,'c',3,3),(4,'d',4,4);
delete from list1 where c3 = 1 or c3 = 2 and c3 = 3 or c3 = 4 and c3 = 5;
select * from __3001__idx__idx1;
c1	yao_virtual_col
2	NULL
3	NULL
4	NULL
select * from __3001__idx__idx2;
c1	c2	yao_virtual_col
2	b	NULL
3	c	NULL
4	d	NULL
select * from __3001__idx__idx3;
c1	c3	yao_virtual_col
2	2	NULL
3	3	NULL
4	4	NULL
replace into list1 values(1,'a',1,1),(2,'b',2,2),(3,'c',3,3),(4,'d',4,4);
delete from list1 where c3 between 1 and 1;
select * from __3001__idx__idx1;
c1	yao_virtual_col
2	NULL
3	NULL
4	NULL
select * from __3001__idx__idx2;
c1	c2	yao_virtual_col
2	b	NULL
3	c	NULL
4	d	NULL
select * from __3001__idx__idx3;
c1	c3	yao_virtual_col
2	2	NULL
3	3	NULL
4	4	NULL
replace into list1 values(1,'a',1,1),(2,'b',2,2),(3,'c',3,3),(4,'d',4,4);
delete from list1 where c3 between 3 and 4;
select * from __3001__idx__idx1;
c1	yao_virtual_col
1	NULL
2	NULL
select * from __3001__idx__idx2;
c1	c2	yao_virtual_col
1	a	NULL
2	b	NULL
select * from __3001__idx__idx3;
c1	c3	yao_virtual_col
1	1	NULL
2	2	NULL
replace into list1 values(1,'a',1,1),(2,'b',2,2),(3,'c',3,3),(4,'d',4,4);
delete from list1 where c3 IN (10,11,12,13,14,15);
select * from __3001__idx__idx1;
c1	yao_virtual_col
1	NULL
2	NULL
3	NULL
4	NULL
select * from __3001__idx__idx2;
c1	c2	yao_virtual_col
1	a	NULL
2	b	NULL
3	c	NULL
4	d	NULL
select * from __3001__idx__idx3;
c1	c3	yao_virtual_col
1	1	NULL
2	2	NULL
3	3	NULL
4	4	NULL
replace into list1 values(1,'a',1,1),(2,'b',2,2),(3,'c',3,3),(4,'d',4,4);
delete from list1 where c3 IN (1);
select * from __3001__idx__idx1;
c1	yao_virtual_col
2	NULL
3	NULL
4	NULL
select * from __3001__idx__idx2;
c1	c2	yao_virtual_col
2	b	NULL
3	c	NULL
4	d	NULL
select * from __3001__idx__idx3;
c1	c3	yao_virtual_col
2	2	NULL
3	3	NULL
4	4	NULL
replace into list1 values(1,'a',1,1),(2,'b',2,2),(3,'c',3,3),(4,'d',4,4);
delete from list1 where c3 IN (2);
select * from __3001__idx__idx1;
c1	yao_virtual_col
1	NULL
3	NULL
4	NULL
select * from __3001__idx__idx2;
c1	c2	yao_virtual_col
1	a	NULL
3	c	NULL
4	d	NULL
select * from __3001__idx__idx3;
c1	c3	yao_virtual_col
1	1	NULL
3	3	NULL
4	4	NULL
replace into list1 values(1,'a',1,1),(2,'b',2,2),(3,'c',3,3),(4,'d',4,4);
delete from list1 where c3 IN (1,2,3,4,5,6,7,8,9,10);
select * from __3001__idx__idx1;
c1	yao_virtual_col
select * from __3001__idx__idx2;
c1	c2	yao_virtual_col
select * from __3001__idx__idx3;
c1	c3	yao_virtual_col
replace into list1 values(1,'a',1,1),(2,'b',2,2),(3,'c',3,3),(4,'d',4,4);
delete from list1 where c3 * 2 + 1 > 3;
select * from __3001__idx__idx1;
c1	yao_virtual_col
1	NULL
select * from __3001__idx__idx2;
c1	c2	yao_virtual_col
1	a	NULL
select * from __3001__idx__idx3;
c1	c3	yao_virtual_col
1	1	NULL
replace into list1 values(1,'a',1,1),(2,'b',2,2),(3,'c',3,3),(4,'d',4,4);
delete from list1 where c3 / 2 - 1 > 1;
select * from __3001__idx__idx1;
c1	yao_virtual_col
1	NULL
2	NULL
3	NULL
4	NULL
select * from __3001__idx__idx2;
c1	c2	yao_virtual_col
1	a	NULL
2	b	NULL
3	c	NULL
4	d	NULL
select * from __3001__idx__idx3;
c1	c3	yao_virtual_col
1	1	NULL
2	2	NULL
3	3	NULL
4	4	NULL
replace into list1 values(1,'a',1,1),(2,'b',2,2),(3,'c',3,3),(4,'d',4,4);
delete from list1 where c3 * 2 / 3 * 5 % 4 + 1 > 8;
select * from __3001__idx__idx1;
c1	yao_virtual_col
1	NULL
2	NULL
3	NULL
4	NULL
select * from __3001__idx__idx2;
c1	c2	yao_virtual_col
1	a	NULL
2	b	NULL
3	c	NULL
4	d	NULL
select * from __3001__idx__idx3;
c1	c3	yao_virtual_col
1	1	NULL
2	2	NULL
3	3	NULL
4	4	NULL
replace into list1 values(1,'a',1,1),(2,'b',2,2),(3,'c',3,3),(4,'d',4,4);
delete from list1 where (c3 * 2 / 3 * 5) MOD 3 + 1 > 8;
select * from __3001__idx__idx1;
c1	yao_virtual_col
1	NULL
2	NULL
3	NULL
4	NULL
select * from __3001__idx__idx2;
c1	c2	yao_virtual_col
1	a	NULL
2	b	NULL
3	c	NULL
4	d	NULL
select * from __3001__idx__idx3;
c1	c3	yao_virtual_col
1	1	NULL
2	2	NULL
3	3	NULL
4	4	NULL
replace into list1 values(1,'a',1,1),(2,'b',2,2),(3,'c',3,3),(4,'d',4,4);
delete from list1 where c1 = 1 OR c2 = '2' OR c3 = 3 OR c4 = 4 OR c2 = '5';
select * from __3001__idx__idx1;
c1	yao_virtual_col
2	NULL
select * from __3001__idx__idx2;
c1	c2	yao_virtual_col
2	b	NULL
select * from __3001__idx__idx3;
c1	c3	yao_virtual_col
2	2	NULL
replace into list1 values(1,'a',1,1),(2,'b',2,2),(3,'c',3,3),(4,'d',4,4);
delete from list1 where c1 = 1 and c2 = 'b' and c3 = 3 and c4 = 1 and c5 = 1;
ERROR 42S22: YAO-5009: Unkown column name c5
select * from __3001__idx__idx1;
c1	yao_virtual_col
1	NULL
2	NULL
3	NULL
4	NULL
select * from __3001__idx__idx2;
c1	c2	yao_virtual_col
1	a	NULL
2	b	NULL
3	c	NULL
4	d	NULL
select * from __3001__idx__idx3;
c1	c3	yao_virtual_col
1	1	NULL
2	2	NULL
3	3	NULL
4	4	NULL
replace into list1 values(1,'a',1,1),(2,'b',2,2),(3,'c',3,3),(4,'d',4,4);
delete from list1 where c1 = 1 and c2 = 'a' and c3 = 1 and c4 = 1;
select * from __3001__idx__idx1;
c1	yao_virtual_col
2	NULL
3	NULL
4	NULL
select * from __3001__idx__idx2;
c1	c2	yao_virtual_col
2	b	NULL
3	c	NULL
4	d	NULL
select * from __3001__idx__idx3;
c1	c3	yao_virtual_col
2	2	NULL
3	3	NULL
4	4	NULL
replace into list1 values(1,'a',1,1),(2,'b',2,2),(3,'c',3,3),(4,'d',4,4);
delete from list1 where c2 = 'a' and c3 = 1 and c4 = 1;
select * from __3001__idx__idx1;
c1	yao_virtual_col
2	NULL
3	NULL
4	NULL
select * from __3001__idx__idx2;
c1	c2	yao_virtual_col
2	b	NULL
3	c	NULL
4	d	NULL
select * from __3001__idx__idx3;
c1	c3	yao_virtual_col
2	2	NULL
3	3	NULL
4	4	NULL
replace into list1 values(1,'a',1,1),(2,'b',2,2),(3,'c',3,3),(4,'d',4,4);
delete from list1 where c1 = 1 or c2 = 'b' and c4 = 3 or c2 = 'd' and c2 = 'e';
select * from __3001__idx__idx1;
c1	yao_virtual_col
2	NULL
3	NULL
4	NULL
select * from __3001__idx__idx2;
c1	c2	yao_virtual_col
2	b	NULL
3	c	NULL
4	d	NULL
select * from __3001__idx__idx3;
c1	c3	yao_virtual_col
2	2	NULL
3	3	NULL
4	4	NULL
replace into list1 values(1,'a',1,1),(2,'b',2,2),(3,'c',3,3),(4,'d',4,4);
delete from list1 where c3 between 1 and 4 and c4 between 3 and 4;
select * from __3001__idx__idx1;
c1	yao_virtual_col
1	NULL
2	NULL
select * from __3001__idx__idx2;
c1	c2	yao_virtual_col
1	a	NULL
2	b	NULL
select * from __3001__idx__idx3;
c1	c3	yao_virtual_col
1	1	NULL
2	2	NULL
replace into list1 values(1,'a',1,1),(2,'b',2,2),(3,'c',3,3),(4,'d',4,4);
delete from list1 where c2 * 2 + c3 > 3;
select * from __3001__idx__idx1;
c1	yao_virtual_col
1	NULL
2	NULL
3	NULL
select * from __3001__idx__idx2;
c1	c2	yao_virtual_col
1	a	NULL
2	b	NULL
3	c	NULL
select * from __3001__idx__idx3;
c1	c3	yao_virtual_col
1	1	NULL
2	2	NULL
3	3	NULL
replace into list1 values(1,'a',1,1),(2,'b',2,2),(3,'c',3,3),(4,'d',4,4);
delete from list1 where c2 * c3 - 1 > 1;
select * from __3001__idx__idx1;
c1	yao_virtual_col
1	NULL
2	NULL
3	NULL
4	NULL
select * from __3001__idx__idx2;
c1	c2	yao_virtual_col
1	a	NULL
2	b	NULL
3	c	NULL
4	d	NULL
select * from __3001__idx__idx3;
c1	c3	yao_virtual_col
1	1	NULL
2	2	NULL
3	3	NULL
4	4	NULL
replace into list1 values(1,'a',1,1),(2,'b',2,2),(3,'c',3,3),(4,'d',4,4);
delete from list1 where c2 * 2 / c3 * 5 % c3 + 1 > 8;
select * from __3001__idx__idx1;
c1	yao_virtual_col
1	NULL
2	NULL
3	NULL
4	NULL
select * from __3001__idx__idx2;
c1	c2	yao_virtual_col
1	a	NULL
2	b	NULL
3	c	NULL
4	d	NULL
select * from __3001__idx__idx3;
c1	c3	yao_virtual_col
1	1	NULL
2	2	NULL
3	3	NULL
4	4	NULL
replace into list1 values(1,'a',1,1),(2,'b',2,2),(3,'c',3,3),(4,'d',4,4);
delete from list1 where (c2 * 2 / 3 * 5) MOD c1 + 1 > 8;
select * from __3001__idx__idx1;
c1	yao_virtual_col
1	NULL
2	NULL
3	NULL
4	NULL
select * from __3001__idx__idx2;
c1	c2	yao_virtual_col
1	a	NULL
2	b	NULL
3	c	NULL
4	d	NULL
select * from __3001__idx__idx3;
c1	c3	yao_virtual_col
1	1	NULL
2	2	NULL
3	3	NULL
4	4	NULL
replace into list1 values(1,'a',1,1),(2,'b',2,2),(3,'c',3,3),(4,'d',4,4);
update list2 set c7=11.11,c8='abcd' where c1 = 1 and c2 = 1.11 and c3 = 'a';
delete from list2 where c1 > 0;
replace into list2 values(1,1.11,'a',1,1,1,1,1),(2,2.22,'b',2,2,2,2,2),(3,3.33,'c',3,3,3,3,3),(4,4.44,'b',4,4,4,4,4);
update list2 set c7=11.11,c8='abcd' where c1 > 1 and c2 > 1 and c3 > 'a';
select * from __3005__idx__idx2;
c1	c2	c3	c4	c5	c6
1	1.11	a	1	1	1
2	2.22	b	2	2	2
3	3.33	c	3	3	3
4	4.44	b	4	4	4
select * from __3005__idx__idx3;
c1	c2	c3	c4	c5
1	1.11	a	1	1
2	2.22	b	2	2
3	3.33	c	3	3
4	4.44	b	4	4
replace into list2 values(1,1.11,'a',1,1,1,1,1),(2,2.22,'b',2,2,2,2,2),(3,3.33,'c',3,3,3,3,3),(4,4.44,'b',4,4,4,4,4);
update list2 set c7=11.11,c8='abcd' where c1 > 1;
select * from __3005__idx__idx2;
c1	c2	c3	c4	c5	c6
1	1.11	a	1	1	1
2	2.22	b	2	2	2
3	3.33	c	3	3	3
4	4.44	b	4	4	4
select * from __3005__idx__idx3;
c1	c2	c3	c4	c5
1	1.11	a	1	1
2	2.22	b	2	2
3	3.33	c	3	3
4	4.44	b	4	4
update list2 set c7=11.11,c8='abcd' where c1 > 0;
select * from __3005__idx__idx2;
c1	c2	c3	c4	c5	c6
1	1.11	a	1	1	1
2	2.22	b	2	2	2
3	3.33	c	3	3	3
4	4.44	b	4	4	4
select * from __3005__idx__idx3;
c1	c2	c3	c4	c5
1	1.11	a	1	1
2	2.22	b	2	2
3	3.33	c	3	3
4	4.44	b	4	4
replace into list2 values(1,1.11,'a',1,1,1,1,1),(2,2.22,'b',2,2,2,2,2),(3,3.33,'c',3,3,3,3,3),(4,4.44,'b',4,4,4,4,4);
update list2 set c7=11.11,c8='abcd' where c2 > 1;
select * from __3005__idx__idx2;
c1	c2	c3	c4	c5	c6
1	1.11	a	1	1	1
2	2.22	b	2	2	2
3	3.33	c	3	3	3
4	4.44	b	4	4	4
select * from __3005__idx__idx3;
c1	c2	c3	c4	c5
1	1.11	a	1	1
2	2.22	b	2	2
3	3.33	c	3	3
4	4.44	b	4	4
replace into list2 values(1,1.11,'a',1,1,1,1,1),(2,2.22,'b',2,2,2,2,2),(3,3.33,'c',3,3,3,3,3),(4,4.44,'b',4,4,4,4,4);
update list2 set c7=11.11,c8='abcd' where c3 > 'a';
select * from __3005__idx__idx2;
c1	c2	c3	c4	c5	c6
1	1.11	a	1	1	1
2	2.22	b	2	2	2
3	3.33	c	3	3	3
4	4.44	b	4	4	4
select * from __3005__idx__idx3;
c1	c2	c3	c4	c5
1	1.11	a	1	1
2	2.22	b	2	2
3	3.33	c	3	3
4	4.44	b	4	4
replace into list2 values(1,1.11,'a',1,1,1,1,1),(2,2.22,'b',2,2,2,2,2),(3,3.33,'c',3,3,3,3,3),(4,4.44,'b',4,4,4,4,4);
update list2 set c7=11.11,c8='abcd' where c1 = 1 OR c2 = 2 OR c3 = 'a';
select * from __3005__idx__idx2;
c1	c2	c3	c4	c5	c6
1	1.11	a	1	1	1
2	2.22	b	2	2	2
3	3.33	c	3	3	3
4	4.44	b	4	4	4
select * from __3005__idx__idx3;
c1	c2	c3	c4	c5
1	1.11	a	1	1
2	2.22	b	2	2
3	3.33	c	3	3
4	4.44	b	4	4
delete from list2 where c1 > 0;
replace into list2 values(1,1.11,'a',1,1,1,1,1),(2,2.22,'b',2,2,2,2,2),(3,3.33,'c',3,3,3,3,3),(4,4.44,'b',4,4,4,4,4);
update list2 set c7=11.11,c8='abcd' where c1 = 1 and c2 = 1 and c3 = 'b';
select * from __3005__idx__idx2;
c1	c2	c3	c4	c5	c6
1	1.11	a	1	1	1
2	2.22	b	2	2	2
3	3.33	c	3	3	3
4	4.44	b	4	4	4
select * from __3005__idx__idx3;
c1	c2	c3	c4	c5
1	1.11	a	1	1
2	2.22	b	2	2
3	3.33	c	3	3
4	4.44	b	4	4
delete from list2 where c1 > 0;
replace into list2 values(1,1.11,'a',1,1,1,1,1),(2,2.22,'b',2,2,2,2,2),(3,3.33,'c',3,3,3,3,3),(4,4.44,'b',4,4,4,4,4);
update list2 set c7=11.11,c8='abcd' where c1 = 1 and c2 = 2 and c3 = 'c';
select * from __3005__idx__idx2;
c1	c2	c3	c4	c5	c6
1	1.11	a	1	1	1
2	2.22	b	2	2	2
3	3.33	c	3	3	3
4	4.44	b	4	4	4
select * from __3005__idx__idx3;
c1	c2	c3	c4	c5
1	1.11	a	1	1
2	2.22	b	2	2
3	3.33	c	3	3
4	4.44	b	4	4
delete from list2 where c1 > 0;
replace into list2 values(1,1.11,'a',1,1,1,1,1),(2,2.22,'b',2,2,2,2,2),(3,3.33,'c',3,3,3,3,3),(4,4.44,'b',4,4,4,4,4);
update list2 set c7=11.11,c8='abcd' where c1 = 1 and c2 = 2 and c3 = 'd';
select * from __3005__idx__idx2;
c1	c2	c3	c4	c5	c6
1	1.11	a	1	1	1
2	2.22	b	2	2	2
3	3.33	c	3	3	3
4	4.44	b	4	4	4
select * from __3005__idx__idx3;
c1	c2	c3	c4	c5
1	1.11	a	1	1
2	2.22	b	2	2
3	3.33	c	3	3
4	4.44	b	4	4
delete from list2 where c1 > 0;
replace into list2 values(1,1.11,'a',1,1,1,1,1),(2,2.22,'b',2,2,2,2,2),(3,3.33,'c',3,3,3,3,3),(4,4.44,'b',4,4,4,4,4);
update list2 set c7=11.11,c8='abcd' where c1 between 1 and 1;
select * from __3005__idx__idx2;
c1	c2	c3	c4	c5	c6
1	1.11	a	1	1	1
2	2.22	b	2	2	2
3	3.33	c	3	3	3
4	4.44	b	4	4	4
select * from __3005__idx__idx3;
c1	c2	c3	c4	c5
1	1.11	a	1	1
2	2.22	b	2	2
3	3.33	c	3	3
4	4.44	b	4	4
delete from list2 where c1 > 0;
replace into list2 values(1,1.11,'a',1,1,1,1,1),(2,2.22,'b',2,2,2,2,2),(3,3.33,'c',3,3,3,3,3),(4,4.44,'b',4,4,4,4,4);
update list2 set c7=11.11,c8='abcd' where c2 between 3 and 4;
select * from __3005__idx__idx2;
c1	c2	c3	c4	c5	c6
1	1.11	a	1	1	1
2	2.22	b	2	2	2
3	3.33	c	3	3	3
4	4.44	b	4	4	4
select * from __3005__idx__idx3;
c1	c2	c3	c4	c5
1	1.11	a	1	1
2	2.22	b	2	2
3	3.33	c	3	3
4	4.44	b	4	4
delete from list2 where c1 > 0;
replace into list2 values(1,1.11,'a',1,1,1,1,1),(2,2.22,'b',2,2,2,2,2),(3,3.33,'c',3,3,3,3,3),(4,4.44,'b',4,4,4,4,4);
update list2 set c7=11.11,c8='abcd' where c3 between 'a' and 'd';
select * from __3005__idx__idx2;
c1	c2	c3	c4	c5	c6
1	1.11	a	1	1	1
2	2.22	b	2	2	2
3	3.33	c	3	3	3
4	4.44	b	4	4	4
select * from __3005__idx__idx3;
c1	c2	c3	c4	c5
1	1.11	a	1	1
2	2.22	b	2	2
3	3.33	c	3	3
4	4.44	b	4	4
replace into list2 values(1,1.11,'a',1,1,1,1,1),(2,2.22,'b',2,2,2,2,2),(3,3.33,'c',3,3,3,3,3),(4,4.44,'b',4,4,4,4,4);
update list2 set c7=11.11,c8='abcd' where c1 IN (10,11,12,13,14,15);
select * from __3005__idx__idx2;
c1	c2	c3	c4	c5	c6
1	1.11	a	1	1	1
2	2.22	b	2	2	2
3	3.33	c	3	3	3
4	4.44	b	4	4	4
select * from __3005__idx__idx3;
c1	c2	c3	c4	c5
1	1.11	a	1	1
2	2.22	b	2	2
3	3.33	c	3	3
4	4.44	b	4	4
replace into list2 values(1,1.11,'a',1,1,1,1,1),(2,2.22,'b',2,2,2,2,2),(3,3.33,'c',3,3,3,3,3),(4,4.44,'b',4,4,4,4,4);
update list2 set c7=11.11,c8='abcd' where c2 IN (1);
select * from __3005__idx__idx2;
c1	c2	c3	c4	c5	c6
1	1.11	a	1	1	1
2	2.22	b	2	2	2
3	3.33	c	3	3	3
4	4.44	b	4	4	4
select * from __3005__idx__idx3;
c1	c2	c3	c4	c5
1	1.11	a	1	1
2	2.22	b	2	2
3	3.33	c	3	3
4	4.44	b	4	4
replace into list2 values(1,1.11,'a',1,1,1,1,1),(2,2.22,'b',2,2,2,2,2),(3,3.33,'c',3,3,3,3,3),(4,4.44,'b',4,4,4,4,4);
update list2 set c7=11.11,c8='abcd' where c3 IN ('a');
select * from __3005__idx__idx2;
c1	c2	c3	c4	c5	c6
1	1.11	a	1	1	1
2	2.22	b	2	2	2
3	3.33	c	3	3	3
4	4.44	b	4	4	4
select * from __3005__idx__idx3;
c1	c2	c3	c4	c5
1	1.11	a	1	1
2	2.22	b	2	2
3	3.33	c	3	3
4	4.44	b	4	4
replace into list2 values(1,1.11,'a',1,1,1,1,1),(2,2.22,'b',2,2,2,2,2),(3,3.33,'c',3,3,3,3,3),(4,4.44,'b',4,4,4,4,4);
update list2 set c7=11.11,c8='abcd' where c1 IN (1,2,3,4,5,6,7,8,9,10);
select * from __3005__idx__idx2;
c1	c2	c3	c4	c5	c6
1	1.11	a	1	1	1
2	2.22	b	2	2	2
3	3.33	c	3	3	3
4	4.44	b	4	4	4
select * from __3005__idx__idx3;
c1	c2	c3	c4	c5
1	1.11	a	1	1
2	2.22	b	2	2
3	3.33	c	3	3
4	4.44	b	4	4
replace into list2 values(1,1.11,'a',1,1,1,1,1),(2,2.22,'b',2,2,2,2,2),(3,3.33,'c',3,3,3,3,3),(4,4.44,'b',4,4,4,4,4);
update list2 set c7=11.11,c8='abcd' where c1 * c2 + 1 > 3;
select * from __3005__idx__idx2;
c1	c2	c3	c4	c5	c6
1	1.11	a	1	1	1
2	2.22	b	2	2	2
3	3.33	c	3	3	3
4	4.44	b	4	4	4
select * from __3005__idx__idx3;
c1	c2	c3	c4	c5
1	1.11	a	1	1
2	2.22	b	2	2
3	3.33	c	3	3
4	4.44	b	4	4
replace into list2 values(1,1.11,'a',1,1,1,1,1),(2,2.22,'b',2,2,2,2,2),(3,3.33,'c',3,3,3,3,3),(4,4.44,'b',4,4,4,4,4);
update list2 set c7=11.11,c8='abcd' where c1 / c2 - 1 > 1;
select * from __3005__idx__idx2;
c1	c2	c3	c4	c5	c6
1	1.11	a	1	1	1
2	2.22	b	2	2	2
3	3.33	c	3	3	3
4	4.44	b	4	4	4
select * from __3005__idx__idx3;
c1	c2	c3	c4	c5
1	1.11	a	1	1
2	2.22	b	2	2
3	3.33	c	3	3
4	4.44	b	4	4
replace into list2 values(1,1.11,'a',1,1,1,1,1),(2,2.22,'b',2,2,2,2,2),(3,3.33,'c',3,3,3,3,3),(4,4.44,'b',4,4,4,4,4);
update list2 set c7=11.11,c8='abcd' where c1 * 2 / c2 * 5 % 4 + 1 > 8;
select * from __3005__idx__idx2;
c1	c2	c3	c4	c5	c6
1	1.11	a	1	1	1
2	2.22	b	2	2	2
3	3.33	c	3	3	3
4	4.44	b	4	4	4
select * from __3005__idx__idx3;
c1	c2	c3	c4	c5
1	1.11	a	1	1
2	2.22	b	2	2
3	3.33	c	3	3
4	4.44	b	4	4
replace into list2 values(1,1.11,'a',1,1,1,1,1),(2,2.22,'b',2,2,2,2,2),(3,3.33,'c',3,3,3,3,3),(4,4.44,'b',4,4,4,4,4);
update list2 set c7=11.11,c8='abcd' where (c1 * 2 / 3 * 5) MOD 3 + 1 > 8;
select * from __3005__idx__idx2;
c1	c2	c3	c4	c5	c6
1	1.11	a	1	1	1
2	2.22	b	2	2	2
3	3.33	c	3	3	3
4	4.44	b	4	4	4
select * from __3005__idx__idx3;
c1	c2	c3	c4	c5
1	1.11	a	1	1
2	2.22	b	2	2
3	3.33	c	3	3
4	4.44	b	4	4
replace into list2 values(1,1.11,'a',1,1,1,1,1),(2,2.22,'b',2,2,2,2,2),(3,3.33,'c',3,3,3,3,3),(4,4.44,'b',4,4,4,4,4);
update list2 set c7=11.11,c8='abcd' where c4 > 100;
update list2 set c7=11.11,c8='abcd' where c5 = 1;
delete from list2 where c1 > 0;
replace into list2 values(1,1.11,'a',1,1,1,1,1),(2,2.22,'b',2,2,2,2,2),(3,3.33,'c',3,3,3,3,3),(4,4.44,'b',4,4,4,4,4);
update list2 set c7=11.11,c8='abcd' where c6 > 1;
select * from __3005__idx__idx2;
c1	c2	c3	c4	c5	c6
1	1.11	a	1	1	1
2	2.22	b	2	2	2
3	3.33	c	3	3	3
4	4.44	b	4	4	4
select * from __3005__idx__idx3;
c1	c2	c3	c4	c5
1	1.11	a	1	1
2	2.22	b	2	2
3	3.33	c	3	3
4	4.44	b	4	4
replace into list2 values(1,1.11,'a',1,1,1,1,1),(2,2.22,'b',2,2,2,2,2),(3,3.33,'c',3,3,3,3,3),(4,4.44,'b',4,4,4,4,4);
update list2 set c7=11.11,c8='abcd' where c1 = 1 OR c2 = 2 OR c4 = 3 OR c5 = 4 OR c6 = 5;
select * from __3005__idx__idx2;
c1	c2	c3	c4	c5	c6
1	1.11	a	1	1	1
2	2.22	b	2	2	2
3	3.33	c	3	3	3
4	4.44	b	4	4	4
select * from __3005__idx__idx3;
c1	c2	c3	c4	c5
1	1.11	a	1	1
2	2.22	b	2	2
3	3.33	c	3	3
4	4.44	b	4	4
replace into list2 values(1,1.11,'a',1,1,1,1,1),(2,2.22,'b',2,2,2,2,2),(3,3.33,'c',3,3,3,3,3),(4,4.44,'b',4,4,4,4,4);
update list2 set c7=11.11,c8='abcd' where c2 = 1 and c3 = 1 and c4 = 1 and c5 = 1 and c6 = 1;
select * from __3005__idx__idx2;
c1	c2	c3	c4	c5	c6
1	1.11	a	1	1	1
2	2.22	b	2	2	2
3	3.33	c	3	3	3
4	4.44	b	4	4	4
select * from __3005__idx__idx3;
c1	c2	c3	c4	c5
1	1.11	a	1	1
2	2.22	b	2	2
3	3.33	c	3	3
4	4.44	b	4	4
replace into list2 values(1,1.11,'a',1,1,1,1,1),(2,2.22,'b',2,2,2,2,2),(3,3.33,'c',3,3,3,3,3),(4,4.44,'b',4,4,4,4,4);
update list2 set c7=11.11,c8='abcd' where c1 = 1 and c2 = 2 and c3 = 3 and c4 = 4 and c6 = 5;
select * from __3005__idx__idx2;
c1	c2	c3	c4	c5	c6
1	1.11	a	1	1	1
2	2.22	b	2	2	2
3	3.33	c	3	3	3
4	4.44	b	4	4	4
select * from __3005__idx__idx3;
c1	c2	c3	c4	c5
1	1.11	a	1	1
2	2.22	b	2	2
3	3.33	c	3	3
4	4.44	b	4	4
replace into list2 values(1,1.11,'a',1,1,1,1,1),(2,2.22,'b',2,2,2,2,2),(3,3.33,'c',3,3,3,3,3),(4,4.44,'b',4,4,4,4,4);
update list2 set c7=11.11,c8='abcd' where c2 = 1 or c4 = 2 and c5 = 3 or c7 = 4 and c6 = 5;
select * from __3005__idx__idx2;
c1	c2	c3	c4	c5	c6
1	1.11	a	1	1	1
2	2.22	b	2	2	2
3	3.33	c	3	3	3
4	4.44	b	4	4	4
select * from __3005__idx__idx3;
c1	c2	c3	c4	c5
1	1.11	a	1	1
2	2.22	b	2	2
3	3.33	c	3	3
4	4.44	b	4	4
replace into list2 values(1,1.11,'a',1,1,1,1,1),(2,2.22,'b',2,2,2,2,2),(3,3.33,'c',3,3,3,3,3),(4,4.44,'b',4,4,4,4,4);
update list2 set c7=11.11,c8='abcd' where c4 between 1 and 1;
select * from __3005__idx__idx2;
c1	c2	c3	c4	c5	c6
1	1.11	a	1	1	1
2	2.22	b	2	2	2
3	3.33	c	3	3	3
4	4.44	b	4	4	4
select * from __3005__idx__idx3;
c1	c2	c3	c4	c5
1	1.11	a	1	1
2	2.22	b	2	2
3	3.33	c	3	3
4	4.44	b	4	4
replace into list2 values(1,1.11,'a',1,1,1,1,1),(2,2.22,'b',2,2,2,2,2),(3,3.33,'c',3,3,3,3,3),(4,4.44,'b',4,4,4,4,4);
update list2 set c7=11.11,c8='abcd' where c5 between 3 and 4;
select * from __3005__idx__idx2;
c1	c2	c3	c4	c5	c6
1	1.11	a	1	1	1
2	2.22	b	2	2	2
3	3.33	c	3	3	3
4	4.44	b	4	4	4
select * from __3005__idx__idx3;
c1	c2	c3	c4	c5
1	1.11	a	1	1
2	2.22	b	2	2
3	3.33	c	3	3
4	4.44	b	4	4
replace into list2 values(1,1.11,'a',1,1,1,1,1),(2,2.22,'b',2,2,2,2,2),(3,3.33,'c',3,3,3,3,3),(4,4.44,'b',4,4,4,4,4);
update list2 set c7=11.11,c8='abcd' where c6 IN (10,11,12,13,14,15);
select * from __3005__idx__idx2;
c1	c2	c3	c4	c5	c6
1	1.11	a	1	1	1
2	2.22	b	2	2	2
3	3.33	c	3	3	3
4	4.44	b	4	4	4
select * from __3005__idx__idx3;
c1	c2	c3	c4	c5
1	1.11	a	1	1
2	2.22	b	2	2
3	3.33	c	3	3
4	4.44	b	4	4
replace into list2 values(1,1.11,'a',1,1,1,1,1),(2,2.22,'b',2,2,2,2,2),(3,3.33,'c',3,3,3,3,3),(4,4.44,'b',4,4,4,4,4);
update list2 set c7=11.11,c8='abcd' where c7 IN (1);
select * from __3005__idx__idx2;
c1	c2	c3	c4	c5	c6
1	1.11	a	1	1	1
2	2.22	b	2	2	2
3	3.33	c	3	3	3
4	4.44	b	4	4	4
select * from __3005__idx__idx3;
c1	c2	c3	c4	c5
1	1.11	a	1	1
2	2.22	b	2	2
3	3.33	c	3	3
4	4.44	b	4	4
replace into list2 values(1,1.11,'a',1,1,1,1,1),(2,2.22,'b',2,2,2,2,2),(3,3.33,'c',3,3,3,3,3),(4,4.44,'b',4,4,4,4,4);
update list2 set c7=11.11,c8='abcd' where c8 IN (2);
select * from __3005__idx__idx2;
c1	c2	c3	c4	c5	c6
1	1.11	a	1	1	1
2	2.22	b	2	2	2
3	3.33	c	3	3	3
4	4.44	b	4	4	4
select * from __3005__idx__idx3;
c1	c2	c3	c4	c5
1	1.11	a	1	1
2	2.22	b	2	2
3	3.33	c	3	3
4	4.44	b	4	4
replace into list2 values(1,1.11,'a',1,1,1,1,1),(2,2.22,'b',2,2,2,2,2),(3,3.33,'c',3,3,3,3,3),(4,4.44,'b',4,4,4,4,4);
update list2 set c7=11.11,c8='abcd' where c5 IN (1,2,3,4,5,6,7,8,9,10);
select * from __3005__idx__idx2;
c1	c2	c3	c4	c5	c6
1	1.11	a	1	1	1
2	2.22	b	2	2	2
3	3.33	c	3	3	3
4	4.44	b	4	4	4
select * from __3005__idx__idx3;
c1	c2	c3	c4	c5
1	1.11	a	1	1
2	2.22	b	2	2
3	3.33	c	3	3
4	4.44	b	4	4
replace into list2 values(1,1.11,'a',1,1,1,1,1),(2,2.22,'b',2,2,2,2,2),(3,3.33,'c',3,3,3,3,3),(4,4.44,'b',4,4,4,4,4);
update list2 set c7=11.11,c8='abcd' where c4 * 2 + 1 > 3;
select * from __3005__idx__idx2;
c1	c2	c3	c4	c5	c6
1	1.11	a	1	1	1
2	2.22	b	2	2	2
3	3.33	c	3	3	3
4	4.44	b	4	4	4
select * from __3005__idx__idx3;
c1	c2	c3	c4	c5
1	1.11	a	1	1
2	2.22	b	2	2
3	3.33	c	3	3
4	4.44	b	4	4
replace into list2 values(1,1.11,'a',1,1,1,1,1),(2,2.22,'b',2,2,2,2,2),(3,3.33,'c',3,3,3,3,3),(4,4.44,'b',4,4,4,4,4);
update list2 set c7=11.11,c8='abcd' where c5 / 2 - 1 > 1;
select * from __3005__idx__idx2;
c1	c2	c3	c4	c5	c6
1	1.11	a	1	1	1
2	2.22	b	2	2	2
3	3.33	c	3	3	3
4	4.44	b	4	4	4
select * from __3005__idx__idx3;
c1	c2	c3	c4	c5
1	1.11	a	1	1
2	2.22	b	2	2
3	3.33	c	3	3
4	4.44	b	4	4
replace into list2 values(1,1.11,'a',1,1,1,1,1),(2,2.22,'b',2,2,2,2,2),(3,3.33,'c',3,3,3,3,3),(4,4.44,'b',4,4,4,4,4);
update list2 set c7=11.11,c8='abcd' where c7 * 2 / 3 * c6 % 4 + 1 > 8;
select * from __3005__idx__idx2;
c1	c2	c3	c4	c5	c6
1	1.11	a	1	1	1
2	2.22	b	2	2	2
3	3.33	c	3	3	3
4	4.44	b	4	4	4
select * from __3005__idx__idx3;
c1	c2	c3	c4	c5
1	1.11	a	1	1
2	2.22	b	2	2
3	3.33	c	3	3
4	4.44	b	4	4
replace into list2 values(1,1.11,'a',1,1,1,1,1),(2,2.22,'b',2,2,2,2,2),(3,3.33,'c',3,3,3,3,3),(4,4.44,'b',4,4,4,4,4);
update list2 set c7=11.11,c8='abcd' where (c8 * c4 / 3 * 5) MOD 3 + 1 > 8;
select * from __3005__idx__idx2;
c1	c2	c3	c4	c5	c6
1	1.11	a	1	1	1
2	2.22	b	2	2	2
3	3.33	c	3	3	3
4	4.44	b	4	4	4
select * from __3005__idx__idx3;
c1	c2	c3	c4	c5
1	1.11	a	1	1
2	2.22	b	2	2
3	3.33	c	3	3
4	4.44	b	4	4
