drop table if exists t1,t2,t3,t4,t5;
replace into __all_partition_rules(rule_name,rule_par_num,rule_par_list,rule_body,type)
values
('hash_partition_func_1',1,'x','x',0),
('hash_partition_func_2',1,'x','x+1',0),
('hash_partition_func_3',1,'x','x-2',0),
('hash_partition_func_4',1,'x','x*2',0),
('hash_partition_func_5',1,'x','x/3',0),
('hash_partition_func_6',1,'x','x%4',0),
('hash_partition_func_7',1,'x','(x+3)%5',0);
drop table if exists hash_partition_int_1;;
create table hash_partition_int_1(c1 int,c2 int,c3 int,c4 int,primary key(c1)) partition by(hash_partition__group_,not_exist_func,c1);;
ERROR HY000: YAO-5077: partition function 'not_exist_func' doesn't exist
create table hash_partition_int_1(c1 int,c2 int,c3 int,c4 int,primary key(c1)) partition by(hash_partition__group_,hash_partition_func_1,c7);;
ERROR 42S22: YAO-5009: partition column 'c7' does not exist in table
create table hash_int_part_table1_012345678901234567890123456789012345678901234567890123456789012345678901234567890123456789012345678901234567890123456789012345678901234567890123456789012345678900123456789123456789012345678901234567890123456789012345678901234567891234560(c1 int,c2 int,c3 int,c4 int,primary key(c1)) partition by(hash_partition__group_,hash_partition_func_1,c1);;
ERROR HY000: YAO-2: table_name is invalid.
create table hash_partition_int_1(c1 int,c2 int,c3 int,c4 int,primary key(c1)) partition by(hash_partition__group_,hash_partition_func_1,c4);;
ERROR HY000: YAO-5081: parameter[c4] is not rowkey
create table hash_partition_int_1(c1 int,c2 int,c3 int,c4 int,primary key(c1)) partition by(hash_partition__group_,hash_partition_func_1,c1);;
create table hash_partition_int_1(c1 int,c2 int,c3 int,c4 int,primary key(c1)) partition by(hash_partition__group_,hash_partition_func_1,c1);;
ERROR 42S01: YAO-5025: table 'hash_partition_int_1' already exists
insert into hash_partition_int_1 values(1,1,1,1),(2,2,2,2),(3,3,3,3),(4,4,4,4),(5,5,5,5);;
insert into hash_partition_int_1 values(1,1,1,1);;
ERROR 23000: YAO-5024: Duplicate entry ' <3002.16>=int32:1' for key 'PRIMARY'
insert into  values(1,6,6,6);;
ERROR 42000: YAO-5001: You have an error in your SQL syntax; check the manual that corresponds to your YaoBase version for the right syntax 
insert into hash_partition_int_1(c1,c2,c3,c5) values(1,6,6,6);;
ERROR 42S22: YAO-5009: Unknown column name c5
insert into hash_partition_int_1 values(6,6,6,6,6);;
ERROR HY000: YAO-5007: too many value, value num[4], column num[5]
replace into hash_partition_int_1 values(1,1,1,1),(2,2,2,2),(3,3,3,3),(4,4,4,4),(5,5,5,5);;
replace into hash_partition_int_1 values(11,1,1,1),(12,2,2,2),(13,3,3,3),(14,4,4,4),(15,5,5,5);;
replace into hash_partition_int_1 values(1,1,1,1);;
replace into  values(1,6,6,6);;
ERROR 42000: YAO-5001: You have an error in your SQL syntax; check the manual that corresponds to your YaoBase version for the right syntax 
replace into hash_partition_int_1(c1,c2,c3,c5) values(1,6,6,6);;
ERROR 42S22: YAO-5009: Unknown column name c5
replace into hash_partition_int_1 values(6,6,6,6,6);;
ERROR HY000: YAO-5007: too many value, value num[4], column num[5]
select * from hash_partition_int_1;
c1	c2	c3	c4
1	1	1	1
2	2	2	2
3	3	3	3
4	4	4	4
5	5	5	5
11	1	1	1
12	2	2	2
13	3	3	3
14	4	4	4
15	5	5	5
select * from hash_partition_int_1 where c1=1;
c1	c2	c3	c4
1	1	1	1
select * from hash_partition_int_1 where c1=2;
c1	c2	c3	c4
2	2	2	2
select * from hash_partition_int_1 where c1=3;
c1	c2	c3	c4
3	3	3	3
select * from hash_partition_int_1 where c1=4;
c1	c2	c3	c4
4	4	4	4
select * from hash_partition_int_1 where c1=5;
c1	c2	c3	c4
5	5	5	5
select * from hash_partition_int_1 where c1=6;
c1	c2	c3	c4
select * from hash_partition_int_1 where c1=7;
c1	c2	c3	c4
select * from hash_partition_int_1 where c1=3 and c4=7;
c1	c2	c3	c4
update hash_partition_int_1 set c4=c2+2 where c1=1;
update hash_partition_int_1 set c4=c2+2 where c1=2;
update hash_partition_int_1 set c4=c2+2 where c1=3;
update hash_partition_int_1 set c4=c2+2 where c3=3;
update  set c4=c2+2 where c1=5;
ERROR 42000: YAO-5001: You have an error in your SQL syntax; check the manual that corresponds to your YaoBase version for the right syntax 
update hash_partition_int_1 set c5=c2+2 where c1=4;
ERROR 42S22: YAO-5009: Unknown column name c5
update hash_partition_int_1 set c4=c2+2 where c5=3;
ERROR 42S22: YAO-5009: Unkown column name c5
update hash_partition_int_1 set c4=c2+2 where c1=5 and c4=1;
update hash_partition_int_1 set c4=c2+2 where c1=5 and c4=5;
select * from hash_partition_int_1;
c1	c2	c3	c4
1	1	1	3
2	2	2	4
3	3	3	5
4	4	4	4
5	5	5	7
11	1	1	1
12	2	2	2
13	3	3	5
14	4	4	4
15	5	5	5
select * from hash_partition_int_1 where c1=1;
c1	c2	c3	c4
1	1	1	3
select * from hash_partition_int_1 where c1=2;
c1	c2	c3	c4
2	2	2	4
select * from hash_partition_int_1 where c1=3;
c1	c2	c3	c4
3	3	3	5
select * from hash_partition_int_1 where c1=4;
c1	c2	c3	c4
4	4	4	4
select * from hash_partition_int_1 where c1=5;
c1	c2	c3	c4
5	5	5	7
select * from hash_partition_int_1 where c1=6;
c1	c2	c3	c4
select * from hash_partition_int_1 where c1=7;
c1	c2	c3	c4
select * from hash_partition_int_1 where c1=6 and c4=7;
c1	c2	c3	c4
delete from hash_partition_int_1 where c1=1;
delete from hash_partition_int_1 where c1=2;
delete from hash_partition_int_1 where c1=3;
delete from hash_partition_int_1 where c1=4;
delete from  where condition5;
ERROR 42000: YAO-5001: You have an error in your SQL syntax; check the manual that corresponds to your YaoBase version for the right syntax 
delete from hash_partition_int_1 where c3=3;
delete from hash_partition_int_1 where condition_column_not_exist;
ERROR 42S22: YAO-5009: Unkown column name condition_column_not_exist
select * from hash_partition_int_1;
c1	c2	c3	c4
5	5	5	7
11	1	1	1
12	2	2	2
14	4	4	4
15	5	5	5
drop table if exists hash_partition_int_2;;
create table hash_partition_int_2(c1 int,c2 int,c3 int,c4 int,primary key(c1)) partition by(hash_partition__group_,not_exist_func,c1);;
ERROR HY000: YAO-5077: partition function 'not_exist_func' doesn't exist
create table hash_partition_int_2(c1 int,c2 int,c3 int,c4 int,primary key(c1)) partition by(hash_partition__group_,hash_partition_func_2,c7);;
ERROR 42S22: YAO-5009: partition column 'c7' does not exist in table
create table hash_int_part_table1_012345678901234567890123456789012345678901234567890123456789012345678901234567890123456789012345678901234567890123456789012345678901234567890123456789012345678900123456789123456789012345678901234567890123456789012345678901234567891234560(c1 int,c2 int,c3 int,c4 int,primary key(c1)) partition by(hash_partition__group_,hash_partition_func_2,c1);;
ERROR HY000: YAO-2: table_name is invalid.
create table hash_partition_int_2(c1 int,c2 int,c3 int,c4 int,primary key(c1)) partition by(hash_partition__group_,hash_partition_func_2,c4);;
ERROR HY000: YAO-5081: parameter[c4] is not rowkey
create table hash_partition_int_2(c1 int,c2 int,c3 int,c4 int,primary key(c1)) partition by(hash_partition__group_,hash_partition_func_2,c1);;
create table hash_partition_int_2(c1 int,c2 int,c3 int,c4 int,primary key(c1)) partition by(hash_partition__group_,hash_partition_func_2,c1);;
ERROR 42S01: YAO-5025: table 'hash_partition_int_2' already exists
insert into hash_partition_int_2 values(1,1,1,1),(2,2,2,2),(3,3,3,3),(4,4,4,4),(5,5,5,5);;
insert into hash_partition_int_2 values(1,1,1,1);;
ERROR 23000: YAO-5024: Duplicate entry ' <3004.16>=int32:1' for key 'PRIMARY'
insert into  values(1,6,6,6);;
ERROR 42000: YAO-5001: You have an error in your SQL syntax; check the manual that corresponds to your YaoBase version for the right syntax 
insert into hash_partition_int_2(c1,c2,c3,c5) values(1,6,6,6);;
ERROR 42S22: YAO-5009: Unknown column name c5
insert into hash_partition_int_2 values(6,6,6,6,6);;
ERROR HY000: YAO-5007: too many value, value num[4], column num[5]
replace into hash_partition_int_2 values(1,1,1,1),(2,2,2,2),(3,3,3,3),(4,4,4,4),(5,5,5,5);;
replace into hash_partition_int_2 values(11,1,1,1),(12,2,2,2),(13,3,3,3),(14,4,4,4),(15,5,5,5);;
replace into hash_partition_int_2 values(1,1,1,1);;
replace into  values(1,6,6,6);;
ERROR 42000: YAO-5001: You have an error in your SQL syntax; check the manual that corresponds to your YaoBase version for the right syntax 
replace into hash_partition_int_2(c1,c2,c3,c5) values(1,6,6,6);;
ERROR 42S22: YAO-5009: Unknown column name c5
replace into hash_partition_int_2 values(6,6,6,6,6);;
ERROR HY000: YAO-5007: too many value, value num[4], column num[5]
select * from hash_partition_int_2;
c1	c2	c3	c4
1	1	1	1
2	2	2	2
3	3	3	3
4	4	4	4
5	5	5	5
11	1	1	1
12	2	2	2
13	3	3	3
14	4	4	4
15	5	5	5
select * from hash_partition_int_2 where c1=1;
c1	c2	c3	c4
1	1	1	1
select * from hash_partition_int_2 where c1=2;
c1	c2	c3	c4
2	2	2	2
select * from hash_partition_int_2 where c1=3;
c1	c2	c3	c4
3	3	3	3
select * from hash_partition_int_2 where c1=4;
c1	c2	c3	c4
4	4	4	4
select * from hash_partition_int_2 where c1=5;
c1	c2	c3	c4
5	5	5	5
select * from hash_partition_int_2 where c1=6;
c1	c2	c3	c4
select * from hash_partition_int_2 where c1=7;
c1	c2	c3	c4
select * from hash_partition_int_2 where c1=3 and c4=7;
c1	c2	c3	c4
update hash_partition_int_2 set c4=c2+2 where c1=1;
update hash_partition_int_2 set c4=c2+2 where c1=2;
update hash_partition_int_2 set c4=c2+2 where c1=3;
update hash_partition_int_2 set c4=c2+2 where c3=3;
update  set c4=c2+2 where c1=5;
ERROR 42000: YAO-5001: You have an error in your SQL syntax; check the manual that corresponds to your YaoBase version for the right syntax 
update hash_partition_int_2 set c5=c2+2 where c1=4;
ERROR 42S22: YAO-5009: Unknown column name c5
update hash_partition_int_2 set c4=c2+2 where c5=3;
ERROR 42S22: YAO-5009: Unkown column name c5
update hash_partition_int_2 set c4=c2+2 where c1=5 and c4=1;
update hash_partition_int_2 set c4=c2+2 where c1=5 and c4=5;
select * from hash_partition_int_2;
c1	c2	c3	c4
1	1	1	3
2	2	2	4
3	3	3	5
4	4	4	4
5	5	5	7
11	1	1	1
12	2	2	2
13	3	3	5
14	4	4	4
15	5	5	5
select * from hash_partition_int_2 where c1=1;
c1	c2	c3	c4
1	1	1	3
select * from hash_partition_int_2 where c1=2;
c1	c2	c3	c4
2	2	2	4
select * from hash_partition_int_2 where c1=3;
c1	c2	c3	c4
3	3	3	5
select * from hash_partition_int_2 where c1=4;
c1	c2	c3	c4
4	4	4	4
select * from hash_partition_int_2 where c1=5;
c1	c2	c3	c4
5	5	5	7
select * from hash_partition_int_2 where c1=6;
c1	c2	c3	c4
select * from hash_partition_int_2 where c1=7;
c1	c2	c3	c4
select * from hash_partition_int_2 where c1=6 and c4=7;
c1	c2	c3	c4
delete from hash_partition_int_2 where c1=1;
delete from hash_partition_int_2 where c1=2;
delete from hash_partition_int_2 where c1=3;
delete from hash_partition_int_2 where c1=4;
delete from  where condition5;
ERROR 42000: YAO-5001: You have an error in your SQL syntax; check the manual that corresponds to your YaoBase version for the right syntax 
delete from hash_partition_int_2 where c3=3;
delete from hash_partition_int_2 where condition_column_not_exist;
ERROR 42S22: YAO-5009: Unkown column name condition_column_not_exist
select * from hash_partition_int_2;
c1	c2	c3	c4
5	5	5	7
11	1	1	1
12	2	2	2
14	4	4	4
15	5	5	5
drop table if exists hash_partition_int_3;;
create table hash_partition_int_3(c1 int,c2 int,c3 int,c4 int,primary key(c1)) partition by(hash_partition__group_,not_exist_func,c1);;
ERROR HY000: YAO-5077: partition function 'not_exist_func' doesn't exist
create table hash_partition_int_3(c1 int,c2 int,c3 int,c4 int,primary key(c1)) partition by(hash_partition__group_,hash_partition_func_3,c7);;
ERROR 42S22: YAO-5009: partition column 'c7' does not exist in table
create table hash_int_part_table1_012345678901234567890123456789012345678901234567890123456789012345678901234567890123456789012345678901234567890123456789012345678901234567890123456789012345678900123456789123456789012345678901234567890123456789012345678901234567891234560(c1 int,c2 int,c3 int,c4 int,primary key(c1)) partition by(hash_partition__group_,hash_partition_func_3,c1);;
ERROR HY000: YAO-2: table_name is invalid.
create table hash_partition_int_3(c1 int,c2 int,c3 int,c4 int,primary key(c1)) partition by(hash_partition__group_,hash_partition_func_3,c4);;
ERROR HY000: YAO-5081: parameter[c4] is not rowkey
create table hash_partition_int_3(c1 int,c2 int,c3 int,c4 int,primary key(c1)) partition by(hash_partition__group_,hash_partition_func_3,c1);;
create table hash_partition_int_3(c1 int,c2 int,c3 int,c4 int,primary key(c1)) partition by(hash_partition__group_,hash_partition_func_3,c1);;
ERROR 42S01: YAO-5025: table 'hash_partition_int_3' already exists
insert into hash_partition_int_3 values(1,1,1,1),(2,2,2,2),(3,3,3,3),(4,4,4,4),(5,5,5,5);;
insert into hash_partition_int_3 values(1,1,1,1);;
ERROR 23000: YAO-5024: Duplicate entry ' <3006.16>=int32:1' for key 'PRIMARY'
insert into  values(1,6,6,6);;
ERROR 42000: YAO-5001: You have an error in your SQL syntax; check the manual that corresponds to your YaoBase version for the right syntax 
insert into hash_partition_int_3(c1,c2,c3,c5) values(1,6,6,6);;
ERROR 42S22: YAO-5009: Unknown column name c5
insert into hash_partition_int_3 values(6,6,6,6,6);;
ERROR HY000: YAO-5007: too many value, value num[4], column num[5]
replace into hash_partition_int_3 values(1,1,1,1),(2,2,2,2),(3,3,3,3),(4,4,4,4),(5,5,5,5);;
replace into hash_partition_int_3 values(11,1,1,1),(12,2,2,2),(13,3,3,3),(14,4,4,4),(15,5,5,5);;
replace into hash_partition_int_3 values(1,1,1,1);;
replace into  values(1,6,6,6);;
ERROR 42000: YAO-5001: You have an error in your SQL syntax; check the manual that corresponds to your YaoBase version for the right syntax 
replace into hash_partition_int_3(c1,c2,c3,c5) values(1,6,6,6);;
ERROR 42S22: YAO-5009: Unknown column name c5
replace into hash_partition_int_3 values(6,6,6,6,6);;
ERROR HY000: YAO-5007: too many value, value num[4], column num[5]
select * from hash_partition_int_3;
c1	c2	c3	c4
1	1	1	1
2	2	2	2
3	3	3	3
4	4	4	4
5	5	5	5
11	1	1	1
12	2	2	2
13	3	3	3
14	4	4	4
15	5	5	5
select * from hash_partition_int_3 where c1=1;
c1	c2	c3	c4
1	1	1	1
select * from hash_partition_int_3 where c1=2;
c1	c2	c3	c4
2	2	2	2
select * from hash_partition_int_3 where c1=3;
c1	c2	c3	c4
3	3	3	3
select * from hash_partition_int_3 where c1=4;
c1	c2	c3	c4
4	4	4	4
select * from hash_partition_int_3 where c1=5;
c1	c2	c3	c4
5	5	5	5
select * from hash_partition_int_3 where c1=6;
c1	c2	c3	c4
select * from hash_partition_int_3 where c1=7;
c1	c2	c3	c4
select * from hash_partition_int_3 where c1=3 and c4=7;
c1	c2	c3	c4
update hash_partition_int_3 set c4=c2+2 where c1=1;
update hash_partition_int_3 set c4=c2+2 where c1=2;
update hash_partition_int_3 set c4=c2+2 where c1=3;
update hash_partition_int_3 set c4=c2+2 where c3=3;
update  set c4=c2+2 where c1=5;
ERROR 42000: YAO-5001: You have an error in your SQL syntax; check the manual that corresponds to your YaoBase version for the right syntax 
update hash_partition_int_3 set c5=c2+2 where c1=4;
ERROR 42S22: YAO-5009: Unknown column name c5
update hash_partition_int_3 set c4=c2+2 where c5=3;
ERROR 42S22: YAO-5009: Unkown column name c5
update hash_partition_int_3 set c4=c2+2 where c1=5 and c4=1;
update hash_partition_int_3 set c4=c2+2 where c1=5 and c4=5;
select * from hash_partition_int_3;
c1	c2	c3	c4
1	1	1	3
2	2	2	4
3	3	3	5
4	4	4	4
5	5	5	7
11	1	1	1
12	2	2	2
13	3	3	5
14	4	4	4
15	5	5	5
select * from hash_partition_int_3 where c1=1;
c1	c2	c3	c4
1	1	1	3
select * from hash_partition_int_3 where c1=2;
c1	c2	c3	c4
2	2	2	4
select * from hash_partition_int_3 where c1=3;
c1	c2	c3	c4
3	3	3	5
select * from hash_partition_int_3 where c1=4;
c1	c2	c3	c4
4	4	4	4
select * from hash_partition_int_3 where c1=5;
c1	c2	c3	c4
5	5	5	7
select * from hash_partition_int_3 where c1=6;
c1	c2	c3	c4
select * from hash_partition_int_3 where c1=7;
c1	c2	c3	c4
select * from hash_partition_int_3 where c1=6 and c4=7;
c1	c2	c3	c4
delete from hash_partition_int_3 where c1=1;
delete from hash_partition_int_3 where c1=2;
delete from hash_partition_int_3 where c1=3;
delete from hash_partition_int_3 where c1=4;
delete from  where condition5;
ERROR 42000: YAO-5001: You have an error in your SQL syntax; check the manual that corresponds to your YaoBase version for the right syntax 
delete from hash_partition_int_3 where c3=3;
delete from hash_partition_int_3 where condition_column_not_exist;
ERROR 42S22: YAO-5009: Unkown column name condition_column_not_exist
select * from hash_partition_int_3;
c1	c2	c3	c4
5	5	5	7
11	1	1	1
12	2	2	2
14	4	4	4
15	5	5	5
drop table if exists hash_partition_int_4;;
create table hash_partition_int_4(c1 int,c2 int,c3 int,c4 int,primary key(c1)) partition by(hash_partition__group_,not_exist_func,c1);;
ERROR HY000: YAO-5077: partition function 'not_exist_func' doesn't exist
create table hash_partition_int_4(c1 int,c2 int,c3 int,c4 int,primary key(c1)) partition by(hash_partition__group_,hash_partition_func_4,c7);;
ERROR 42S22: YAO-5009: partition column 'c7' does not exist in table
create table hash_int_part_table1_012345678901234567890123456789012345678901234567890123456789012345678901234567890123456789012345678901234567890123456789012345678901234567890123456789012345678900123456789123456789012345678901234567890123456789012345678901234567891234560(c1 int,c2 int,c3 int,c4 int,primary key(c1)) partition by(hash_partition__group_,hash_partition_func_4,c1);;
ERROR HY000: YAO-2: table_name is invalid.
create table hash_partition_int_4(c1 int,c2 int,c3 int,c4 int,primary key(c1)) partition by(hash_partition__group_,hash_partition_func_4,c4);;
ERROR HY000: YAO-5081: parameter[c4] is not rowkey
create table hash_partition_int_4(c1 int,c2 int,c3 int,c4 int,primary key(c1)) partition by(hash_partition__group_,hash_partition_func_4,c1);;
create table hash_partition_int_4(c1 int,c2 int,c3 int,c4 int,primary key(c1)) partition by(hash_partition__group_,hash_partition_func_4,c1);;
ERROR 42S01: YAO-5025: table 'hash_partition_int_4' already exists
insert into hash_partition_int_4 values(1,1,1,1),(2,2,2,2),(3,3,3,3),(4,4,4,4),(5,5,5,5);;
insert into hash_partition_int_4 values(1,1,1,1);;
ERROR 23000: YAO-5024: Duplicate entry ' <3008.16>=int32:1' for key 'PRIMARY'
insert into  values(1,6,6,6);;
ERROR 42000: YAO-5001: You have an error in your SQL syntax; check the manual that corresponds to your YaoBase version for the right syntax 
insert into hash_partition_int_4(c1,c2,c3,c5) values(1,6,6,6);;
ERROR 42S22: YAO-5009: Unknown column name c5
insert into hash_partition_int_4 values(6,6,6,6,6);;
ERROR HY000: YAO-5007: too many value, value num[4], column num[5]
replace into hash_partition_int_4 values(1,1,1,1),(2,2,2,2),(3,3,3,3),(4,4,4,4),(5,5,5,5);;
replace into hash_partition_int_4 values(11,1,1,1),(12,2,2,2),(13,3,3,3),(14,4,4,4),(15,5,5,5);;
replace into hash_partition_int_4 values(1,1,1,1);;
replace into  values(1,6,6,6);;
ERROR 42000: YAO-5001: You have an error in your SQL syntax; check the manual that corresponds to your YaoBase version for the right syntax 
replace into hash_partition_int_4(c1,c2,c3,c5) values(1,6,6,6);;
ERROR 42S22: YAO-5009: Unknown column name c5
replace into hash_partition_int_4 values(6,6,6,6,6);;
ERROR HY000: YAO-5007: too many value, value num[4], column num[5]
select * from hash_partition_int_4;
c1	c2	c3	c4
1	1	1	1
2	2	2	2
3	3	3	3
4	4	4	4
5	5	5	5
11	1	1	1
12	2	2	2
13	3	3	3
14	4	4	4
15	5	5	5
select * from hash_partition_int_4 where c1=1;
c1	c2	c3	c4
1	1	1	1
select * from hash_partition_int_4 where c1=2;
c1	c2	c3	c4
2	2	2	2
select * from hash_partition_int_4 where c1=3;
c1	c2	c3	c4
3	3	3	3
select * from hash_partition_int_4 where c1=4;
c1	c2	c3	c4
4	4	4	4
select * from hash_partition_int_4 where c1=5;
c1	c2	c3	c4
5	5	5	5
select * from hash_partition_int_4 where c1=6;
c1	c2	c3	c4
select * from hash_partition_int_4 where c1=7;
c1	c2	c3	c4
select * from hash_partition_int_4 where c1=3 and c4=7;
c1	c2	c3	c4
update hash_partition_int_4 set c4=c2+2 where c1=1;
update hash_partition_int_4 set c4=c2+2 where c1=2;
update hash_partition_int_4 set c4=c2+2 where c1=3;
update hash_partition_int_4 set c4=c2+2 where c3=3;
update  set c4=c2+2 where c1=5;
ERROR 42000: YAO-5001: You have an error in your SQL syntax; check the manual that corresponds to your YaoBase version for the right syntax 
update hash_partition_int_4 set c5=c2+2 where c1=4;
ERROR 42S22: YAO-5009: Unknown column name c5
update hash_partition_int_4 set c4=c2+2 where c5=3;
ERROR 42S22: YAO-5009: Unkown column name c5
update hash_partition_int_4 set c4=c2+2 where c1=5 and c4=1;
update hash_partition_int_4 set c4=c2+2 where c1=5 and c4=5;
select * from hash_partition_int_4;
c1	c2	c3	c4
1	1	1	3
2	2	2	4
3	3	3	5
4	4	4	4
5	5	5	7
11	1	1	1
12	2	2	2
13	3	3	5
14	4	4	4
15	5	5	5
select * from hash_partition_int_4 where c1=1;
c1	c2	c3	c4
1	1	1	3
select * from hash_partition_int_4 where c1=2;
c1	c2	c3	c4
2	2	2	4
select * from hash_partition_int_4 where c1=3;
c1	c2	c3	c4
3	3	3	5
select * from hash_partition_int_4 where c1=4;
c1	c2	c3	c4
4	4	4	4
select * from hash_partition_int_4 where c1=5;
c1	c2	c3	c4
5	5	5	7
select * from hash_partition_int_4 where c1=6;
c1	c2	c3	c4
select * from hash_partition_int_4 where c1=7;
c1	c2	c3	c4
select * from hash_partition_int_4 where c1=6 and c4=7;
c1	c2	c3	c4
delete from hash_partition_int_4 where c1=1;
delete from hash_partition_int_4 where c1=2;
delete from hash_partition_int_4 where c1=3;
delete from hash_partition_int_4 where c1=4;
delete from  where condition5;
ERROR 42000: YAO-5001: You have an error in your SQL syntax; check the manual that corresponds to your YaoBase version for the right syntax 
delete from hash_partition_int_4 where c3=3;
delete from hash_partition_int_4 where condition_column_not_exist;
ERROR 42S22: YAO-5009: Unkown column name condition_column_not_exist
select * from hash_partition_int_4;
c1	c2	c3	c4
5	5	5	7
11	1	1	1
12	2	2	2
14	4	4	4
15	5	5	5
drop table if exists hash_partition_int_5;;
create table hash_partition_int_5(c1 int,c2 int,c3 int,c4 int,primary key(c1)) partition by(hash_partition__group_,not_exist_func,c1);;
ERROR HY000: YAO-5077: partition function 'not_exist_func' doesn't exist
create table hash_partition_int_5(c1 int,c2 int,c3 int,c4 int,primary key(c1)) partition by(hash_partition__group_,hash_partition_func_5,c7);;
ERROR 42S22: YAO-5009: partition column 'c7' does not exist in table
create table hash_int_part_table1_012345678901234567890123456789012345678901234567890123456789012345678901234567890123456789012345678901234567890123456789012345678901234567890123456789012345678900123456789123456789012345678901234567890123456789012345678901234567891234560(c1 int,c2 int,c3 int,c4 int,primary key(c1)) partition by(hash_partition__group_,hash_partition_func_5,c1);;
ERROR HY000: YAO-2: table_name is invalid.
create table hash_partition_int_5(c1 int,c2 int,c3 int,c4 int,primary key(c1)) partition by(hash_partition__group_,hash_partition_func_5,c4);;
ERROR HY000: YAO-5081: parameter[c4] is not rowkey
create table hash_partition_int_5(c1 int,c2 int,c3 int,c4 int,primary key(c1)) partition by(hash_partition__group_,hash_partition_func_5,c1);;
create table hash_partition_int_5(c1 int,c2 int,c3 int,c4 int,primary key(c1)) partition by(hash_partition__group_,hash_partition_func_5,c1);;
ERROR 42S01: YAO-5025: table 'hash_partition_int_5' already exists
insert into hash_partition_int_5 values(1,1,1,1),(2,2,2,2),(3,3,3,3),(4,4,4,4),(5,5,5,5);;
insert into hash_partition_int_5 values(1,1,1,1);;
ERROR 23000: YAO-5024: Duplicate entry ' <3010.16>=int32:1' for key 'PRIMARY'
insert into  values(1,6,6,6);;
ERROR 42000: YAO-5001: You have an error in your SQL syntax; check the manual that corresponds to your YaoBase version for the right syntax 
insert into hash_partition_int_5(c1,c2,c3,c5) values(1,6,6,6);;
ERROR 42S22: YAO-5009: Unknown column name c5
insert into hash_partition_int_5 values(6,6,6,6,6);;
ERROR HY000: YAO-5007: too many value, value num[4], column num[5]
replace into hash_partition_int_5 values(1,1,1,1),(2,2,2,2),(3,3,3,3),(4,4,4,4),(5,5,5,5);;
replace into hash_partition_int_5 values(11,1,1,1),(12,2,2,2),(13,3,3,3),(14,4,4,4),(15,5,5,5);;
replace into hash_partition_int_5 values(1,1,1,1);;
replace into  values(1,6,6,6);;
ERROR 42000: YAO-5001: You have an error in your SQL syntax; check the manual that corresponds to your YaoBase version for the right syntax 
replace into hash_partition_int_5(c1,c2,c3,c5) values(1,6,6,6);;
ERROR 42S22: YAO-5009: Unknown column name c5
replace into hash_partition_int_5 values(6,6,6,6,6);;
ERROR HY000: YAO-5007: too many value, value num[4], column num[5]
select * from hash_partition_int_5;
c1	c2	c3	c4
1	1	1	1
2	2	2	2
3	3	3	3
4	4	4	4
5	5	5	5
11	1	1	1
12	2	2	2
13	3	3	3
14	4	4	4
15	5	5	5
select * from hash_partition_int_5 where c1=1;
c1	c2	c3	c4
1	1	1	1
select * from hash_partition_int_5 where c1=2;
c1	c2	c3	c4
2	2	2	2
select * from hash_partition_int_5 where c1=3;
c1	c2	c3	c4
3	3	3	3
select * from hash_partition_int_5 where c1=4;
c1	c2	c3	c4
4	4	4	4
select * from hash_partition_int_5 where c1=5;
c1	c2	c3	c4
5	5	5	5
select * from hash_partition_int_5 where c1=6;
c1	c2	c3	c4
select * from hash_partition_int_5 where c1=7;
c1	c2	c3	c4
select * from hash_partition_int_5 where c1=3 and c4=7;
c1	c2	c3	c4
update hash_partition_int_5 set c4=c2+2 where c1=1;
update hash_partition_int_5 set c4=c2+2 where c1=2;
update hash_partition_int_5 set c4=c2+2 where c1=3;
update hash_partition_int_5 set c4=c2+2 where c3=3;
update  set c4=c2+2 where c1=5;
ERROR 42000: YAO-5001: You have an error in your SQL syntax; check the manual that corresponds to your YaoBase version for the right syntax 
update hash_partition_int_5 set c5=c2+2 where c1=4;
ERROR 42S22: YAO-5009: Unknown column name c5
update hash_partition_int_5 set c4=c2+2 where c5=3;
ERROR 42S22: YAO-5009: Unkown column name c5
update hash_partition_int_5 set c4=c2+2 where c1=5 and c4=1;
update hash_partition_int_5 set c4=c2+2 where c1=5 and c4=5;
select * from hash_partition_int_5;
c1	c2	c3	c4
1	1	1	3
2	2	2	4
3	3	3	5
4	4	4	4
5	5	5	7
11	1	1	1
12	2	2	2
13	3	3	5
14	4	4	4
15	5	5	5
select * from hash_partition_int_5 where c1=1;
c1	c2	c3	c4
1	1	1	3
select * from hash_partition_int_5 where c1=2;
c1	c2	c3	c4
2	2	2	4
select * from hash_partition_int_5 where c1=3;
c1	c2	c3	c4
3	3	3	5
select * from hash_partition_int_5 where c1=4;
c1	c2	c3	c4
4	4	4	4
select * from hash_partition_int_5 where c1=5;
c1	c2	c3	c4
5	5	5	7
select * from hash_partition_int_5 where c1=6;
c1	c2	c3	c4
select * from hash_partition_int_5 where c1=7;
c1	c2	c3	c4
select * from hash_partition_int_5 where c1=6 and c4=7;
c1	c2	c3	c4
delete from hash_partition_int_5 where c1=1;
delete from hash_partition_int_5 where c1=2;
delete from hash_partition_int_5 where c1=3;
delete from hash_partition_int_5 where c1=4;
delete from  where condition5;
ERROR 42000: YAO-5001: You have an error in your SQL syntax; check the manual that corresponds to your YaoBase version for the right syntax 
delete from hash_partition_int_5 where c3=3;
delete from hash_partition_int_5 where condition_column_not_exist;
ERROR 42S22: YAO-5009: Unkown column name condition_column_not_exist
select * from hash_partition_int_5;
c1	c2	c3	c4
5	5	5	7
11	1	1	1
12	2	2	2
14	4	4	4
15	5	5	5
drop table if exists hash_partition_int_6;;
create table hash_partition_int_6(c1 int,c2 int,c3 int,c4 int,primary key(c1)) partition by(hash_partition__group_,not_exist_func,c1);;
ERROR HY000: YAO-5077: partition function 'not_exist_func' doesn't exist
create table hash_partition_int_6(c1 int,c2 int,c3 int,c4 int,primary key(c1)) partition by(hash_partition__group_,hash_partition_func_6,c7);;
ERROR 42S22: YAO-5009: partition column 'c7' does not exist in table
create table hash_int_part_table1_012345678901234567890123456789012345678901234567890123456789012345678901234567890123456789012345678901234567890123456789012345678901234567890123456789012345678900123456789123456789012345678901234567890123456789012345678901234567891234560(c1 int,c2 int,c3 int,c4 int,primary key(c1)) partition by(hash_partition__group_,hash_partition_func_6,c1);;
ERROR HY000: YAO-2: table_name is invalid.
create table hash_partition_int_6(c1 int,c2 int,c3 int,c4 int,primary key(c1)) partition by(hash_partition__group_,hash_partition_func_6,c4);;
ERROR HY000: YAO-5081: parameter[c4] is not rowkey
create table hash_partition_int_6(c1 int,c2 int,c3 int,c4 int,primary key(c1)) partition by(hash_partition__group_,hash_partition_func_6,c1);;
create table hash_partition_int_6(c1 int,c2 int,c3 int,c4 int,primary key(c1)) partition by(hash_partition__group_,hash_partition_func_6,c1);;
ERROR 42S01: YAO-5025: table 'hash_partition_int_6' already exists
insert into hash_partition_int_6 values(1,1,1,1),(2,2,2,2),(3,3,3,3),(4,4,4,4),(5,5,5,5);;
insert into hash_partition_int_6 values(1,1,1,1);;
ERROR 23000: YAO-5024: Duplicate entry ' <3012.16>=int32:1' for key 'PRIMARY'
insert into  values(1,6,6,6);;
ERROR 42000: YAO-5001: You have an error in your SQL syntax; check the manual that corresponds to your YaoBase version for the right syntax 
insert into hash_partition_int_6(c1,c2,c3,c5) values(1,6,6,6);;
ERROR 42S22: YAO-5009: Unknown column name c5
insert into hash_partition_int_6 values(6,6,6,6,6);;
ERROR HY000: YAO-5007: too many value, value num[4], column num[5]
replace into hash_partition_int_6 values(1,1,1,1),(2,2,2,2),(3,3,3,3),(4,4,4,4),(5,5,5,5);;
replace into hash_partition_int_6 values(11,1,1,1),(12,2,2,2),(13,3,3,3),(14,4,4,4),(15,5,5,5);;
replace into hash_partition_int_6 values(1,1,1,1);;
replace into  values(1,6,6,6);;
ERROR 42000: YAO-5001: You have an error in your SQL syntax; check the manual that corresponds to your YaoBase version for the right syntax 
replace into hash_partition_int_6(c1,c2,c3,c5) values(1,6,6,6);;
ERROR 42S22: YAO-5009: Unknown column name c5
replace into hash_partition_int_6 values(6,6,6,6,6);;
ERROR HY000: YAO-5007: too many value, value num[4], column num[5]
select * from hash_partition_int_6;
c1	c2	c3	c4
1	1	1	1
2	2	2	2
3	3	3	3
4	4	4	4
5	5	5	5
11	1	1	1
12	2	2	2
13	3	3	3
14	4	4	4
15	5	5	5
select * from hash_partition_int_6 where c1=1;
c1	c2	c3	c4
1	1	1	1
select * from hash_partition_int_6 where c1=2;
c1	c2	c3	c4
2	2	2	2
select * from hash_partition_int_6 where c1=3;
c1	c2	c3	c4
3	3	3	3
select * from hash_partition_int_6 where c1=4;
c1	c2	c3	c4
4	4	4	4
select * from hash_partition_int_6 where c1=5;
c1	c2	c3	c4
5	5	5	5
select * from hash_partition_int_6 where c1=6;
c1	c2	c3	c4
select * from hash_partition_int_6 where c1=7;
c1	c2	c3	c4
select * from hash_partition_int_6 where c1=3 and c4=7;
c1	c2	c3	c4
update hash_partition_int_6 set c4=c2+2 where c1=1;
update hash_partition_int_6 set c4=c2+2 where c1=2;
update hash_partition_int_6 set c4=c2+2 where c1=3;
update hash_partition_int_6 set c4=c2+2 where c3=3;
update  set c4=c2+2 where c1=5;
ERROR 42000: YAO-5001: You have an error in your SQL syntax; check the manual that corresponds to your YaoBase version for the right syntax 
update hash_partition_int_6 set c5=c2+2 where c1=4;
ERROR 42S22: YAO-5009: Unknown column name c5
update hash_partition_int_6 set c4=c2+2 where c5=3;
ERROR 42S22: YAO-5009: Unkown column name c5
update hash_partition_int_6 set c4=c2+2 where c1=5 and c4=1;
update hash_partition_int_6 set c4=c2+2 where c1=5 and c4=5;
select * from hash_partition_int_6;
c1	c2	c3	c4
1	1	1	3
2	2	2	4
3	3	3	5
4	4	4	4
5	5	5	7
11	1	1	1
12	2	2	2
13	3	3	5
14	4	4	4
15	5	5	5
select * from hash_partition_int_6 where c1=1;
c1	c2	c3	c4
1	1	1	3
select * from hash_partition_int_6 where c1=2;
c1	c2	c3	c4
2	2	2	4
select * from hash_partition_int_6 where c1=3;
c1	c2	c3	c4
3	3	3	5
select * from hash_partition_int_6 where c1=4;
c1	c2	c3	c4
4	4	4	4
select * from hash_partition_int_6 where c1=5;
c1	c2	c3	c4
5	5	5	7
select * from hash_partition_int_6 where c1=6;
c1	c2	c3	c4
select * from hash_partition_int_6 where c1=7;
c1	c2	c3	c4
select * from hash_partition_int_6 where c1=6 and c4=7;
c1	c2	c3	c4
delete from hash_partition_int_6 where c1=1;
delete from hash_partition_int_6 where c1=2;
delete from hash_partition_int_6 where c1=3;
delete from hash_partition_int_6 where c1=4;
delete from  where condition5;
ERROR 42000: YAO-5001: You have an error in your SQL syntax; check the manual that corresponds to your YaoBase version for the right syntax 
delete from hash_partition_int_6 where c3=3;
delete from hash_partition_int_6 where condition_column_not_exist;
ERROR 42S22: YAO-5009: Unkown column name condition_column_not_exist
select * from hash_partition_int_6;
c1	c2	c3	c4
5	5	5	7
11	1	1	1
12	2	2	2
14	4	4	4
15	5	5	5
drop table if exists hash_partition_int_7;;
create table hash_partition_int_7(c1 int,c2 int,c3 int,c4 int,primary key(c1)) partition by(hash_partition__group_,not_exist_func,c1);;
ERROR HY000: YAO-5077: partition function 'not_exist_func' doesn't exist
create table hash_partition_int_7(c1 int,c2 int,c3 int,c4 int,primary key(c1)) partition by(hash_partition__group_,hash_partition_func_7,c7);;
ERROR 42S22: YAO-5009: partition column 'c7' does not exist in table
create table hash_int_part_table1_012345678901234567890123456789012345678901234567890123456789012345678901234567890123456789012345678901234567890123456789012345678901234567890123456789012345678900123456789123456789012345678901234567890123456789012345678901234567891234560(c1 int,c2 int,c3 int,c4 int,primary key(c1)) partition by(hash_partition__group_,hash_partition_func_7,c1);;
ERROR HY000: YAO-2: table_name is invalid.
create table hash_partition_int_7(c1 int,c2 int,c3 int,c4 int,primary key(c1)) partition by(hash_partition__group_,hash_partition_func_7,c4);;
ERROR HY000: YAO-5081: parameter[c4] is not rowkey
create table hash_partition_int_7(c1 int,c2 int,c3 int,c4 int,primary key(c1)) partition by(hash_partition__group_,hash_partition_func_7,c1);;
create table hash_partition_int_7(c1 int,c2 int,c3 int,c4 int,primary key(c1)) partition by(hash_partition__group_,hash_partition_func_7,c1);;
ERROR 42S01: YAO-5025: table 'hash_partition_int_7' already exists
insert into hash_partition_int_7 values(1,1,1,1),(2,2,2,2),(3,3,3,3),(4,4,4,4),(5,5,5,5);;
insert into hash_partition_int_7 values(1,1,1,1);;
ERROR 23000: YAO-5024: Duplicate entry ' <3014.16>=int32:1' for key 'PRIMARY'
insert into  values(1,6,6,6);;
ERROR 42000: YAO-5001: You have an error in your SQL syntax; check the manual that corresponds to your YaoBase version for the right syntax 
insert into hash_partition_int_7(c1,c2,c3,c5) values(1,6,6,6);;
ERROR 42S22: YAO-5009: Unknown column name c5
insert into hash_partition_int_7 values(6,6,6,6,6);;
ERROR HY000: YAO-5007: too many value, value num[4], column num[5]
replace into hash_partition_int_7 values(1,1,1,1),(2,2,2,2),(3,3,3,3),(4,4,4,4),(5,5,5,5);;
replace into hash_partition_int_7 values(11,1,1,1),(12,2,2,2),(13,3,3,3),(14,4,4,4),(15,5,5,5);;
replace into hash_partition_int_7 values(1,1,1,1);;
replace into  values(1,6,6,6);;
ERROR 42000: YAO-5001: You have an error in your SQL syntax; check the manual that corresponds to your YaoBase version for the right syntax 
replace into hash_partition_int_7(c1,c2,c3,c5) values(1,6,6,6);;
ERROR 42S22: YAO-5009: Unknown column name c5
replace into hash_partition_int_7 values(6,6,6,6,6);;
ERROR HY000: YAO-5007: too many value, value num[4], column num[5]
select * from hash_partition_int_7;
c1	c2	c3	c4
1	1	1	1
2	2	2	2
3	3	3	3
4	4	4	4
5	5	5	5
11	1	1	1
12	2	2	2
13	3	3	3
14	4	4	4
15	5	5	5
select * from hash_partition_int_7 where c1=1;
c1	c2	c3	c4
1	1	1	1
select * from hash_partition_int_7 where c1=2;
c1	c2	c3	c4
2	2	2	2
select * from hash_partition_int_7 where c1=3;
c1	c2	c3	c4
3	3	3	3
select * from hash_partition_int_7 where c1=4;
c1	c2	c3	c4
4	4	4	4
select * from hash_partition_int_7 where c1=5;
c1	c2	c3	c4
5	5	5	5
select * from hash_partition_int_7 where c1=6;
c1	c2	c3	c4
select * from hash_partition_int_7 where c1=7;
c1	c2	c3	c4
select * from hash_partition_int_7 where c1=3 and c4=7;
c1	c2	c3	c4
update hash_partition_int_7 set c4=c2+2 where c1=1;
update hash_partition_int_7 set c4=c2+2 where c1=2;
update hash_partition_int_7 set c4=c2+2 where c1=3;
update hash_partition_int_7 set c4=c2+2 where c3=3;
update  set c4=c2+2 where c1=5;
ERROR 42000: YAO-5001: You have an error in your SQL syntax; check the manual that corresponds to your YaoBase version for the right syntax 
update hash_partition_int_7 set c5=c2+2 where c1=4;
ERROR 42S22: YAO-5009: Unknown column name c5
update hash_partition_int_7 set c4=c2+2 where c5=3;
ERROR 42S22: YAO-5009: Unkown column name c5
update hash_partition_int_7 set c4=c2+2 where c1=5 and c4=1;
update hash_partition_int_7 set c4=c2+2 where c1=5 and c4=5;
select * from hash_partition_int_7;
c1	c2	c3	c4
1	1	1	3
2	2	2	4
3	3	3	5
4	4	4	4
5	5	5	7
11	1	1	1
12	2	2	2
13	3	3	5
14	4	4	4
15	5	5	5
select * from hash_partition_int_7 where c1=1;
c1	c2	c3	c4
1	1	1	3
select * from hash_partition_int_7 where c1=2;
c1	c2	c3	c4
2	2	2	4
select * from hash_partition_int_7 where c1=3;
c1	c2	c3	c4
3	3	3	5
select * from hash_partition_int_7 where c1=4;
c1	c2	c3	c4
4	4	4	4
select * from hash_partition_int_7 where c1=5;
c1	c2	c3	c4
5	5	5	7
select * from hash_partition_int_7 where c1=6;
c1	c2	c3	c4
select * from hash_partition_int_7 where c1=7;
c1	c2	c3	c4
select * from hash_partition_int_7 where c1=6 and c4=7;
c1	c2	c3	c4
delete from hash_partition_int_7 where c1=1;
delete from hash_partition_int_7 where c1=2;
delete from hash_partition_int_7 where c1=3;
delete from hash_partition_int_7 where c1=4;
delete from  where condition5;
ERROR 42000: YAO-5001: You have an error in your SQL syntax; check the manual that corresponds to your YaoBase version for the right syntax 
delete from hash_partition_int_7 where c3=3;
delete from hash_partition_int_7 where condition_column_not_exist;
ERROR 42S22: YAO-5009: Unkown column name condition_column_not_exist
select * from hash_partition_int_7;
c1	c2	c3	c4
5	5	5	7
11	1	1	1
12	2	2	2
14	4	4	4
15	5	5	5
replace into __all_partition_rules(rule_name,rule_par_num,rule_par_list,rule_body,type)
values
('hash_partition_func_8',3,'x,y,z','(x*y+z)%5',0),
('hash_partition_func_9',3,'x,y,z','(x*y-z)%5',0),
('hash_partition_func_10',3,'x,y,z','((x+y)%z)%5',0),
('hash_partition_func_11',2,'x,y','(x+y)%5',0),
('hash_partition_func_12',2,'x,y','x*y/5%5',0);
create table hash_partition_int_8(c1 int,c2 int,c3 int,c4 int,primary key(c1,c2,c3)) partition by(hash_partition_int_group_8,hash_partition_func_8,c1,c2,c3);;
create table hash_partition_int_8(c1 int,c2 int,c3 int,c4 int,primary key(c1,c2,c3)) partition by(hash_partition_int_group_8,hash_partition_func_8,c1,c2,c3);;
ERROR 42S01: YAO-5025: table 'hash_partition_int_8' already exists
insert into hash_partition_int_8 values(1,1,1,1),(2,2,2,2),(3,3,3,3),(4,4,4,4),(5,5,5,5);;
insert into hash_partition_int_8 values(1,1,1,1);;
ERROR 23000: YAO-5024: Duplicate entry ' <3015.16>=int32:1 <3015.17>=int32:1 <3015.18>=int32:1' for key 'PRIMARY'
insert into  values(1,6,6,6);;
ERROR 42000: YAO-5001: You have an error in your SQL syntax; check the manual that corresponds to your YaoBase version for the right syntax 
insert into hash_partition_int_8(c1,c2,c3,c5) values(1,6,6,6);;
ERROR 42S22: YAO-5009: Unknown column name c5
insert into hash_partition_int_8 values(6,6,6,6,6);;
ERROR HY000: YAO-5007: too many value, value num[4], column num[5]
replace into hash_partition_int_8 values(1,1,1,1),(2,2,2,2),(3,3,3,3),(4,4,4,4),(5,5,5,5);;
replace into hash_partition_int_8 values(11,1,1,1),(12,2,2,2),(13,3,3,3),(14,4,4,4),(15,5,5,5);;
replace into hash_partition_int_8 values(1,1,1,1);;
replace into  values(1,6,6,6);;
ERROR 42000: YAO-5001: You have an error in your SQL syntax; check the manual that corresponds to your YaoBase version for the right syntax 
replace into hash_partition_int_8(c1,c2,c3,c5) values(1,6,6,6);;
ERROR 42S22: YAO-5009: Unknown column name c5
replace into hash_partition_int_8 values(6,6,6,6,6);;
ERROR HY000: YAO-5007: too many value, value num[4], column num[5]
select * from hash_partition_int_8;
c1	c2	c3	c4
1	1	1	1
2	2	2	2
3	3	3	3
4	4	4	4
5	5	5	5
11	1	1	1
12	2	2	2
13	3	3	3
14	4	4	4
15	5	5	5
select * from hash_partition_int_8 where c1=1 and c2=1 and c3=1;
c1	c2	c3	c4
1	1	1	1
select * from hash_partition_int_8 where c1=2 and c2=2 and c3=2;
c1	c2	c3	c4
2	2	2	2
select * from hash_partition_int_8 where c1=3 and c2=3 and c3=3;
c1	c2	c3	c4
3	3	3	3
select * from hash_partition_int_8 where c1=4 and c2=4 and c3=4;
c1	c2	c3	c4
4	4	4	4
select * from hash_partition_int_8 where c1=5 and c2=5 and c3=5;
c1	c2	c3	c4
5	5	5	5
select * from hash_partition_int_8 where c1=6 and c2=6 and c3=6;
c1	c2	c3	c4
select * from hash_partition_int_8 where c1=7 and c2=7 and c3=7;
c1	c2	c3	c4
select * from hash_partition_int_8 where c1=3 and c2=3 and c3=3 and c4=7;
c1	c2	c3	c4
update hash_partition_int_8 set c4=c2+2 where c1=1 and c2=1 and c3=1;
update hash_partition_int_8 set c4=c2+2 where c1=2 and c2=2 and c3=2;
update hash_partition_int_8 set c4=c2+2 where c1=3 and c2=3 and c3=3;
update hash_partition_int_8 set c4=c2+2 where c1=7 and c2=7 and c4=7;
update  set c4=c2+2 where c1=5 and c2=5 and c3=5;
ERROR 42000: YAO-5001: You have an error in your SQL syntax; check the manual that corresponds to your YaoBase version for the right syntax 
update hash_partition_int_8 set c5=c2+2 where c1=4 and c2=4 and c3=4;
ERROR 42S22: YAO-5009: Unknown column name c5
update hash_partition_int_8 set c4=c2+2 where c1=7 and c2=7 and c5=7;
ERROR 42S22: YAO-5009: Unkown column name c5
update hash_partition_int_8 set c4=c2+2 where c1=5 and c2=5 and c3=5 and c4=1;
update hash_partition_int_8 set c4=c2+2 where c1=5 and c2=5 and c3=5 and c4=5;
select * from hash_partition_int_8;
c1	c2	c3	c4
1	1	1	3
2	2	2	4
3	3	3	5
4	4	4	4
5	5	5	7
11	1	1	1
12	2	2	2
13	3	3	3
14	4	4	4
15	5	5	5
select * from hash_partition_int_8 where c1=1 and c2=1 and c3=1;
c1	c2	c3	c4
1	1	1	3
select * from hash_partition_int_8 where c1=2 and c2=2 and c3=2;
c1	c2	c3	c4
2	2	2	4
select * from hash_partition_int_8 where c1=3 and c2=3 and c3=3;
c1	c2	c3	c4
3	3	3	5
select * from hash_partition_int_8 where c1=4 and c2=4 and c3=4;
c1	c2	c3	c4
4	4	4	4
select * from hash_partition_int_8 where c1=5 and c2=5 and c3=5;
c1	c2	c3	c4
5	5	5	7
select * from hash_partition_int_8 where c1=6 and c2=6 and c3=6;
c1	c2	c3	c4
select * from hash_partition_int_8 where c1=7 and c2=7 and c3=7;
c1	c2	c3	c4
select * from hash_partition_int_8 where c1=6 and c2=6 and c3=6 and c4=7;
c1	c2	c3	c4
delete from hash_partition_int_8 where c1=1 and c2=1 and c3=1;
delete from hash_partition_int_8 where c1=2 and c2=2 and c3=2;
delete from hash_partition_int_8 where c1=3 and c2=3 and c3=3;
delete from hash_partition_int_8 where c1=4 and c2=4 and c3=4;
delete from  where c1=5 and c2=5 and c3=5;
ERROR 42000: YAO-5001: You have an error in your SQL syntax; check the manual that corresponds to your YaoBase version for the right syntax 
delete from hash_partition_int_8 where c1=7 and c2=7 and c4=7;
delete from hash_partition_int_8 where condition_column_not_exist;
ERROR 42S22: YAO-5009: Unkown column name condition_column_not_exist
select * from hash_partition_int_8;
c1	c2	c3	c4
5	5	5	7
11	1	1	1
12	2	2	2
13	3	3	3
14	4	4	4
15	5	5	5
create table hash_partition_int_9(c1 int,c2 int,c3 int,c4 int,primary key(c1,c2,c3)) partition by(hash_partition_int_group_9,hash_partition_func_9,c1,c2,c3);;
create table hash_partition_int_9(c1 int,c2 int,c3 int,c4 int,primary key(c1,c2,c3)) partition by(hash_partition_int_group_9,hash_partition_func_9,c1,c2,c3);;
ERROR 42S01: YAO-5025: table 'hash_partition_int_9' already exists
insert into hash_partition_int_9 values(1,1,1,1),(2,2,2,2),(3,3,3,3),(4,4,4,4),(5,5,5,5);;
insert into hash_partition_int_9 values(1,1,1,1);;
ERROR 23000: YAO-5024: Duplicate entry ' <3016.16>=int32:1 <3016.17>=int32:1 <3016.18>=int32:1' for key 'PRIMARY'
insert into  values(1,6,6,6);;
ERROR 42000: YAO-5001: You have an error in your SQL syntax; check the manual that corresponds to your YaoBase version for the right syntax 
insert into hash_partition_int_9(c1,c2,c3,c5) values(1,6,6,6);;
ERROR 42S22: YAO-5009: Unknown column name c5
insert into hash_partition_int_9 values(6,6,6,6,6);;
ERROR HY000: YAO-5007: too many value, value num[4], column num[5]
replace into hash_partition_int_9 values(1,1,1,1),(2,2,2,2),(3,3,3,3),(4,4,4,4),(5,5,5,5);;
replace into hash_partition_int_9 values(11,1,1,1),(12,2,2,2),(13,3,3,3),(14,4,4,4),(15,5,5,5);;
replace into hash_partition_int_9 values(1,1,1,1);;
replace into  values(1,6,6,6);;
ERROR 42000: YAO-5001: You have an error in your SQL syntax; check the manual that corresponds to your YaoBase version for the right syntax 
replace into hash_partition_int_9(c1,c2,c3,c5) values(1,6,6,6);;
ERROR 42S22: YAO-5009: Unknown column name c5
replace into hash_partition_int_9 values(6,6,6,6,6);;
ERROR HY000: YAO-5007: too many value, value num[4], column num[5]
select * from hash_partition_int_9;
c1	c2	c3	c4
1	1	1	1
2	2	2	2
3	3	3	3
4	4	4	4
5	5	5	5
11	1	1	1
12	2	2	2
13	3	3	3
14	4	4	4
15	5	5	5
select * from hash_partition_int_9 where c1=1 and c2=1 and c3=1;
c1	c2	c3	c4
1	1	1	1
select * from hash_partition_int_9 where c1=2 and c2=2 and c3=2;
c1	c2	c3	c4
2	2	2	2
select * from hash_partition_int_9 where c1=3 and c2=3 and c3=3;
c1	c2	c3	c4
3	3	3	3
select * from hash_partition_int_9 where c1=4 and c2=4 and c3=4;
c1	c2	c3	c4
4	4	4	4
select * from hash_partition_int_9 where c1=5 and c2=5 and c3=5;
c1	c2	c3	c4
5	5	5	5
select * from hash_partition_int_9 where c1=6 and c2=6 and c3=6;
c1	c2	c3	c4
select * from hash_partition_int_9 where c1=7 and c2=7 and c3=7;
c1	c2	c3	c4
select * from hash_partition_int_9 where c1=3 and c2=3 and c3=3 and c4=7;
c1	c2	c3	c4
update hash_partition_int_9 set c4=c2+2 where c1=1 and c2=1 and c3=1;
update hash_partition_int_9 set c4=c2+2 where c1=2 and c2=2 and c3=2;
update hash_partition_int_9 set c4=c2+2 where c1=3 and c2=3 and c3=3;
update hash_partition_int_9 set c4=c2+2 where c1=7 and c2=7 and c4=7;
update  set c4=c2+2 where c1=5 and c2=5 and c3=5;
ERROR 42000: YAO-5001: You have an error in your SQL syntax; check the manual that corresponds to your YaoBase version for the right syntax 
update hash_partition_int_9 set c5=c2+2 where c1=4 and c2=4 and c3=4;
ERROR 42S22: YAO-5009: Unknown column name c5
update hash_partition_int_9 set c4=c2+2 where c1=7 and c2=7 and c5=7;
ERROR 42S22: YAO-5009: Unkown column name c5
update hash_partition_int_9 set c4=c2+2 where c1=5 and c2=5 and c3=5 and c4=1;
update hash_partition_int_9 set c4=c2+2 where c1=5 and c2=5 and c3=5 and c4=5;
select * from hash_partition_int_9;
c1	c2	c3	c4
1	1	1	3
2	2	2	4
3	3	3	5
4	4	4	4
5	5	5	7
11	1	1	1
12	2	2	2
13	3	3	3
14	4	4	4
15	5	5	5
select * from hash_partition_int_9 where c1=1 and c2=1 and c3=1;
c1	c2	c3	c4
1	1	1	3
select * from hash_partition_int_9 where c1=2 and c2=2 and c3=2;
c1	c2	c3	c4
2	2	2	4
select * from hash_partition_int_9 where c1=3 and c2=3 and c3=3;
c1	c2	c3	c4
3	3	3	5
select * from hash_partition_int_9 where c1=4 and c2=4 and c3=4;
c1	c2	c3	c4
4	4	4	4
select * from hash_partition_int_9 where c1=5 and c2=5 and c3=5;
c1	c2	c3	c4
5	5	5	7
select * from hash_partition_int_9 where c1=6 and c2=6 and c3=6;
c1	c2	c3	c4
select * from hash_partition_int_9 where c1=7 and c2=7 and c3=7;
c1	c2	c3	c4
select * from hash_partition_int_9 where c1=6 and c2=6 and c3=6 and c4=7;
c1	c2	c3	c4
delete from hash_partition_int_9 where c1=1 and c2=1 and c3=1;
delete from hash_partition_int_9 where c1=2 and c2=2 and c3=2;
delete from hash_partition_int_9 where c1=3 and c2=3 and c3=3;
delete from hash_partition_int_9 where c1=4 and c2=4 and c3=4;
delete from  where c1=5 and c2=5 and c3=5;
ERROR 42000: YAO-5001: You have an error in your SQL syntax; check the manual that corresponds to your YaoBase version for the right syntax 
delete from hash_partition_int_9 where c1=7 and c2=7 and c4=7;
delete from hash_partition_int_9 where condition_column_not_exist;
ERROR 42S22: YAO-5009: Unkown column name condition_column_not_exist
select * from hash_partition_int_9;
c1	c2	c3	c4
5	5	5	7
11	1	1	1
12	2	2	2
13	3	3	3
14	4	4	4
15	5	5	5
create table hash_partition_int_10(c1 int,c2 int,c3 int,c4 int,primary key(c1,c2,c3)) partition by(hash_partition_int_group_10,hash_partition_func_10,c1,c2,c3);;
create table hash_partition_int_10(c1 int,c2 int,c3 int,c4 int,primary key(c1,c2,c3)) partition by(hash_partition_int_group_10,hash_partition_func_10,c1,c2,c3);;
ERROR 42S01: YAO-5025: table 'hash_partition_int_10' already exists
insert into hash_partition_int_10 values(1,1,1,1),(2,2,2,2),(3,3,3,3),(4,4,4,4),(5,5,5,5);;
insert into hash_partition_int_10 values(1,1,1,1);;
ERROR 23000: YAO-5024: Duplicate entry ' <3017.16>=int32:1 <3017.17>=int32:1 <3017.18>=int32:1' for key 'PRIMARY'
insert into  values(1,6,6,6);;
ERROR 42000: YAO-5001: You have an error in your SQL syntax; check the manual that corresponds to your YaoBase version for the right syntax 
insert into hash_partition_int_10(c1,c2,c3,c5) values(1,6,6,6);;
ERROR 42S22: YAO-5009: Unknown column name c5
insert into hash_partition_int_10 values(6,6,6,6,6);;
ERROR HY000: YAO-5007: too many value, value num[4], column num[5]
replace into hash_partition_int_10 values(1,1,1,1),(2,2,2,2),(3,3,3,3),(4,4,4,4),(5,5,5,5);;
replace into hash_partition_int_10 values(11,1,1,1),(12,2,2,2),(13,3,3,3),(14,4,4,4),(15,5,5,5);;
replace into hash_partition_int_10 values(1,1,1,1);;
replace into  values(1,6,6,6);;
ERROR 42000: YAO-5001: You have an error in your SQL syntax; check the manual that corresponds to your YaoBase version for the right syntax 
replace into hash_partition_int_10(c1,c2,c3,c5) values(1,6,6,6);;
ERROR 42S22: YAO-5009: Unknown column name c5
replace into hash_partition_int_10 values(6,6,6,6,6);;
ERROR HY000: YAO-5007: too many value, value num[4], column num[5]
select * from hash_partition_int_10;
c1	c2	c3	c4
1	1	1	1
2	2	2	2
3	3	3	3
4	4	4	4
5	5	5	5
11	1	1	1
12	2	2	2
13	3	3	3
14	4	4	4
15	5	5	5
select * from hash_partition_int_10 where c1=1 and c2=1 and c3=1;
c1	c2	c3	c4
1	1	1	1
select * from hash_partition_int_10 where c1=2 and c2=2 and c3=2;
c1	c2	c3	c4
2	2	2	2
select * from hash_partition_int_10 where c1=3 and c2=3 and c3=3;
c1	c2	c3	c4
3	3	3	3
select * from hash_partition_int_10 where c1=4 and c2=4 and c3=4;
c1	c2	c3	c4
4	4	4	4
select * from hash_partition_int_10 where c1=5 and c2=5 and c3=5;
c1	c2	c3	c4
5	5	5	5
select * from hash_partition_int_10 where c1=6 and c2=6 and c3=6;
c1	c2	c3	c4
select * from hash_partition_int_10 where c1=7 and c2=7 and c3=7;
c1	c2	c3	c4
select * from hash_partition_int_10 where c1=3 and c2=3 and c3=3 and c4=7;
c1	c2	c3	c4
update hash_partition_int_10 set c4=c2+2 where c1=1 and c2=1 and c3=1;
update hash_partition_int_10 set c4=c2+2 where c1=2 and c2=2 and c3=2;
update hash_partition_int_10 set c4=c2+2 where c1=3 and c2=3 and c3=3;
update hash_partition_int_10 set c4=c2+2 where c1=7 and c2=7 and c4=7;
update  set c4=c2+2 where c1=5 and c2=5 and c3=5;
ERROR 42000: YAO-5001: You have an error in your SQL syntax; check the manual that corresponds to your YaoBase version for the right syntax 
update hash_partition_int_10 set c5=c2+2 where c1=4 and c2=4 and c3=4;
ERROR 42S22: YAO-5009: Unknown column name c5
update hash_partition_int_10 set c4=c2+2 where c1=7 and c2=7 and c5=7;
ERROR 42S22: YAO-5009: Unkown column name c5
update hash_partition_int_10 set c4=c2+2 where c1=5 and c2=5 and c3=5 and c4=1;
update hash_partition_int_10 set c4=c2+2 where c1=5 and c2=5 and c3=5 and c4=5;
select * from hash_partition_int_10;
c1	c2	c3	c4
1	1	1	3
2	2	2	4
3	3	3	5
4	4	4	4
5	5	5	7
11	1	1	1
12	2	2	2
13	3	3	3
14	4	4	4
15	5	5	5
select * from hash_partition_int_10 where c1=1 and c2=1 and c3=1;
c1	c2	c3	c4
1	1	1	3
select * from hash_partition_int_10 where c1=2 and c2=2 and c3=2;
c1	c2	c3	c4
2	2	2	4
select * from hash_partition_int_10 where c1=3 and c2=3 and c3=3;
c1	c2	c3	c4
3	3	3	5
select * from hash_partition_int_10 where c1=4 and c2=4 and c3=4;
c1	c2	c3	c4
4	4	4	4
select * from hash_partition_int_10 where c1=5 and c2=5 and c3=5;
c1	c2	c3	c4
5	5	5	7
select * from hash_partition_int_10 where c1=6 and c2=6 and c3=6;
c1	c2	c3	c4
select * from hash_partition_int_10 where c1=7 and c2=7 and c3=7;
c1	c2	c3	c4
select * from hash_partition_int_10 where c1=6 and c2=6 and c3=6 and c4=7;
c1	c2	c3	c4
delete from hash_partition_int_10 where c1=1 and c2=1 and c3=1;
delete from hash_partition_int_10 where c1=2 and c2=2 and c3=2;
delete from hash_partition_int_10 where c1=3 and c2=3 and c3=3;
delete from hash_partition_int_10 where c1=4 and c2=4 and c3=4;
delete from  where c1=5 and c2=5 and c3=5;
ERROR 42000: YAO-5001: You have an error in your SQL syntax; check the manual that corresponds to your YaoBase version for the right syntax 
delete from hash_partition_int_10 where c1=7 and c2=7 and c4=7;
delete from hash_partition_int_10 where condition_column_not_exist;
ERROR 42S22: YAO-5009: Unkown column name condition_column_not_exist
select * from hash_partition_int_10;
c1	c2	c3	c4
5	5	5	7
11	1	1	1
12	2	2	2
13	3	3	3
14	4	4	4
15	5	5	5
create table hash_partition_int_11(c1 int,c2 int,c3 int,c4 int,primary key(c1,c2)) partition by(hash_partition_int_group_11,hash_partition_func_11,c1,c2);;
create table hash_partition_int_11(c1 int,c2 int,c3 int,c4 int,primary key(c1,c2)) partition by(hash_partition_int_group_11,hash_partition_func_11,c1,c2);;
ERROR 42S01: YAO-5025: table 'hash_partition_int_11' already exists
insert into hash_partition_int_11 values(1,1,1,1),(2,2,2,2),(3,3,3,3),(4,4,4,4),(5,5,5,5);;
insert into hash_partition_int_11 values(1,1,1,1);;
ERROR 23000: YAO-5024: Duplicate entry ' <3018.16>=int32:1 <3018.17>=int32:1' for key 'PRIMARY'
insert into  values(1,6,6,6);;
ERROR 42000: YAO-5001: You have an error in your SQL syntax; check the manual that corresponds to your YaoBase version for the right syntax 
insert into hash_partition_int_11(c1,c2,c3,c5) values(1,6,6,6);;
ERROR 42S22: YAO-5009: Unknown column name c5
insert into hash_partition_int_11 values(6,6,6,6,6);;
ERROR HY000: YAO-5007: too many value, value num[4], column num[5]
replace into hash_partition_int_11 values(1,1,1,1),(2,2,2,2),(3,3,3,3),(4,4,4,4),(5,5,5,5);;
replace into hash_partition_int_11 values(11,1,1,1),(12,2,2,2),(13,3,3,3),(14,4,4,4),(15,5,5,5);;
replace into hash_partition_int_11 values(1,1,1,1);;
replace into  values(1,6,6,6);;
ERROR 42000: YAO-5001: You have an error in your SQL syntax; check the manual that corresponds to your YaoBase version for the right syntax 
replace into hash_partition_int_11(c1,c2,c3,c5) values(1,6,6,6);;
ERROR 42S22: YAO-5009: Unknown column name c5
replace into hash_partition_int_11 values(6,6,6,6,6);;
ERROR HY000: YAO-5007: too many value, value num[4], column num[5]
select * from hash_partition_int_11;
c1	c2	c3	c4
1	1	1	1
2	2	2	2
3	3	3	3
4	4	4	4
5	5	5	5
11	1	1	1
12	2	2	2
13	3	3	3
14	4	4	4
15	5	5	5
select * from hash_partition_int_11 where c1=1 and c2=1 and c3=1;
c1	c2	c3	c4
1	1	1	1
select * from hash_partition_int_11 where c1=2 and c2=2 and c3=2;
c1	c2	c3	c4
2	2	2	2
select * from hash_partition_int_11 where c1=3 and c2=3 and c3=3;
c1	c2	c3	c4
3	3	3	3
select * from hash_partition_int_11 where c1=4 and c2=4 and c3=4;
c1	c2	c3	c4
4	4	4	4
select * from hash_partition_int_11 where c1=5 and c2=5 and c3=5;
c1	c2	c3	c4
5	5	5	5
select * from hash_partition_int_11 where c1=6 and c2=6 and c3=6;
c1	c2	c3	c4
select * from hash_partition_int_11 where c1=7 and c2=7 and c3=7;
c1	c2	c3	c4
select * from hash_partition_int_11 where c1=3 and c2=3 and c3=3 and c4=7;
c1	c2	c3	c4
update hash_partition_int_11 set c4=c2+2 where c1=1 and c2=1 and c3=1;
update hash_partition_int_11 set c4=c2+2 where c1=2 and c2=2 and c3=2;
update hash_partition_int_11 set c4=c2+2 where c1=3 and c2=3 and c3=3;
update hash_partition_int_11 set c4=c2+2 where c1=7 and c2=7 and c4=7;
update  set c4=c2+2 where c1=5 and c2=5 and c3=5;
ERROR 42000: YAO-5001: You have an error in your SQL syntax; check the manual that corresponds to your YaoBase version for the right syntax 
update hash_partition_int_11 set c5=c2+2 where c1=4 and c2=4 and c3=4;
ERROR 42S22: YAO-5009: Unknown column name c5
update hash_partition_int_11 set c4=c2+2 where c1=7 and c2=7 and c5=7;
ERROR 42S22: YAO-5009: Unkown column name c5
update hash_partition_int_11 set c4=c2+2 where c1=5 and c2=5 and c3=5 and c4=1;
update hash_partition_int_11 set c4=c2+2 where c1=5 and c2=5 and c3=5 and c4=5;
select * from hash_partition_int_11;
c1	c2	c3	c4
1	1	1	3
2	2	2	4
3	3	3	5
4	4	4	4
5	5	5	7
11	1	1	1
12	2	2	2
13	3	3	3
14	4	4	4
15	5	5	5
select * from hash_partition_int_11 where c1=1 and c2=1 and c3=1;
c1	c2	c3	c4
1	1	1	3
select * from hash_partition_int_11 where c1=2 and c2=2 and c3=2;
c1	c2	c3	c4
2	2	2	4
select * from hash_partition_int_11 where c1=3 and c2=3 and c3=3;
c1	c2	c3	c4
3	3	3	5
select * from hash_partition_int_11 where c1=4 and c2=4 and c3=4;
c1	c2	c3	c4
4	4	4	4
select * from hash_partition_int_11 where c1=5 and c2=5 and c3=5;
c1	c2	c3	c4
5	5	5	7
select * from hash_partition_int_11 where c1=6 and c2=6 and c3=6;
c1	c2	c3	c4
select * from hash_partition_int_11 where c1=7 and c2=7 and c3=7;
c1	c2	c3	c4
select * from hash_partition_int_11 where c1=6 and c2=6 and c3=6 and c4=7;
c1	c2	c3	c4
delete from hash_partition_int_11 where c1=1 and c2=1 and c3=1;
delete from hash_partition_int_11 where c1=2 and c2=2 and c3=2;
delete from hash_partition_int_11 where c1=3 and c2=3 and c3=3;
delete from hash_partition_int_11 where c1=4 and c2=4 and c3=4;
delete from  where condition5;
ERROR 42000: YAO-5001: You have an error in your SQL syntax; check the manual that corresponds to your YaoBase version for the right syntax 
delete from hash_partition_int_11 where c1=7 and c2=7 and c4=7;
delete from hash_partition_int_11 where condition_column_not_exist;
ERROR 42S22: YAO-5009: Unkown column name condition_column_not_exist
select * from hash_partition_int_11;
c1	c2	c3	c4
5	5	5	7
11	1	1	1
12	2	2	2
13	3	3	3
14	4	4	4
15	5	5	5
create table hash_partition_int_12(c1 int,c2 int,c3 int,c4 int,primary key(c1,c2)) partition by(hash_partition_int_group_12,hash_partition_func_12,c1,c2);;
create table hash_partition_int_12(c1 int,c2 int,c3 int,c4 int,primary key(c1,c2)) partition by(hash_partition_int_group_12,hash_partition_func_12,c1,c2);;
ERROR 42S01: YAO-5025: table 'hash_partition_int_12' already exists
insert into hash_partition_int_12 values(1,1,1,1),(2,2,2,2),(3,3,3,3),(4,4,4,4),(5,5,5,5);;
insert into hash_partition_int_12 values(1,1,1,1);;
ERROR 23000: YAO-5024: Duplicate entry ' <3019.16>=int32:1 <3019.17>=int32:1' for key 'PRIMARY'
insert into  values(1,6,6,6);;
ERROR 42000: YAO-5001: You have an error in your SQL syntax; check the manual that corresponds to your YaoBase version for the right syntax 
insert into hash_partition_int_12(c1,c2,c3,c5) values(1,6,6,6);;
ERROR 42S22: YAO-5009: Unknown column name c5
insert into hash_partition_int_12 values(6,6,6,6,6);;
ERROR HY000: YAO-5007: too many value, value num[4], column num[5]
replace into hash_partition_int_12 values(1,1,1,1),(2,2,2,2),(3,3,3,3),(4,4,4,4),(5,5,5,5);;
replace into hash_partition_int_12 values(11,1,1,1),(12,2,2,2),(13,3,3,3),(14,4,4,4),(15,5,5,5);;
replace into hash_partition_int_12 values(1,1,1,1);;
replace into  values(1,6,6,6);;
ERROR 42000: YAO-5001: You have an error in your SQL syntax; check the manual that corresponds to your YaoBase version for the right syntax 
replace into hash_partition_int_12(c1,c2,c3,c5) values(1,6,6,6);;
ERROR 42S22: YAO-5009: Unknown column name c5
replace into hash_partition_int_12 values(6,6,6,6,6);;
ERROR HY000: YAO-5007: too many value, value num[4], column num[5]
select * from hash_partition_int_12;
c1	c2	c3	c4
1	1	1	1
2	2	2	2
3	3	3	3
4	4	4	4
5	5	5	5
11	1	1	1
12	2	2	2
13	3	3	3
14	4	4	4
15	5	5	5
select * from hash_partition_int_12 where c1=1 and c2=1 and c3=1;
c1	c2	c3	c4
1	1	1	1
select * from hash_partition_int_12 where c1=2 and c2=2 and c3=2;
c1	c2	c3	c4
2	2	2	2
select * from hash_partition_int_12 where c1=3 and c2=3 and c3=3;
c1	c2	c3	c4
3	3	3	3
select * from hash_partition_int_12 where c1=4 and c2=4 and c3=4;
c1	c2	c3	c4
4	4	4	4
select * from hash_partition_int_12 where c1=5 and c2=5 and c3=5;
c1	c2	c3	c4
5	5	5	5
select * from hash_partition_int_12 where c1=6 and c2=6 and c3=6;
c1	c2	c3	c4
select * from hash_partition_int_12 where c1=7 and c2=7 and c3=7;
c1	c2	c3	c4
select * from hash_partition_int_12 where c1=3 and c2=3 and c3=3 and c4=7;
c1	c2	c3	c4
update hash_partition_int_12 set c4=c2+2 where c1=1 and c2=1 and c3=1;
update hash_partition_int_12 set c4=c2+2 where c1=2 and c2=2 and c3=2;
update hash_partition_int_12 set c4=c2+2 where c1=3 and c2=3 and c3=3;
update hash_partition_int_12 set c4=c2+2 where c1=7 and c2=7 and c4=7;
update  set c4=c2+2 where c1=5 and c2=5 and c3=5;
ERROR 42000: YAO-5001: You have an error in your SQL syntax; check the manual that corresponds to your YaoBase version for the right syntax 
update hash_partition_int_12 set c5=c2+2 where c1=4 and c2=4 and c3=4;
ERROR 42S22: YAO-5009: Unknown column name c5
update hash_partition_int_12 set c4=c2+2 where c1=7 and c2=7 and c5=7;
ERROR 42S22: YAO-5009: Unkown column name c5
update hash_partition_int_12 set c4=c2+2 where c1=5 and c2=5 and c3=5 and c4=1;
update hash_partition_int_12 set c4=c2+2 where c1=5 and c2=5 and c3=5 and c4=5;
select * from hash_partition_int_12;
c1	c2	c3	c4
1	1	1	3
2	2	2	4
3	3	3	5
4	4	4	4
5	5	5	7
11	1	1	1
12	2	2	2
13	3	3	3
14	4	4	4
15	5	5	5
select * from hash_partition_int_12 where c1=1 and c2=1 and c3=1;
c1	c2	c3	c4
1	1	1	3
select * from hash_partition_int_12 where c1=2 and c2=2 and c3=2;
c1	c2	c3	c4
2	2	2	4
select * from hash_partition_int_12 where c1=3 and c2=3 and c3=3;
c1	c2	c3	c4
3	3	3	5
select * from hash_partition_int_12 where c1=4 and c2=4 and c3=4;
c1	c2	c3	c4
4	4	4	4
select * from hash_partition_int_12 where c1=5 and c2=5 and c3=5;
c1	c2	c3	c4
5	5	5	7
select * from hash_partition_int_12 where c1=6 and c2=6 and c3=6;
c1	c2	c3	c4
select * from hash_partition_int_12 where c1=7 and c2=7 and c3=7;
c1	c2	c3	c4
select * from hash_partition_int_12 where c1=6 and c2=6 and c3=6 and c4=7;
c1	c2	c3	c4
delete from hash_partition_int_12 where c1=1 and c2=1 and c3=1;
delete from hash_partition_int_12 where c1=2 and c2=2 and c3=2;
delete from hash_partition_int_12 where c1=3 and c2=3 and c3=3;
delete from hash_partition_int_12 where c1=4 and c2=4 and c3=4;
delete from  where condition5;
ERROR 42000: YAO-5001: You have an error in your SQL syntax; check the manual that corresponds to your YaoBase version for the right syntax 
delete from hash_partition_int_12 where c1=7 and c2=7 and c4=7;
delete from hash_partition_int_12 where condition_column_not_exist;
ERROR 42S22: YAO-5009: Unkown column name condition_column_not_exist
select * from hash_partition_int_12;
c1	c2	c3	c4
5	5	5	7
11	1	1	1
12	2	2	2
13	3	3	3
14	4	4	4
15	5	5	5
