drop table if exists t1,t2,t3,t4;
drop partition function h1;
ERROR HY000: YAO-5077: partition function 'h1' doesn't exist
create hash partition function h1(x)'x+4';
create table t1(pk int primary key,extra int) partition by (ta1,h1,pk);
insert into t1(pk) values(1),(2);
select * from t1;
pk	extra
1	NULL
2	NULL
insert into t1(pk,extra) values(3,null),(4,null);
select * from t1;
pk	extra
1	NULL
2	NULL
3	NULL
4	NULL
insert into t1(pk,extra) values(null,null);
select * from t1;
pk	extra
1	NULL
2	NULL
3	NULL
4	NULL
NULL	NULL
select * from t1 where extra =null;
pk	extra
select * from t1 where extra !=null;
pk	extra
select * from t1 where extra is null;
pk	extra
1	NULL
2	NULL
3	NULL
4	NULL
NULL	NULL
select * from t1 where extra is not null;
pk	extra
select * from t1 where pk is null;
pk	extra
NULL	NULL
select * from t1 where pk =null;
pk	extra
select * from t1 where pk !=null;
pk	extra
select * from t1 where pk is not null;
pk	extra
1	NULL
2	NULL
3	NULL
4	NULL
select * from t1 where pk in (null);
pk	extra
select * from t1 where pk in (null,1);
pk	extra
1	NULL
select * from t1 where null > null;
pk	extra
select * from t1 where null < null;
pk	extra
select * from t1 where null = null;
pk	extra
select * from t1 where null > 1;
pk	extra
select * from t1 where null < 1;
pk	extra
select * from t1 where null is null;
pk	extra
1	NULL
2	NULL
3	NULL
4	NULL
NULL	NULL
update t1 set extra=1 where pk =null;
select * from t1;
pk	extra
1	NULL
2	NULL
3	NULL
4	NULL
NULL	NULL
update t1 set extra=1 where pk !=null;
update t1 set extra=1 where pk is null;
update t1 set extra=1 where pk is not null;
delete from t1 where pk =null;
select * from t1;
pk	extra
1	1
2	1
3	1
4	1
NULL	1
delete from t1 where pk is null;
delete from t1 where pk is not null;
delete from t1 where pk !=null;
set autocommit=0;
select * from t1;
pk	extra
insert into t1 values (5,null);
insert into t1 values (null,null);
select * from t1 where extra is null and pk=5 for update;
ERROR HY000: YAO-5049: Exclusive lock conflict 'int32:5' for key 'PRIMARY'
select * from t1 where extra is null and pk is null for update;
pk	extra
commit;
select * from t1 where extra is null and pk=5 for update;
pk	extra
5	NULL
select * from t1 where extra is not null and pk=5 for update;
pk	extra
select * from t1 where extra is null and pk is null for update;
pk	extra
NULL	NULL
select * from t1 where extra is not null and pk is not null for update;
pk	extra
set autocommit=1;
