create table t1(c1 int, c2 int);
create table t2(c1 int, c2 int);
insert into t1 values(1, unix_timestamp(990909));
insert into t1 values(2, unix_timestamp(910909));
insert into t2 values(1, unix_timestamp(990909));
alter table t1 add c3 int;
update t1 set c3=980909;
select unix_timestamp(null);
unix_timestamp(null)
NULL
select unix_timestamp();
unix_timestamp()
1700467530
select unix_timestamp(19990909,19990909);
ERROR HY000: YAO-5054: Param num of function 'unix_timestamp' can be less than 2, ret=-5054
select unix_timestamp(9999);
unix_timestamp(9999)
0
select unix_timestamp(19990909080808);
unix_timestamp(19990909080808)
936835688
select unix_timestamp('');
unix_timestamp('')
0
select unix_timestamp('99-09-09');
unix_timestamp('99-09-09')
936806400
select unix_timestamp('1999-09-09');
unix_timestamp('1999-09-09')
936806400
select unix_timestamp('1999-13-01');
unix_timestamp('1999-13-01')
0
select unix_timestamp('1999/09/09');
unix_timestamp('1999/09/09')
936806400
select unix_timestamp('990909.08');
unix_timestamp('990909.08')
936835200
select unix_timestamp(convert(19990909.9, float));
unix_timestamp(convert(19990909.9, float))
936892800
select unix_timestamp(true);
unix_timestamp(true)
0
select unix_timestamp(to_timestamp('1999-09-09 08:08:08','yyyy-mm-dd hh:mm:ss'));
unix_timestamp(to_timestamp('1999-09-09 08:08:08','yyyy-mm-dd hh:mm:ss'))
936835688
select unix_timestamp(now());
unix_timestamp(now())
1700467530.153995
select unix_timestamp(to_date('1999-09-09','yyyy-mm-dd'));
unix_timestamp(to_date('1999-09-09','yyyy-mm-dd'))
936806400
select unix_timestamp(current_time());
unix_timestamp(current_time())
1700467530
select unix_timestamp(19990909.1234567);
unix_timestamp(19990909.1234567)
936806400
select unix_timestamp(19990909.12345678910);
unix_timestamp(19990909.12345678910)
936806400
select unix_timestamp(1.2345e3);
unix_timestamp(1.2345e3)
0
update t1 set c1=3 where c2=unix_timestamp(990909);
update t1 set c2=unix_timestamp(980909) where c1=3;
select c1, c2 from t1 where c2=unix_timestamp(980909);
c1	c2
3	905270400
select c1,c2 from t1 having c2=unix_timestamp(980909);
c1	c2
3	905270400
select unix_timestamp(c1),c2 from t1 order by c1 desc;
unix_timestamp(c1)	c2
0	905270400
0	684342000
insert into t1 values(4, unix_timestamp(970909), 120909);
delete from t1 where c2=unix_timestamp(970909);
(select c1,unix_timestamp(c1),c2 from t1 where c1=2) union (select c1,unix_timestamp(c1),c2 from t1 where c1=3);
c1	unix_timestamp(c1)	c2
2	0	684342000
3	0	905270400
select c1,c2 from t1 where c2 between unix_timestamp(970808) and unix_timestamp(991010);
c1	c2
3	905270400
select unix_timestamp(unix_timestamp(990909));
unix_timestamp(unix_timestamp(990909))
0
select length('yaobase_test'),unix_timestamp(length('yaobase_test'));
length('yaobase_test')	unix_timestamp(length('yaobase_test'))
12	0
select round(1234.567,1),unix_timestamp(round(1234.567,1));
round(1234.567,1)	unix_timestamp(round(1234.567,1))
1234.6	0
select ceil(990909.99),unix_timestamp(ceil(990909.99));
ceil(990909.99)	unix_timestamp(ceil(990909.99))
990910	936892800
select floor(990909.99),unix_timestamp(floor(990909.99));
floor(990909.99)	unix_timestamp(floor(990909.99))
990909	936806400
select c1+c3, unix_timestamp(c1+c3) from t1;
c1+c3	unix_timestamp(c1+c3)
980912	905529600
980911	905443200
select c3-c1,unix_timestamp(c3-c1) from t1;
c3-c1	unix_timestamp(c3-c1)
980906	905011200
980907	905097600
select c3*(c1/c1),unix_timestamp(c3*(c1/c1)) from t1;
c3*(c1/c1)	unix_timestamp(c3*(c1/c1))
980909	905270400
980909	905270400
select c3/(c1/c1),unix_timestamp(c3/(c1/c1)) from t1;
c3/(c1/c1)	unix_timestamp(c3/(c1/c1))
980909	905270400
980909	905270400
select c3%(c1/c1),unix_timestamp(c3%(c1/c1)) from t1;
c3%(c1/c1)	unix_timestamp(c3%(c1/c1))
0	0
0	0
select c3*(c1-1),unix_timestamp(c3*(c1-2)) from t1;
c3*(c1-1)	unix_timestamp(c3*(c1-2))
1961818	905270400
980909	0
select c1, c2 from t1 where c2 in (unix_timestamp(980909));
c1	c2
3	905270400
select tb1.c1,tb2.c2, unix_timestamp(t1.c3) from t1 as tb1, t1 as tb2 where tb1.c1<tb2.c1;
c1	c2	unix_timestamp(t1.c3)
2	905270400	905270400
drop table if exists t1,t2;
create table t1(c1 date,c2 time,c3 datetime,c4 timestamp);
create table t2(c1 int,c2 int,c3 int);
create table t3(c1 int,c2 int,c3 int);
insert into t1 values('2015-07-07','00:00:15','2015-07-07 00:00:15','2015-07-07 00:00:15.000000'),('2017-07-07','00:50:15','2017-07-07 00:50:15','2017-07-07 00:50:15.000000'),('2023-07-07','09:50:15','2017-07-07 09:50:15','2017-07-07 09:50:15.000000');
insert into t2 values(1,100,21),(2,200,31),(3,300,41),(5,500,51);
insert into t3 values(1,100,21),(2,200,31),(3,300,41),(6,600,61);
select time_to_sec('2023-10');
time_to_sec('2023-10')
1223
select time_to_sec('2023-1-28');
time_to_sec('2023-1-28')
1223
select time_to_sec('2023-10-10 12');
time_to_sec('2023-10-10 12')
43200
select time_to_sec('2023-10-10 12-43');
time_to_sec('2023-10-10 12-43')
45780
select time_to_sec('2020-02-29 11:11:11.123456567');
time_to_sec('2020-02-29 11:11:11.123456567')
40271
select time_to_sec('2021-02-29 11:11:11.123456');
time_to_sec('2021-02-29 11:11:11.123456')
NULL
select time_to_sec('2023-07-24 09:14:20');
time_to_sec('2023-07-24 09:14:20')
33260
select time_to_sec('2023-13-24 09:14:20.123456');
time_to_sec('2023-13-24 09:14:20.123456')
NULL
select time_to_sec('2023-07-24 09:60:20.123456');
time_to_sec('2023-07-24 09:60:20.123456')
NULL
select time_to_sec('00:39:38');
time_to_sec('00:39:38')
2378
select time_to_sec('900:00:00');
time_to_sec('900:00:00')
NULL
select time_to_sec('12:34:56 PM');
time_to_sec('12:34:56 PM')
45296
select time_to_sec('2023/07/11 12:34:56');
time_to_sec('2023/07/11 12:34:56')
NULL
select time_to_sec(null);
time_to_sec(null)
NULL
select time_to_sec('abc');
time_to_sec('abc')
0
select time_to_sec(true);
time_to_sec(true)
1
select time_to_sec(false);
time_to_sec(false)
0
select time_to_sec(cast('2023-09-01 12:12:12'as datetime));
time_to_sec(cast('2023-09-01 12:12:12'as datetime))
43932
select time_to_sec(cast('2023-07-24 09:14:20.123456'as datetime));
time_to_sec(cast('2023-07-24 09:14:20.123456'as datetime))
33260
select time_to_sec(cast('2023-13-24 09:14:20.123456'as datetime));
time_to_sec(cast('2023-13-24 09:14:20.123456'as datetime))
NULL
select time_to_sec(cast('2023-09-24 24:14:20.123456'as datetime));
time_to_sec(cast('2023-09-24 24:14:20.123456'as datetime))
NULL
select time_to_sec(cast('2023-07-24'as date));
time_to_sec(cast('2023-07-24'as date))
0
select time_to_sec(cast('11:11:11'as time));
time_to_sec(cast('11:11:11'as time))
40271
select time_to_sec(0);
time_to_sec(0)
0
select time_to_sec(-11);
time_to_sec(-11)
-11
select time_to_sec(61);
time_to_sec(61)
NULL
select time_to_sec(101);
time_to_sec(101)
61
select time_to_sec(-1111);
time_to_sec(-1111)
-671
select time_to_sec(-98765432111111);
time_to_sec(-98765432111111)
NULL
select time_to_sec(98765432601111);
time_to_sec(98765432601111)
NULL
select time_to_sec(cast(11.12 as float));
time_to_sec(cast(11.12 as float))
11
select time_to_sec(cast(415123e-3 as float));
time_to_sec(cast(415123e-3 as float))
255
select time_to_sec(cast(0.0 as double));
time_to_sec(cast(0.0 as double))
0
select time_to_sec(cast(8391234.5678 as double));
time_to_sec(cast(8391234.5678 as double))
NULL
select time_to_sec(cast(0.0 as decimal(2,1)));
time_to_sec(cast(0.0 as decimal(2,1)))
0
select time_to_sec(cast(415123e-3 as decimal(6,3)));
time_to_sec(cast(415123e-3 as decimal(6,3)))
255
select time_to_sec(' \n \r \t 20230320124356.123456');
time_to_sec(' \n \r \t 20230320124356.123456')
45836
select time_to_sec('.-/20230320124356.123456');
time_to_sec('.-/20230320124356.123456')
0
select time_to_sec('111160');
time_to_sec('111160')
NULL
select time_to_sec('010303111111');
time_to_sec('010303111111')
40271
select time_to_sec('20230320124356. gcd!@#$%^&*12');
time_to_sec('20230320124356. gcd!@#$%^&*12')
45836
select time_to_sec('20230320124356 ');
time_to_sec('20230320124356 ')
45836
select time_to_sec('2010303111111');
time_to_sec('2010303111111')
40271
select time_to_sec('0303111111');
time_to_sec('0303111111')
NULL
select time_to_sec('12341234');
time_to_sec('12341234')
NULL
select time_to_sec('11:11:');
time_to_sec('11:11:')
40260
select time_to_sec('11::');
time_to_sec('11::')
11
select time_to_sec(':11:11');
time_to_sec(':11:11')
671
select time_to_sec('11:');
time_to_sec('11:')
11
select time_to_sec(current_date());
time_to_sec(current_date())
0
select time_to_sec(current_time());
time_to_sec(current_time())
57935
select time_to_sec(current_timestamp());
time_to_sec(current_timestamp())
57935
select time_to_sec(strict_current_timestamp());
time_to_sec(strict_current_timestamp())
57935
select time_to_sec(current_timestamp(),1);
ERROR HY000: YAO-5054: Param num of function 'time_to_sec' must be 1, ret=-5054
select time_to_sec(cast('9999-12-31 23:59:59.999999' as timestamp));
time_to_sec(cast('9999-12-31 23:59:59.999999' as timestamp))
86399
select time_to_sec(cast('10000-12-31 23:59:59.999999' as timestamp));
time_to_sec(cast('10000-12-31 23:59:59.999999' as timestamp))
NULL
select time_to_sec(cast('0001-01-01 00:00:00.000000' as timestamp));
time_to_sec(cast('0001-01-01 00:00:00.000000' as timestamp))
0
select time_to_sec(cast('-0001-01-01 00:00:00.000001' as timestamp));
time_to_sec(cast('-0001-01-01 00:00:00.000001' as timestamp))
NULL
select time_to_sec(111111111.12345678912345678912345678912);
time_to_sec(111111111.12345678912345678912345678912)
NULL
select time_to_sec(20000101010101.123456+10101010102/1*1-1+0.123456);
time_to_sec(20000101010101.123456+10101010102/1*1-1+0.123456)
7322
update t2 set c1 = 3 where c1 = time_to_sec(1);
select * from t2;
c1	c2	c3
3	100	21
2	200	31
3	300	41
5	500	51
update t2 set c1 = 1 where c2 = time_to_sec(':1:');
select * from t2;
c1	c2	c3
3	100	21
2	200	31
3	300	41
5	500	51
update t2 set c3 = time_to_sec('2001-02-26 11:11:') where c1 = 2;
select * from t2;
c1	c2	c3
3	100	21
2	200	40260
3	300	41
5	500	51
select * from t2 where c1 < time_to_sec(2);
c1	c2	c3
select * from t2;
c1	c2	c3
3	100	21
2	200	40260
3	300	41
5	500	51
select * from t2 group by c2 having c3 > time_to_sec(1);
c1	c2	c3
3	100	21
2	200	40260
3	300	41
5	500	51
select * from t2 order by time_to_sec(c1);
c1	c2	c3
2	200	40260
3	100	21
3	300	41
5	500	51
insert into t2 values(1,60,time_to_sec(1));
select * from t2;
c1	c2	c3
3	100	21
2	200	40260
3	300	41
5	500	51
1	60	1
delete from t2 where c1 = time_to_sec(3);
select * from t2;
c1	c2	c3
2	200	40260
5	500	51
1	60	1
(select c1,time_to_sec(c2-30) from t2) union (select c1,time_to_sec(c2-20) from t2);
c1	time_to_sec(c2-30)
1	30
1	40
2	NULL
5	NULL
(select c1,time_to_sec(c2-30) from t2) intersect (select c1,time_to_sec(c2-30) from t2);
c1	time_to_sec(c2-30)
1	30
2	NULL
5	NULL
(select c1,time_to_sec(c2-30) from t2) except (select c1,time_to_sec(c2-20) from t2);
c1	time_to_sec(c2-30)
1	30
select * from t2 where c1 between time_to_sec(1) and time_to_sec(4);
c1	c2	c3
2	200	40260
1	60	1
select time_to_sec(time_to_sec('2001-02-26 11:10:11'));
time_to_sec(time_to_sec('2001-02-26 11:10:11'))
14531
select round(c2-20),time_to_sec(round(c2-20)) from t2;
round(c2-20)	time_to_sec(round(c2-20))
180	NULL
480	NULL
40	40
select concat('2001-02-26 ','11:11:11'),time_to_sec(concat('2001-02-26 ','11:11:11'));
concat('2001-02-26 ','11:11:11')	time_to_sec(concat('2001-02-26 ','11:11:11'))
2001-02-26 11:11:11	40271
select max(time_to_sec(c1)),time_to_sec(min(c1)),sum(time_to_sec(c3)),time_to_sec(count(c1)) from t2;
max(time_to_sec(c1))	time_to_sec(min(c1))	sum(time_to_sec(c3))	time_to_sec(count(c1))
5	1	52	3
select * from t2 where c1 in (select time_to_sec(c1) from t2);
c1	c2	c3
2	200	40260
5	500	51
1	60	1
create table t4(c1_int int,c2_varchar varchar(10),c3_float float,c4_double double,c5_bool bool,c6_timestamp timestamp,c7_date date,c8_time time,c9_decimal decimal(5,3));
insert into t4 values(1,'aaa',1.1,1.111,false,'2023-01-28 14:24:34.865411','2023-01-29','2023-02-28 14:24:34.865411',12.123),(2,'bbb',2.1,2.111,true,'2023-09-28 14:24:34.865411','2023-09-29','2023-09-28 14:24:34.865411',12.123);
select c5_bool,time_to_sec(c5_bool) from t4;
c5_bool	time_to_sec(c5_bool)
0	0
1	1
select time_to_sec(c1_int),time_to_sec(c2_varchar),time_to_sec(c3_float),time_to_sec(c4_double) from t4;
time_to_sec(c1_int)	time_to_sec(c2_varchar)	time_to_sec(c3_float)	time_to_sec(c4_double)
1	0	1	1
2	0	2	2
select time_to_sec(c6_timestamp),time_to_sec(c7_date),time_to_sec(c8_time),time_to_sec(c9_decimal) from t4;
time_to_sec(c6_timestamp)	time_to_sec(c7_date)	time_to_sec(c8_time)	time_to_sec(c9_decimal)
51874	0	51874	12
51874	0	51874	12
select time_to_sec(12+11*10/20%10 mod(3));
time_to_sec(12+11*10/20%10 mod(3))
14
SELECT TIME_TO_SEC('01:30:00') + TIME_TO_SEC('00:45:00');
TIME_TO_SEC('01:30:00') + TIME_TO_SEC('00:45:00')
8100
SELECT TIME_TO_SEC('00:15:00') * 3;
TIME_TO_SEC('00:15:00') * 3
2700
select time_to_sec(c1) from t1;
time_to_sec(c1)
0
0
0
select time_to_sec(c2) from t1;
time_to_sec(c2)
15
3015
35415
select time_to_sec(c3) from t1;
time_to_sec(c3)
15
3015
35415
select time_to_sec(c4) as timestamp_column  from t1;
timestamp_column
15
3015
35415
select c1 from t1 where time_to_sec(c2) > 3600;
c1
2023-07-07
select t2.c1,t3.c1,time_to_sec(t2.c2),time_to_sec(t3.c3) from t2,t3;
c1	c1	time_to_sec(t2.c2)	time_to_sec(t3.c3)
2	1	120	21
2	2	120	31
2	3	120	41
2	6	120	NULL
5	1	300	21
5	2	300	31
5	3	300	41
5	6	300	NULL
1	1	NULL	21
1	2	NULL	31
1	3	NULL	41
1	6	NULL	NULL
drop table t1,t2,t3,t4;
