set names utf8mb4;
select char_length(' ');
char_length(' ')
1
select char_length('abcd');
char_length('abcd')
4
select char_length('你好abc');
char_length('你好abc')
5
select char_length(char(0));
char_length(char(0))
1
select char_length(NULL);
char_length(NULL)
NULL
select char_length('，。【】@,. ');
char_length('，。【】@,. ')
8
select char_length(',你好.abc []');
char_length(',你好.abc []')
10
select char_length('2+3*2/2.5');
char_length('2+3*2/2.5')
9
select char_length('2+3*2/2.5-10');
char_length('2+3*2/2.5-10')
12
select char_length('5mod2');
char_length('5mod2')
5
select char_length('1=1');
char_length('1=1')
3
select char_length('1>1');
char_length('1>1')
3
select char_length('10>3.14');
char_length('10>3.14')
7
select char_length('(1+2*(0.5*2)/1)>10/2');
char_length('(1+2*(0.5*2)/1)>10/2')
20
select char_length('1<1');
char_length('1<1')
3
select char_length('(1+2*(0.5*2)/1)<10/2');
char_length('(1+2*(0.5*2)/1)<10/2')
20
select char_length('(1+2*(0.5*2)/1)>=3');
char_length('(1+2*(0.5*2)/1)>=3')
18
select char_length('1+2*(0.5*2)/1)>=(10+2*1.5)');
char_length('1+2*(0.5*2)/1)>=(10+2*1.5)')
26
select char_length('(1+2*(0.5*2)/1)<=(10+2*1.5)');
char_length('(1+2*(0.5*2)/1)<=(10+2*1.5)')
27
select char_length('(1+2*(0.5*2)/1)!=(10+2*1.5)/10');
char_length('(1+2*(0.5*2)/1)!=(10+2*1.5)/10')
30
select char_length('(1+2*(0.5*2)/1)!=(1+2*(0.5*2)/1)');
char_length('(1+2*(0.5*2)/1)!=(1+2*(0.5*2)/1)')
32
select char_length('1<>1');
char_length('1<>1')
4
select char_length('1||2');
char_length('1||2')
4
use test;
create table t1 (c_int int,c_varchar varchar(30),c_float float,c_double double,c_decimal decimal);
insert into t1 values(2,'西北工业大学',2.3,4.6,6);
select char_length(c_varchar) from t1;
char_length(c_varchar)
6
select char_length(c_float) from t1;
char_length(c_float)
3
select char_length(c_double) from t1;
char_length(c_double)
3
select char_length(c_int) from t1;
char_length(c_int)
1
select char_length(c_decimal) from t1;
char_length(c_decimal)
1
select char_length(c_varchar + 'abc') from t1;
char_length(c_varchar + 'abc')
1
select char_length(c_float*2) from t1;
char_length(c_float*2)
3
select char_length(c_decimal+2.5) from t1;
char_length(c_decimal+2.5)
3
select char_length(c_double+2.5) from t1;
char_length(c_double+2.5)
3
select char_length(c_int*2) from t1;
char_length(c_int*2)
1
select char_length(concat(c_varchar,'123')) from t1;
char_length(concat(c_varchar,'123'))
9
select char_length(upper(c_varchar)) from t1;
char_length(upper(c_varchar))
6
insert into t1 values(3,'西安',2.3,4.6,6);
insert into t1 values(4,'北京市',2.3,4.6,6);
insert into t1 values(5,'1',2.3,4.6,6);
select * from t1;
c_int	c_varchar	c_float	c_double	c_decimal
2	西北工业大学	2.3	4.6	6
3	西安	2.3	4.6	6
4	北京市	2.3	4.6	6
5	1	2.3	4.6	6
update t1 set c_int=10 where char_length(c_varchar)=2;
select * from t1;
c_int	c_varchar	c_float	c_double	c_decimal
2	西北工业大学	2.3	4.6	6
10	西安	2.3	4.6	6
4	北京市	2.3	4.6	6
5	1	2.3	4.6	6
update t1 set c_int=char_length('今天天气真好！。') where c_varchar='1';
select * from t1;
c_int	c_varchar	c_float	c_double	c_decimal
2	西北工业大学	2.3	4.6	6
10	西安	2.3	4.6	6
4	北京市	2.3	4.6	6
8	1	2.3	4.6	6
insert into t1 values(5,'上海',char_length('你好abc,.，。'),4.5,1);
select * from t1;
c_int	c_varchar	c_float	c_double	c_decimal
2	西北工业大学	2.3	4.6	6
10	西安	2.3	4.6	6
4	北京市	2.3	4.6	6
8	1	2.3	4.6	6
5	上海	9	4.5	1
delete from t1 where c_int=char_length('1234');
select * from t1;
c_int	c_varchar	c_float	c_double	c_decimal
2	西北工业大学	2.3	4.6	6
10	西安	2.3	4.6	6
8	1	2.3	4.6	6
5	上海	9	4.5	1
create table t2(c_int int,c_varchar varchar(20),c_float float,c_double double,c_decimal decimal);
insert into t2 values(5,'欢迎你',4.5,5.6,3);
select c_varchar from t1 where c_int=char_length('西安') union select c_varchar from t2 where c_int=char_length('北京市人民');
c_varchar
欢迎你
西北工业大学
select c_varchar from t1 where c_int=char_length('西安') intersect select c_varchar from t2 where c_int=char_length('北京市人民');
c_varchar
insert into t1 values(6,'西安市',2.3,4.6,6);
select t1.c_int,t2.c_int from t1,t2 where char_length(t1.c_varchar)=char_length(t2.c_varchar);
c_int	c_int
6	5
select char_length(t1.c_varchar||t2.c_varchar) from t1,t2 where t1.c_int=t2.c_int;
char_length(t1.c_varchar||t2.c_varchar)
1
select null regexp '1';
null regexp '1'
NULL
select '1' regexp null;
'1' regexp null
NULL
select null regexp null;
null regexp null
NULL
SELECT 111 REGEXP '1+';
111 REGEXP '1+'
1
SELECT '111' REGEXP '1+';
'111' REGEXP '1+'
1
select '1998-09-03 00:00:00' REGEXP '1';
'1998-09-03 00:00:00' REGEXP '1'
1
select cast(2.141 as float) regexp '2.141+$';
cast(2.141 as float) regexp '2.141+$'
0
select cast(2.141 as double) regexp '2.141+$';
cast(2.141 as double) regexp '2.141+$'
0
select true regexp 'true$';
true regexp 'true$'
0
SELECT '1' REGEXP 1;
'1' REGEXP 1
1
SELECT '111' REGEXP '1+';
'111' REGEXP '1+'
1
select '1998-09-03 00:00:00' REGEXP '1998-09-03 00:00:00';
'1998-09-03 00:00:00' REGEXP '1998-09-03 00:00:00'
1
select cast(2.141 as float) regexp '2.141+$';
cast(2.141 as float) regexp '2.141+$'
0
select cast(2.141 as double) regexp '2.141+$';
cast(2.141 as double) regexp '2.141+$'
0
select 'true' regexp true;
'true' regexp true
0
SELECT 'fo\nfo' REGEXP '^fo$';
'fo\nfo' REGEXP '^fo$'
0
SELECT 'fo\no' REGEXP '^fo\no$';
'fo\no' REGEXP '^fo\no$'
1
SELECT 'justalnums' REGEXP '[[:alnum:]]+';
'justalnums' REGEXP '[[:alnum:]]+'
1
SELECT 'a word a' REGEXP '[[:<:]]word[[:>:]]';
'a word a' REGEXP '[[:<:]]word[[:>:]]'
1
SELECT '1+2' REGEXP '1\\+2';
'1+2' REGEXP '1\\+2'
1
SELECT 'Ban' REGEXP '^Ba*n';
'Ban' REGEXP '^Ba*n'
1
SELECT 'Ban' REGEXP '^Ba+n';
'Ban' REGEXP '^Ba+n'
1
SELECT 'Baan' REGEXP '^Ba?n';
'Baan' REGEXP '^Ba?n'
0
SELECT 'pi' REGEXP 'pi|apa';
'pi' REGEXP 'pi|apa'
1
SELECT 'pi' REGEXP '^(pi)*$';
'pi' REGEXP '^(pi)*$'
1
SELECT 'abcde' REGEXP 'a[bcd]{2}e';
'abcde' REGEXP 'a[bcd]{2}e'
0
SELECT 'aXbc' REGEXP '[a-dXYZ]';
'aXbc' REGEXP '[a-dXYZ]'
1
SELECT '~' REGEXP '[[.~.]]';
'~' REGEXP '[[.~.]]'
1
SELECT '' REGEXP '[[.~.]]';
'' REGEXP '[[.~.]]'
0
SELECT '~' REGEXP '';
ERROR HY000: YAO-2: Illegal argument to a regular expression
SELECT 98+2 REGEXP '1+';
98+2 REGEXP '1+'
1
SELECT 102-2 REGEXP '1+';
102-2 REGEXP '1+'
1
SELECT 20/2 REGEXP '1+';
20/2 REGEXP '1+'
1
SELECT 5*2 REGEXP '1+';
5*2 REGEXP '1+'
1
SELECT 1=1 REGEXP '1+';
1=1 REGEXP '1+'
1
SELECT 2<1 REGEXP '1+';
2<1 REGEXP '1+'
0
SELECT 2>1 REGEXP '1+';
2>1 REGEXP '1+'
1
SELECT 2>=1 REGEXP '1+';
2>=1 REGEXP '1+'
1
SELECT 2<=1 REGEXP '1+';
2<=1 REGEXP '1+'
0
SELECT 1!=1 REGEXP '0+';
1!=1 REGEXP '0+'
1
CREATE TABLE STUDENT(ID  VARCHAR(50)  NOT NULL PRIMARY KEY, NAME VARCHAR(20) NOT NULL);
insert into STUDENT values(1,'abcbcbc');
select * from STUDENT where id  REGEXP '1+';
ID	NAME
1	abcbcbc
update STUDENT set ID = ( '0'regexp '1+') where Id=1;
SELECT * from STUDENT;
ID	NAME
0	abcbcbc
select ID from STUDENT group by ID having ID > ( '1' regexp '1+');
ID
select * from STUDENT where id  REGEXP '0+' order by ID;
ID	NAME
0	abcbcbc
insert into STUDENT values(1,'111' REGEXP '1+');
SELECT * from STUDENT;
ID	NAME
0	abcbcbc
1	1
delete from STUDENT where  id  REGEXP '1+';
SELECT * from STUDENT;
ID	NAME
0	abcbcbc
select * from STUDENT where id  REGEXP '0+'  union select * from STUDENT where id  REGEXP '0+';
ID	NAME
0	abcbcbc
SELECT SUBSTR('Quadratically','111' regexp '1+');
SUBSTR('Quadratically','111' regexp '1+')
Quadratically
select substr('1+111',1) regexp substr('1+111',3);
substr('1+111',1) regexp substr('1+111',3)
1
create table people(pid int primary key not null,pname varchar(20) not null,psex bool not null,pdate datetime not null,psalary_d double not null,psalary_f float not null);
insert into people values(1,'jing',true,'2020-04-21',10324.83,12439.9);
SELECT pname REGEXP '1+' from people;
pname REGEXP '1+'
0
SELECT pid REGEXP '1+' from people;
pid REGEXP '1+'
1
SELECT psalary_d REGEXP '1+' from people;
psalary_d REGEXP '1+'
1
SELECT psalary_f REGEXP '1+' from people;
psalary_f REGEXP '1+'
1
SELECT 'jing' REGEXP pname from people;
'jing' REGEXP pname
1
SELECT '111' REGEXP pid from people;
'111' REGEXP pid
1
SELECT '111' REGEXP psalary_d  from people;
'111' REGEXP psalary_d
0
SELECT '111' REGEXP psalary_f from people;
'111' REGEXP psalary_f
0
SELECT pname REGEXP pname from people;
pname REGEXP pname
1
SELECT pid-1 REGEXP '1+' from people;
pid-1 REGEXP '1+'
0
SELECT pid+9 REGEXP '1+' from people;
pid+9 REGEXP '1+'
1
SELECT pid*2 REGEXP '1+' from people;
pid*2 REGEXP '1+'
0
SELECT (pid+1)/2 REGEXP '1+' from people;
(pid+1)/2 REGEXP '1+'
1
SELECT sum(pid) REGEXP '1+' from people;
sum(pid) REGEXP '1+'
1
SELECT max(pid) REGEXP '1+' from people;
max(pid) REGEXP '1+'
1
SELECT min(pid) REGEXP '1+' from people;
min(pid) REGEXP '1+'
1
CREATE TABLE STUDENT1(ID  number(10)  NOT NULL PRIMARY KEY, NAME VARCHAR(20) NOT NULL);
CREATE TABLE STUDENT2(ID  number(10)  NOT NULL PRIMARY KEY, NAME VARCHAR(20) NOT NULL);
insert into STUDENT1 values(1,'abcbcbc');
insert into STUDENT2 values(1,'bc');
SELECT student1.id REGEXP student2.id from student1,student2;
student1.id REGEXP student2.id
1
SELECT student1.name REGEXP student2.name from student1,student2;
student1.name REGEXP student2.name
1
select locate('baidu','www.baidu.com') output;
output
5
select locate(null,'www.baidu.com') output;
output
NULL
select locate('baidu',null) output;
output
NULL
select locate(null, null) output;
output
NULL
select locate() output;
ERROR HY000: YAO-5054: Param num of function 'locate' can not be less than 2 or more than 3, ret=-5054
select locate(12,12312,1) output;
output
1
select locate(12,12312,2) output;
output
4
select (123);
(123)
123
select locate('','') output;
output
1
select locate('567','') output;
output
0
select locate('','567') output;
output
1
select locate('工','西北工业大学') output;
output
3
select locate(123,12345) output;
output
1
select locate('abc', 'aabcd') output;
output
2
select locate(true,23145) output;
output
3
select locate(false,123021) output;
output
4
select locate(false,false) output;
output
1
select locate(true,true) output;
output
1
select locate('09','1998-09-03 00:00:00') output;
output
6
select locate(cast(1.23 as float),1.23) output;
output
1
select locate(cast(1.23 as double),1.23) output;
output
1
select locate(1e3,1000) output;
output
1
drop table student;
create table student (id int,name varchar(10), age int, sex varchar(10));
insert into student values(1,'aaa',22,'男'),(2,'bbb',20,'男'),(3,'ccc',27,'女'),(4,'ddd',25,'女');
update student set name='Jack' where id=locate('345','123456');
select * from student;
id	name	age	sex
1	aaa	22	男
2	bbb	20	男
3	Jack	27	女
4	ddd	25	女
update student set age=locate('789','123456789') where id=1;
select * from student;
id	name	age	sex
1	aaa	7	男
2	bbb	20	男
3	Jack	27	女
4	ddd	25	女
select sex,count(*) from student s GROUP BY sex having count(*)  > locate(123,12345);
sex	count(*)
女	2
男	2
insert into student values(5,'胡图图',locate('678','123456789'),'男');
select * from student;
id	name	age	sex
1	aaa	7	男
2	bbb	20	男
3	Jack	27	女
4	ddd	25	女
5	胡图图	6	男
delete from student where age=locate('678','123456789');
select * from student;
id	name	age	sex
1	aaa	7	男
2	bbb	20	男
3	Jack	27	女
4	ddd	25	女
(select name from student where age=locate('789','123456789')) union (select name from student where id=2);
name
aaa
bbb
select substr('baid5',locate('baidu','www.baidu.com',5)) output;
output
5
select locate('baidu','www.baidu.com',locate('baidu','www.baidu.com',5)) output;
output
5
select locate('baidu','www.baidu.com',substr('baid5',5)) output;
output
5
select name from student where id between locate(1+5,567) and 3;
name
bbb
Jack
select locate(substr('2345',3),'1234567') output;
output
4
select locate(replace('bc45','bc','23'),'12345') output;
output
2
create table teacher (id int,name varchar(30),age int);
insert into teacher values(1,'Tom',22),(2,'Jack',20),(3,'Mary',27);
select s.name,t.name from student s,teacher t where t.id=locate('baidu','w.baidu.com',2) and s.id=locate('baidu','w.baidu.com',2);
name	name
Jack	Mary
select locate(1<2,123) output;
output
1
select locate(1>2,123) output;
output
0
select locate(1<=2,123) output;
output
1
select locate(1>=2,123) output;
output
0
select locate(1!=2,123) output;
output
1
select locate(1=1,123) output;
output
1
select locate(1<>2,123) output;
output
1
select locate(1=2,123) output;
output
0
select locate(1+1,123) output;
output
2
select locate(1-1,1023) output;
output
2
select locate(1*2,123) output;
output
2
select locate(1/1,123) output;
output
0
select locate(4/2,123) output;
output
0
select locate(21%10,123) output;
output
1
insert into teacher values(4,'Tom',locate(1-1,163023));
select * from teacher;
id	name	age
1	Tom	22
2	Jack	20
3	Mary	27
4	Tom	4
insert into teacher values(5,'胡图图',locate('09','1998-09-03 00:00:00'));
select * from teacher;
id	name	age
1	Tom	22
2	Jack	20
3	Mary	27
4	Tom	4
5	胡图图	6
insert into teacher values(6,'胡英俊',locate(2+1,'1998-09-03 00:00:00'));
select * from teacher;
id	name	age
1	Tom	22
2	Jack	20
3	Mary	27
4	Tom	4
5	胡图图	6
6	胡英俊	10
insert into teacher values(7,'Bob',locate(2>1,'1998-09-03 00:00:00'));
select * from teacher;
id	name	age
1	Tom	22
2	Jack	20
3	Mary	27
4	Tom	4
5	胡图图	6
6	胡英俊	10
7	Bob	1
insert into teacher values(8,substr('baid5',locate('baidu','www.baidu.com',5)),locate(2>1,'1998-09-03 00:00:00'));
select * from teacher;
id	name	age
1	Tom	22
2	Jack	20
3	Mary	27
4	Tom	4
5	胡图图	6
6	胡英俊	10
7	Bob	1
8	5	1
select locate((select age from student where id =1),127) output;
output
3
drop table people;
create table people(pid int primary key not null,pname varchar(20) not null,psex bool not null,pdate datetime not null,psalary_d double not null,psalary_f float not null);
insert into people values(1,'jing',true,'2020-04-21',10324.83,12439.9);
select locate((select psalary_d from people where pid =1),10324.83) output;
output
1
select locate((select name from student where id =1),'xxaaa') output;
output
3
select locate('ab' ,name) from student;
locate('ab' ,name)
0
0
0
0
select locate(123,id) from student;
locate(123,id)
0
0
0
0
select locate('abc', name) from student;
locate('abc', name)
0
0
0
0
select locate(cast(id as float),1.23)  from student;
locate(cast(id as float),1.23)
1
3
4
0
select locate(cast(id as double),1.23) from student;
locate(cast(id as double),1.23)
1
3
4
0
select locate(id+1,123) from student;
locate(id+1,123)
2
3
0
0
select locate(id-1,1023) from student;
locate(id-1,1023)
2
1
3
4
select locate(id*2,123) from student;
locate(id*2,123)
2
0
0
0
select locate(id/1,123) from student;
locate(id/1,123)
0
0
0
0
select locate(id%10,123) from student;
locate(id%10,123)
1
2
3
0
select locate(sum(id),'1234') from student;
locate(sum(id),'1234')
0
select locate(max(id),'1234') from student;
locate(max(id),'1234')
4
select locate(min(id),'1234') from student;
locate(min(id),'1234')
1
select locate(id<4,123) from student;
locate(id<4,123)
1
1
1
0
select locate(id>2,123) from student;
locate(id>2,123)
0
0
1
1
select locate(id<=2,123) from student;
locate(id<=2,123)
1
1
0
0
select locate(id>=2,123) from student;
locate(id>=2,123)
0
1
1
1
select locate(id!=2,123) from student;
locate(id!=2,123)
1
0
1
1
select locate(id=1,123) from student;
locate(id=1,123)
1
0
0
0
select locate(id<>2,123) from student;
locate(id<>2,123)
1
0
1
1
select locate(1=2,123) from student;
locate(1=2,123)
0
0
0
0
select locate(id,id) from student;
locate(id,id)
1
1
1
1
select locate(id,name) from student;
locate(id,name)
0
0
0
0
select locate(student.id, teacher.name) from student, teacher;
locate(student.id, teacher.name)
0
0
0
0
0
0
0
0
0
0
0
0
0
0
0
0
0
0
0
0
0
0
0
0
0
0
0
0
0
0
0
0
select substring_index('www.wiki.com','.',2) output;
output
www.wiki
select substring_index('www.wiki.com',2) output;
ERROR HY000: YAO-5054: Param num of function 'substring_index' must be 3, ret=-5054
select substring_index('www.wiki.com','.') output;
ERROR HY000: YAO-5054: Param num of function 'substring_index' must be 3, ret=-5054
select substring_index(null,'.',2) output;
output
NULL
select substring_index('www.wiki.com',null,2) output;
output
NULL
select substring_index('www.wiki.com','.',null) output;
output
NULL
select substring_index('www.wiki.com','.',-1) output;
output
com
select substring_index('www.wiki.com','.',20) output;
output
www.wiki.com
select substring_index('www.wiki.com','.',0) output;
output

select substring_index('西北工业大学','工',1) output;
output
西北
select substring_index('www.wiki.com',',',1) output;
output
www.wiki.com
select substring_index(567879,7,1) output;
output
56
select substring_index(32123,true,1) output;
output
32
select substring_index(32123,1,true) output;
output
32
select substring_index('1998-09-03 00:00:00',':',1) output;
output
1998-09-03 00
select substring_index(cast(1.23 as float),'.',1) output;
output
1
select substring_index(cast(1.23 as double),'.',1) output;
output
1
drop table student;
create table student (id int,name varchar(10), age int, sex varchar(10));
insert into student values(1,'aaa',22,'男'),(2,'bbb',20,'男'),(3,'ccc',27,'女'),(4,'ddd',25,'女');
update student set age='24' where name=substring_index('aaatestbbb','t',1);
select * from student;
id	name	age	sex
1	aaa	24	男
2	bbb	20	男
3	ccc	27	女
4	ddd	25	女
update student set name=substring_index('Tomtestbbb','t',1) where id=1;
select * from student;
id	name	age	sex
1	Tom	24	男
2	bbb	20	男
3	ccc	27	女
4	ddd	25	女
select sex,count(*) from student s GROUP BY sex having count(*)  > substring_index(123,2,1);
sex	count(*)
女	2
男	2
insert into student values(5,'胡图图',substring_index('223432',3,1),'男');
select * from student;
id	name	age	sex
1	Tom	24	男
2	bbb	20	男
3	ccc	27	女
4	ddd	25	女
5	胡图图	22	男
delete from student where name=substring_index('Tom3432',3,1);
select * from student;
id	name	age	sex
2	bbb	20	男
3	ccc	27	女
4	ddd	25	女
5	胡图图	22	男
(select * from student where name=substring_index('bbb3432',3,1)) union (select * from student where id=5);
id	name	age	sex
2	bbb	20	男
5	胡图图	22	男
(select name from student where name=substring_index('bbb3432',3,1)) intersect (select name from student where age>=19);
name
bbb
(select name from student where age>=19) except (select name from student where name=substring_index('bbb3432',3,1));
name
ccc
ddd
胡图图
select substring_index(substr('123456',2),substring_index(34567,4,1),1) output;
output
2
select substring_index('1234567',substring_index(34567,4,1),1) output;
output
12
select * from student where id between substring_index('1234321',2,1) and 3;
id	name	age	sex
2	bbb	20	男
3	ccc	27	女
select substring_index(substr('123456',2),substring_index(34567,4,1),1) output;
output
2
select substring_index(replace('bc45','bc','23'),3,1) output;
output
2
drop table teacher;
create table teacher (id int,name varchar(30),age int);
insert into teacher values(1,'Tom',22),(2,'Jack',20),(3,'Mary',27);
select t.age,s.age from student s,teacher t where t.name=substring_index('Tom3432',3,1) and s.name=substring_index('bbb3432',3,1);
age	age
22	20
select substring_index('341567',1,2<3) output;
output
34
select substring_index('341567',1,5>3) output;
output
34
select substring_index('341567',1,2<=3) output;
output
34
select substring_index('341567',1,2>=3) output;
output

select substring_index('341567',1,2!=3) output;
output
34
select substring_index('341567',1,3=3) output;
output
34
select substring_index('341567',1,2<>3) output;
output
34
select substring_index('341567',1,2+3) output;
output
341567
select substring_index('341567',1,2-3) output;
output
567
select substring_index('341567',1,2*3) output;
output
341567
select substring_index('341567',1,6/3) output;
output
341567
select substring_index('341567',1,11%10) output;
output
34
drop table people;
create table people(pid int primary key not null,pname varchar(20) not null,psex bool not null,pdate datetime not null,psalary_d double not null,psalary_f float not null);
insert into people values(1,'jing',true,'2020-04-21',10324.83,12439.9);
insert into people values(7,substring_index('Tom3432',3,1),true,'2020-04-21',10324.83,12439.9);
select * from people;
pid	pname	psex	pdate	psalary_d	psalary_f
1	jing	1	2020-04-21 00:00:00.000000	10324.83	12439.9
7	Tom	1	2020-04-21 00:00:00.000000	10324.83	12439.9
insert into people values(2,'jing',true,substring_index('1998-09-03 00:00:00','0',1+1),10324.83,12439.9);
ERROR HY000: YAO-5102: Format of TIMESTAMP value is incorrect.
insert into people values(2,'jing',true,substring_index('1998-09-03 00:00:00',' ',3-2),10324.83,12439.9);
insert into people values(10,substring_index('胡图图aba','a',3>2),true,'2020-04-21',10324.83,12439.9);
select * from people;
pid	pname	psex	pdate	psalary_d	psalary_f
1	jing	1	2020-04-21 00:00:00.000000	10324.83	12439.9
2	jing	1	1998-09-03 00:00:00.000000	10324.83	12439.9
7	Tom	1	2020-04-21 00:00:00.000000	10324.83	12439.9
10	胡图图	1	2020-04-21 00:00:00.000000	10324.83	12439.9
insert into people values(11,substring_index(substr('Jack23456',2),substring_index(34567,4,1),1),true,'2020-04-21',10324.83,12439.9);
select * from people;
pid	pname	psex	pdate	psalary_d	psalary_f
1	jing	1	2020-04-21 00:00:00.000000	10324.83	12439.9
2	jing	1	1998-09-03 00:00:00.000000	10324.83	12439.9
7	Tom	1	2020-04-21 00:00:00.000000	10324.83	12439.9
10	胡图图	1	2020-04-21 00:00:00.000000	10324.83	12439.9
11	ack2	1	2020-04-21 00:00:00.000000	10324.83	12439.9
select substring_index((select pname from people where pid =7),'o',1);
substring_index((select pname from people where pid =7),'o',1)
T
select substring_index((select psalary_d from people where pid =7),0,1) output;
output
1
select substring_index((select name from student where id =2),'b',2) output;
output
b
select substring_index('12ccc12',name,1) from student;
substring_index('12ccc12',name,1)
12ccc12
12
12ccc12
12ccc12
select substring_index('1234',sum(id),1) from student;
substring_index('1234',sum(id),1)
1234
select substring_index('123456789',max(id),1) res from student;
res
1234
select substring_index('123456789',min(id),1) res from student;
res
1
select substring_index('341567',1,2<3) res from student;
res
34
34
34
34
select substring_index('341567',1,5>3) res from student;
res
34
34
34
34
select substring_index('341567',1,2<=3) res from student;
res
34
34
34
34
select substring_index('341567',1,5>=3) res from student;
res
34
34
34
34
select substring_index('341567',1,2!=3) res from student;
res
34
34
34
34
select substring_index('341567',1,3=3) res from student;
res
34
34
34
34
select substring_index('341567',1,6/3) res from student;
res
341567
341567
341567
341567
select substring_index('341567',1,11%10) res from student;
res
34
34
34
34
select substring_index('xccc',name,1) res from student;
res
xccc
x
xccc
xccc
select substring_index(2,id,1) res from student;
res

2
2
2
select substring_index(cast(id as float),1.23,1) from student;
substring_index(cast(id as float),1.23,1)
2
3
4
5
select substring_index(cast(id as double),1.23,1) from student;
substring_index(cast(id as double),1.23,1)
2
3
4
5
select substring_index(age,1.2,1.3)  from student;
substring_index(age,1.2,1.3)
20
27
25
22
select substring_index('341567',id+2,1) res from student;
res
3
341
3415
34156
select substring_index('341567',id-2,1) res from student;
res
341567
34
341567

select substring_index('341567',id*2,1) res from student;
res
3
3415
341567
341567
select substring_index('341567',id/2,1) res from student;
res
341567
341567
341567
341567
select substring_index(id,id,1) from student;
substring_index(id,id,1)




select substring_index(id,name,1) from student;
substring_index(id,name,1)
2
3
4
5
select substring_index(student.id, teacher.name,1) from student, teacher;
substring_index(student.id, teacher.name,1)
2
2
2
3
3
3
4
4
4
5
5
5
