use test;
create table t1(c1 int primary key);
insert into t1 values(-1),(0),(1);
create table t2(c1 int primary key,c2 int);
insert into t2 values(-1,-1),(0,0),(1,1);
create table t3(c1 int);
insert into t3 values(1),(2),(3);
create table t4(c1 int primary key);
create table t5(c1 int primary key);
insert into t5 values(1),(2),(3),(4),(5),(6),(7),(8),(9),(10),(11),(12),(13),(14),(15),(16),(17),(18),(19),(20);
select row_count(1);
ERROR 42000: YAO-5001: You have an error in your SQL syntax; check the manual that corresponds to your YaoBase version for the right syntax 
select row_count(1,2);
ERROR 42000: YAO-5001: You have an error in your SQL syntax; check the manual that corresponds to your YaoBase version for the right syntax 
select row_count();
row_count()
20
select * from t1;
c1
-1
0
1
update t1 set c1=-2 where c1=row_count();
select * from t1;
c1
-2
0
1
update t1 set c1=row_count()-2 where c1=-2;
select * from t1;
c1
-3
0
1
select c1 from t1 having row_count()>=-1;
c1
-3
0
1
select c1 from t1 group by c1 having c1> row_count();
c1
0
1
select c1 from t1 where c1>row_count() order by c1;
c1
0
1
select * from t1;
c1
-3
0
1
insert into t1 values(row_count());
select * from t1;
c1
-3
-1
0
1
delete from t1 where c1=row_count()-2;
select * from t1;
c1
-1
0
1
(select c1 from t1 where c1=-1) union (select c1 from t2 where c1=row_count());
c1
-1
(select c1 from t1 where c1=1) intersect (select c1 from t2 where c1=row_count());
c1
(select c1 from t1 where c1=1) except (select c1 from t2 where c1=row_count());
c1
1
select ord(row_count()) from t1;
ord(row_count())
45
45
45
select floor(row_count());
floor(row_count())
-1
select if(1<2,row_count(),4);
if(1<2,row_count(),4)
-1
select concat(row_count(),-2);
concat(row_count(),-2)
-1-2
select c1 from t1 where c1 between row_count() and 2;
c1
-1
0
1
select c1 from t1 where c1 between -1 and row_count();
c1
-1
select row_count()+c1 from t1;
row_count()+c1
-2
-1
0
select row_count()-c1 from t1;
row_count()-c1
0
-1
-2
select row_count()*c1 from t1;
row_count()*c1
1
0
-1
select c1/row_count() from t1;
c1/row_count()
1
0
-1
select c1 from t1 where c1 in (select row_count() from t1);
c1
-1
select row_count() from t1 join t2 on t1.c1=t2.c1;
row_count()
-1
-1
-1
select t1.c1 from t1,t2 where t2.c1=row_count() and t1.c1=t2.c1;
c1
-1
create database rowtest;
select row_count();
row_count()
0
use rowtest;
select row_count();
row_count()
0
drop database rowtest;
select row_count();
row_count()
1
create database ybtest;
use ybtest;
create table test(c1 int);
select row_count();
row_count()
0
drop table test;
select row_count();
row_count()
0
use test;
alter table t1 add c2 int;
select row_count();
row_count()
0
truncate table t3;
select row_count();
row_count()
0
show tables;
table_name_in_test
t1
t2
t3
t4
t5
select row_count();
row_count()
-1
create or replace sequence seq1 as integer start with 1 increment by 1 minvalue -1 maxvalue 1 cycle;
select row_count();
row_count()
1
alter sequence seq1 restart with 1 increment by 1 no minvalue no maxvalue no cycle;
select row_count();
row_count()
1
drop sequence seq1;
select row_count();
row_count()
1
create hash partition function hs(x) '(x+1)%2';
select row_count();
row_count()
0
create enum partition function em(x,y) '[(1,1),(2,3)],[(3,4)]';
select row_count();
row_count()
0
drop partition function hs;
select row_count();
row_count()
0
create index indx on t2(c2);
select row_count();
row_count()
0
drop index indx on t2;
select row_count();
row_count()
0
create view v1 as select * from t1;
select row_count();
row_count()
0
alter view v1 as select * from t1 where c1>0;
select row_count();
row_count()
0
select * from v1;
c1	c2
1	NULL
select row_count();
row_count()
-1
show create view v1;
View	Create View	character_set_client	collation_connection
test.v1	create view `test`.`v1` as select "test"."t1"."c1" as "c1", "test"."t1"."c2" as "c2" from "test"."t1" where (("test"."t1"."c1" > 0))	utf8mb4	utf8mb4_general_ci
select row_count();
row_count()
-1
drop view v1;
select row_count();
row_count()
0
desc t1;
Field	Type	Null	Key	Default	Extra
c1	int(10)	YES	PRI	NULL	
c2	int(10)	YES		NULL	
select row_count();
row_count()
-1
insert into t1(c1) values(4),(5),(6);
select row_count();
row_count()
3
insert into t4 select * from t5;
select row_count();
row_count()
20
update t1 set c2=c1;
select row_count();
row_count()
6
delete from t1 where c1=4 or c1=5 or c1=6;
select row_count();
row_count()
3
replace into t1 values(1,1),(3,3);
select row_count();
row_count()
2
replace into t2 values(1,2);
select row_count();
row_count()
1
select * from t1;
c1	c2
-1	-1
0	0
1	1
3	3
select row_count();
row_count()
-1
select * from t2 where c1=1 for update;
c1	c2
1	2
select row_count();
row_count()
-1
prepare stmt_1 from 'update  t2 set c1=2 where c2=?';
select row_count();
row_count()
0
set @a=2;
select row_count();
row_count()
0
execute stmt_1 using @a;
select row_count();
row_count()
1
deallocate prepare stmt_1;
select row_count();
row_count()
0
create user 'test' identified by 'test.123456';
select row_count();
row_count()
0
set password for 'test' = '1.password';
select row_count();
row_count()
0
grant select on *.* to 'test';
select row_count();
row_count()
0
revoke select on *.* from 'test';
select row_count();
row_count()
0
rename user 'test' to 'test1';
select row_count();
row_count()
0
alter user test1 locked;
select row_count();
row_count()
0
alter user test1 unlocked;
select row_count();
row_count()
0
drop user 'test1';
select row_count();
row_count()
0
set @@session.yao_tx_timeout=900000;
select row_count();
row_count()
0
alter system set tablet_replicas_num=3 comment 'modify by wn' scope = spfile server_type=yaoadminsvr;
select row_count();
row_count()
1
select * from t3;
c1
begin;
select row_count();
row_count()
0
insert into t3 values(4),(5);
select row_count();
row_count()
2
commit;
select row_count();
row_count()
0
select * from t3;
c1
4
5
explain select 1;
Query Plan

{
    "LogicalPlan":{
        "StmtList":[
            {
                "QueryId":2,
                "TableItemList":[
                ],
                "ColumnItemList":[
                ]
            }
        ],
        "ExprList":[
         {
            "ExprId":1,"TableId":"NULL","ColumnId":65519,
            "RawExprs":[
               {}
            ]
         }
        ]
    }
}
Explain()
Project(columns=[expr<NULL,65519>=[int:1|]])(sequence_values_=[])
DualTableScan()

select row_count();
row_count()
-1
select * from t2 where c1=2 when 1=1;
c1	c2
2	2
select row_count();
row_count()
-1
update t3 set c1=3 where c1=4 when 1=1;
select row_count();
row_count()
1
delete from t3 where c1=3 or c1=5;
select row_count();
row_count()
2
select * from t1;
c1	c2
-1	-1
0	0
1	1
3	3
select c1 from t1 where c1=3 when row_count(update t1 set c2=2 where c1=3)>=0;
c1
3
select * from t1;
c1	c2
-1	-1
0	0
1	1
3	2
