ALTER SYSTEM SET merge_delay_interval='6s' server_type=yaodatasvr;
ALTER SYSTEM SET major_freeze_wait_time='6s' server_type=yaoadminsvr;
ALTER SYSTEM SET  min_major_freeze_interval='5s' server_type=yaotxnsvr;
ALTER SYSTEM SET min_merge_interval='5s' server_type=yaodatasvr;
ALTER SYSTEM SET  max_merge_thread_num='20' server_type=yaodatasvr;
create table counttest(c1 varchar(20),c2 varchar(20),c3 varchar(20),primary key(c2));
insert into counttest(c1,c2) values (11,12);
insert into counttest(c2,c3) values (21,22);
insert into counttest(c1,c2) values (31,32);
select count(*) from counttest;
count(*)
3
select c1 from counttest;
c1
11
NULL
31
select c2 from counttest;
c2
12
21
32
select c3 from counttest;
c3
NULL
22
NULL
select c1,c2 from counttest;
c1	c2
11	12
NULL	21
31	32
select * from counttest;
c1	c2	c3
11	12	NULL
NULL	21	22
31	32	NULL
delete from counttest;
select count(*) from counttest;
count(*)
0
select c1 from counttest;
c1
select c2 from counttest;
c2
select c3 from counttest;
c3
select c1,c2 from counttest;
c1	c2
select * from counttest;
c1	c2	c3
insert into counttest(c1,c2) values (11,12);
insert into counttest(c2,c3) values (21,22);
select count(*) from counttest;
count(*)
2
select c1 from counttest;
c1
11
NULL
select c2 from counttest;
c2
12
21
select c3 from counttest;
c3
NULL
22
select c1,c2 from counttest;
c1	c2
11	12
NULL	21
select * from counttest;
c1	c2	c3
11	12	NULL
NULL	21	22
delete from counttest;
select count(*) from counttest;
count(*)
0
select c1 from counttest;
c1
select c2 from counttest;
c2
select c3 from counttest;
c3
select c1,c2 from counttest;
c1	c2
select * from counttest;
c1	c2	c3
insert into counttest(c1,c2) values (11,12);
insert into counttest(c2,c3) values (21,22);
select count(*) from counttest;
count(*)
2
select c1 from counttest;
c1
11
NULL
select c2 from counttest;
c2
12
21
select c3 from counttest;
c3
NULL
22
select c1,c2 from counttest;
c1	c2
11	12
NULL	21
select * from counttest;
c1	c2	c3
11	12	NULL
NULL	21	22
create table o_hdfs_sgps_bep_pmsaccbok999
(
psdbrno varchar(6),
logno varchar(14),
buslog varchar(11),
actdat varchar(8),
bildat varchar(8),
oidate varchar(8),
txndat varchar(8),
srtim varchar(6),
rettim varchar(6),
thddt varchar(6),
txnamt varchar(15),
nodno varchar(6),
retnod varchar(6),
ctlnod varchar(6),
bilsts varchar(1),
txncod varchar(6),
cmtcod varchar(6),
bussqn varchar(8),
rbilcd varchar(2),
rscode varchar(4),
exctm varchar(4),
vchno varchar(9),
vchtyp varchar(3),
vchcmt varchar(10),
prtflg varchar(1),
tprflg varchar(1),
prtcnt varchar(1),
bilno varchar(19),
sub varchar(4),
rpdflg varchar(1),
feetyp varchar(1),
remfee varchar(15),
fee varchar(15),
ccycod varchar(3),
oiflag varchar(1),
bchflg varchar(1),
cdflg varchar(1),
rbkno varchar(12),
rbknam varchar(60),
rcvact varchar(35),
rcvnam varchar(60),
rcvadr varchar(60),
ropnbk varchar(12),
sbkno varchar(12),
sbknam varchar(60),
sndact varchar(35),
sndnam varchar(60),
sndadr varchar(60),
sopnbk varchar(12),
opccod varchar(4),
srtcbk varchar(6),
srtbnm varchar(60),
rpccod varchar(4),
rpcnam varchar(30),
rrtcbk varchar(6),
rrtbnm varchar(60),
ssetbk varchar(12),
rsetbk varchar(12),
actno varchar(21),
canam varchar(60),
cclno varchar(21),
smr varchar(60),
totnum varchar(6),
totamt varchar(15),
pmtpwd varchar(20),
cntrno varchar(3),
rsvfld varchar(20),
obsqn varchar(11),
oinsqn varchar(7),
oppnam varchar(60),
ogtrno varchar(20),
rpyrac varchar(21),
rpyrna varchar(60),
rpyeac varchar(21),
rpyena varchar(60),
ornamt varchar(15),
cgudty varchar(1),
pdtms varchar(2),
pdamt varchar(15),
ovramt varchar(15),
rfsamt varchar(15),
dmgamt varchar(15),
anlno varchar(3),
loarat varchar(7),
loalmt varchar(5),
filnam varchar(60),
pmbtyp varchar(2),
psttyp varchar(1),
pstsmr varchar(60),
actsqn varchar(3),
drnact varchar(21),
drnnam varchar(60),
tlrid1 varchar(7),
tlrid2 varchar(7),
tlrid3 varchar(7),
tlrid4 varchar(7),
proflg varchar(1),
lstlog varchar(14),
chkflg varchar(1),
trspcd varchar(8),
gtrno varchar(10),
protim varchar(14),
tckno varchar(11),
sumamt varchar(15),
subamt varchar(15),
flag1 varchar(60),
flag2 varchar(60),
flag3 varchar(60),
flag4 varchar(60),
fill varchar(60),
sndfee varchar(6),
outnod varchar(6),
brno varchar(6),
hds_lupt varchar(10) not null,
primary key (logno,actdat)
)compress_method='snappy_1.0';
insert into o_hdfs_sgps_bep_pmsaccbok999(psdbrno,actdat,logno,rpyeac,hds_lupt) values (12433,12423,12423,12423,12423);
insert into o_hdfs_sgps_bep_pmsaccbok999(psdbrno,actdat,logno,rpyeac,hds_lupt) values (15433,15423,15423,15423,15423);
insert into o_hdfs_sgps_bep_pmsaccbok999(actdat,logno,rpyeac,hds_lupt) values (2,3,4,5);
insert into o_hdfs_sgps_bep_pmsaccbok999(actdat,logno,rpyeac,hds_lupt) values (20,30,40,50);
insert into o_hdfs_sgps_bep_pmsaccbok999(psdbrno,actdat,logno,rpyeac,hds_lupt) values (100,200,300,400,500);
select count(*) from o_hdfs_sgps_bep_pmsaccbok999;
count(*)
5
select psdbrno from o_hdfs_sgps_bep_pmsaccbok999;
psdbrno
12433
15433
NULL
NULL
100
select psdbrno,actdat from o_hdfs_sgps_bep_pmsaccbok999;
psdbrno	actdat
12433	12423
15433	15423
NULL	2
NULL	20
100	200
select actdat from o_hdfs_sgps_bep_pmsaccbok999;
actdat
12423
15423
2
20
200
select * from o_hdfs_sgps_bep_pmsaccbok999;
psdbrno	logno	buslog	actdat	bildat	oidate	txndat	srtim	rettim	thddt	txnamt	nodno	retnod	ctlnod	bilsts	txncod	cmtcod	bussqn	rbilcd	rscode	exctm	vchno	vchtyp	vchcmt	prtflg	tprflg	prtcnt	bilno	sub	rpdflg	feetyp	remfee	fee	ccycod	oiflag	bchflg	cdflg	rbkno	rbknam	rcvact	rcvnam	rcvadr	ropnbk	sbkno	sbknam	sndact	sndnam	sndadr	sopnbk	opccod	srtcbk	srtbnm	rpccod	rpcnam	rrtcbk	rrtbnm	ssetbk	rsetbk	actno	canam	cclno	smr	totnum	totamt	pmtpwd	cntrno	rsvfld	obsqn	oinsqn	oppnam	ogtrno	rpyrac	rpyrna	rpyeac	rpyena	ornamt	cgudty	pdtms	pdamt	ovramt	rfsamt	dmgamt	anlno	loarat	loalmt	filnam	pmbtyp	psttyp	pstsmr	actsqn	drnact	drnnam	tlrid1	tlrid2	tlrid3	tlrid4	proflg	lstlog	chkflg	trspcd	gtrno	protim	tckno	sumamt	subamt	flag1	flag2	flag3	flag4	fill	sndfee	outnod	brno	hds_lupt
12433	12423	NULL	12423	NULL	NULL	NULL	NULL	NULL	NULL	NULL	NULL	NULL	NULL	NULL	NULL	NULL	NULL	NULL	NULL	NULL	NULL	NULL	NULL	NULL	NULL	NULL	NULL	NULL	NULL	NULL	NULL	NULL	NULL	NULL	NULL	NULL	NULL	NULL	NULL	NULL	NULL	NULL	NULL	NULL	NULL	NULL	NULL	NULL	NULL	NULL	NULL	NULL	NULL	NULL	NULL	NULL	NULL	NULL	NULL	NULL	NULL	NULL	NULL	NULL	NULL	NULL	NULL	NULL	NULL	NULL	NULL	NULL	12423	NULL	NULL	NULL	NULL	NULL	NULL	NULL	NULL	NULL	NULL	NULL	NULL	NULL	NULL	NULL	NULL	NULL	NULL	NULL	NULL	NULL	NULL	NULL	NULL	NULL	NULL	NULL	NULL	NULL	NULL	NULL	NULL	NULL	NULL	NULL	NULL	NULL	NULL	NULL	12423
15433	15423	NULL	15423	NULL	NULL	NULL	NULL	NULL	NULL	NULL	NULL	NULL	NULL	NULL	NULL	NULL	NULL	NULL	NULL	NULL	NULL	NULL	NULL	NULL	NULL	NULL	NULL	NULL	NULL	NULL	NULL	NULL	NULL	NULL	NULL	NULL	NULL	NULL	NULL	NULL	NULL	NULL	NULL	NULL	NULL	NULL	NULL	NULL	NULL	NULL	NULL	NULL	NULL	NULL	NULL	NULL	NULL	NULL	NULL	NULL	NULL	NULL	NULL	NULL	NULL	NULL	NULL	NULL	NULL	NULL	NULL	NULL	15423	NULL	NULL	NULL	NULL	NULL	NULL	NULL	NULL	NULL	NULL	NULL	NULL	NULL	NULL	NULL	NULL	NULL	NULL	NULL	NULL	NULL	NULL	NULL	NULL	NULL	NULL	NULL	NULL	NULL	NULL	NULL	NULL	NULL	NULL	NULL	NULL	NULL	NULL	NULL	15423
NULL	3	NULL	2	NULL	NULL	NULL	NULL	NULL	NULL	NULL	NULL	NULL	NULL	NULL	NULL	NULL	NULL	NULL	NULL	NULL	NULL	NULL	NULL	NULL	NULL	NULL	NULL	NULL	NULL	NULL	NULL	NULL	NULL	NULL	NULL	NULL	NULL	NULL	NULL	NULL	NULL	NULL	NULL	NULL	NULL	NULL	NULL	NULL	NULL	NULL	NULL	NULL	NULL	NULL	NULL	NULL	NULL	NULL	NULL	NULL	NULL	NULL	NULL	NULL	NULL	NULL	NULL	NULL	NULL	NULL	NULL	NULL	4	NULL	NULL	NULL	NULL	NULL	NULL	NULL	NULL	NULL	NULL	NULL	NULL	NULL	NULL	NULL	NULL	NULL	NULL	NULL	NULL	NULL	NULL	NULL	NULL	NULL	NULL	NULL	NULL	NULL	NULL	NULL	NULL	NULL	NULL	NULL	NULL	NULL	NULL	NULL	5
NULL	30	NULL	20	NULL	NULL	NULL	NULL	NULL	NULL	NULL	NULL	NULL	NULL	NULL	NULL	NULL	NULL	NULL	NULL	NULL	NULL	NULL	NULL	NULL	NULL	NULL	NULL	NULL	NULL	NULL	NULL	NULL	NULL	NULL	NULL	NULL	NULL	NULL	NULL	NULL	NULL	NULL	NULL	NULL	NULL	NULL	NULL	NULL	NULL	NULL	NULL	NULL	NULL	NULL	NULL	NULL	NULL	NULL	NULL	NULL	NULL	NULL	NULL	NULL	NULL	NULL	NULL	NULL	NULL	NULL	NULL	NULL	40	NULL	NULL	NULL	NULL	NULL	NULL	NULL	NULL	NULL	NULL	NULL	NULL	NULL	NULL	NULL	NULL	NULL	NULL	NULL	NULL	NULL	NULL	NULL	NULL	NULL	NULL	NULL	NULL	NULL	NULL	NULL	NULL	NULL	NULL	NULL	NULL	NULL	NULL	NULL	50
100	300	NULL	200	NULL	NULL	NULL	NULL	NULL	NULL	NULL	NULL	NULL	NULL	NULL	NULL	NULL	NULL	NULL	NULL	NULL	NULL	NULL	NULL	NULL	NULL	NULL	NULL	NULL	NULL	NULL	NULL	NULL	NULL	NULL	NULL	NULL	NULL	NULL	NULL	NULL	NULL	NULL	NULL	NULL	NULL	NULL	NULL	NULL	NULL	NULL	NULL	NULL	NULL	NULL	NULL	NULL	NULL	NULL	NULL	NULL	NULL	NULL	NULL	NULL	NULL	NULL	NULL	NULL	NULL	NULL	NULL	NULL	400	NULL	NULL	NULL	NULL	NULL	NULL	NULL	NULL	NULL	NULL	NULL	NULL	NULL	NULL	NULL	NULL	NULL	NULL	NULL	NULL	NULL	NULL	NULL	NULL	NULL	NULL	NULL	NULL	NULL	NULL	NULL	NULL	NULL	NULL	NULL	NULL	NULL	NULL	NULL	500
alter system set min_drop_cache_wait_time='10s' server_type=yaodatasvr;
"merge"
major_freeze...
select count(*) from o_hdfs_sgps_bep_pmsaccbok999;
count(*)
5
select psdbrno from o_hdfs_sgps_bep_pmsaccbok999;
psdbrno
12433
15433
NULL
NULL
100
select psdbrno,actdat from o_hdfs_sgps_bep_pmsaccbok999;
psdbrno	actdat
12433	12423
15433	15423
NULL	2
NULL	20
100	200
select actdat from o_hdfs_sgps_bep_pmsaccbok999;
actdat
12423
15423
2
20
200
select * from o_hdfs_sgps_bep_pmsaccbok999;
psdbrno	logno	buslog	actdat	bildat	oidate	txndat	srtim	rettim	thddt	txnamt	nodno	retnod	ctlnod	bilsts	txncod	cmtcod	bussqn	rbilcd	rscode	exctm	vchno	vchtyp	vchcmt	prtflg	tprflg	prtcnt	bilno	sub	rpdflg	feetyp	remfee	fee	ccycod	oiflag	bchflg	cdflg	rbkno	rbknam	rcvact	rcvnam	rcvadr	ropnbk	sbkno	sbknam	sndact	sndnam	sndadr	sopnbk	opccod	srtcbk	srtbnm	rpccod	rpcnam	rrtcbk	rrtbnm	ssetbk	rsetbk	actno	canam	cclno	smr	totnum	totamt	pmtpwd	cntrno	rsvfld	obsqn	oinsqn	oppnam	ogtrno	rpyrac	rpyrna	rpyeac	rpyena	ornamt	cgudty	pdtms	pdamt	ovramt	rfsamt	dmgamt	anlno	loarat	loalmt	filnam	pmbtyp	psttyp	pstsmr	actsqn	drnact	drnnam	tlrid1	tlrid2	tlrid3	tlrid4	proflg	lstlog	chkflg	trspcd	gtrno	protim	tckno	sumamt	subamt	flag1	flag2	flag3	flag4	fill	sndfee	outnod	brno	hds_lupt
12433	12423	NULL	12423	NULL	NULL	NULL	NULL	NULL	NULL	NULL	NULL	NULL	NULL	NULL	NULL	NULL	NULL	NULL	NULL	NULL	NULL	NULL	NULL	NULL	NULL	NULL	NULL	NULL	NULL	NULL	NULL	NULL	NULL	NULL	NULL	NULL	NULL	NULL	NULL	NULL	NULL	NULL	NULL	NULL	NULL	NULL	NULL	NULL	NULL	NULL	NULL	NULL	NULL	NULL	NULL	NULL	NULL	NULL	NULL	NULL	NULL	NULL	NULL	NULL	NULL	NULL	NULL	NULL	NULL	NULL	NULL	NULL	12423	NULL	NULL	NULL	NULL	NULL	NULL	NULL	NULL	NULL	NULL	NULL	NULL	NULL	NULL	NULL	NULL	NULL	NULL	NULL	NULL	NULL	NULL	NULL	NULL	NULL	NULL	NULL	NULL	NULL	NULL	NULL	NULL	NULL	NULL	NULL	NULL	NULL	NULL	NULL	12423
15433	15423	NULL	15423	NULL	NULL	NULL	NULL	NULL	NULL	NULL	NULL	NULL	NULL	NULL	NULL	NULL	NULL	NULL	NULL	NULL	NULL	NULL	NULL	NULL	NULL	NULL	NULL	NULL	NULL	NULL	NULL	NULL	NULL	NULL	NULL	NULL	NULL	NULL	NULL	NULL	NULL	NULL	NULL	NULL	NULL	NULL	NULL	NULL	NULL	NULL	NULL	NULL	NULL	NULL	NULL	NULL	NULL	NULL	NULL	NULL	NULL	NULL	NULL	NULL	NULL	NULL	NULL	NULL	NULL	NULL	NULL	NULL	15423	NULL	NULL	NULL	NULL	NULL	NULL	NULL	NULL	NULL	NULL	NULL	NULL	NULL	NULL	NULL	NULL	NULL	NULL	NULL	NULL	NULL	NULL	NULL	NULL	NULL	NULL	NULL	NULL	NULL	NULL	NULL	NULL	NULL	NULL	NULL	NULL	NULL	NULL	NULL	15423
NULL	3	NULL	2	NULL	NULL	NULL	NULL	NULL	NULL	NULL	NULL	NULL	NULL	NULL	NULL	NULL	NULL	NULL	NULL	NULL	NULL	NULL	NULL	NULL	NULL	NULL	NULL	NULL	NULL	NULL	NULL	NULL	NULL	NULL	NULL	NULL	NULL	NULL	NULL	NULL	NULL	NULL	NULL	NULL	NULL	NULL	NULL	NULL	NULL	NULL	NULL	NULL	NULL	NULL	NULL	NULL	NULL	NULL	NULL	NULL	NULL	NULL	NULL	NULL	NULL	NULL	NULL	NULL	NULL	NULL	NULL	NULL	4	NULL	NULL	NULL	NULL	NULL	NULL	NULL	NULL	NULL	NULL	NULL	NULL	NULL	NULL	NULL	NULL	NULL	NULL	NULL	NULL	NULL	NULL	NULL	NULL	NULL	NULL	NULL	NULL	NULL	NULL	NULL	NULL	NULL	NULL	NULL	NULL	NULL	NULL	NULL	5
NULL	30	NULL	20	NULL	NULL	NULL	NULL	NULL	NULL	NULL	NULL	NULL	NULL	NULL	NULL	NULL	NULL	NULL	NULL	NULL	NULL	NULL	NULL	NULL	NULL	NULL	NULL	NULL	NULL	NULL	NULL	NULL	NULL	NULL	NULL	NULL	NULL	NULL	NULL	NULL	NULL	NULL	NULL	NULL	NULL	NULL	NULL	NULL	NULL	NULL	NULL	NULL	NULL	NULL	NULL	NULL	NULL	NULL	NULL	NULL	NULL	NULL	NULL	NULL	NULL	NULL	NULL	NULL	NULL	NULL	NULL	NULL	40	NULL	NULL	NULL	NULL	NULL	NULL	NULL	NULL	NULL	NULL	NULL	NULL	NULL	NULL	NULL	NULL	NULL	NULL	NULL	NULL	NULL	NULL	NULL	NULL	NULL	NULL	NULL	NULL	NULL	NULL	NULL	NULL	NULL	NULL	NULL	NULL	NULL	NULL	NULL	50
100	300	NULL	200	NULL	NULL	NULL	NULL	NULL	NULL	NULL	NULL	NULL	NULL	NULL	NULL	NULL	NULL	NULL	NULL	NULL	NULL	NULL	NULL	NULL	NULL	NULL	NULL	NULL	NULL	NULL	NULL	NULL	NULL	NULL	NULL	NULL	NULL	NULL	NULL	NULL	NULL	NULL	NULL	NULL	NULL	NULL	NULL	NULL	NULL	NULL	NULL	NULL	NULL	NULL	NULL	NULL	NULL	NULL	NULL	NULL	NULL	NULL	NULL	NULL	NULL	NULL	NULL	NULL	NULL	NULL	NULL	NULL	400	NULL	NULL	NULL	NULL	NULL	NULL	NULL	NULL	NULL	NULL	NULL	NULL	NULL	NULL	NULL	NULL	NULL	NULL	NULL	NULL	NULL	NULL	NULL	NULL	NULL	NULL	NULL	NULL	NULL	NULL	NULL	NULL	NULL	NULL	NULL	NULL	NULL	NULL	NULL	500
alter system set min_drop_cache_wait_time='10s' server_type=yaodatasvr;
"merge"
major_freeze...
select count(*) from o_hdfs_sgps_bep_pmsaccbok999;
count(*)
5
select psdbrno from o_hdfs_sgps_bep_pmsaccbok999;
psdbrno
12433
15433
NULL
NULL
100
select psdbrno,actdat from o_hdfs_sgps_bep_pmsaccbok999;
psdbrno	actdat
12433	12423
15433	15423
NULL	2
NULL	20
100	200
select actdat from o_hdfs_sgps_bep_pmsaccbok999;
actdat
12423
15423
2
20
200
select * from o_hdfs_sgps_bep_pmsaccbok999;
psdbrno	logno	buslog	actdat	bildat	oidate	txndat	srtim	rettim	thddt	txnamt	nodno	retnod	ctlnod	bilsts	txncod	cmtcod	bussqn	rbilcd	rscode	exctm	vchno	vchtyp	vchcmt	prtflg	tprflg	prtcnt	bilno	sub	rpdflg	feetyp	remfee	fee	ccycod	oiflag	bchflg	cdflg	rbkno	rbknam	rcvact	rcvnam	rcvadr	ropnbk	sbkno	sbknam	sndact	sndnam	sndadr	sopnbk	opccod	srtcbk	srtbnm	rpccod	rpcnam	rrtcbk	rrtbnm	ssetbk	rsetbk	actno	canam	cclno	smr	totnum	totamt	pmtpwd	cntrno	rsvfld	obsqn	oinsqn	oppnam	ogtrno	rpyrac	rpyrna	rpyeac	rpyena	ornamt	cgudty	pdtms	pdamt	ovramt	rfsamt	dmgamt	anlno	loarat	loalmt	filnam	pmbtyp	psttyp	pstsmr	actsqn	drnact	drnnam	tlrid1	tlrid2	tlrid3	tlrid4	proflg	lstlog	chkflg	trspcd	gtrno	protim	tckno	sumamt	subamt	flag1	flag2	flag3	flag4	fill	sndfee	outnod	brno	hds_lupt
12433	12423	NULL	12423	NULL	NULL	NULL	NULL	NULL	NULL	NULL	NULL	NULL	NULL	NULL	NULL	NULL	NULL	NULL	NULL	NULL	NULL	NULL	NULL	NULL	NULL	NULL	NULL	NULL	NULL	NULL	NULL	NULL	NULL	NULL	NULL	NULL	NULL	NULL	NULL	NULL	NULL	NULL	NULL	NULL	NULL	NULL	NULL	NULL	NULL	NULL	NULL	NULL	NULL	NULL	NULL	NULL	NULL	NULL	NULL	NULL	NULL	NULL	NULL	NULL	NULL	NULL	NULL	NULL	NULL	NULL	NULL	NULL	12423	NULL	NULL	NULL	NULL	NULL	NULL	NULL	NULL	NULL	NULL	NULL	NULL	NULL	NULL	NULL	NULL	NULL	NULL	NULL	NULL	NULL	NULL	NULL	NULL	NULL	NULL	NULL	NULL	NULL	NULL	NULL	NULL	NULL	NULL	NULL	NULL	NULL	NULL	NULL	12423
15433	15423	NULL	15423	NULL	NULL	NULL	NULL	NULL	NULL	NULL	NULL	NULL	NULL	NULL	NULL	NULL	NULL	NULL	NULL	NULL	NULL	NULL	NULL	NULL	NULL	NULL	NULL	NULL	NULL	NULL	NULL	NULL	NULL	NULL	NULL	NULL	NULL	NULL	NULL	NULL	NULL	NULL	NULL	NULL	NULL	NULL	NULL	NULL	NULL	NULL	NULL	NULL	NULL	NULL	NULL	NULL	NULL	NULL	NULL	NULL	NULL	NULL	NULL	NULL	NULL	NULL	NULL	NULL	NULL	NULL	NULL	NULL	15423	NULL	NULL	NULL	NULL	NULL	NULL	NULL	NULL	NULL	NULL	NULL	NULL	NULL	NULL	NULL	NULL	NULL	NULL	NULL	NULL	NULL	NULL	NULL	NULL	NULL	NULL	NULL	NULL	NULL	NULL	NULL	NULL	NULL	NULL	NULL	NULL	NULL	NULL	NULL	15423
NULL	3	NULL	2	NULL	NULL	NULL	NULL	NULL	NULL	NULL	NULL	NULL	NULL	NULL	NULL	NULL	NULL	NULL	NULL	NULL	NULL	NULL	NULL	NULL	NULL	NULL	NULL	NULL	NULL	NULL	NULL	NULL	NULL	NULL	NULL	NULL	NULL	NULL	NULL	NULL	NULL	NULL	NULL	NULL	NULL	NULL	NULL	NULL	NULL	NULL	NULL	NULL	NULL	NULL	NULL	NULL	NULL	NULL	NULL	NULL	NULL	NULL	NULL	NULL	NULL	NULL	NULL	NULL	NULL	NULL	NULL	NULL	4	NULL	NULL	NULL	NULL	NULL	NULL	NULL	NULL	NULL	NULL	NULL	NULL	NULL	NULL	NULL	NULL	NULL	NULL	NULL	NULL	NULL	NULL	NULL	NULL	NULL	NULL	NULL	NULL	NULL	NULL	NULL	NULL	NULL	NULL	NULL	NULL	NULL	NULL	NULL	5
NULL	30	NULL	20	NULL	NULL	NULL	NULL	NULL	NULL	NULL	NULL	NULL	NULL	NULL	NULL	NULL	NULL	NULL	NULL	NULL	NULL	NULL	NULL	NULL	NULL	NULL	NULL	NULL	NULL	NULL	NULL	NULL	NULL	NULL	NULL	NULL	NULL	NULL	NULL	NULL	NULL	NULL	NULL	NULL	NULL	NULL	NULL	NULL	NULL	NULL	NULL	NULL	NULL	NULL	NULL	NULL	NULL	NULL	NULL	NULL	NULL	NULL	NULL	NULL	NULL	NULL	NULL	NULL	NULL	NULL	NULL	NULL	40	NULL	NULL	NULL	NULL	NULL	NULL	NULL	NULL	NULL	NULL	NULL	NULL	NULL	NULL	NULL	NULL	NULL	NULL	NULL	NULL	NULL	NULL	NULL	NULL	NULL	NULL	NULL	NULL	NULL	NULL	NULL	NULL	NULL	NULL	NULL	NULL	NULL	NULL	NULL	50
100	300	NULL	200	NULL	NULL	NULL	NULL	NULL	NULL	NULL	NULL	NULL	NULL	NULL	NULL	NULL	NULL	NULL	NULL	NULL	NULL	NULL	NULL	NULL	NULL	NULL	NULL	NULL	NULL	NULL	NULL	NULL	NULL	NULL	NULL	NULL	NULL	NULL	NULL	NULL	NULL	NULL	NULL	NULL	NULL	NULL	NULL	NULL	NULL	NULL	NULL	NULL	NULL	NULL	NULL	NULL	NULL	NULL	NULL	NULL	NULL	NULL	NULL	NULL	NULL	NULL	NULL	NULL	NULL	NULL	NULL	NULL	400	NULL	NULL	NULL	NULL	NULL	NULL	NULL	NULL	NULL	NULL	NULL	NULL	NULL	NULL	NULL	NULL	NULL	NULL	NULL	NULL	NULL	NULL	NULL	NULL	NULL	NULL	NULL	NULL	NULL	NULL	NULL	NULL	NULL	NULL	NULL	NULL	NULL	NULL	NULL	500
insert into o_hdfs_sgps_bep_pmsaccbok999(psdbrno,actdat,logno,rpyeac,hds_lupt) values (1000,2000,3000,4000,5000);
insert into o_hdfs_sgps_bep_pmsaccbok999(actdat,logno,rpyeac,hds_lupt) values (2100,2200,2300,2400);
select count(*) from o_hdfs_sgps_bep_pmsaccbok999;
count(*)
7
select psdbrno from o_hdfs_sgps_bep_pmsaccbok999;
psdbrno
12433
15433
NULL
NULL
NULL
100
1000
select psdbrno,actdat from o_hdfs_sgps_bep_pmsaccbok999;
psdbrno	actdat
12433	12423
15433	15423
NULL	2100
NULL	2
NULL	20
100	200
1000	2000
select actdat from o_hdfs_sgps_bep_pmsaccbok999;
actdat
12423
15423
2100
2
20
200
2000
select * from o_hdfs_sgps_bep_pmsaccbok999;
psdbrno	logno	buslog	actdat	bildat	oidate	txndat	srtim	rettim	thddt	txnamt	nodno	retnod	ctlnod	bilsts	txncod	cmtcod	bussqn	rbilcd	rscode	exctm	vchno	vchtyp	vchcmt	prtflg	tprflg	prtcnt	bilno	sub	rpdflg	feetyp	remfee	fee	ccycod	oiflag	bchflg	cdflg	rbkno	rbknam	rcvact	rcvnam	rcvadr	ropnbk	sbkno	sbknam	sndact	sndnam	sndadr	sopnbk	opccod	srtcbk	srtbnm	rpccod	rpcnam	rrtcbk	rrtbnm	ssetbk	rsetbk	actno	canam	cclno	smr	totnum	totamt	pmtpwd	cntrno	rsvfld	obsqn	oinsqn	oppnam	ogtrno	rpyrac	rpyrna	rpyeac	rpyena	ornamt	cgudty	pdtms	pdamt	ovramt	rfsamt	dmgamt	anlno	loarat	loalmt	filnam	pmbtyp	psttyp	pstsmr	actsqn	drnact	drnnam	tlrid1	tlrid2	tlrid3	tlrid4	proflg	lstlog	chkflg	trspcd	gtrno	protim	tckno	sumamt	subamt	flag1	flag2	flag3	flag4	fill	sndfee	outnod	brno	hds_lupt
12433	12423	NULL	12423	NULL	NULL	NULL	NULL	NULL	NULL	NULL	NULL	NULL	NULL	NULL	NULL	NULL	NULL	NULL	NULL	NULL	NULL	NULL	NULL	NULL	NULL	NULL	NULL	NULL	NULL	NULL	NULL	NULL	NULL	NULL	NULL	NULL	NULL	NULL	NULL	NULL	NULL	NULL	NULL	NULL	NULL	NULL	NULL	NULL	NULL	NULL	NULL	NULL	NULL	NULL	NULL	NULL	NULL	NULL	NULL	NULL	NULL	NULL	NULL	NULL	NULL	NULL	NULL	NULL	NULL	NULL	NULL	NULL	12423	NULL	NULL	NULL	NULL	NULL	NULL	NULL	NULL	NULL	NULL	NULL	NULL	NULL	NULL	NULL	NULL	NULL	NULL	NULL	NULL	NULL	NULL	NULL	NULL	NULL	NULL	NULL	NULL	NULL	NULL	NULL	NULL	NULL	NULL	NULL	NULL	NULL	NULL	NULL	12423
15433	15423	NULL	15423	NULL	NULL	NULL	NULL	NULL	NULL	NULL	NULL	NULL	NULL	NULL	NULL	NULL	NULL	NULL	NULL	NULL	NULL	NULL	NULL	NULL	NULL	NULL	NULL	NULL	NULL	NULL	NULL	NULL	NULL	NULL	NULL	NULL	NULL	NULL	NULL	NULL	NULL	NULL	NULL	NULL	NULL	NULL	NULL	NULL	NULL	NULL	NULL	NULL	NULL	NULL	NULL	NULL	NULL	NULL	NULL	NULL	NULL	NULL	NULL	NULL	NULL	NULL	NULL	NULL	NULL	NULL	NULL	NULL	15423	NULL	NULL	NULL	NULL	NULL	NULL	NULL	NULL	NULL	NULL	NULL	NULL	NULL	NULL	NULL	NULL	NULL	NULL	NULL	NULL	NULL	NULL	NULL	NULL	NULL	NULL	NULL	NULL	NULL	NULL	NULL	NULL	NULL	NULL	NULL	NULL	NULL	NULL	NULL	15423
NULL	2200	NULL	2100	NULL	NULL	NULL	NULL	NULL	NULL	NULL	NULL	NULL	NULL	NULL	NULL	NULL	NULL	NULL	NULL	NULL	NULL	NULL	NULL	NULL	NULL	NULL	NULL	NULL	NULL	NULL	NULL	NULL	NULL	NULL	NULL	NULL	NULL	NULL	NULL	NULL	NULL	NULL	NULL	NULL	NULL	NULL	NULL	NULL	NULL	NULL	NULL	NULL	NULL	NULL	NULL	NULL	NULL	NULL	NULL	NULL	NULL	NULL	NULL	NULL	NULL	NULL	NULL	NULL	NULL	NULL	NULL	NULL	2300	NULL	NULL	NULL	NULL	NULL	NULL	NULL	NULL	NULL	NULL	NULL	NULL	NULL	NULL	NULL	NULL	NULL	NULL	NULL	NULL	NULL	NULL	NULL	NULL	NULL	NULL	NULL	NULL	NULL	NULL	NULL	NULL	NULL	NULL	NULL	NULL	NULL	NULL	NULL	2400
NULL	3	NULL	2	NULL	NULL	NULL	NULL	NULL	NULL	NULL	NULL	NULL	NULL	NULL	NULL	NULL	NULL	NULL	NULL	NULL	NULL	NULL	NULL	NULL	NULL	NULL	NULL	NULL	NULL	NULL	NULL	NULL	NULL	NULL	NULL	NULL	NULL	NULL	NULL	NULL	NULL	NULL	NULL	NULL	NULL	NULL	NULL	NULL	NULL	NULL	NULL	NULL	NULL	NULL	NULL	NULL	NULL	NULL	NULL	NULL	NULL	NULL	NULL	NULL	NULL	NULL	NULL	NULL	NULL	NULL	NULL	NULL	4	NULL	NULL	NULL	NULL	NULL	NULL	NULL	NULL	NULL	NULL	NULL	NULL	NULL	NULL	NULL	NULL	NULL	NULL	NULL	NULL	NULL	NULL	NULL	NULL	NULL	NULL	NULL	NULL	NULL	NULL	NULL	NULL	NULL	NULL	NULL	NULL	NULL	NULL	NULL	5
NULL	30	NULL	20	NULL	NULL	NULL	NULL	NULL	NULL	NULL	NULL	NULL	NULL	NULL	NULL	NULL	NULL	NULL	NULL	NULL	NULL	NULL	NULL	NULL	NULL	NULL	NULL	NULL	NULL	NULL	NULL	NULL	NULL	NULL	NULL	NULL	NULL	NULL	NULL	NULL	NULL	NULL	NULL	NULL	NULL	NULL	NULL	NULL	NULL	NULL	NULL	NULL	NULL	NULL	NULL	NULL	NULL	NULL	NULL	NULL	NULL	NULL	NULL	NULL	NULL	NULL	NULL	NULL	NULL	NULL	NULL	NULL	40	NULL	NULL	NULL	NULL	NULL	NULL	NULL	NULL	NULL	NULL	NULL	NULL	NULL	NULL	NULL	NULL	NULL	NULL	NULL	NULL	NULL	NULL	NULL	NULL	NULL	NULL	NULL	NULL	NULL	NULL	NULL	NULL	NULL	NULL	NULL	NULL	NULL	NULL	NULL	50
100	300	NULL	200	NULL	NULL	NULL	NULL	NULL	NULL	NULL	NULL	NULL	NULL	NULL	NULL	NULL	NULL	NULL	NULL	NULL	NULL	NULL	NULL	NULL	NULL	NULL	NULL	NULL	NULL	NULL	NULL	NULL	NULL	NULL	NULL	NULL	NULL	NULL	NULL	NULL	NULL	NULL	NULL	NULL	NULL	NULL	NULL	NULL	NULL	NULL	NULL	NULL	NULL	NULL	NULL	NULL	NULL	NULL	NULL	NULL	NULL	NULL	NULL	NULL	NULL	NULL	NULL	NULL	NULL	NULL	NULL	NULL	400	NULL	NULL	NULL	NULL	NULL	NULL	NULL	NULL	NULL	NULL	NULL	NULL	NULL	NULL	NULL	NULL	NULL	NULL	NULL	NULL	NULL	NULL	NULL	NULL	NULL	NULL	NULL	NULL	NULL	NULL	NULL	NULL	NULL	NULL	NULL	NULL	NULL	NULL	NULL	500
1000	3000	NULL	2000	NULL	NULL	NULL	NULL	NULL	NULL	NULL	NULL	NULL	NULL	NULL	NULL	NULL	NULL	NULL	NULL	NULL	NULL	NULL	NULL	NULL	NULL	NULL	NULL	NULL	NULL	NULL	NULL	NULL	NULL	NULL	NULL	NULL	NULL	NULL	NULL	NULL	NULL	NULL	NULL	NULL	NULL	NULL	NULL	NULL	NULL	NULL	NULL	NULL	NULL	NULL	NULL	NULL	NULL	NULL	NULL	NULL	NULL	NULL	NULL	NULL	NULL	NULL	NULL	NULL	NULL	NULL	NULL	NULL	4000	NULL	NULL	NULL	NULL	NULL	NULL	NULL	NULL	NULL	NULL	NULL	NULL	NULL	NULL	NULL	NULL	NULL	NULL	NULL	NULL	NULL	NULL	NULL	NULL	NULL	NULL	NULL	NULL	NULL	NULL	NULL	NULL	NULL	NULL	NULL	NULL	NULL	NULL	NULL	5000
