'conn1'
alter system set max_row_cell_num = 3 server_type=yaotxnsvr;
create table t1 (c1 int primary key,c2 int,c3 int,c4 int,c5 int);
create table t2 (c1 int primary key,c2 int,c3 int,c4 int,c5 int);
truncate table t1;
begin;
replace into t2 values(1,1,1,1,1);
'conn2'
replace into t1 values(1,2,3,4,5);
replace into t1 values(1,20,30,40,50);
'conn1'
update t1 set c2 = 200 where c1 = 1;
commit;
select /*+READ_CONSISTENCY(STRONG)*/ * from t1;
c1	c2	c3	c4	c5
1	200	30	40	50
select /*+READ_CONSISTENCY(WEAK)*/ * from t1;
c1	c2	c3	c4	c5
1	200	30	40	50
select /*+READ_CONSISTENCY(WEAK)*/ * from t1;
c1	c2	c3	c4	c5
1	200	30	40	50
select /*+READ_CONSISTENCY(WEAK)*/ * from t1;
c1	c2	c3	c4	c5
1	200	30	40	50
select /*+READ_CONSISTENCY(WEAK)*/ * from t1;
c1	c2	c3	c4	c5
1	200	30	40	50
select /*+READ_CONSISTENCY(WEAK)*/ * from t1;
c1	c2	c3	c4	c5
1	200	30	40	50
select /*+READ_CONSISTENCY(WEAK)*/ * from t1;
c1	c2	c3	c4	c5
1	200	30	40	50
select /*+READ_CONSISTENCY(WEAK)*/ * from t1;
c1	c2	c3	c4	c5
1	200	30	40	50
select /*+READ_CONSISTENCY(WEAK)*/ * from t1;
c1	c2	c3	c4	c5
1	200	30	40	50
select /*+READ_CONSISTENCY(WEAK)*/ * from t1;
c1	c2	c3	c4	c5
1	200	30	40	50
select /*+READ_CONSISTENCY(WEAK)*/ * from t1;
c1	c2	c3	c4	c5
1	200	30	40	50
select /*+READ_CONSISTENCY(WEAK)*/ * from t1;
c1	c2	c3	c4	c5
1	200	30	40	50
select /*+READ_CONSISTENCY(WEAK)*/ * from t1;
c1	c2	c3	c4	c5
1	200	30	40	50
select /*+READ_CONSISTENCY(WEAK)*/ * from t1;
c1	c2	c3	c4	c5
1	200	30	40	50
select /*+READ_CONSISTENCY(WEAK)*/ * from t1;
c1	c2	c3	c4	c5
1	200	30	40	50
truncate table t2;
begin;
replace into t1 values(1,1,1,1,1);
'conn2'
replace into t2 values(10,2,3,4,5);
replace into t2 values(10,20,30,40,50);
'conn1'
update t2 set c2 = 200 where c1 = 10;
commit;
select /*+READ_CONSISTENCY(STRONG)*/ * from t2;
c1	c2	c3	c4	c5
10	200	30	40	50
select /*+READ_CONSISTENCY(WEAK)*/ * from t2;
c1	c2	c3	c4	c5
10	200	30	40	50
select /*+READ_CONSISTENCY(WEAK)*/ * from t2;
c1	c2	c3	c4	c5
10	200	30	40	50
select /*+READ_CONSISTENCY(WEAK)*/ * from t2;
c1	c2	c3	c4	c5
10	200	30	40	50
select /*+READ_CONSISTENCY(WEAK)*/ * from t2;
c1	c2	c3	c4	c5
10	200	30	40	50
select /*+READ_CONSISTENCY(WEAK)*/ * from t2;
c1	c2	c3	c4	c5
10	200	30	40	50
select /*+READ_CONSISTENCY(WEAK)*/ * from t2;
c1	c2	c3	c4	c5
10	200	30	40	50
select /*+READ_CONSISTENCY(WEAK)*/ * from t2;
c1	c2	c3	c4	c5
10	200	30	40	50
select /*+READ_CONSISTENCY(WEAK)*/ * from t2;
c1	c2	c3	c4	c5
10	200	30	40	50
select /*+READ_CONSISTENCY(WEAK)*/ * from t2;
c1	c2	c3	c4	c5
10	200	30	40	50
select /*+READ_CONSISTENCY(WEAK)*/ * from t2;
c1	c2	c3	c4	c5
10	200	30	40	50
select /*+READ_CONSISTENCY(WEAK)*/ * from t2;
c1	c2	c3	c4	c5
10	200	30	40	50
select /*+READ_CONSISTENCY(WEAK)*/ * from t2;
c1	c2	c3	c4	c5
10	200	30	40	50
select /*+READ_CONSISTENCY(WEAK)*/ * from t2;
c1	c2	c3	c4	c5
10	200	30	40	50
select /*+READ_CONSISTENCY(WEAK)*/ * from t2;
c1	c2	c3	c4	c5
10	200	30	40	50
alter system set max_row_cell_num = 32 server_type=yaotxnsvr;
