ALTER SYSTEM SET merge_delay_interval='6s' server_type=yaodatasvr;
ALTER SYSTEM SET major_freeze_wait_time='6s' server_type=yaoadminsvr;
ALTER SYSTEM SET  min_major_freeze_interval='5s' server_type=yaotxnsvr;
ALTER SYSTEM SET min_merge_interval='5s' server_type=yaodatasvr;
ALTER SYSTEM SET  max_merge_thread_num='20' server_type=yaodatasvr;
alter system set balance_max_concurrent_migrate_num=30 server_type=yaoadminsvr;
alter system set balance_max_migrate_in_per_ds=6 server_type=yaoadminsvr;
alter system set balance_max_migrate_out_per_ds=6 server_type=yaoadminsvr;
alter system set max_migrate_task_count=6 server_type=yaodatasvr;
drop table if exists t1;
create table t1(c1 int primary  key,c2 int,c3 int,c4 int);
insert into t1 values(1,1,1,1),(2,2,2,2),(3,3,3,3),(4,4,4,4);
create index idx1 on t1(c1);
create index idx2 on t1(c2);
create index idx3 on t1(c3);
create index idx4 on t1(c4);
alter system set min_drop_cache_wait_time='10s' server_type=yaodatasvr;
merge 
major_freeze...
select * from t1;
c1	c2	c3	c4
1	1	1	1
2	2	2	2
3	3	3	3
4	4	4	4
delete from t1 where c1 > 1;
select * from t1;
c1	c2	c3	c4
1	1	1	1
insert into t1 values(2,2,2,2),(3,3,3,3),(4,4,4,4);
delete from t1 where c1 = 1;
select * from t1;
c1	c2	c3	c4
2	2	2	2
3	3	3	3
4	4	4	4
delete from t1;
select * from t1;
c1	c2	c3	c4
insert into t1 values(1,1,1,1),(2,2,2,2),(3,3,3,3),(4,4,4,4);
select * from t1;
c1	c2	c3	c4
1	1	1	1
2	2	2	2
3	3	3	3
4	4	4	4
delete from t1 where c2 = 1;
select * from t1;
c1	c2	c3	c4
2	2	2	2
3	3	3	3
4	4	4	4
insert into t1 values(1,1,1,1);
select * from t1;
c1	c2	c3	c4
1	1	1	1
2	2	2	2
3	3	3	3
4	4	4	4
delete from t1 where c2 in(1,2,3,4);
select * from t1;
c1	c2	c3	c4
