ALTER SYSTEM SET merge_delay_interval='6s' server_type=yaodatasvr;
ALTER SYSTEM SET major_freeze_wait_time='6s' server_type=yaoadminsvr;
ALTER SYSTEM SET  min_major_freeze_interval='5s' server_type=yaotxnsvr;
ALTER SYSTEM SET min_merge_interval='5s' server_type=yaodatasvr;
ALTER SYSTEM SET  max_merge_thread_num='20' server_type=yaodatasvr;
drop table if exists t1;
drop partition function h;
ERROR HY000: YAO-5077: partition function 'h' doesn't exist
create hash partition function h(x)'x+1';
create table t1(c1 int ,c2 varchar(20),c3 decimal(10,5),c4 int,primary key(c1)) partition by(th1,h,c1);
replace into t1 values(1,'a',1,1),(2,'b',2,2),(3,'c',3,3),(4,'d',4,4);
create index idx1 on t1(c1);
create index idx2 on t1(c2);
create index idx3 on t1(c3);
alter system set min_drop_cache_wait_time='10s' server_type=yaodatasvr;
merge
major_freeze...
__3001__idx__idx1
__3001__idx__idx2
__3001__idx__idx3
show index on t1;
index_name	status	index_type
__3001__idx__idx1	1	0
__3001__idx__idx2	1	0
__3001__idx__idx3	1	0
replace into t1 values(1,'a',1,1),(2,'b',2,2),(3,'c',3,3),(4,'d',4,4);
select * from t1;
c1	c2	c3	c4
1	a	1	1
2	b	2	2
3	c	3	3
4	d	4	4
delete from t1 where c1 > 1;
select * from t1;
c1	c2	c3	c4
1	a	1	1
replace into t1 values(1,'a',1,1),(2,'b',2,2),(3,'c',3,3),(4,'d',4,4);
select * from t1;
c1	c2	c3	c4
1	a	1	1
2	b	2	2
3	c	3	3
4	d	4	4
replace into t1 values(1,'a',1,1),(2,'b',2,2),(3,'c',3,3),(4,'d',4,4);
select * from t1;
c1	c2	c3	c4
1	a	1	1
2	b	2	2
3	c	3	3
4	d	4	4
delete from t1 where c1 = 1;
select * from t1;
c1	c2	c3	c4
2	b	2	2
3	c	3	3
4	d	4	4
replace into t1 values(1,'a',1,1),(2,'b',2,2),(3,'c',3,3),(4,'d',4,4);
select * from t1;
c1	c2	c3	c4
1	a	1	1
2	b	2	2
3	c	3	3
4	d	4	4
replace into t1 values(1,'a',1,1),(2,'b',2,2),(3,'c',3,3),(4,'d',4,4);
select * from t1;
c1	c2	c3	c4
1	a	1	1
2	b	2	2
3	c	3	3
4	d	4	4
delete from t1 where c1 = 1 or c1 = 2 or c1 = 3 or c1 = 4;
select * from t1;
c1	c2	c3	c4
replace into t1 values(1,'a',1,1),(2,'b',2,2),(3,'c',3,3),(4,'d',4,4);
select * from t1;
c1	c2	c3	c4
1	a	1	1
2	b	2	2
3	c	3	3
4	d	4	4
