ALTER SYSTEM SET merge_delay_interval='6s' server_type=yaodatasvr;
ALTER SYSTEM SET major_freeze_wait_time='6s' server_type=yaoadminsvr;
ALTER SYSTEM SET  min_major_freeze_interval='5s' server_type=yaotxnsvr;
ALTER SYSTEM SET min_merge_interval='5s' server_type=yaodatasvr;
ALTER SYSTEM SET  max_merge_thread_num='20' server_type=yaodatasvr;
drop table if exists sbtest;
alter system set min_drop_cache_wait_time='10s' server_type=yaodatasvr;
alter system set each_tablet_sync_meta=False server_type=yaodatasvr;
create table t1(pk int primary key,a int);
insert into t1 values(1,0),(2,0),(4,0),(3,0);
insert into t1 values(0,0);
insert into t1 values(5,0),(6,0),(8,0),(7,0);
update t1 set a=1 where pk = 0;
update t1 set a=1 where pk = 1;
replace into t1(pk,a) values(0,2);
replace into t1(pk,a) values(2,2);
delete from t1 where pk = 2;
delete from t1 where pk = 1;
delete from t1 where pk = 5;
select * from t1;
pk	a
0	2
3	0
4	0
6	0
7	0
8	0
major_freeze...
insert into t1 values(100,0),(200,0),(101,0);
insert into t1 values(102,0);
insert into t1 values(104,0),(103,0);
insert into t1 values(2,0);
update t1 set a=1 where pk = 7;
update t1 set a=1 where pk = 3;
delete from t1 where pk = 0
delete from t1 where pk = 7;
ERROR 42000: YAO-5001: You have an error in your SQL syntax; check the manual that corresponds to your YaoBase version for the right syntax 
delete from t1 where pk = 103;
select * from t1;
pk	a
0	2
2	0
3	1
4	0
6	0
7	1
8	0
100	0
101	0
102	0
104	0
200	0
major_freeze...
insert into t1 values(0,0),(7,0);
ERROR 23000: YAO-5024: Duplicate entry ' <3001.16>=int32:0' for key 'PRIMARY'
insert into t1 values(307,0),(103,0);
insert into t1 values(300,0),(305,0),(301,0);
insert into t1 values(302,0);
insert into t1 values(304,0),(303,0);
update t1 set a=1 where pk = 7;
update t1 set a=1 where pk = 3;
update t1 set a=1 where pk = 102;
update t1 set a=1 where pk = 101;
delete from t1 where pk = 4;
delete from t1 where pk = 200;
delete from t1 where pk = 300;
select * from t1;
pk	a
0	2
2	0
3	1
6	0
7	1
8	0
100	0
101	1
102	1
103	0
104	0
301	0
302	0
303	0
304	0
305	0
307	0
drop table t1;
