ALTER SYSTEM SET merge_delay_interval='6s' server_type=yaodatasvr;
ALTER SYSTEM SET major_freeze_wait_time='6s' server_type=yaoadminsvr;
ALTER SYSTEM SET  min_major_freeze_interval='5s' server_type=yaotxnsvr;
ALTER SYSTEM SET min_merge_interval='5s' server_type=yaodatasvr;
ALTER SYSTEM SET  max_merge_thread_num='20' server_type=yaodatasvr;
drop table if exists sbtest;
create table sbtest (id integer not null,name varchar(30),whenn datetime,k integer default 0 not null,pad char(60) default '' not null,whenn1 datetime,stat1 bool,primary key (id,name,whenn));
insert 100 rows to ups
insert into sbtest(id,name,whenn,k,pad,whenn1) values (1,'junyue','2013-1-6 14:44:00',1,'qqqqqqqqqqwwwwwwwwwweeeeeeeeeerrrrrrrrrrtttttttttt','2013-1-7 14:44:00');
insert into sbtest(id,name,whenn,k,pad,whenn1) values (2,'junyue','2013-1-6 14:44:00',1,'qqqqqqqqqqwwwwwwwwwweeeeeeeeeerrrrrrrrrrtttttttttt','2013-1-7 14:44:00');
insert into sbtest(id,name,whenn,k,pad,whenn1) values (3,'junyue','2013-1-6 14:44:00',1,'qqqqqqqqqqwwwwwwwwwweeeeeeeeeerrrrrrrrrrtttttttttt','2013-1-7 14:44:00');
insert into sbtest(id,name,whenn,k,pad,whenn1) values (4,'junyue','2013-1-6 14:44:00',1,'qqqqqqqqqqwwwwwwwwwweeeeeeeeeerrrrrrrrrrtttttttttt','2013-1-7 14:44:00');
insert into sbtest(id,name,whenn,k,pad,whenn1) values (5,'junyue','2013-1-6 14:44:00',1,'qqqqqqqqqqwwwwwwwwwweeeeeeeeeerrrrrrrrrrtttttttttt','2013-1-7 14:44:00');
insert into sbtest(id,name,whenn,k,pad,whenn1) values (6,'junyue','2013-1-6 14:44:00',1,'qqqqqqqqqqwwwwwwwwwweeeeeeeeeerrrrrrrrrrtttttttttt','2013-1-7 14:44:00');
insert into sbtest(id,name,whenn,k,pad,whenn1) values (7,'junyue','2013-1-6 14:44:00',1,'qqqqqqqqqqwwwwwwwwwweeeeeeeeeerrrrrrrrrrtttttttttt','2013-1-7 14:44:00');
insert into sbtest(id,name,whenn,k,pad,whenn1) values (8,'junyue','2013-1-6 14:44:00',1,'qqqqqqqqqqwwwwwwwwwweeeeeeeeeerrrrrrrrrrtttttttttt','2013-1-7 14:44:00');
insert into sbtest(id,name,whenn,k,pad,whenn1) values (9,'junyue','2013-1-6 14:44:00',1,'qqqqqqqqqqwwwwwwwwwweeeeeeeeeerrrrrrrrrrtttttttttt','2013-1-7 14:44:00');
insert into sbtest(id,name,whenn,k,pad,whenn1) values (10,'junyue','2013-1-6 14:44:00',1,'qqqqqqqqqqwwwwwwwwwweeeeeeeeeerrrrrrrrrrtttttttttt','2013-1-7 14:44:00');
insert into sbtest(id,name,whenn,k,pad,whenn1) values (11,'junyue','2013-1-6 14:44:00',1,'qqqqqqqqqqwwwwwwwwwweeeeeeeeeerrrrrrrrrrtttttttttt','2013-1-7 14:44:00');
insert into sbtest(id,name,whenn,k,pad,whenn1) values (12,'junyue','2013-1-6 14:44:00',1,'qqqqqqqqqqwwwwwwwwwweeeeeeeeeerrrrrrrrrrtttttttttt','2013-1-7 14:44:00');
insert into sbtest(id,name,whenn,k,pad,whenn1) values (13,'junyue','2013-1-6 14:44:00',1,'qqqqqqqqqqwwwwwwwwwweeeeeeeeeerrrrrrrrrrtttttttttt','2013-1-7 14:44:00');
insert into sbtest(id,name,whenn,k,pad,whenn1) values (14,'junyue','2013-1-6 14:44:00',1,'qqqqqqqqqqwwwwwwwwwweeeeeeeeeerrrrrrrrrrtttttttttt','2013-1-7 14:44:00');
insert into sbtest(id,name,whenn,k,pad,whenn1) values (15,'junyue','2013-1-6 14:44:00',1,'qqqqqqqqqqwwwwwwwwwweeeeeeeeeerrrrrrrrrrtttttttttt','2013-1-7 14:44:00');
insert into sbtest(id,name,whenn,k,pad,whenn1) values (16,'junyue','2013-1-6 14:44:00',1,'qqqqqqqqqqwwwwwwwwwweeeeeeeeeerrrrrrrrrrtttttttttt','2013-1-7 14:44:00');
insert into sbtest(id,name,whenn,k,pad,whenn1) values (17,'junyue','2013-1-6 14:44:00',1,'qqqqqqqqqqwwwwwwwwwweeeeeeeeeerrrrrrrrrrtttttttttt','2013-1-7 14:44:00');
insert into sbtest(id,name,whenn,k,pad,whenn1) values (18,'junyue','2013-1-6 14:44:00',1,'qqqqqqqqqqwwwwwwwwwweeeeeeeeeerrrrrrrrrrtttttttttt','2013-1-7 14:44:00');
insert into sbtest(id,name,whenn,k,pad,whenn1) values (19,'junyue','2013-1-6 14:44:00',1,'qqqqqqqqqqwwwwwwwwwweeeeeeeeeerrrrrrrrrrtttttttttt','2013-1-7 14:44:00');
insert into sbtest(id,name,whenn,k,pad,whenn1) values (20,'junyue','2013-1-6 14:44:00',1,'qqqqqqqqqqwwwwwwwwwweeeeeeeeeerrrrrrrrrrtttttttttt','2013-1-7 14:44:00');
insert into sbtest(id,name,whenn,k,pad,whenn1) values (21,'junyue','2013-1-6 14:44:00',1,'qqqqqqqqqqwwwwwwwwwweeeeeeeeeerrrrrrrrrrtttttttttt','2013-1-7 14:44:00');
insert into sbtest(id,name,whenn,k,pad,whenn1) values (22,'junyue','2013-1-6 14:44:00',1,'qqqqqqqqqqwwwwwwwwwweeeeeeeeeerrrrrrrrrrtttttttttt','2013-1-7 14:44:00');
insert into sbtest(id,name,whenn,k,pad,whenn1) values (23,'junyue','2013-1-6 14:44:00',1,'qqqqqqqqqqwwwwwwwwwweeeeeeeeeerrrrrrrrrrtttttttttt','2013-1-7 14:44:00');
insert into sbtest(id,name,whenn,k,pad,whenn1) values (24,'junyue','2013-1-6 14:44:00',1,'qqqqqqqqqqwwwwwwwwwweeeeeeeeeerrrrrrrrrrtttttttttt','2013-1-7 14:44:00');
insert into sbtest(id,name,whenn,k,pad,whenn1) values (25,'junyue','2013-1-6 14:44:00',1,'qqqqqqqqqqwwwwwwwwwweeeeeeeeeerrrrrrrrrrtttttttttt','2013-1-7 14:44:00');
insert into sbtest(id,name,whenn,k,pad,whenn1) values (26,'junyue','2013-1-6 14:44:00',1,'qqqqqqqqqqwwwwwwwwwweeeeeeeeeerrrrrrrrrrtttttttttt','2013-1-7 14:44:00');
insert into sbtest(id,name,whenn,k,pad,whenn1) values (27,'junyue','2013-1-6 14:44:00',1,'qqqqqqqqqqwwwwwwwwwweeeeeeeeeerrrrrrrrrrtttttttttt','2013-1-7 14:44:00');
insert into sbtest(id,name,whenn,k,pad,whenn1) values (28,'junyue','2013-1-6 14:44:00',1,'qqqqqqqqqqwwwwwwwwwweeeeeeeeeerrrrrrrrrrtttttttttt','2013-1-7 14:44:00');
insert into sbtest(id,name,whenn,k,pad,whenn1) values (29,'junyue','2013-1-6 14:44:00',1,'qqqqqqqqqqwwwwwwwwwweeeeeeeeeerrrrrrrrrrtttttttttt','2013-1-7 14:44:00');
insert into sbtest(id,name,whenn,k,pad,whenn1) values (30,'junyue','2013-1-6 14:44:00',1,'qqqqqqqqqqwwwwwwwwwweeeeeeeeeerrrrrrrrrrtttttttttt','2013-1-7 14:44:00');
insert into sbtest(id,name,whenn,k,pad,whenn1) values (31,'junyue','2013-1-6 14:44:00',1,'qqqqqqqqqqwwwwwwwwwweeeeeeeeeerrrrrrrrrrtttttttttt','2013-1-7 14:44:00');
insert into sbtest(id,name,whenn,k,pad,whenn1) values (32,'junyue','2013-1-6 14:44:00',1,'qqqqqqqqqqwwwwwwwwwweeeeeeeeeerrrrrrrrrrtttttttttt','2013-1-7 14:44:00');
insert into sbtest(id,name,whenn,k,pad,whenn1) values (33,'junyue','2013-1-6 14:44:00',1,'qqqqqqqqqqwwwwwwwwwweeeeeeeeeerrrrrrrrrrtttttttttt','2013-1-7 14:44:00');
insert into sbtest(id,name,whenn,k,pad,whenn1) values (34,'junyue','2013-1-6 14:44:00',1,'qqqqqqqqqqwwwwwwwwwweeeeeeeeeerrrrrrrrrrtttttttttt','2013-1-7 14:44:00');
insert into sbtest(id,name,whenn,k,pad,whenn1) values (35,'junyue','2013-1-6 14:44:00',1,'qqqqqqqqqqwwwwwwwwwweeeeeeeeeerrrrrrrrrrtttttttttt','2013-1-7 14:44:00');
insert into sbtest(id,name,whenn,k,pad,whenn1) values (36,'junyue','2013-1-6 14:44:00',1,'qqqqqqqqqqwwwwwwwwwweeeeeeeeeerrrrrrrrrrtttttttttt','2013-1-7 14:44:00');
insert into sbtest(id,name,whenn,k,pad,whenn1) values (37,'junyue','2013-1-6 14:44:00',1,'qqqqqqqqqqwwwwwwwwwweeeeeeeeeerrrrrrrrrrtttttttttt','2013-1-7 14:44:00');
insert into sbtest(id,name,whenn,k,pad,whenn1) values (38,'junyue','2013-1-6 14:44:00',1,'qqqqqqqqqqwwwwwwwwwweeeeeeeeeerrrrrrrrrrtttttttttt','2013-1-7 14:44:00');
insert into sbtest(id,name,whenn,k,pad,whenn1) values (39,'junyue','2013-1-6 14:44:00',1,'qqqqqqqqqqwwwwwwwwwweeeeeeeeeerrrrrrrrrrtttttttttt','2013-1-7 14:44:00');
insert into sbtest(id,name,whenn,k,pad,whenn1) values (40,'junyue','2013-1-6 14:44:00',1,'qqqqqqqqqqwwwwwwwwwweeeeeeeeeerrrrrrrrrrtttttttttt','2013-1-7 14:44:00');
insert into sbtest(id,name,whenn,k,pad,whenn1) values (41,'junyue','2013-1-6 14:44:00',1,'qqqqqqqqqqwwwwwwwwwweeeeeeeeeerrrrrrrrrrtttttttttt','2013-1-7 14:44:00');
insert into sbtest(id,name,whenn,k,pad,whenn1) values (42,'junyue','2013-1-6 14:44:00',1,'qqqqqqqqqqwwwwwwwwwweeeeeeeeeerrrrrrrrrrtttttttttt','2013-1-7 14:44:00');
insert into sbtest(id,name,whenn,k,pad,whenn1) values (43,'junyue','2013-1-6 14:44:00',1,'qqqqqqqqqqwwwwwwwwwweeeeeeeeeerrrrrrrrrrtttttttttt','2013-1-7 14:44:00');
insert into sbtest(id,name,whenn,k,pad,whenn1) values (44,'junyue','2013-1-6 14:44:00',1,'qqqqqqqqqqwwwwwwwwwweeeeeeeeeerrrrrrrrrrtttttttttt','2013-1-7 14:44:00');
insert into sbtest(id,name,whenn,k,pad,whenn1) values (45,'junyue','2013-1-6 14:44:00',1,'qqqqqqqqqqwwwwwwwwwweeeeeeeeeerrrrrrrrrrtttttttttt','2013-1-7 14:44:00');
insert into sbtest(id,name,whenn,k,pad,whenn1) values (46,'junyue','2013-1-6 14:44:00',1,'qqqqqqqqqqwwwwwwwwwweeeeeeeeeerrrrrrrrrrtttttttttt','2013-1-7 14:44:00');
insert into sbtest(id,name,whenn,k,pad,whenn1) values (47,'junyue','2013-1-6 14:44:00',1,'qqqqqqqqqqwwwwwwwwwweeeeeeeeeerrrrrrrrrrtttttttttt','2013-1-7 14:44:00');
insert into sbtest(id,name,whenn,k,pad,whenn1) values (48,'junyue','2013-1-6 14:44:00',1,'qqqqqqqqqqwwwwwwwwwweeeeeeeeeerrrrrrrrrrtttttttttt','2013-1-7 14:44:00');
insert into sbtest(id,name,whenn,k,pad,whenn1) values (49,'junyue','2013-1-6 14:44:00',1,'qqqqqqqqqqwwwwwwwwwweeeeeeeeeerrrrrrrrrrtttttttttt','2013-1-7 14:44:00');
insert into sbtest(id,name,whenn,k,pad,whenn1) values (50,'junyue','2013-1-6 14:44:00',1,'qqqqqqqqqqwwwwwwwwwweeeeeeeeeerrrrrrrrrrtttttttttt','2013-1-7 14:44:00');
insert into sbtest(id,name,whenn,k,pad,whenn1) values (51,'junyue','2013-1-6 14:44:00',1,'qqqqqqqqqqwwwwwwwwwweeeeeeeeeerrrrrrrrrrtttttttttt','2013-1-7 14:44:00');
insert into sbtest(id,name,whenn,k,pad,whenn1) values (52,'junyue','2013-1-6 14:44:00',1,'qqqqqqqqqqwwwwwwwwwweeeeeeeeeerrrrrrrrrrtttttttttt','2013-1-7 14:44:00');
insert into sbtest(id,name,whenn,k,pad,whenn1) values (53,'junyue','2013-1-6 14:44:00',1,'qqqqqqqqqqwwwwwwwwwweeeeeeeeeerrrrrrrrrrtttttttttt','2013-1-7 14:44:00');
insert into sbtest(id,name,whenn,k,pad,whenn1) values (54,'junyue','2013-1-6 14:44:00',1,'qqqqqqqqqqwwwwwwwwwweeeeeeeeeerrrrrrrrrrtttttttttt','2013-1-7 14:44:00');
insert into sbtest(id,name,whenn,k,pad,whenn1) values (55,'junyue','2013-1-6 14:44:00',1,'qqqqqqqqqqwwwwwwwwwweeeeeeeeeerrrrrrrrrrtttttttttt','2013-1-7 14:44:00');
insert into sbtest(id,name,whenn,k,pad,whenn1) values (56,'junyue','2013-1-6 14:44:00',1,'qqqqqqqqqqwwwwwwwwwweeeeeeeeeerrrrrrrrrrtttttttttt','2013-1-7 14:44:00');
insert into sbtest(id,name,whenn,k,pad,whenn1) values (57,'junyue','2013-1-6 14:44:00',1,'qqqqqqqqqqwwwwwwwwwweeeeeeeeeerrrrrrrrrrtttttttttt','2013-1-7 14:44:00');
insert into sbtest(id,name,whenn,k,pad,whenn1) values (58,'junyue','2013-1-6 14:44:00',1,'qqqqqqqqqqwwwwwwwwwweeeeeeeeeerrrrrrrrrrtttttttttt','2013-1-7 14:44:00');
insert into sbtest(id,name,whenn,k,pad,whenn1) values (59,'junyue','2013-1-6 14:44:00',1,'qqqqqqqqqqwwwwwwwwwweeeeeeeeeerrrrrrrrrrtttttttttt','2013-1-7 14:44:00');
insert into sbtest(id,name,whenn,k,pad,whenn1) values (60,'junyue','2013-1-6 14:44:00',1,'qqqqqqqqqqwwwwwwwwwweeeeeeeeeerrrrrrrrrrtttttttttt','2013-1-7 14:44:00');
insert into sbtest(id,name,whenn,k,pad,whenn1) values (61,'junyue','2013-1-6 14:44:00',1,'qqqqqqqqqqwwwwwwwwwweeeeeeeeeerrrrrrrrrrtttttttttt','2013-1-7 14:44:00');
insert into sbtest(id,name,whenn,k,pad,whenn1) values (62,'junyue','2013-1-6 14:44:00',1,'qqqqqqqqqqwwwwwwwwwweeeeeeeeeerrrrrrrrrrtttttttttt','2013-1-7 14:44:00');
insert into sbtest(id,name,whenn,k,pad,whenn1) values (63,'junyue','2013-1-6 14:44:00',1,'qqqqqqqqqqwwwwwwwwwweeeeeeeeeerrrrrrrrrrtttttttttt','2013-1-7 14:44:00');
insert into sbtest(id,name,whenn,k,pad,whenn1) values (64,'junyue','2013-1-6 14:44:00',1,'qqqqqqqqqqwwwwwwwwwweeeeeeeeeerrrrrrrrrrtttttttttt','2013-1-7 14:44:00');
insert into sbtest(id,name,whenn,k,pad,whenn1) values (65,'junyue','2013-1-6 14:44:00',1,'qqqqqqqqqqwwwwwwwwwweeeeeeeeeerrrrrrrrrrtttttttttt','2013-1-7 14:44:00');
insert into sbtest(id,name,whenn,k,pad,whenn1) values (66,'junyue','2013-1-6 14:44:00',1,'qqqqqqqqqqwwwwwwwwwweeeeeeeeeerrrrrrrrrrtttttttttt','2013-1-7 14:44:00');
insert into sbtest(id,name,whenn,k,pad,whenn1) values (67,'junyue','2013-1-6 14:44:00',1,'qqqqqqqqqqwwwwwwwwwweeeeeeeeeerrrrrrrrrrtttttttttt','2013-1-7 14:44:00');
insert into sbtest(id,name,whenn,k,pad,whenn1) values (68,'junyue','2013-1-6 14:44:00',1,'qqqqqqqqqqwwwwwwwwwweeeeeeeeeerrrrrrrrrrtttttttttt','2013-1-7 14:44:00');
insert into sbtest(id,name,whenn,k,pad,whenn1) values (69,'junyue','2013-1-6 14:44:00',1,'qqqqqqqqqqwwwwwwwwwweeeeeeeeeerrrrrrrrrrtttttttttt','2013-1-7 14:44:00');
insert into sbtest(id,name,whenn,k,pad,whenn1) values (70,'junyue','2013-1-6 14:44:00',1,'qqqqqqqqqqwwwwwwwwwweeeeeeeeeerrrrrrrrrrtttttttttt','2013-1-7 14:44:00');
insert into sbtest(id,name,whenn,k,pad,whenn1) values (71,'junyue','2013-1-6 14:44:00',1,'qqqqqqqqqqwwwwwwwwwweeeeeeeeeerrrrrrrrrrtttttttttt','2013-1-7 14:44:00');
insert into sbtest(id,name,whenn,k,pad,whenn1) values (72,'junyue','2013-1-6 14:44:00',1,'qqqqqqqqqqwwwwwwwwwweeeeeeeeeerrrrrrrrrrtttttttttt','2013-1-7 14:44:00');
insert into sbtest(id,name,whenn,k,pad,whenn1) values (73,'junyue','2013-1-6 14:44:00',1,'qqqqqqqqqqwwwwwwwwwweeeeeeeeeerrrrrrrrrrtttttttttt','2013-1-7 14:44:00');
insert into sbtest(id,name,whenn,k,pad,whenn1) values (74,'junyue','2013-1-6 14:44:00',1,'qqqqqqqqqqwwwwwwwwwweeeeeeeeeerrrrrrrrrrtttttttttt','2013-1-7 14:44:00');
insert into sbtest(id,name,whenn,k,pad,whenn1) values (75,'junyue','2013-1-6 14:44:00',1,'qqqqqqqqqqwwwwwwwwwweeeeeeeeeerrrrrrrrrrtttttttttt','2013-1-7 14:44:00');
insert into sbtest(id,name,whenn,k,pad,whenn1) values (76,'junyue','2013-1-6 14:44:00',1,'qqqqqqqqqqwwwwwwwwwweeeeeeeeeerrrrrrrrrrtttttttttt','2013-1-7 14:44:00');
insert into sbtest(id,name,whenn,k,pad,whenn1) values (77,'junyue','2013-1-6 14:44:00',1,'qqqqqqqqqqwwwwwwwwwweeeeeeeeeerrrrrrrrrrtttttttttt','2013-1-7 14:44:00');
insert into sbtest(id,name,whenn,k,pad,whenn1) values (78,'junyue','2013-1-6 14:44:00',1,'qqqqqqqqqqwwwwwwwwwweeeeeeeeeerrrrrrrrrrtttttttttt','2013-1-7 14:44:00');
insert into sbtest(id,name,whenn,k,pad,whenn1) values (79,'junyue','2013-1-6 14:44:00',1,'qqqqqqqqqqwwwwwwwwwweeeeeeeeeerrrrrrrrrrtttttttttt','2013-1-7 14:44:00');
insert into sbtest(id,name,whenn,k,pad,whenn1) values (80,'junyue','2013-1-6 14:44:00',1,'qqqqqqqqqqwwwwwwwwwweeeeeeeeeerrrrrrrrrrtttttttttt','2013-1-7 14:44:00');
insert into sbtest(id,name,whenn,k,pad,whenn1) values (81,'junyue','2013-1-6 14:44:00',1,'qqqqqqqqqqwwwwwwwwwweeeeeeeeeerrrrrrrrrrtttttttttt','2013-1-7 14:44:00');
insert into sbtest(id,name,whenn,k,pad,whenn1) values (82,'junyue','2013-1-6 14:44:00',1,'qqqqqqqqqqwwwwwwwwwweeeeeeeeeerrrrrrrrrrtttttttttt','2013-1-7 14:44:00');
insert into sbtest(id,name,whenn,k,pad,whenn1) values (83,'junyue','2013-1-6 14:44:00',1,'qqqqqqqqqqwwwwwwwwwweeeeeeeeeerrrrrrrrrrtttttttttt','2013-1-7 14:44:00');
insert into sbtest(id,name,whenn,k,pad,whenn1) values (84,'junyue','2013-1-6 14:44:00',1,'qqqqqqqqqqwwwwwwwwwweeeeeeeeeerrrrrrrrrrtttttttttt','2013-1-7 14:44:00');
insert into sbtest(id,name,whenn,k,pad,whenn1) values (85,'junyue','2013-1-6 14:44:00',1,'qqqqqqqqqqwwwwwwwwwweeeeeeeeeerrrrrrrrrrtttttttttt','2013-1-7 14:44:00');
insert into sbtest(id,name,whenn,k,pad,whenn1) values (86,'junyue','2013-1-6 14:44:00',1,'qqqqqqqqqqwwwwwwwwwweeeeeeeeeerrrrrrrrrrtttttttttt','2013-1-7 14:44:00');
insert into sbtest(id,name,whenn,k,pad,whenn1) values (87,'junyue','2013-1-6 14:44:00',1,'qqqqqqqqqqwwwwwwwwwweeeeeeeeeerrrrrrrrrrtttttttttt','2013-1-7 14:44:00');
insert into sbtest(id,name,whenn,k,pad,whenn1) values (88,'junyue','2013-1-6 14:44:00',1,'qqqqqqqqqqwwwwwwwwwweeeeeeeeeerrrrrrrrrrtttttttttt','2013-1-7 14:44:00');
insert into sbtest(id,name,whenn,k,pad,whenn1) values (89,'junyue','2013-1-6 14:44:00',1,'qqqqqqqqqqwwwwwwwwwweeeeeeeeeerrrrrrrrrrtttttttttt','2013-1-7 14:44:00');
insert into sbtest(id,name,whenn,k,pad,whenn1) values (90,'junyue','2013-1-6 14:44:00',1,'qqqqqqqqqqwwwwwwwwwweeeeeeeeeerrrrrrrrrrtttttttttt','2013-1-7 14:44:00');
insert into sbtest(id,name,whenn,k,pad,whenn1) values (91,'junyue','2013-1-6 14:44:00',1,'qqqqqqqqqqwwwwwwwwwweeeeeeeeeerrrrrrrrrrtttttttttt','2013-1-7 14:44:00');
insert into sbtest(id,name,whenn,k,pad,whenn1) values (92,'junyue','2013-1-6 14:44:00',1,'qqqqqqqqqqwwwwwwwwwweeeeeeeeeerrrrrrrrrrtttttttttt','2013-1-7 14:44:00');
insert into sbtest(id,name,whenn,k,pad,whenn1) values (93,'junyue','2013-1-6 14:44:00',1,'qqqqqqqqqqwwwwwwwwwweeeeeeeeeerrrrrrrrrrtttttttttt','2013-1-7 14:44:00');
insert into sbtest(id,name,whenn,k,pad,whenn1) values (94,'junyue','2013-1-6 14:44:00',1,'qqqqqqqqqqwwwwwwwwwweeeeeeeeeerrrrrrrrrrtttttttttt','2013-1-7 14:44:00');
insert into sbtest(id,name,whenn,k,pad,whenn1) values (95,'junyue','2013-1-6 14:44:00',1,'qqqqqqqqqqwwwwwwwwwweeeeeeeeeerrrrrrrrrrtttttttttt','2013-1-7 14:44:00');
insert into sbtest(id,name,whenn,k,pad,whenn1) values (96,'junyue','2013-1-6 14:44:00',1,'qqqqqqqqqqwwwwwwwwwweeeeeeeeeerrrrrrrrrrtttttttttt','2013-1-7 14:44:00');
insert into sbtest(id,name,whenn,k,pad,whenn1) values (97,'junyue','2013-1-6 14:44:00',1,'qqqqqqqqqqwwwwwwwwwweeeeeeeeeerrrrrrrrrrtttttttttt','2013-1-7 14:44:00');
insert into sbtest(id,name,whenn,k,pad,whenn1) values (98,'junyue','2013-1-6 14:44:00',1,'qqqqqqqqqqwwwwwwwwwweeeeeeeeeerrrrrrrrrrtttttttttt','2013-1-7 14:44:00');
insert into sbtest(id,name,whenn,k,pad,whenn1) values (99,'junyue','2013-1-6 14:44:00',1,'qqqqqqqqqqwwwwwwwwwweeeeeeeeeerrrrrrrrrrtttttttttt','2013-1-7 14:44:00');
insert into sbtest(id,name,whenn,k,pad,whenn1) values (100,'junyue','2013-1-6 14:44:00',1,'qqqqqqqqqqwwwwwwwwwweeeeeeeeeerrrrrrrrrrtttttttttt','2013-1-7 14:44:00');
merge
major_freeze...
select * from sbtest where id = 1;
id	name	whenn	k	pad	whenn1	stat1
1	junyue	2013-01-06 14:44:00.000000	1	qqqqqqqqqqwwwwwwwwwweeeeeeeeeerrrrrrrrrrtttttttttt	2013-01-07 14:44:00.000000	NULL
select * from sbtest where id = 2;
id	name	whenn	k	pad	whenn1	stat1
2	junyue	2013-01-06 14:44:00.000000	1	qqqqqqqqqqwwwwwwwwwweeeeeeeeeerrrrrrrrrrtttttttttt	2013-01-07 14:44:00.000000	NULL
select * from sbtest where id = 3;
id	name	whenn	k	pad	whenn1	stat1
3	junyue	2013-01-06 14:44:00.000000	1	qqqqqqqqqqwwwwwwwwwweeeeeeeeeerrrrrrrrrrtttttttttt	2013-01-07 14:44:00.000000	NULL
select * from sbtest where id = 4;
id	name	whenn	k	pad	whenn1	stat1
4	junyue	2013-01-06 14:44:00.000000	1	qqqqqqqqqqwwwwwwwwwweeeeeeeeeerrrrrrrrrrtttttttttt	2013-01-07 14:44:00.000000	NULL
select * from sbtest where id = 5;
id	name	whenn	k	pad	whenn1	stat1
5	junyue	2013-01-06 14:44:00.000000	1	qqqqqqqqqqwwwwwwwwwweeeeeeeeeerrrrrrrrrrtttttttttt	2013-01-07 14:44:00.000000	NULL
select * from sbtest where id = 6;
id	name	whenn	k	pad	whenn1	stat1
6	junyue	2013-01-06 14:44:00.000000	1	qqqqqqqqqqwwwwwwwwwweeeeeeeeeerrrrrrrrrrtttttttttt	2013-01-07 14:44:00.000000	NULL
select * from sbtest where id = 7;
id	name	whenn	k	pad	whenn1	stat1
7	junyue	2013-01-06 14:44:00.000000	1	qqqqqqqqqqwwwwwwwwwweeeeeeeeeerrrrrrrrrrtttttttttt	2013-01-07 14:44:00.000000	NULL
select * from sbtest where id = 8;
id	name	whenn	k	pad	whenn1	stat1
8	junyue	2013-01-06 14:44:00.000000	1	qqqqqqqqqqwwwwwwwwwweeeeeeeeeerrrrrrrrrrtttttttttt	2013-01-07 14:44:00.000000	NULL
select * from sbtest where id = 9;
id	name	whenn	k	pad	whenn1	stat1
9	junyue	2013-01-06 14:44:00.000000	1	qqqqqqqqqqwwwwwwwwwweeeeeeeeeerrrrrrrrrrtttttttttt	2013-01-07 14:44:00.000000	NULL
select * from sbtest where id = 10;
id	name	whenn	k	pad	whenn1	stat1
10	junyue	2013-01-06 14:44:00.000000	1	qqqqqqqqqqwwwwwwwwwweeeeeeeeeerrrrrrrrrrtttttttttt	2013-01-07 14:44:00.000000	NULL
select * from sbtest where id = 11;
id	name	whenn	k	pad	whenn1	stat1
11	junyue	2013-01-06 14:44:00.000000	1	qqqqqqqqqqwwwwwwwwwweeeeeeeeeerrrrrrrrrrtttttttttt	2013-01-07 14:44:00.000000	NULL
select * from sbtest where id = 12;
id	name	whenn	k	pad	whenn1	stat1
12	junyue	2013-01-06 14:44:00.000000	1	qqqqqqqqqqwwwwwwwwwweeeeeeeeeerrrrrrrrrrtttttttttt	2013-01-07 14:44:00.000000	NULL
select * from sbtest where id = 13;
id	name	whenn	k	pad	whenn1	stat1
13	junyue	2013-01-06 14:44:00.000000	1	qqqqqqqqqqwwwwwwwwwweeeeeeeeeerrrrrrrrrrtttttttttt	2013-01-07 14:44:00.000000	NULL
select * from sbtest where id = 14;
id	name	whenn	k	pad	whenn1	stat1
14	junyue	2013-01-06 14:44:00.000000	1	qqqqqqqqqqwwwwwwwwwweeeeeeeeeerrrrrrrrrrtttttttttt	2013-01-07 14:44:00.000000	NULL
select * from sbtest where id = 15;
id	name	whenn	k	pad	whenn1	stat1
15	junyue	2013-01-06 14:44:00.000000	1	qqqqqqqqqqwwwwwwwwwweeeeeeeeeerrrrrrrrrrtttttttttt	2013-01-07 14:44:00.000000	NULL
select * from sbtest where id = 16;
id	name	whenn	k	pad	whenn1	stat1
16	junyue	2013-01-06 14:44:00.000000	1	qqqqqqqqqqwwwwwwwwwweeeeeeeeeerrrrrrrrrrtttttttttt	2013-01-07 14:44:00.000000	NULL
select * from sbtest where id = 17;
id	name	whenn	k	pad	whenn1	stat1
17	junyue	2013-01-06 14:44:00.000000	1	qqqqqqqqqqwwwwwwwwwweeeeeeeeeerrrrrrrrrrtttttttttt	2013-01-07 14:44:00.000000	NULL
select * from sbtest where id = 18;
id	name	whenn	k	pad	whenn1	stat1
18	junyue	2013-01-06 14:44:00.000000	1	qqqqqqqqqqwwwwwwwwwweeeeeeeeeerrrrrrrrrrtttttttttt	2013-01-07 14:44:00.000000	NULL
select * from sbtest where id = 19;
id	name	whenn	k	pad	whenn1	stat1
19	junyue	2013-01-06 14:44:00.000000	1	qqqqqqqqqqwwwwwwwwwweeeeeeeeeerrrrrrrrrrtttttttttt	2013-01-07 14:44:00.000000	NULL
select * from sbtest where id = 20;
id	name	whenn	k	pad	whenn1	stat1
20	junyue	2013-01-06 14:44:00.000000	1	qqqqqqqqqqwwwwwwwwwweeeeeeeeeerrrrrrrrrrtttttttttt	2013-01-07 14:44:00.000000	NULL
select * from sbtest where id = 21;
id	name	whenn	k	pad	whenn1	stat1
21	junyue	2013-01-06 14:44:00.000000	1	qqqqqqqqqqwwwwwwwwwweeeeeeeeeerrrrrrrrrrtttttttttt	2013-01-07 14:44:00.000000	NULL
select * from sbtest where id = 22;
id	name	whenn	k	pad	whenn1	stat1
22	junyue	2013-01-06 14:44:00.000000	1	qqqqqqqqqqwwwwwwwwwweeeeeeeeeerrrrrrrrrrtttttttttt	2013-01-07 14:44:00.000000	NULL
select * from sbtest where id = 23;
id	name	whenn	k	pad	whenn1	stat1
23	junyue	2013-01-06 14:44:00.000000	1	qqqqqqqqqqwwwwwwwwwweeeeeeeeeerrrrrrrrrrtttttttttt	2013-01-07 14:44:00.000000	NULL
select * from sbtest where id = 24;
id	name	whenn	k	pad	whenn1	stat1
24	junyue	2013-01-06 14:44:00.000000	1	qqqqqqqqqqwwwwwwwwwweeeeeeeeeerrrrrrrrrrtttttttttt	2013-01-07 14:44:00.000000	NULL
select * from sbtest where id = 25;
id	name	whenn	k	pad	whenn1	stat1
25	junyue	2013-01-06 14:44:00.000000	1	qqqqqqqqqqwwwwwwwwwweeeeeeeeeerrrrrrrrrrtttttttttt	2013-01-07 14:44:00.000000	NULL
select * from sbtest where id = 26;
id	name	whenn	k	pad	whenn1	stat1
26	junyue	2013-01-06 14:44:00.000000	1	qqqqqqqqqqwwwwwwwwwweeeeeeeeeerrrrrrrrrrtttttttttt	2013-01-07 14:44:00.000000	NULL
select * from sbtest where id = 27;
id	name	whenn	k	pad	whenn1	stat1
27	junyue	2013-01-06 14:44:00.000000	1	qqqqqqqqqqwwwwwwwwwweeeeeeeeeerrrrrrrrrrtttttttttt	2013-01-07 14:44:00.000000	NULL
select * from sbtest where id = 28;
id	name	whenn	k	pad	whenn1	stat1
28	junyue	2013-01-06 14:44:00.000000	1	qqqqqqqqqqwwwwwwwwwweeeeeeeeeerrrrrrrrrrtttttttttt	2013-01-07 14:44:00.000000	NULL
select * from sbtest where id = 29;
id	name	whenn	k	pad	whenn1	stat1
29	junyue	2013-01-06 14:44:00.000000	1	qqqqqqqqqqwwwwwwwwwweeeeeeeeeerrrrrrrrrrtttttttttt	2013-01-07 14:44:00.000000	NULL
select * from sbtest where id = 30;
id	name	whenn	k	pad	whenn1	stat1
30	junyue	2013-01-06 14:44:00.000000	1	qqqqqqqqqqwwwwwwwwwweeeeeeeeeerrrrrrrrrrtttttttttt	2013-01-07 14:44:00.000000	NULL
select * from sbtest where id = 31;
id	name	whenn	k	pad	whenn1	stat1
31	junyue	2013-01-06 14:44:00.000000	1	qqqqqqqqqqwwwwwwwwwweeeeeeeeeerrrrrrrrrrtttttttttt	2013-01-07 14:44:00.000000	NULL
select * from sbtest where id = 32;
id	name	whenn	k	pad	whenn1	stat1
32	junyue	2013-01-06 14:44:00.000000	1	qqqqqqqqqqwwwwwwwwwweeeeeeeeeerrrrrrrrrrtttttttttt	2013-01-07 14:44:00.000000	NULL
select * from sbtest where id = 33;
id	name	whenn	k	pad	whenn1	stat1
33	junyue	2013-01-06 14:44:00.000000	1	qqqqqqqqqqwwwwwwwwwweeeeeeeeeerrrrrrrrrrtttttttttt	2013-01-07 14:44:00.000000	NULL
select * from sbtest where id = 34;
id	name	whenn	k	pad	whenn1	stat1
34	junyue	2013-01-06 14:44:00.000000	1	qqqqqqqqqqwwwwwwwwwweeeeeeeeeerrrrrrrrrrtttttttttt	2013-01-07 14:44:00.000000	NULL
select * from sbtest where id = 35;
id	name	whenn	k	pad	whenn1	stat1
35	junyue	2013-01-06 14:44:00.000000	1	qqqqqqqqqqwwwwwwwwwweeeeeeeeeerrrrrrrrrrtttttttttt	2013-01-07 14:44:00.000000	NULL
select * from sbtest where id = 36;
id	name	whenn	k	pad	whenn1	stat1
36	junyue	2013-01-06 14:44:00.000000	1	qqqqqqqqqqwwwwwwwwwweeeeeeeeeerrrrrrrrrrtttttttttt	2013-01-07 14:44:00.000000	NULL
select * from sbtest where id = 37;
id	name	whenn	k	pad	whenn1	stat1
37	junyue	2013-01-06 14:44:00.000000	1	qqqqqqqqqqwwwwwwwwwweeeeeeeeeerrrrrrrrrrtttttttttt	2013-01-07 14:44:00.000000	NULL
select * from sbtest where id = 38;
id	name	whenn	k	pad	whenn1	stat1
38	junyue	2013-01-06 14:44:00.000000	1	qqqqqqqqqqwwwwwwwwwweeeeeeeeeerrrrrrrrrrtttttttttt	2013-01-07 14:44:00.000000	NULL
select * from sbtest where id = 39;
id	name	whenn	k	pad	whenn1	stat1
39	junyue	2013-01-06 14:44:00.000000	1	qqqqqqqqqqwwwwwwwwwweeeeeeeeeerrrrrrrrrrtttttttttt	2013-01-07 14:44:00.000000	NULL
select * from sbtest where id = 40;
id	name	whenn	k	pad	whenn1	stat1
40	junyue	2013-01-06 14:44:00.000000	1	qqqqqqqqqqwwwwwwwwwweeeeeeeeeerrrrrrrrrrtttttttttt	2013-01-07 14:44:00.000000	NULL
select * from sbtest where id = 41;
id	name	whenn	k	pad	whenn1	stat1
41	junyue	2013-01-06 14:44:00.000000	1	qqqqqqqqqqwwwwwwwwwweeeeeeeeeerrrrrrrrrrtttttttttt	2013-01-07 14:44:00.000000	NULL
select * from sbtest where id = 42;
id	name	whenn	k	pad	whenn1	stat1
42	junyue	2013-01-06 14:44:00.000000	1	qqqqqqqqqqwwwwwwwwwweeeeeeeeeerrrrrrrrrrtttttttttt	2013-01-07 14:44:00.000000	NULL
select * from sbtest where id = 43;
id	name	whenn	k	pad	whenn1	stat1
43	junyue	2013-01-06 14:44:00.000000	1	qqqqqqqqqqwwwwwwwwwweeeeeeeeeerrrrrrrrrrtttttttttt	2013-01-07 14:44:00.000000	NULL
select * from sbtest where id = 44;
id	name	whenn	k	pad	whenn1	stat1
44	junyue	2013-01-06 14:44:00.000000	1	qqqqqqqqqqwwwwwwwwwweeeeeeeeeerrrrrrrrrrtttttttttt	2013-01-07 14:44:00.000000	NULL
select * from sbtest where id = 45;
id	name	whenn	k	pad	whenn1	stat1
45	junyue	2013-01-06 14:44:00.000000	1	qqqqqqqqqqwwwwwwwwwweeeeeeeeeerrrrrrrrrrtttttttttt	2013-01-07 14:44:00.000000	NULL
select * from sbtest where id = 46;
id	name	whenn	k	pad	whenn1	stat1
46	junyue	2013-01-06 14:44:00.000000	1	qqqqqqqqqqwwwwwwwwwweeeeeeeeeerrrrrrrrrrtttttttttt	2013-01-07 14:44:00.000000	NULL
select * from sbtest where id = 47;
id	name	whenn	k	pad	whenn1	stat1
47	junyue	2013-01-06 14:44:00.000000	1	qqqqqqqqqqwwwwwwwwwweeeeeeeeeerrrrrrrrrrtttttttttt	2013-01-07 14:44:00.000000	NULL
select * from sbtest where id = 48;
id	name	whenn	k	pad	whenn1	stat1
48	junyue	2013-01-06 14:44:00.000000	1	qqqqqqqqqqwwwwwwwwwweeeeeeeeeerrrrrrrrrrtttttttttt	2013-01-07 14:44:00.000000	NULL
select * from sbtest where id = 49;
id	name	whenn	k	pad	whenn1	stat1
49	junyue	2013-01-06 14:44:00.000000	1	qqqqqqqqqqwwwwwwwwwweeeeeeeeeerrrrrrrrrrtttttttttt	2013-01-07 14:44:00.000000	NULL
select * from sbtest where id = 50;
id	name	whenn	k	pad	whenn1	stat1
50	junyue	2013-01-06 14:44:00.000000	1	qqqqqqqqqqwwwwwwwwwweeeeeeeeeerrrrrrrrrrtttttttttt	2013-01-07 14:44:00.000000	NULL
select * from sbtest where id = 51;
id	name	whenn	k	pad	whenn1	stat1
51	junyue	2013-01-06 14:44:00.000000	1	qqqqqqqqqqwwwwwwwwwweeeeeeeeeerrrrrrrrrrtttttttttt	2013-01-07 14:44:00.000000	NULL
select * from sbtest where id = 52;
id	name	whenn	k	pad	whenn1	stat1
52	junyue	2013-01-06 14:44:00.000000	1	qqqqqqqqqqwwwwwwwwwweeeeeeeeeerrrrrrrrrrtttttttttt	2013-01-07 14:44:00.000000	NULL
select * from sbtest where id = 53;
id	name	whenn	k	pad	whenn1	stat1
53	junyue	2013-01-06 14:44:00.000000	1	qqqqqqqqqqwwwwwwwwwweeeeeeeeeerrrrrrrrrrtttttttttt	2013-01-07 14:44:00.000000	NULL
select * from sbtest where id = 54;
id	name	whenn	k	pad	whenn1	stat1
54	junyue	2013-01-06 14:44:00.000000	1	qqqqqqqqqqwwwwwwwwwweeeeeeeeeerrrrrrrrrrtttttttttt	2013-01-07 14:44:00.000000	NULL
select * from sbtest where id = 55;
id	name	whenn	k	pad	whenn1	stat1
55	junyue	2013-01-06 14:44:00.000000	1	qqqqqqqqqqwwwwwwwwwweeeeeeeeeerrrrrrrrrrtttttttttt	2013-01-07 14:44:00.000000	NULL
select * from sbtest where id = 56;
id	name	whenn	k	pad	whenn1	stat1
56	junyue	2013-01-06 14:44:00.000000	1	qqqqqqqqqqwwwwwwwwwweeeeeeeeeerrrrrrrrrrtttttttttt	2013-01-07 14:44:00.000000	NULL
select * from sbtest where id = 57;
id	name	whenn	k	pad	whenn1	stat1
57	junyue	2013-01-06 14:44:00.000000	1	qqqqqqqqqqwwwwwwwwwweeeeeeeeeerrrrrrrrrrtttttttttt	2013-01-07 14:44:00.000000	NULL
select * from sbtest where id = 58;
id	name	whenn	k	pad	whenn1	stat1
58	junyue	2013-01-06 14:44:00.000000	1	qqqqqqqqqqwwwwwwwwwweeeeeeeeeerrrrrrrrrrtttttttttt	2013-01-07 14:44:00.000000	NULL
select * from sbtest where id = 59;
id	name	whenn	k	pad	whenn1	stat1
59	junyue	2013-01-06 14:44:00.000000	1	qqqqqqqqqqwwwwwwwwwweeeeeeeeeerrrrrrrrrrtttttttttt	2013-01-07 14:44:00.000000	NULL
select * from sbtest where id = 60;
id	name	whenn	k	pad	whenn1	stat1
60	junyue	2013-01-06 14:44:00.000000	1	qqqqqqqqqqwwwwwwwwwweeeeeeeeeerrrrrrrrrrtttttttttt	2013-01-07 14:44:00.000000	NULL
select * from sbtest where id = 61;
id	name	whenn	k	pad	whenn1	stat1
61	junyue	2013-01-06 14:44:00.000000	1	qqqqqqqqqqwwwwwwwwwweeeeeeeeeerrrrrrrrrrtttttttttt	2013-01-07 14:44:00.000000	NULL
select * from sbtest where id = 62;
id	name	whenn	k	pad	whenn1	stat1
62	junyue	2013-01-06 14:44:00.000000	1	qqqqqqqqqqwwwwwwwwwweeeeeeeeeerrrrrrrrrrtttttttttt	2013-01-07 14:44:00.000000	NULL
select * from sbtest where id = 63;
id	name	whenn	k	pad	whenn1	stat1
63	junyue	2013-01-06 14:44:00.000000	1	qqqqqqqqqqwwwwwwwwwweeeeeeeeeerrrrrrrrrrtttttttttt	2013-01-07 14:44:00.000000	NULL
select * from sbtest where id = 64;
id	name	whenn	k	pad	whenn1	stat1
64	junyue	2013-01-06 14:44:00.000000	1	qqqqqqqqqqwwwwwwwwwweeeeeeeeeerrrrrrrrrrtttttttttt	2013-01-07 14:44:00.000000	NULL
select * from sbtest where id = 65;
id	name	whenn	k	pad	whenn1	stat1
65	junyue	2013-01-06 14:44:00.000000	1	qqqqqqqqqqwwwwwwwwwweeeeeeeeeerrrrrrrrrrtttttttttt	2013-01-07 14:44:00.000000	NULL
select * from sbtest where id = 66;
id	name	whenn	k	pad	whenn1	stat1
66	junyue	2013-01-06 14:44:00.000000	1	qqqqqqqqqqwwwwwwwwwweeeeeeeeeerrrrrrrrrrtttttttttt	2013-01-07 14:44:00.000000	NULL
select * from sbtest where id = 67;
id	name	whenn	k	pad	whenn1	stat1
67	junyue	2013-01-06 14:44:00.000000	1	qqqqqqqqqqwwwwwwwwwweeeeeeeeeerrrrrrrrrrtttttttttt	2013-01-07 14:44:00.000000	NULL
select * from sbtest where id = 68;
id	name	whenn	k	pad	whenn1	stat1
68	junyue	2013-01-06 14:44:00.000000	1	qqqqqqqqqqwwwwwwwwwweeeeeeeeeerrrrrrrrrrtttttttttt	2013-01-07 14:44:00.000000	NULL
select * from sbtest where id = 69;
id	name	whenn	k	pad	whenn1	stat1
69	junyue	2013-01-06 14:44:00.000000	1	qqqqqqqqqqwwwwwwwwwweeeeeeeeeerrrrrrrrrrtttttttttt	2013-01-07 14:44:00.000000	NULL
select * from sbtest where id = 70;
id	name	whenn	k	pad	whenn1	stat1
70	junyue	2013-01-06 14:44:00.000000	1	qqqqqqqqqqwwwwwwwwwweeeeeeeeeerrrrrrrrrrtttttttttt	2013-01-07 14:44:00.000000	NULL
select * from sbtest where id = 71;
id	name	whenn	k	pad	whenn1	stat1
71	junyue	2013-01-06 14:44:00.000000	1	qqqqqqqqqqwwwwwwwwwweeeeeeeeeerrrrrrrrrrtttttttttt	2013-01-07 14:44:00.000000	NULL
select * from sbtest where id = 72;
id	name	whenn	k	pad	whenn1	stat1
72	junyue	2013-01-06 14:44:00.000000	1	qqqqqqqqqqwwwwwwwwwweeeeeeeeeerrrrrrrrrrtttttttttt	2013-01-07 14:44:00.000000	NULL
select * from sbtest where id = 73;
id	name	whenn	k	pad	whenn1	stat1
73	junyue	2013-01-06 14:44:00.000000	1	qqqqqqqqqqwwwwwwwwwweeeeeeeeeerrrrrrrrrrtttttttttt	2013-01-07 14:44:00.000000	NULL
select * from sbtest where id = 74;
id	name	whenn	k	pad	whenn1	stat1
74	junyue	2013-01-06 14:44:00.000000	1	qqqqqqqqqqwwwwwwwwwweeeeeeeeeerrrrrrrrrrtttttttttt	2013-01-07 14:44:00.000000	NULL
select * from sbtest where id = 75;
id	name	whenn	k	pad	whenn1	stat1
75	junyue	2013-01-06 14:44:00.000000	1	qqqqqqqqqqwwwwwwwwwweeeeeeeeeerrrrrrrrrrtttttttttt	2013-01-07 14:44:00.000000	NULL
select * from sbtest where id = 76;
id	name	whenn	k	pad	whenn1	stat1
76	junyue	2013-01-06 14:44:00.000000	1	qqqqqqqqqqwwwwwwwwwweeeeeeeeeerrrrrrrrrrtttttttttt	2013-01-07 14:44:00.000000	NULL
select * from sbtest where id = 77;
id	name	whenn	k	pad	whenn1	stat1
77	junyue	2013-01-06 14:44:00.000000	1	qqqqqqqqqqwwwwwwwwwweeeeeeeeeerrrrrrrrrrtttttttttt	2013-01-07 14:44:00.000000	NULL
select * from sbtest where id = 78;
id	name	whenn	k	pad	whenn1	stat1
78	junyue	2013-01-06 14:44:00.000000	1	qqqqqqqqqqwwwwwwwwwweeeeeeeeeerrrrrrrrrrtttttttttt	2013-01-07 14:44:00.000000	NULL
select * from sbtest where id = 79;
id	name	whenn	k	pad	whenn1	stat1
79	junyue	2013-01-06 14:44:00.000000	1	qqqqqqqqqqwwwwwwwwwweeeeeeeeeerrrrrrrrrrtttttttttt	2013-01-07 14:44:00.000000	NULL
select * from sbtest where id = 80;
id	name	whenn	k	pad	whenn1	stat1
80	junyue	2013-01-06 14:44:00.000000	1	qqqqqqqqqqwwwwwwwwwweeeeeeeeeerrrrrrrrrrtttttttttt	2013-01-07 14:44:00.000000	NULL
select * from sbtest where id = 81;
id	name	whenn	k	pad	whenn1	stat1
81	junyue	2013-01-06 14:44:00.000000	1	qqqqqqqqqqwwwwwwwwwweeeeeeeeeerrrrrrrrrrtttttttttt	2013-01-07 14:44:00.000000	NULL
select * from sbtest where id = 82;
id	name	whenn	k	pad	whenn1	stat1
82	junyue	2013-01-06 14:44:00.000000	1	qqqqqqqqqqwwwwwwwwwweeeeeeeeeerrrrrrrrrrtttttttttt	2013-01-07 14:44:00.000000	NULL
select * from sbtest where id = 83;
id	name	whenn	k	pad	whenn1	stat1
83	junyue	2013-01-06 14:44:00.000000	1	qqqqqqqqqqwwwwwwwwwweeeeeeeeeerrrrrrrrrrtttttttttt	2013-01-07 14:44:00.000000	NULL
select * from sbtest where id = 84;
id	name	whenn	k	pad	whenn1	stat1
84	junyue	2013-01-06 14:44:00.000000	1	qqqqqqqqqqwwwwwwwwwweeeeeeeeeerrrrrrrrrrtttttttttt	2013-01-07 14:44:00.000000	NULL
select * from sbtest where id = 85;
id	name	whenn	k	pad	whenn1	stat1
85	junyue	2013-01-06 14:44:00.000000	1	qqqqqqqqqqwwwwwwwwwweeeeeeeeeerrrrrrrrrrtttttttttt	2013-01-07 14:44:00.000000	NULL
select * from sbtest where id = 86;
id	name	whenn	k	pad	whenn1	stat1
86	junyue	2013-01-06 14:44:00.000000	1	qqqqqqqqqqwwwwwwwwwweeeeeeeeeerrrrrrrrrrtttttttttt	2013-01-07 14:44:00.000000	NULL
select * from sbtest where id = 87;
id	name	whenn	k	pad	whenn1	stat1
87	junyue	2013-01-06 14:44:00.000000	1	qqqqqqqqqqwwwwwwwwwweeeeeeeeeerrrrrrrrrrtttttttttt	2013-01-07 14:44:00.000000	NULL
select * from sbtest where id = 88;
id	name	whenn	k	pad	whenn1	stat1
88	junyue	2013-01-06 14:44:00.000000	1	qqqqqqqqqqwwwwwwwwwweeeeeeeeeerrrrrrrrrrtttttttttt	2013-01-07 14:44:00.000000	NULL
select * from sbtest where id = 89;
id	name	whenn	k	pad	whenn1	stat1
89	junyue	2013-01-06 14:44:00.000000	1	qqqqqqqqqqwwwwwwwwwweeeeeeeeeerrrrrrrrrrtttttttttt	2013-01-07 14:44:00.000000	NULL
select * from sbtest where id = 90;
id	name	whenn	k	pad	whenn1	stat1
90	junyue	2013-01-06 14:44:00.000000	1	qqqqqqqqqqwwwwwwwwwweeeeeeeeeerrrrrrrrrrtttttttttt	2013-01-07 14:44:00.000000	NULL
select * from sbtest where id = 91;
id	name	whenn	k	pad	whenn1	stat1
91	junyue	2013-01-06 14:44:00.000000	1	qqqqqqqqqqwwwwwwwwwweeeeeeeeeerrrrrrrrrrtttttttttt	2013-01-07 14:44:00.000000	NULL
select * from sbtest where id = 92;
id	name	whenn	k	pad	whenn1	stat1
92	junyue	2013-01-06 14:44:00.000000	1	qqqqqqqqqqwwwwwwwwwweeeeeeeeeerrrrrrrrrrtttttttttt	2013-01-07 14:44:00.000000	NULL
select * from sbtest where id = 93;
id	name	whenn	k	pad	whenn1	stat1
93	junyue	2013-01-06 14:44:00.000000	1	qqqqqqqqqqwwwwwwwwwweeeeeeeeeerrrrrrrrrrtttttttttt	2013-01-07 14:44:00.000000	NULL
select * from sbtest where id = 94;
id	name	whenn	k	pad	whenn1	stat1
94	junyue	2013-01-06 14:44:00.000000	1	qqqqqqqqqqwwwwwwwwwweeeeeeeeeerrrrrrrrrrtttttttttt	2013-01-07 14:44:00.000000	NULL
select * from sbtest where id = 95;
id	name	whenn	k	pad	whenn1	stat1
95	junyue	2013-01-06 14:44:00.000000	1	qqqqqqqqqqwwwwwwwwwweeeeeeeeeerrrrrrrrrrtttttttttt	2013-01-07 14:44:00.000000	NULL
select * from sbtest where id = 96;
id	name	whenn	k	pad	whenn1	stat1
96	junyue	2013-01-06 14:44:00.000000	1	qqqqqqqqqqwwwwwwwwwweeeeeeeeeerrrrrrrrrrtttttttttt	2013-01-07 14:44:00.000000	NULL
select * from sbtest where id = 97;
id	name	whenn	k	pad	whenn1	stat1
97	junyue	2013-01-06 14:44:00.000000	1	qqqqqqqqqqwwwwwwwwwweeeeeeeeeerrrrrrrrrrtttttttttt	2013-01-07 14:44:00.000000	NULL
select * from sbtest where id = 98;
id	name	whenn	k	pad	whenn1	stat1
98	junyue	2013-01-06 14:44:00.000000	1	qqqqqqqqqqwwwwwwwwwweeeeeeeeeerrrrrrrrrrtttttttttt	2013-01-07 14:44:00.000000	NULL
select * from sbtest where id = 99;
id	name	whenn	k	pad	whenn1	stat1
99	junyue	2013-01-06 14:44:00.000000	1	qqqqqqqqqqwwwwwwwwwweeeeeeeeeerrrrrrrrrrtttttttttt	2013-01-07 14:44:00.000000	NULL
select * from sbtest where id = 100;
id	name	whenn	k	pad	whenn1	stat1
100	junyue	2013-01-06 14:44:00.000000	1	qqqqqqqqqqwwwwwwwwwweeeeeeeeeerrrrrrrrrrtttttttttt	2013-01-07 14:44:00.000000	NULL
insert another 100 rows to ups
insert into sbtest(id,name,whenn,k,pad,whenn1) values (101,'junyue','2013-1-6 14:44:00',1,'qqqqqqqqqqwwwwwwwwwweeeeeeeeeerrrrrrrrrrtttttttttt','2013-1-7 14:44:00');
insert into sbtest(id,name,whenn,k,pad,whenn1) values (102,'junyue','2013-1-6 14:44:00',1,'qqqqqqqqqqwwwwwwwwwweeeeeeeeeerrrrrrrrrrtttttttttt','2013-1-7 14:44:00');
insert into sbtest(id,name,whenn,k,pad,whenn1) values (103,'junyue','2013-1-6 14:44:00',1,'qqqqqqqqqqwwwwwwwwwweeeeeeeeeerrrrrrrrrrtttttttttt','2013-1-7 14:44:00');
insert into sbtest(id,name,whenn,k,pad,whenn1) values (104,'junyue','2013-1-6 14:44:00',1,'qqqqqqqqqqwwwwwwwwwweeeeeeeeeerrrrrrrrrrtttttttttt','2013-1-7 14:44:00');
insert into sbtest(id,name,whenn,k,pad,whenn1) values (105,'junyue','2013-1-6 14:44:00',1,'qqqqqqqqqqwwwwwwwwwweeeeeeeeeerrrrrrrrrrtttttttttt','2013-1-7 14:44:00');
insert into sbtest(id,name,whenn,k,pad,whenn1) values (106,'junyue','2013-1-6 14:44:00',1,'qqqqqqqqqqwwwwwwwwwweeeeeeeeeerrrrrrrrrrtttttttttt','2013-1-7 14:44:00');
insert into sbtest(id,name,whenn,k,pad,whenn1) values (107,'junyue','2013-1-6 14:44:00',1,'qqqqqqqqqqwwwwwwwwwweeeeeeeeeerrrrrrrrrrtttttttttt','2013-1-7 14:44:00');
insert into sbtest(id,name,whenn,k,pad,whenn1) values (108,'junyue','2013-1-6 14:44:00',1,'qqqqqqqqqqwwwwwwwwwweeeeeeeeeerrrrrrrrrrtttttttttt','2013-1-7 14:44:00');
insert into sbtest(id,name,whenn,k,pad,whenn1) values (109,'junyue','2013-1-6 14:44:00',1,'qqqqqqqqqqwwwwwwwwwweeeeeeeeeerrrrrrrrrrtttttttttt','2013-1-7 14:44:00');
insert into sbtest(id,name,whenn,k,pad,whenn1) values (110,'junyue','2013-1-6 14:44:00',1,'qqqqqqqqqqwwwwwwwwwweeeeeeeeeerrrrrrrrrrtttttttttt','2013-1-7 14:44:00');
insert into sbtest(id,name,whenn,k,pad,whenn1) values (111,'junyue','2013-1-6 14:44:00',1,'qqqqqqqqqqwwwwwwwwwweeeeeeeeeerrrrrrrrrrtttttttttt','2013-1-7 14:44:00');
insert into sbtest(id,name,whenn,k,pad,whenn1) values (112,'junyue','2013-1-6 14:44:00',1,'qqqqqqqqqqwwwwwwwwwweeeeeeeeeerrrrrrrrrrtttttttttt','2013-1-7 14:44:00');
insert into sbtest(id,name,whenn,k,pad,whenn1) values (113,'junyue','2013-1-6 14:44:00',1,'qqqqqqqqqqwwwwwwwwwweeeeeeeeeerrrrrrrrrrtttttttttt','2013-1-7 14:44:00');
insert into sbtest(id,name,whenn,k,pad,whenn1) values (114,'junyue','2013-1-6 14:44:00',1,'qqqqqqqqqqwwwwwwwwwweeeeeeeeeerrrrrrrrrrtttttttttt','2013-1-7 14:44:00');
insert into sbtest(id,name,whenn,k,pad,whenn1) values (115,'junyue','2013-1-6 14:44:00',1,'qqqqqqqqqqwwwwwwwwwweeeeeeeeeerrrrrrrrrrtttttttttt','2013-1-7 14:44:00');
insert into sbtest(id,name,whenn,k,pad,whenn1) values (116,'junyue','2013-1-6 14:44:00',1,'qqqqqqqqqqwwwwwwwwwweeeeeeeeeerrrrrrrrrrtttttttttt','2013-1-7 14:44:00');
insert into sbtest(id,name,whenn,k,pad,whenn1) values (117,'junyue','2013-1-6 14:44:00',1,'qqqqqqqqqqwwwwwwwwwweeeeeeeeeerrrrrrrrrrtttttttttt','2013-1-7 14:44:00');
insert into sbtest(id,name,whenn,k,pad,whenn1) values (118,'junyue','2013-1-6 14:44:00',1,'qqqqqqqqqqwwwwwwwwwweeeeeeeeeerrrrrrrrrrtttttttttt','2013-1-7 14:44:00');
insert into sbtest(id,name,whenn,k,pad,whenn1) values (119,'junyue','2013-1-6 14:44:00',1,'qqqqqqqqqqwwwwwwwwwweeeeeeeeeerrrrrrrrrrtttttttttt','2013-1-7 14:44:00');
insert into sbtest(id,name,whenn,k,pad,whenn1) values (120,'junyue','2013-1-6 14:44:00',1,'qqqqqqqqqqwwwwwwwwwweeeeeeeeeerrrrrrrrrrtttttttttt','2013-1-7 14:44:00');
insert into sbtest(id,name,whenn,k,pad,whenn1) values (121,'junyue','2013-1-6 14:44:00',1,'qqqqqqqqqqwwwwwwwwwweeeeeeeeeerrrrrrrrrrtttttttttt','2013-1-7 14:44:00');
insert into sbtest(id,name,whenn,k,pad,whenn1) values (122,'junyue','2013-1-6 14:44:00',1,'qqqqqqqqqqwwwwwwwwwweeeeeeeeeerrrrrrrrrrtttttttttt','2013-1-7 14:44:00');
insert into sbtest(id,name,whenn,k,pad,whenn1) values (123,'junyue','2013-1-6 14:44:00',1,'qqqqqqqqqqwwwwwwwwwweeeeeeeeeerrrrrrrrrrtttttttttt','2013-1-7 14:44:00');
insert into sbtest(id,name,whenn,k,pad,whenn1) values (124,'junyue','2013-1-6 14:44:00',1,'qqqqqqqqqqwwwwwwwwwweeeeeeeeeerrrrrrrrrrtttttttttt','2013-1-7 14:44:00');
insert into sbtest(id,name,whenn,k,pad,whenn1) values (125,'junyue','2013-1-6 14:44:00',1,'qqqqqqqqqqwwwwwwwwwweeeeeeeeeerrrrrrrrrrtttttttttt','2013-1-7 14:44:00');
insert into sbtest(id,name,whenn,k,pad,whenn1) values (126,'junyue','2013-1-6 14:44:00',1,'qqqqqqqqqqwwwwwwwwwweeeeeeeeeerrrrrrrrrrtttttttttt','2013-1-7 14:44:00');
insert into sbtest(id,name,whenn,k,pad,whenn1) values (127,'junyue','2013-1-6 14:44:00',1,'qqqqqqqqqqwwwwwwwwwweeeeeeeeeerrrrrrrrrrtttttttttt','2013-1-7 14:44:00');
insert into sbtest(id,name,whenn,k,pad,whenn1) values (128,'junyue','2013-1-6 14:44:00',1,'qqqqqqqqqqwwwwwwwwwweeeeeeeeeerrrrrrrrrrtttttttttt','2013-1-7 14:44:00');
insert into sbtest(id,name,whenn,k,pad,whenn1) values (129,'junyue','2013-1-6 14:44:00',1,'qqqqqqqqqqwwwwwwwwwweeeeeeeeeerrrrrrrrrrtttttttttt','2013-1-7 14:44:00');
insert into sbtest(id,name,whenn,k,pad,whenn1) values (130,'junyue','2013-1-6 14:44:00',1,'qqqqqqqqqqwwwwwwwwwweeeeeeeeeerrrrrrrrrrtttttttttt','2013-1-7 14:44:00');
insert into sbtest(id,name,whenn,k,pad,whenn1) values (131,'junyue','2013-1-6 14:44:00',1,'qqqqqqqqqqwwwwwwwwwweeeeeeeeeerrrrrrrrrrtttttttttt','2013-1-7 14:44:00');
insert into sbtest(id,name,whenn,k,pad,whenn1) values (132,'junyue','2013-1-6 14:44:00',1,'qqqqqqqqqqwwwwwwwwwweeeeeeeeeerrrrrrrrrrtttttttttt','2013-1-7 14:44:00');
insert into sbtest(id,name,whenn,k,pad,whenn1) values (133,'junyue','2013-1-6 14:44:00',1,'qqqqqqqqqqwwwwwwwwwweeeeeeeeeerrrrrrrrrrtttttttttt','2013-1-7 14:44:00');
insert into sbtest(id,name,whenn,k,pad,whenn1) values (134,'junyue','2013-1-6 14:44:00',1,'qqqqqqqqqqwwwwwwwwwweeeeeeeeeerrrrrrrrrrtttttttttt','2013-1-7 14:44:00');
insert into sbtest(id,name,whenn,k,pad,whenn1) values (135,'junyue','2013-1-6 14:44:00',1,'qqqqqqqqqqwwwwwwwwwweeeeeeeeeerrrrrrrrrrtttttttttt','2013-1-7 14:44:00');
insert into sbtest(id,name,whenn,k,pad,whenn1) values (136,'junyue','2013-1-6 14:44:00',1,'qqqqqqqqqqwwwwwwwwwweeeeeeeeeerrrrrrrrrrtttttttttt','2013-1-7 14:44:00');
insert into sbtest(id,name,whenn,k,pad,whenn1) values (137,'junyue','2013-1-6 14:44:00',1,'qqqqqqqqqqwwwwwwwwwweeeeeeeeeerrrrrrrrrrtttttttttt','2013-1-7 14:44:00');
insert into sbtest(id,name,whenn,k,pad,whenn1) values (138,'junyue','2013-1-6 14:44:00',1,'qqqqqqqqqqwwwwwwwwwweeeeeeeeeerrrrrrrrrrtttttttttt','2013-1-7 14:44:00');
insert into sbtest(id,name,whenn,k,pad,whenn1) values (139,'junyue','2013-1-6 14:44:00',1,'qqqqqqqqqqwwwwwwwwwweeeeeeeeeerrrrrrrrrrtttttttttt','2013-1-7 14:44:00');
insert into sbtest(id,name,whenn,k,pad,whenn1) values (140,'junyue','2013-1-6 14:44:00',1,'qqqqqqqqqqwwwwwwwwwweeeeeeeeeerrrrrrrrrrtttttttttt','2013-1-7 14:44:00');
insert into sbtest(id,name,whenn,k,pad,whenn1) values (141,'junyue','2013-1-6 14:44:00',1,'qqqqqqqqqqwwwwwwwwwweeeeeeeeeerrrrrrrrrrtttttttttt','2013-1-7 14:44:00');
insert into sbtest(id,name,whenn,k,pad,whenn1) values (142,'junyue','2013-1-6 14:44:00',1,'qqqqqqqqqqwwwwwwwwwweeeeeeeeeerrrrrrrrrrtttttttttt','2013-1-7 14:44:00');
insert into sbtest(id,name,whenn,k,pad,whenn1) values (143,'junyue','2013-1-6 14:44:00',1,'qqqqqqqqqqwwwwwwwwwweeeeeeeeeerrrrrrrrrrtttttttttt','2013-1-7 14:44:00');
insert into sbtest(id,name,whenn,k,pad,whenn1) values (144,'junyue','2013-1-6 14:44:00',1,'qqqqqqqqqqwwwwwwwwwweeeeeeeeeerrrrrrrrrrtttttttttt','2013-1-7 14:44:00');
insert into sbtest(id,name,whenn,k,pad,whenn1) values (145,'junyue','2013-1-6 14:44:00',1,'qqqqqqqqqqwwwwwwwwwweeeeeeeeeerrrrrrrrrrtttttttttt','2013-1-7 14:44:00');
insert into sbtest(id,name,whenn,k,pad,whenn1) values (146,'junyue','2013-1-6 14:44:00',1,'qqqqqqqqqqwwwwwwwwwweeeeeeeeeerrrrrrrrrrtttttttttt','2013-1-7 14:44:00');
insert into sbtest(id,name,whenn,k,pad,whenn1) values (147,'junyue','2013-1-6 14:44:00',1,'qqqqqqqqqqwwwwwwwwwweeeeeeeeeerrrrrrrrrrtttttttttt','2013-1-7 14:44:00');
insert into sbtest(id,name,whenn,k,pad,whenn1) values (148,'junyue','2013-1-6 14:44:00',1,'qqqqqqqqqqwwwwwwwwwweeeeeeeeeerrrrrrrrrrtttttttttt','2013-1-7 14:44:00');
insert into sbtest(id,name,whenn,k,pad,whenn1) values (149,'junyue','2013-1-6 14:44:00',1,'qqqqqqqqqqwwwwwwwwwweeeeeeeeeerrrrrrrrrrtttttttttt','2013-1-7 14:44:00');
insert into sbtest(id,name,whenn,k,pad,whenn1) values (150,'junyue','2013-1-6 14:44:00',1,'qqqqqqqqqqwwwwwwwwwweeeeeeeeeerrrrrrrrrrtttttttttt','2013-1-7 14:44:00');
insert into sbtest(id,name,whenn,k,pad,whenn1) values (151,'junyue','2013-1-6 14:44:00',1,'qqqqqqqqqqwwwwwwwwwweeeeeeeeeerrrrrrrrrrtttttttttt','2013-1-7 14:44:00');
insert into sbtest(id,name,whenn,k,pad,whenn1) values (152,'junyue','2013-1-6 14:44:00',1,'qqqqqqqqqqwwwwwwwwwweeeeeeeeeerrrrrrrrrrtttttttttt','2013-1-7 14:44:00');
insert into sbtest(id,name,whenn,k,pad,whenn1) values (153,'junyue','2013-1-6 14:44:00',1,'qqqqqqqqqqwwwwwwwwwweeeeeeeeeerrrrrrrrrrtttttttttt','2013-1-7 14:44:00');
insert into sbtest(id,name,whenn,k,pad,whenn1) values (154,'junyue','2013-1-6 14:44:00',1,'qqqqqqqqqqwwwwwwwwwweeeeeeeeeerrrrrrrrrrtttttttttt','2013-1-7 14:44:00');
insert into sbtest(id,name,whenn,k,pad,whenn1) values (155,'junyue','2013-1-6 14:44:00',1,'qqqqqqqqqqwwwwwwwwwweeeeeeeeeerrrrrrrrrrtttttttttt','2013-1-7 14:44:00');
insert into sbtest(id,name,whenn,k,pad,whenn1) values (156,'junyue','2013-1-6 14:44:00',1,'qqqqqqqqqqwwwwwwwwwweeeeeeeeeerrrrrrrrrrtttttttttt','2013-1-7 14:44:00');
insert into sbtest(id,name,whenn,k,pad,whenn1) values (157,'junyue','2013-1-6 14:44:00',1,'qqqqqqqqqqwwwwwwwwwweeeeeeeeeerrrrrrrrrrtttttttttt','2013-1-7 14:44:00');
insert into sbtest(id,name,whenn,k,pad,whenn1) values (158,'junyue','2013-1-6 14:44:00',1,'qqqqqqqqqqwwwwwwwwwweeeeeeeeeerrrrrrrrrrtttttttttt','2013-1-7 14:44:00');
insert into sbtest(id,name,whenn,k,pad,whenn1) values (159,'junyue','2013-1-6 14:44:00',1,'qqqqqqqqqqwwwwwwwwwweeeeeeeeeerrrrrrrrrrtttttttttt','2013-1-7 14:44:00');
insert into sbtest(id,name,whenn,k,pad,whenn1) values (160,'junyue','2013-1-6 14:44:00',1,'qqqqqqqqqqwwwwwwwwwweeeeeeeeeerrrrrrrrrrtttttttttt','2013-1-7 14:44:00');
insert into sbtest(id,name,whenn,k,pad,whenn1) values (161,'junyue','2013-1-6 14:44:00',1,'qqqqqqqqqqwwwwwwwwwweeeeeeeeeerrrrrrrrrrtttttttttt','2013-1-7 14:44:00');
insert into sbtest(id,name,whenn,k,pad,whenn1) values (162,'junyue','2013-1-6 14:44:00',1,'qqqqqqqqqqwwwwwwwwwweeeeeeeeeerrrrrrrrrrtttttttttt','2013-1-7 14:44:00');
insert into sbtest(id,name,whenn,k,pad,whenn1) values (163,'junyue','2013-1-6 14:44:00',1,'qqqqqqqqqqwwwwwwwwwweeeeeeeeeerrrrrrrrrrtttttttttt','2013-1-7 14:44:00');
insert into sbtest(id,name,whenn,k,pad,whenn1) values (164,'junyue','2013-1-6 14:44:00',1,'qqqqqqqqqqwwwwwwwwwweeeeeeeeeerrrrrrrrrrtttttttttt','2013-1-7 14:44:00');
insert into sbtest(id,name,whenn,k,pad,whenn1) values (165,'junyue','2013-1-6 14:44:00',1,'qqqqqqqqqqwwwwwwwwwweeeeeeeeeerrrrrrrrrrtttttttttt','2013-1-7 14:44:00');
insert into sbtest(id,name,whenn,k,pad,whenn1) values (166,'junyue','2013-1-6 14:44:00',1,'qqqqqqqqqqwwwwwwwwwweeeeeeeeeerrrrrrrrrrtttttttttt','2013-1-7 14:44:00');
insert into sbtest(id,name,whenn,k,pad,whenn1) values (167,'junyue','2013-1-6 14:44:00',1,'qqqqqqqqqqwwwwwwwwwweeeeeeeeeerrrrrrrrrrtttttttttt','2013-1-7 14:44:00');
insert into sbtest(id,name,whenn,k,pad,whenn1) values (168,'junyue','2013-1-6 14:44:00',1,'qqqqqqqqqqwwwwwwwwwweeeeeeeeeerrrrrrrrrrtttttttttt','2013-1-7 14:44:00');
insert into sbtest(id,name,whenn,k,pad,whenn1) values (169,'junyue','2013-1-6 14:44:00',1,'qqqqqqqqqqwwwwwwwwwweeeeeeeeeerrrrrrrrrrtttttttttt','2013-1-7 14:44:00');
insert into sbtest(id,name,whenn,k,pad,whenn1) values (170,'junyue','2013-1-6 14:44:00',1,'qqqqqqqqqqwwwwwwwwwweeeeeeeeeerrrrrrrrrrtttttttttt','2013-1-7 14:44:00');
insert into sbtest(id,name,whenn,k,pad,whenn1) values (171,'junyue','2013-1-6 14:44:00',1,'qqqqqqqqqqwwwwwwwwwweeeeeeeeeerrrrrrrrrrtttttttttt','2013-1-7 14:44:00');
insert into sbtest(id,name,whenn,k,pad,whenn1) values (172,'junyue','2013-1-6 14:44:00',1,'qqqqqqqqqqwwwwwwwwwweeeeeeeeeerrrrrrrrrrtttttttttt','2013-1-7 14:44:00');
insert into sbtest(id,name,whenn,k,pad,whenn1) values (173,'junyue','2013-1-6 14:44:00',1,'qqqqqqqqqqwwwwwwwwwweeeeeeeeeerrrrrrrrrrtttttttttt','2013-1-7 14:44:00');
insert into sbtest(id,name,whenn,k,pad,whenn1) values (174,'junyue','2013-1-6 14:44:00',1,'qqqqqqqqqqwwwwwwwwwweeeeeeeeeerrrrrrrrrrtttttttttt','2013-1-7 14:44:00');
insert into sbtest(id,name,whenn,k,pad,whenn1) values (175,'junyue','2013-1-6 14:44:00',1,'qqqqqqqqqqwwwwwwwwwweeeeeeeeeerrrrrrrrrrtttttttttt','2013-1-7 14:44:00');
insert into sbtest(id,name,whenn,k,pad,whenn1) values (176,'junyue','2013-1-6 14:44:00',1,'qqqqqqqqqqwwwwwwwwwweeeeeeeeeerrrrrrrrrrtttttttttt','2013-1-7 14:44:00');
insert into sbtest(id,name,whenn,k,pad,whenn1) values (177,'junyue','2013-1-6 14:44:00',1,'qqqqqqqqqqwwwwwwwwwweeeeeeeeeerrrrrrrrrrtttttttttt','2013-1-7 14:44:00');
insert into sbtest(id,name,whenn,k,pad,whenn1) values (178,'junyue','2013-1-6 14:44:00',1,'qqqqqqqqqqwwwwwwwwwweeeeeeeeeerrrrrrrrrrtttttttttt','2013-1-7 14:44:00');
insert into sbtest(id,name,whenn,k,pad,whenn1) values (179,'junyue','2013-1-6 14:44:00',1,'qqqqqqqqqqwwwwwwwwwweeeeeeeeeerrrrrrrrrrtttttttttt','2013-1-7 14:44:00');
insert into sbtest(id,name,whenn,k,pad,whenn1) values (180,'junyue','2013-1-6 14:44:00',1,'qqqqqqqqqqwwwwwwwwwweeeeeeeeeerrrrrrrrrrtttttttttt','2013-1-7 14:44:00');
insert into sbtest(id,name,whenn,k,pad,whenn1) values (181,'junyue','2013-1-6 14:44:00',1,'qqqqqqqqqqwwwwwwwwwweeeeeeeeeerrrrrrrrrrtttttttttt','2013-1-7 14:44:00');
insert into sbtest(id,name,whenn,k,pad,whenn1) values (182,'junyue','2013-1-6 14:44:00',1,'qqqqqqqqqqwwwwwwwwwweeeeeeeeeerrrrrrrrrrtttttttttt','2013-1-7 14:44:00');
insert into sbtest(id,name,whenn,k,pad,whenn1) values (183,'junyue','2013-1-6 14:44:00',1,'qqqqqqqqqqwwwwwwwwwweeeeeeeeeerrrrrrrrrrtttttttttt','2013-1-7 14:44:00');
insert into sbtest(id,name,whenn,k,pad,whenn1) values (184,'junyue','2013-1-6 14:44:00',1,'qqqqqqqqqqwwwwwwwwwweeeeeeeeeerrrrrrrrrrtttttttttt','2013-1-7 14:44:00');
insert into sbtest(id,name,whenn,k,pad,whenn1) values (185,'junyue','2013-1-6 14:44:00',1,'qqqqqqqqqqwwwwwwwwwweeeeeeeeeerrrrrrrrrrtttttttttt','2013-1-7 14:44:00');
insert into sbtest(id,name,whenn,k,pad,whenn1) values (186,'junyue','2013-1-6 14:44:00',1,'qqqqqqqqqqwwwwwwwwwweeeeeeeeeerrrrrrrrrrtttttttttt','2013-1-7 14:44:00');
insert into sbtest(id,name,whenn,k,pad,whenn1) values (187,'junyue','2013-1-6 14:44:00',1,'qqqqqqqqqqwwwwwwwwwweeeeeeeeeerrrrrrrrrrtttttttttt','2013-1-7 14:44:00');
insert into sbtest(id,name,whenn,k,pad,whenn1) values (188,'junyue','2013-1-6 14:44:00',1,'qqqqqqqqqqwwwwwwwwwweeeeeeeeeerrrrrrrrrrtttttttttt','2013-1-7 14:44:00');
insert into sbtest(id,name,whenn,k,pad,whenn1) values (189,'junyue','2013-1-6 14:44:00',1,'qqqqqqqqqqwwwwwwwwwweeeeeeeeeerrrrrrrrrrtttttttttt','2013-1-7 14:44:00');
insert into sbtest(id,name,whenn,k,pad,whenn1) values (190,'junyue','2013-1-6 14:44:00',1,'qqqqqqqqqqwwwwwwwwwweeeeeeeeeerrrrrrrrrrtttttttttt','2013-1-7 14:44:00');
insert into sbtest(id,name,whenn,k,pad,whenn1) values (191,'junyue','2013-1-6 14:44:00',1,'qqqqqqqqqqwwwwwwwwwweeeeeeeeeerrrrrrrrrrtttttttttt','2013-1-7 14:44:00');
insert into sbtest(id,name,whenn,k,pad,whenn1) values (192,'junyue','2013-1-6 14:44:00',1,'qqqqqqqqqqwwwwwwwwwweeeeeeeeeerrrrrrrrrrtttttttttt','2013-1-7 14:44:00');
insert into sbtest(id,name,whenn,k,pad,whenn1) values (193,'junyue','2013-1-6 14:44:00',1,'qqqqqqqqqqwwwwwwwwwweeeeeeeeeerrrrrrrrrrtttttttttt','2013-1-7 14:44:00');
insert into sbtest(id,name,whenn,k,pad,whenn1) values (194,'junyue','2013-1-6 14:44:00',1,'qqqqqqqqqqwwwwwwwwwweeeeeeeeeerrrrrrrrrrtttttttttt','2013-1-7 14:44:00');
insert into sbtest(id,name,whenn,k,pad,whenn1) values (195,'junyue','2013-1-6 14:44:00',1,'qqqqqqqqqqwwwwwwwwwweeeeeeeeeerrrrrrrrrrtttttttttt','2013-1-7 14:44:00');
insert into sbtest(id,name,whenn,k,pad,whenn1) values (196,'junyue','2013-1-6 14:44:00',1,'qqqqqqqqqqwwwwwwwwwweeeeeeeeeerrrrrrrrrrtttttttttt','2013-1-7 14:44:00');
insert into sbtest(id,name,whenn,k,pad,whenn1) values (197,'junyue','2013-1-6 14:44:00',1,'qqqqqqqqqqwwwwwwwwwweeeeeeeeeerrrrrrrrrrtttttttttt','2013-1-7 14:44:00');
insert into sbtest(id,name,whenn,k,pad,whenn1) values (198,'junyue','2013-1-6 14:44:00',1,'qqqqqqqqqqwwwwwwwwwweeeeeeeeeerrrrrrrrrrtttttttttt','2013-1-7 14:44:00');
insert into sbtest(id,name,whenn,k,pad,whenn1) values (199,'junyue','2013-1-6 14:44:00',1,'qqqqqqqqqqwwwwwwwwwweeeeeeeeeerrrrrrrrrrtttttttttt','2013-1-7 14:44:00');
insert into sbtest(id,name,whenn,k,pad,whenn1) values (200,'junyue','2013-1-6 14:44:00',1,'qqqqqqqqqqwwwwwwwwwweeeeeeeeeerrrrrrrrrrtttttttttt','2013-1-7 14:44:00');
merge
major_freeze...
insert another 100 rows to ups
insert into sbtest(id,name,whenn,k,pad,whenn1) values (201,'junyue','2013-1-6 14:44:00',1,'qqqqqqqqqqwwwwwwwwwweeeeeeeeeerrrrrrrrrrtttttttttt','2013-1-7 14:44:00');
insert into sbtest(id,name,whenn,k,pad,whenn1) values (202,'junyue','2013-1-6 14:44:00',1,'qqqqqqqqqqwwwwwwwwwweeeeeeeeeerrrrrrrrrrtttttttttt','2013-1-7 14:44:00');
insert into sbtest(id,name,whenn,k,pad,whenn1) values (203,'junyue','2013-1-6 14:44:00',1,'qqqqqqqqqqwwwwwwwwwweeeeeeeeeerrrrrrrrrrtttttttttt','2013-1-7 14:44:00');
insert into sbtest(id,name,whenn,k,pad,whenn1) values (204,'junyue','2013-1-6 14:44:00',1,'qqqqqqqqqqwwwwwwwwwweeeeeeeeeerrrrrrrrrrtttttttttt','2013-1-7 14:44:00');
insert into sbtest(id,name,whenn,k,pad,whenn1) values (205,'junyue','2013-1-6 14:44:00',1,'qqqqqqqqqqwwwwwwwwwweeeeeeeeeerrrrrrrrrrtttttttttt','2013-1-7 14:44:00');
insert into sbtest(id,name,whenn,k,pad,whenn1) values (206,'junyue','2013-1-6 14:44:00',1,'qqqqqqqqqqwwwwwwwwwweeeeeeeeeerrrrrrrrrrtttttttttt','2013-1-7 14:44:00');
insert into sbtest(id,name,whenn,k,pad,whenn1) values (207,'junyue','2013-1-6 14:44:00',1,'qqqqqqqqqqwwwwwwwwwweeeeeeeeeerrrrrrrrrrtttttttttt','2013-1-7 14:44:00');
insert into sbtest(id,name,whenn,k,pad,whenn1) values (208,'junyue','2013-1-6 14:44:00',1,'qqqqqqqqqqwwwwwwwwwweeeeeeeeeerrrrrrrrrrtttttttttt','2013-1-7 14:44:00');
insert into sbtest(id,name,whenn,k,pad,whenn1) values (209,'junyue','2013-1-6 14:44:00',1,'qqqqqqqqqqwwwwwwwwwweeeeeeeeeerrrrrrrrrrtttttttttt','2013-1-7 14:44:00');
insert into sbtest(id,name,whenn,k,pad,whenn1) values (210,'junyue','2013-1-6 14:44:00',1,'qqqqqqqqqqwwwwwwwwwweeeeeeeeeerrrrrrrrrrtttttttttt','2013-1-7 14:44:00');
insert into sbtest(id,name,whenn,k,pad,whenn1) values (211,'junyue','2013-1-6 14:44:00',1,'qqqqqqqqqqwwwwwwwwwweeeeeeeeeerrrrrrrrrrtttttttttt','2013-1-7 14:44:00');
insert into sbtest(id,name,whenn,k,pad,whenn1) values (212,'junyue','2013-1-6 14:44:00',1,'qqqqqqqqqqwwwwwwwwwweeeeeeeeeerrrrrrrrrrtttttttttt','2013-1-7 14:44:00');
insert into sbtest(id,name,whenn,k,pad,whenn1) values (213,'junyue','2013-1-6 14:44:00',1,'qqqqqqqqqqwwwwwwwwwweeeeeeeeeerrrrrrrrrrtttttttttt','2013-1-7 14:44:00');
insert into sbtest(id,name,whenn,k,pad,whenn1) values (214,'junyue','2013-1-6 14:44:00',1,'qqqqqqqqqqwwwwwwwwwweeeeeeeeeerrrrrrrrrrtttttttttt','2013-1-7 14:44:00');
insert into sbtest(id,name,whenn,k,pad,whenn1) values (215,'junyue','2013-1-6 14:44:00',1,'qqqqqqqqqqwwwwwwwwwweeeeeeeeeerrrrrrrrrrtttttttttt','2013-1-7 14:44:00');
insert into sbtest(id,name,whenn,k,pad,whenn1) values (216,'junyue','2013-1-6 14:44:00',1,'qqqqqqqqqqwwwwwwwwwweeeeeeeeeerrrrrrrrrrtttttttttt','2013-1-7 14:44:00');
insert into sbtest(id,name,whenn,k,pad,whenn1) values (217,'junyue','2013-1-6 14:44:00',1,'qqqqqqqqqqwwwwwwwwwweeeeeeeeeerrrrrrrrrrtttttttttt','2013-1-7 14:44:00');
insert into sbtest(id,name,whenn,k,pad,whenn1) values (218,'junyue','2013-1-6 14:44:00',1,'qqqqqqqqqqwwwwwwwwwweeeeeeeeeerrrrrrrrrrtttttttttt','2013-1-7 14:44:00');
insert into sbtest(id,name,whenn,k,pad,whenn1) values (219,'junyue','2013-1-6 14:44:00',1,'qqqqqqqqqqwwwwwwwwwweeeeeeeeeerrrrrrrrrrtttttttttt','2013-1-7 14:44:00');
insert into sbtest(id,name,whenn,k,pad,whenn1) values (220,'junyue','2013-1-6 14:44:00',1,'qqqqqqqqqqwwwwwwwwwweeeeeeeeeerrrrrrrrrrtttttttttt','2013-1-7 14:44:00');
insert into sbtest(id,name,whenn,k,pad,whenn1) values (221,'junyue','2013-1-6 14:44:00',1,'qqqqqqqqqqwwwwwwwwwweeeeeeeeeerrrrrrrrrrtttttttttt','2013-1-7 14:44:00');
insert into sbtest(id,name,whenn,k,pad,whenn1) values (222,'junyue','2013-1-6 14:44:00',1,'qqqqqqqqqqwwwwwwwwwweeeeeeeeeerrrrrrrrrrtttttttttt','2013-1-7 14:44:00');
insert into sbtest(id,name,whenn,k,pad,whenn1) values (223,'junyue','2013-1-6 14:44:00',1,'qqqqqqqqqqwwwwwwwwwweeeeeeeeeerrrrrrrrrrtttttttttt','2013-1-7 14:44:00');
insert into sbtest(id,name,whenn,k,pad,whenn1) values (224,'junyue','2013-1-6 14:44:00',1,'qqqqqqqqqqwwwwwwwwwweeeeeeeeeerrrrrrrrrrtttttttttt','2013-1-7 14:44:00');
insert into sbtest(id,name,whenn,k,pad,whenn1) values (225,'junyue','2013-1-6 14:44:00',1,'qqqqqqqqqqwwwwwwwwwweeeeeeeeeerrrrrrrrrrtttttttttt','2013-1-7 14:44:00');
insert into sbtest(id,name,whenn,k,pad,whenn1) values (226,'junyue','2013-1-6 14:44:00',1,'qqqqqqqqqqwwwwwwwwwweeeeeeeeeerrrrrrrrrrtttttttttt','2013-1-7 14:44:00');
insert into sbtest(id,name,whenn,k,pad,whenn1) values (227,'junyue','2013-1-6 14:44:00',1,'qqqqqqqqqqwwwwwwwwwweeeeeeeeeerrrrrrrrrrtttttttttt','2013-1-7 14:44:00');
insert into sbtest(id,name,whenn,k,pad,whenn1) values (228,'junyue','2013-1-6 14:44:00',1,'qqqqqqqqqqwwwwwwwwwweeeeeeeeeerrrrrrrrrrtttttttttt','2013-1-7 14:44:00');
insert into sbtest(id,name,whenn,k,pad,whenn1) values (229,'junyue','2013-1-6 14:44:00',1,'qqqqqqqqqqwwwwwwwwwweeeeeeeeeerrrrrrrrrrtttttttttt','2013-1-7 14:44:00');
insert into sbtest(id,name,whenn,k,pad,whenn1) values (230,'junyue','2013-1-6 14:44:00',1,'qqqqqqqqqqwwwwwwwwwweeeeeeeeeerrrrrrrrrrtttttttttt','2013-1-7 14:44:00');
insert into sbtest(id,name,whenn,k,pad,whenn1) values (231,'junyue','2013-1-6 14:44:00',1,'qqqqqqqqqqwwwwwwwwwweeeeeeeeeerrrrrrrrrrtttttttttt','2013-1-7 14:44:00');
insert into sbtest(id,name,whenn,k,pad,whenn1) values (232,'junyue','2013-1-6 14:44:00',1,'qqqqqqqqqqwwwwwwwwwweeeeeeeeeerrrrrrrrrrtttttttttt','2013-1-7 14:44:00');
insert into sbtest(id,name,whenn,k,pad,whenn1) values (233,'junyue','2013-1-6 14:44:00',1,'qqqqqqqqqqwwwwwwwwwweeeeeeeeeerrrrrrrrrrtttttttttt','2013-1-7 14:44:00');
insert into sbtest(id,name,whenn,k,pad,whenn1) values (234,'junyue','2013-1-6 14:44:00',1,'qqqqqqqqqqwwwwwwwwwweeeeeeeeeerrrrrrrrrrtttttttttt','2013-1-7 14:44:00');
insert into sbtest(id,name,whenn,k,pad,whenn1) values (235,'junyue','2013-1-6 14:44:00',1,'qqqqqqqqqqwwwwwwwwwweeeeeeeeeerrrrrrrrrrtttttttttt','2013-1-7 14:44:00');
insert into sbtest(id,name,whenn,k,pad,whenn1) values (236,'junyue','2013-1-6 14:44:00',1,'qqqqqqqqqqwwwwwwwwwweeeeeeeeeerrrrrrrrrrtttttttttt','2013-1-7 14:44:00');
insert into sbtest(id,name,whenn,k,pad,whenn1) values (237,'junyue','2013-1-6 14:44:00',1,'qqqqqqqqqqwwwwwwwwwweeeeeeeeeerrrrrrrrrrtttttttttt','2013-1-7 14:44:00');
insert into sbtest(id,name,whenn,k,pad,whenn1) values (238,'junyue','2013-1-6 14:44:00',1,'qqqqqqqqqqwwwwwwwwwweeeeeeeeeerrrrrrrrrrtttttttttt','2013-1-7 14:44:00');
insert into sbtest(id,name,whenn,k,pad,whenn1) values (239,'junyue','2013-1-6 14:44:00',1,'qqqqqqqqqqwwwwwwwwwweeeeeeeeeerrrrrrrrrrtttttttttt','2013-1-7 14:44:00');
insert into sbtest(id,name,whenn,k,pad,whenn1) values (240,'junyue','2013-1-6 14:44:00',1,'qqqqqqqqqqwwwwwwwwwweeeeeeeeeerrrrrrrrrrtttttttttt','2013-1-7 14:44:00');
insert into sbtest(id,name,whenn,k,pad,whenn1) values (241,'junyue','2013-1-6 14:44:00',1,'qqqqqqqqqqwwwwwwwwwweeeeeeeeeerrrrrrrrrrtttttttttt','2013-1-7 14:44:00');
insert into sbtest(id,name,whenn,k,pad,whenn1) values (242,'junyue','2013-1-6 14:44:00',1,'qqqqqqqqqqwwwwwwwwwweeeeeeeeeerrrrrrrrrrtttttttttt','2013-1-7 14:44:00');
insert into sbtest(id,name,whenn,k,pad,whenn1) values (243,'junyue','2013-1-6 14:44:00',1,'qqqqqqqqqqwwwwwwwwwweeeeeeeeeerrrrrrrrrrtttttttttt','2013-1-7 14:44:00');
insert into sbtest(id,name,whenn,k,pad,whenn1) values (244,'junyue','2013-1-6 14:44:00',1,'qqqqqqqqqqwwwwwwwwwweeeeeeeeeerrrrrrrrrrtttttttttt','2013-1-7 14:44:00');
insert into sbtest(id,name,whenn,k,pad,whenn1) values (245,'junyue','2013-1-6 14:44:00',1,'qqqqqqqqqqwwwwwwwwwweeeeeeeeeerrrrrrrrrrtttttttttt','2013-1-7 14:44:00');
insert into sbtest(id,name,whenn,k,pad,whenn1) values (246,'junyue','2013-1-6 14:44:00',1,'qqqqqqqqqqwwwwwwwwwweeeeeeeeeerrrrrrrrrrtttttttttt','2013-1-7 14:44:00');
insert into sbtest(id,name,whenn,k,pad,whenn1) values (247,'junyue','2013-1-6 14:44:00',1,'qqqqqqqqqqwwwwwwwwwweeeeeeeeeerrrrrrrrrrtttttttttt','2013-1-7 14:44:00');
insert into sbtest(id,name,whenn,k,pad,whenn1) values (248,'junyue','2013-1-6 14:44:00',1,'qqqqqqqqqqwwwwwwwwwweeeeeeeeeerrrrrrrrrrtttttttttt','2013-1-7 14:44:00');
insert into sbtest(id,name,whenn,k,pad,whenn1) values (249,'junyue','2013-1-6 14:44:00',1,'qqqqqqqqqqwwwwwwwwwweeeeeeeeeerrrrrrrrrrtttttttttt','2013-1-7 14:44:00');
insert into sbtest(id,name,whenn,k,pad,whenn1) values (250,'junyue','2013-1-6 14:44:00',1,'qqqqqqqqqqwwwwwwwwwweeeeeeeeeerrrrrrrrrrtttttttttt','2013-1-7 14:44:00');
insert into sbtest(id,name,whenn,k,pad,whenn1) values (251,'junyue','2013-1-6 14:44:00',1,'qqqqqqqqqqwwwwwwwwwweeeeeeeeeerrrrrrrrrrtttttttttt','2013-1-7 14:44:00');
insert into sbtest(id,name,whenn,k,pad,whenn1) values (252,'junyue','2013-1-6 14:44:00',1,'qqqqqqqqqqwwwwwwwwwweeeeeeeeeerrrrrrrrrrtttttttttt','2013-1-7 14:44:00');
insert into sbtest(id,name,whenn,k,pad,whenn1) values (253,'junyue','2013-1-6 14:44:00',1,'qqqqqqqqqqwwwwwwwwwweeeeeeeeeerrrrrrrrrrtttttttttt','2013-1-7 14:44:00');
insert into sbtest(id,name,whenn,k,pad,whenn1) values (254,'junyue','2013-1-6 14:44:00',1,'qqqqqqqqqqwwwwwwwwwweeeeeeeeeerrrrrrrrrrtttttttttt','2013-1-7 14:44:00');
insert into sbtest(id,name,whenn,k,pad,whenn1) values (255,'junyue','2013-1-6 14:44:00',1,'qqqqqqqqqqwwwwwwwwwweeeeeeeeeerrrrrrrrrrtttttttttt','2013-1-7 14:44:00');
insert into sbtest(id,name,whenn,k,pad,whenn1) values (256,'junyue','2013-1-6 14:44:00',1,'qqqqqqqqqqwwwwwwwwwweeeeeeeeeerrrrrrrrrrtttttttttt','2013-1-7 14:44:00');
insert into sbtest(id,name,whenn,k,pad,whenn1) values (257,'junyue','2013-1-6 14:44:00',1,'qqqqqqqqqqwwwwwwwwwweeeeeeeeeerrrrrrrrrrtttttttttt','2013-1-7 14:44:00');
insert into sbtest(id,name,whenn,k,pad,whenn1) values (258,'junyue','2013-1-6 14:44:00',1,'qqqqqqqqqqwwwwwwwwwweeeeeeeeeerrrrrrrrrrtttttttttt','2013-1-7 14:44:00');
insert into sbtest(id,name,whenn,k,pad,whenn1) values (259,'junyue','2013-1-6 14:44:00',1,'qqqqqqqqqqwwwwwwwwwweeeeeeeeeerrrrrrrrrrtttttttttt','2013-1-7 14:44:00');
insert into sbtest(id,name,whenn,k,pad,whenn1) values (260,'junyue','2013-1-6 14:44:00',1,'qqqqqqqqqqwwwwwwwwwweeeeeeeeeerrrrrrrrrrtttttttttt','2013-1-7 14:44:00');
insert into sbtest(id,name,whenn,k,pad,whenn1) values (261,'junyue','2013-1-6 14:44:00',1,'qqqqqqqqqqwwwwwwwwwweeeeeeeeeerrrrrrrrrrtttttttttt','2013-1-7 14:44:00');
insert into sbtest(id,name,whenn,k,pad,whenn1) values (262,'junyue','2013-1-6 14:44:00',1,'qqqqqqqqqqwwwwwwwwwweeeeeeeeeerrrrrrrrrrtttttttttt','2013-1-7 14:44:00');
insert into sbtest(id,name,whenn,k,pad,whenn1) values (263,'junyue','2013-1-6 14:44:00',1,'qqqqqqqqqqwwwwwwwwwweeeeeeeeeerrrrrrrrrrtttttttttt','2013-1-7 14:44:00');
insert into sbtest(id,name,whenn,k,pad,whenn1) values (264,'junyue','2013-1-6 14:44:00',1,'qqqqqqqqqqwwwwwwwwwweeeeeeeeeerrrrrrrrrrtttttttttt','2013-1-7 14:44:00');
insert into sbtest(id,name,whenn,k,pad,whenn1) values (265,'junyue','2013-1-6 14:44:00',1,'qqqqqqqqqqwwwwwwwwwweeeeeeeeeerrrrrrrrrrtttttttttt','2013-1-7 14:44:00');
insert into sbtest(id,name,whenn,k,pad,whenn1) values (266,'junyue','2013-1-6 14:44:00',1,'qqqqqqqqqqwwwwwwwwwweeeeeeeeeerrrrrrrrrrtttttttttt','2013-1-7 14:44:00');
insert into sbtest(id,name,whenn,k,pad,whenn1) values (267,'junyue','2013-1-6 14:44:00',1,'qqqqqqqqqqwwwwwwwwwweeeeeeeeeerrrrrrrrrrtttttttttt','2013-1-7 14:44:00');
insert into sbtest(id,name,whenn,k,pad,whenn1) values (268,'junyue','2013-1-6 14:44:00',1,'qqqqqqqqqqwwwwwwwwwweeeeeeeeeerrrrrrrrrrtttttttttt','2013-1-7 14:44:00');
insert into sbtest(id,name,whenn,k,pad,whenn1) values (269,'junyue','2013-1-6 14:44:00',1,'qqqqqqqqqqwwwwwwwwwweeeeeeeeeerrrrrrrrrrtttttttttt','2013-1-7 14:44:00');
insert into sbtest(id,name,whenn,k,pad,whenn1) values (270,'junyue','2013-1-6 14:44:00',1,'qqqqqqqqqqwwwwwwwwwweeeeeeeeeerrrrrrrrrrtttttttttt','2013-1-7 14:44:00');
insert into sbtest(id,name,whenn,k,pad,whenn1) values (271,'junyue','2013-1-6 14:44:00',1,'qqqqqqqqqqwwwwwwwwwweeeeeeeeeerrrrrrrrrrtttttttttt','2013-1-7 14:44:00');
insert into sbtest(id,name,whenn,k,pad,whenn1) values (272,'junyue','2013-1-6 14:44:00',1,'qqqqqqqqqqwwwwwwwwwweeeeeeeeeerrrrrrrrrrtttttttttt','2013-1-7 14:44:00');
insert into sbtest(id,name,whenn,k,pad,whenn1) values (273,'junyue','2013-1-6 14:44:00',1,'qqqqqqqqqqwwwwwwwwwweeeeeeeeeerrrrrrrrrrtttttttttt','2013-1-7 14:44:00');
insert into sbtest(id,name,whenn,k,pad,whenn1) values (274,'junyue','2013-1-6 14:44:00',1,'qqqqqqqqqqwwwwwwwwwweeeeeeeeeerrrrrrrrrrtttttttttt','2013-1-7 14:44:00');
insert into sbtest(id,name,whenn,k,pad,whenn1) values (275,'junyue','2013-1-6 14:44:00',1,'qqqqqqqqqqwwwwwwwwwweeeeeeeeeerrrrrrrrrrtttttttttt','2013-1-7 14:44:00');
insert into sbtest(id,name,whenn,k,pad,whenn1) values (276,'junyue','2013-1-6 14:44:00',1,'qqqqqqqqqqwwwwwwwwwweeeeeeeeeerrrrrrrrrrtttttttttt','2013-1-7 14:44:00');
insert into sbtest(id,name,whenn,k,pad,whenn1) values (277,'junyue','2013-1-6 14:44:00',1,'qqqqqqqqqqwwwwwwwwwweeeeeeeeeerrrrrrrrrrtttttttttt','2013-1-7 14:44:00');
insert into sbtest(id,name,whenn,k,pad,whenn1) values (278,'junyue','2013-1-6 14:44:00',1,'qqqqqqqqqqwwwwwwwwwweeeeeeeeeerrrrrrrrrrtttttttttt','2013-1-7 14:44:00');
insert into sbtest(id,name,whenn,k,pad,whenn1) values (279,'junyue','2013-1-6 14:44:00',1,'qqqqqqqqqqwwwwwwwwwweeeeeeeeeerrrrrrrrrrtttttttttt','2013-1-7 14:44:00');
insert into sbtest(id,name,whenn,k,pad,whenn1) values (280,'junyue','2013-1-6 14:44:00',1,'qqqqqqqqqqwwwwwwwwwweeeeeeeeeerrrrrrrrrrtttttttttt','2013-1-7 14:44:00');
insert into sbtest(id,name,whenn,k,pad,whenn1) values (281,'junyue','2013-1-6 14:44:00',1,'qqqqqqqqqqwwwwwwwwwweeeeeeeeeerrrrrrrrrrtttttttttt','2013-1-7 14:44:00');
insert into sbtest(id,name,whenn,k,pad,whenn1) values (282,'junyue','2013-1-6 14:44:00',1,'qqqqqqqqqqwwwwwwwwwweeeeeeeeeerrrrrrrrrrtttttttttt','2013-1-7 14:44:00');
insert into sbtest(id,name,whenn,k,pad,whenn1) values (283,'junyue','2013-1-6 14:44:00',1,'qqqqqqqqqqwwwwwwwwwweeeeeeeeeerrrrrrrrrrtttttttttt','2013-1-7 14:44:00');
insert into sbtest(id,name,whenn,k,pad,whenn1) values (284,'junyue','2013-1-6 14:44:00',1,'qqqqqqqqqqwwwwwwwwwweeeeeeeeeerrrrrrrrrrtttttttttt','2013-1-7 14:44:00');
insert into sbtest(id,name,whenn,k,pad,whenn1) values (285,'junyue','2013-1-6 14:44:00',1,'qqqqqqqqqqwwwwwwwwwweeeeeeeeeerrrrrrrrrrtttttttttt','2013-1-7 14:44:00');
insert into sbtest(id,name,whenn,k,pad,whenn1) values (286,'junyue','2013-1-6 14:44:00',1,'qqqqqqqqqqwwwwwwwwwweeeeeeeeeerrrrrrrrrrtttttttttt','2013-1-7 14:44:00');
insert into sbtest(id,name,whenn,k,pad,whenn1) values (287,'junyue','2013-1-6 14:44:00',1,'qqqqqqqqqqwwwwwwwwwweeeeeeeeeerrrrrrrrrrtttttttttt','2013-1-7 14:44:00');
insert into sbtest(id,name,whenn,k,pad,whenn1) values (288,'junyue','2013-1-6 14:44:00',1,'qqqqqqqqqqwwwwwwwwwweeeeeeeeeerrrrrrrrrrtttttttttt','2013-1-7 14:44:00');
insert into sbtest(id,name,whenn,k,pad,whenn1) values (289,'junyue','2013-1-6 14:44:00',1,'qqqqqqqqqqwwwwwwwwwweeeeeeeeeerrrrrrrrrrtttttttttt','2013-1-7 14:44:00');
insert into sbtest(id,name,whenn,k,pad,whenn1) values (290,'junyue','2013-1-6 14:44:00',1,'qqqqqqqqqqwwwwwwwwwweeeeeeeeeerrrrrrrrrrtttttttttt','2013-1-7 14:44:00');
insert into sbtest(id,name,whenn,k,pad,whenn1) values (291,'junyue','2013-1-6 14:44:00',1,'qqqqqqqqqqwwwwwwwwwweeeeeeeeeerrrrrrrrrrtttttttttt','2013-1-7 14:44:00');
insert into sbtest(id,name,whenn,k,pad,whenn1) values (292,'junyue','2013-1-6 14:44:00',1,'qqqqqqqqqqwwwwwwwwwweeeeeeeeeerrrrrrrrrrtttttttttt','2013-1-7 14:44:00');
insert into sbtest(id,name,whenn,k,pad,whenn1) values (293,'junyue','2013-1-6 14:44:00',1,'qqqqqqqqqqwwwwwwwwwweeeeeeeeeerrrrrrrrrrtttttttttt','2013-1-7 14:44:00');
insert into sbtest(id,name,whenn,k,pad,whenn1) values (294,'junyue','2013-1-6 14:44:00',1,'qqqqqqqqqqwwwwwwwwwweeeeeeeeeerrrrrrrrrrtttttttttt','2013-1-7 14:44:00');
insert into sbtest(id,name,whenn,k,pad,whenn1) values (295,'junyue','2013-1-6 14:44:00',1,'qqqqqqqqqqwwwwwwwwwweeeeeeeeeerrrrrrrrrrtttttttttt','2013-1-7 14:44:00');
insert into sbtest(id,name,whenn,k,pad,whenn1) values (296,'junyue','2013-1-6 14:44:00',1,'qqqqqqqqqqwwwwwwwwwweeeeeeeeeerrrrrrrrrrtttttttttt','2013-1-7 14:44:00');
insert into sbtest(id,name,whenn,k,pad,whenn1) values (297,'junyue','2013-1-6 14:44:00',1,'qqqqqqqqqqwwwwwwwwwweeeeeeeeeerrrrrrrrrrtttttttttt','2013-1-7 14:44:00');
insert into sbtest(id,name,whenn,k,pad,whenn1) values (298,'junyue','2013-1-6 14:44:00',1,'qqqqqqqqqqwwwwwwwwwweeeeeeeeeerrrrrrrrrrtttttttttt','2013-1-7 14:44:00');
insert into sbtest(id,name,whenn,k,pad,whenn1) values (299,'junyue','2013-1-6 14:44:00',1,'qqqqqqqqqqwwwwwwwwwweeeeeeeeeerrrrrrrrrrtttttttttt','2013-1-7 14:44:00');
insert into sbtest(id,name,whenn,k,pad,whenn1) values (300,'junyue','2013-1-6 14:44:00',1,'qqqqqqqqqqwwwwwwwwwweeeeeeeeeerrrrrrrrrrtttttttttt','2013-1-7 14:44:00');
update sbtest set pad = 'qwt' where id = 1 and name = 'junyue' and whenn = '2013-1-6 14:44:00';
select * from sbtest where id = 1;
id	name	whenn	k	pad	whenn1	stat1
1	junyue	2013-01-06 14:44:00.000000	1	qwt	2013-01-07 14:44:00.000000	NULL
update sbtest set pad = 'qwt' where id = 6 and name = 'junyue' and whenn = '2013-1-6 14:44:00';
select * from sbtest where id = 6;
id	name	whenn	k	pad	whenn1	stat1
6	junyue	2013-01-06 14:44:00.000000	1	qwt	2013-01-07 14:44:00.000000	NULL
update sbtest set pad = 'qwt' where id = 11 and name = 'junyue' and whenn = '2013-1-6 14:44:00';
select * from sbtest where id = 11;
id	name	whenn	k	pad	whenn1	stat1
11	junyue	2013-01-06 14:44:00.000000	1	qwt	2013-01-07 14:44:00.000000	NULL
update sbtest set pad = 'qwt' where id = 16 and name = 'junyue' and whenn = '2013-1-6 14:44:00';
select * from sbtest where id = 16;
id	name	whenn	k	pad	whenn1	stat1
16	junyue	2013-01-06 14:44:00.000000	1	qwt	2013-01-07 14:44:00.000000	NULL
update sbtest set pad = 'qwt' where id = 21 and name = 'junyue' and whenn = '2013-1-6 14:44:00';
select * from sbtest where id = 21;
id	name	whenn	k	pad	whenn1	stat1
21	junyue	2013-01-06 14:44:00.000000	1	qwt	2013-01-07 14:44:00.000000	NULL
update sbtest set pad = 'qwt' where id = 26 and name = 'junyue' and whenn = '2013-1-6 14:44:00';
select * from sbtest where id = 26;
id	name	whenn	k	pad	whenn1	stat1
26	junyue	2013-01-06 14:44:00.000000	1	qwt	2013-01-07 14:44:00.000000	NULL
update sbtest set pad = 'qwt' where id = 31 and name = 'junyue' and whenn = '2013-1-6 14:44:00';
select * from sbtest where id = 31;
id	name	whenn	k	pad	whenn1	stat1
31	junyue	2013-01-06 14:44:00.000000	1	qwt	2013-01-07 14:44:00.000000	NULL
update sbtest set pad = 'qwt' where id = 36 and name = 'junyue' and whenn = '2013-1-6 14:44:00';
select * from sbtest where id = 36;
id	name	whenn	k	pad	whenn1	stat1
36	junyue	2013-01-06 14:44:00.000000	1	qwt	2013-01-07 14:44:00.000000	NULL
update sbtest set pad = 'qwt' where id = 41 and name = 'junyue' and whenn = '2013-1-6 14:44:00';
select * from sbtest where id = 41;
id	name	whenn	k	pad	whenn1	stat1
41	junyue	2013-01-06 14:44:00.000000	1	qwt	2013-01-07 14:44:00.000000	NULL
update sbtest set pad = 'qwt' where id = 46 and name = 'junyue' and whenn = '2013-1-6 14:44:00';
select * from sbtest where id = 46;
id	name	whenn	k	pad	whenn1	stat1
46	junyue	2013-01-06 14:44:00.000000	1	qwt	2013-01-07 14:44:00.000000	NULL
update sbtest set pad = 'qwt' where id = 51 and name = 'junyue' and whenn = '2013-1-6 14:44:00';
select * from sbtest where id = 51;
id	name	whenn	k	pad	whenn1	stat1
51	junyue	2013-01-06 14:44:00.000000	1	qwt	2013-01-07 14:44:00.000000	NULL
update sbtest set pad = 'qwt' where id = 56 and name = 'junyue' and whenn = '2013-1-6 14:44:00';
select * from sbtest where id = 56;
id	name	whenn	k	pad	whenn1	stat1
56	junyue	2013-01-06 14:44:00.000000	1	qwt	2013-01-07 14:44:00.000000	NULL
update sbtest set pad = 'qwt' where id = 61 and name = 'junyue' and whenn = '2013-1-6 14:44:00';
select * from sbtest where id = 61;
id	name	whenn	k	pad	whenn1	stat1
61	junyue	2013-01-06 14:44:00.000000	1	qwt	2013-01-07 14:44:00.000000	NULL
update sbtest set pad = 'qwt' where id = 66 and name = 'junyue' and whenn = '2013-1-6 14:44:00';
select * from sbtest where id = 66;
id	name	whenn	k	pad	whenn1	stat1
66	junyue	2013-01-06 14:44:00.000000	1	qwt	2013-01-07 14:44:00.000000	NULL
update sbtest set pad = 'qwt' where id = 71 and name = 'junyue' and whenn = '2013-1-6 14:44:00';
select * from sbtest where id = 71;
id	name	whenn	k	pad	whenn1	stat1
71	junyue	2013-01-06 14:44:00.000000	1	qwt	2013-01-07 14:44:00.000000	NULL
update sbtest set pad = 'qwt' where id = 76 and name = 'junyue' and whenn = '2013-1-6 14:44:00';
select * from sbtest where id = 76;
id	name	whenn	k	pad	whenn1	stat1
76	junyue	2013-01-06 14:44:00.000000	1	qwt	2013-01-07 14:44:00.000000	NULL
update sbtest set pad = 'qwt' where id = 81 and name = 'junyue' and whenn = '2013-1-6 14:44:00';
select * from sbtest where id = 81;
id	name	whenn	k	pad	whenn1	stat1
81	junyue	2013-01-06 14:44:00.000000	1	qwt	2013-01-07 14:44:00.000000	NULL
update sbtest set pad = 'qwt' where id = 86 and name = 'junyue' and whenn = '2013-1-6 14:44:00';
select * from sbtest where id = 86;
id	name	whenn	k	pad	whenn1	stat1
86	junyue	2013-01-06 14:44:00.000000	1	qwt	2013-01-07 14:44:00.000000	NULL
update sbtest set pad = 'qwt' where id = 91 and name = 'junyue' and whenn = '2013-1-6 14:44:00';
select * from sbtest where id = 91;
id	name	whenn	k	pad	whenn1	stat1
91	junyue	2013-01-06 14:44:00.000000	1	qwt	2013-01-07 14:44:00.000000	NULL
update sbtest set pad = 'qwt' where id = 96 and name = 'junyue' and whenn = '2013-1-6 14:44:00';
select * from sbtest where id = 96;
id	name	whenn	k	pad	whenn1	stat1
96	junyue	2013-01-06 14:44:00.000000	1	qwt	2013-01-07 14:44:00.000000	NULL
update sbtest set pad = 'qwt' where id = 101 and name = 'junyue' and whenn = '2013-1-6 14:44:00';
select * from sbtest where id = 101;
id	name	whenn	k	pad	whenn1	stat1
101	junyue	2013-01-06 14:44:00.000000	1	qwt	2013-01-07 14:44:00.000000	NULL
update sbtest set pad = 'qwt' where id = 106 and name = 'junyue' and whenn = '2013-1-6 14:44:00';
select * from sbtest where id = 106;
id	name	whenn	k	pad	whenn1	stat1
106	junyue	2013-01-06 14:44:00.000000	1	qwt	2013-01-07 14:44:00.000000	NULL
update sbtest set pad = 'qwt' where id = 111 and name = 'junyue' and whenn = '2013-1-6 14:44:00';
select * from sbtest where id = 111;
id	name	whenn	k	pad	whenn1	stat1
111	junyue	2013-01-06 14:44:00.000000	1	qwt	2013-01-07 14:44:00.000000	NULL
update sbtest set pad = 'qwt' where id = 116 and name = 'junyue' and whenn = '2013-1-6 14:44:00';
select * from sbtest where id = 116;
id	name	whenn	k	pad	whenn1	stat1
116	junyue	2013-01-06 14:44:00.000000	1	qwt	2013-01-07 14:44:00.000000	NULL
update sbtest set pad = 'qwt' where id = 121 and name = 'junyue' and whenn = '2013-1-6 14:44:00';
select * from sbtest where id = 121;
id	name	whenn	k	pad	whenn1	stat1
121	junyue	2013-01-06 14:44:00.000000	1	qwt	2013-01-07 14:44:00.000000	NULL
update sbtest set pad = 'qwt' where id = 126 and name = 'junyue' and whenn = '2013-1-6 14:44:00';
select * from sbtest where id = 126;
id	name	whenn	k	pad	whenn1	stat1
126	junyue	2013-01-06 14:44:00.000000	1	qwt	2013-01-07 14:44:00.000000	NULL
update sbtest set pad = 'qwt' where id = 131 and name = 'junyue' and whenn = '2013-1-6 14:44:00';
select * from sbtest where id = 131;
id	name	whenn	k	pad	whenn1	stat1
131	junyue	2013-01-06 14:44:00.000000	1	qwt	2013-01-07 14:44:00.000000	NULL
update sbtest set pad = 'qwt' where id = 136 and name = 'junyue' and whenn = '2013-1-6 14:44:00';
select * from sbtest where id = 136;
id	name	whenn	k	pad	whenn1	stat1
136	junyue	2013-01-06 14:44:00.000000	1	qwt	2013-01-07 14:44:00.000000	NULL
update sbtest set pad = 'qwt' where id = 141 and name = 'junyue' and whenn = '2013-1-6 14:44:00';
select * from sbtest where id = 141;
id	name	whenn	k	pad	whenn1	stat1
141	junyue	2013-01-06 14:44:00.000000	1	qwt	2013-01-07 14:44:00.000000	NULL
update sbtest set pad = 'qwt' where id = 146 and name = 'junyue' and whenn = '2013-1-6 14:44:00';
select * from sbtest where id = 146;
id	name	whenn	k	pad	whenn1	stat1
146	junyue	2013-01-06 14:44:00.000000	1	qwt	2013-01-07 14:44:00.000000	NULL
update sbtest set pad = 'qwt' where id = 151 and name = 'junyue' and whenn = '2013-1-6 14:44:00';
select * from sbtest where id = 151;
id	name	whenn	k	pad	whenn1	stat1
151	junyue	2013-01-06 14:44:00.000000	1	qwt	2013-01-07 14:44:00.000000	NULL
update sbtest set pad = 'qwt' where id = 156 and name = 'junyue' and whenn = '2013-1-6 14:44:00';
select * from sbtest where id = 156;
id	name	whenn	k	pad	whenn1	stat1
156	junyue	2013-01-06 14:44:00.000000	1	qwt	2013-01-07 14:44:00.000000	NULL
update sbtest set pad = 'qwt' where id = 161 and name = 'junyue' and whenn = '2013-1-6 14:44:00';
select * from sbtest where id = 161;
id	name	whenn	k	pad	whenn1	stat1
161	junyue	2013-01-06 14:44:00.000000	1	qwt	2013-01-07 14:44:00.000000	NULL
update sbtest set pad = 'qwt' where id = 166 and name = 'junyue' and whenn = '2013-1-6 14:44:00';
select * from sbtest where id = 166;
id	name	whenn	k	pad	whenn1	stat1
166	junyue	2013-01-06 14:44:00.000000	1	qwt	2013-01-07 14:44:00.000000	NULL
update sbtest set pad = 'qwt' where id = 171 and name = 'junyue' and whenn = '2013-1-6 14:44:00';
select * from sbtest where id = 171;
id	name	whenn	k	pad	whenn1	stat1
171	junyue	2013-01-06 14:44:00.000000	1	qwt	2013-01-07 14:44:00.000000	NULL
update sbtest set pad = 'qwt' where id = 176 and name = 'junyue' and whenn = '2013-1-6 14:44:00';
select * from sbtest where id = 176;
id	name	whenn	k	pad	whenn1	stat1
176	junyue	2013-01-06 14:44:00.000000	1	qwt	2013-01-07 14:44:00.000000	NULL
update sbtest set pad = 'qwt' where id = 181 and name = 'junyue' and whenn = '2013-1-6 14:44:00';
select * from sbtest where id = 181;
id	name	whenn	k	pad	whenn1	stat1
181	junyue	2013-01-06 14:44:00.000000	1	qwt	2013-01-07 14:44:00.000000	NULL
update sbtest set pad = 'qwt' where id = 186 and name = 'junyue' and whenn = '2013-1-6 14:44:00';
select * from sbtest where id = 186;
id	name	whenn	k	pad	whenn1	stat1
186	junyue	2013-01-06 14:44:00.000000	1	qwt	2013-01-07 14:44:00.000000	NULL
update sbtest set pad = 'qwt' where id = 191 and name = 'junyue' and whenn = '2013-1-6 14:44:00';
select * from sbtest where id = 191;
id	name	whenn	k	pad	whenn1	stat1
191	junyue	2013-01-06 14:44:00.000000	1	qwt	2013-01-07 14:44:00.000000	NULL
update sbtest set pad = 'qwt' where id = 196 and name = 'junyue' and whenn = '2013-1-6 14:44:00';
select * from sbtest where id = 196;
id	name	whenn	k	pad	whenn1	stat1
196	junyue	2013-01-06 14:44:00.000000	1	qwt	2013-01-07 14:44:00.000000	NULL
update sbtest set pad = 'qwt' where id = 201 and name = 'junyue' and whenn = '2013-1-6 14:44:00';
select * from sbtest where id = 201;
id	name	whenn	k	pad	whenn1	stat1
201	junyue	2013-01-06 14:44:00.000000	1	qwt	2013-01-07 14:44:00.000000	NULL
update sbtest set pad = 'qwt' where id = 206 and name = 'junyue' and whenn = '2013-1-6 14:44:00';
select * from sbtest where id = 206;
id	name	whenn	k	pad	whenn1	stat1
206	junyue	2013-01-06 14:44:00.000000	1	qwt	2013-01-07 14:44:00.000000	NULL
update sbtest set pad = 'qwt' where id = 211 and name = 'junyue' and whenn = '2013-1-6 14:44:00';
select * from sbtest where id = 211;
id	name	whenn	k	pad	whenn1	stat1
211	junyue	2013-01-06 14:44:00.000000	1	qwt	2013-01-07 14:44:00.000000	NULL
update sbtest set pad = 'qwt' where id = 216 and name = 'junyue' and whenn = '2013-1-6 14:44:00';
select * from sbtest where id = 216;
id	name	whenn	k	pad	whenn1	stat1
216	junyue	2013-01-06 14:44:00.000000	1	qwt	2013-01-07 14:44:00.000000	NULL
update sbtest set pad = 'qwt' where id = 221 and name = 'junyue' and whenn = '2013-1-6 14:44:00';
select * from sbtest where id = 221;
id	name	whenn	k	pad	whenn1	stat1
221	junyue	2013-01-06 14:44:00.000000	1	qwt	2013-01-07 14:44:00.000000	NULL
update sbtest set pad = 'qwt' where id = 226 and name = 'junyue' and whenn = '2013-1-6 14:44:00';
select * from sbtest where id = 226;
id	name	whenn	k	pad	whenn1	stat1
226	junyue	2013-01-06 14:44:00.000000	1	qwt	2013-01-07 14:44:00.000000	NULL
update sbtest set pad = 'qwt' where id = 231 and name = 'junyue' and whenn = '2013-1-6 14:44:00';
select * from sbtest where id = 231;
id	name	whenn	k	pad	whenn1	stat1
231	junyue	2013-01-06 14:44:00.000000	1	qwt	2013-01-07 14:44:00.000000	NULL
update sbtest set pad = 'qwt' where id = 236 and name = 'junyue' and whenn = '2013-1-6 14:44:00';
select * from sbtest where id = 236;
id	name	whenn	k	pad	whenn1	stat1
236	junyue	2013-01-06 14:44:00.000000	1	qwt	2013-01-07 14:44:00.000000	NULL
update sbtest set pad = 'qwt' where id = 241 and name = 'junyue' and whenn = '2013-1-6 14:44:00';
select * from sbtest where id = 241;
id	name	whenn	k	pad	whenn1	stat1
241	junyue	2013-01-06 14:44:00.000000	1	qwt	2013-01-07 14:44:00.000000	NULL
update sbtest set pad = 'qwt' where id = 246 and name = 'junyue' and whenn = '2013-1-6 14:44:00';
select * from sbtest where id = 246;
id	name	whenn	k	pad	whenn1	stat1
246	junyue	2013-01-06 14:44:00.000000	1	qwt	2013-01-07 14:44:00.000000	NULL
update sbtest set pad = 'qwt' where id = 251 and name = 'junyue' and whenn = '2013-1-6 14:44:00';
select * from sbtest where id = 251;
id	name	whenn	k	pad	whenn1	stat1
251	junyue	2013-01-06 14:44:00.000000	1	qwt	2013-01-07 14:44:00.000000	NULL
update sbtest set pad = 'qwt' where id = 256 and name = 'junyue' and whenn = '2013-1-6 14:44:00';
select * from sbtest where id = 256;
id	name	whenn	k	pad	whenn1	stat1
256	junyue	2013-01-06 14:44:00.000000	1	qwt	2013-01-07 14:44:00.000000	NULL
update sbtest set pad = 'qwt' where id = 261 and name = 'junyue' and whenn = '2013-1-6 14:44:00';
select * from sbtest where id = 261;
id	name	whenn	k	pad	whenn1	stat1
261	junyue	2013-01-06 14:44:00.000000	1	qwt	2013-01-07 14:44:00.000000	NULL
update sbtest set pad = 'qwt' where id = 266 and name = 'junyue' and whenn = '2013-1-6 14:44:00';
select * from sbtest where id = 266;
id	name	whenn	k	pad	whenn1	stat1
266	junyue	2013-01-06 14:44:00.000000	1	qwt	2013-01-07 14:44:00.000000	NULL
update sbtest set pad = 'qwt' where id = 271 and name = 'junyue' and whenn = '2013-1-6 14:44:00';
select * from sbtest where id = 271;
id	name	whenn	k	pad	whenn1	stat1
271	junyue	2013-01-06 14:44:00.000000	1	qwt	2013-01-07 14:44:00.000000	NULL
update sbtest set pad = 'qwt' where id = 276 and name = 'junyue' and whenn = '2013-1-6 14:44:00';
select * from sbtest where id = 276;
id	name	whenn	k	pad	whenn1	stat1
276	junyue	2013-01-06 14:44:00.000000	1	qwt	2013-01-07 14:44:00.000000	NULL
update sbtest set pad = 'qwt' where id = 281 and name = 'junyue' and whenn = '2013-1-6 14:44:00';
select * from sbtest where id = 281;
id	name	whenn	k	pad	whenn1	stat1
281	junyue	2013-01-06 14:44:00.000000	1	qwt	2013-01-07 14:44:00.000000	NULL
update sbtest set pad = 'qwt' where id = 286 and name = 'junyue' and whenn = '2013-1-6 14:44:00';
select * from sbtest where id = 286;
id	name	whenn	k	pad	whenn1	stat1
286	junyue	2013-01-06 14:44:00.000000	1	qwt	2013-01-07 14:44:00.000000	NULL
update sbtest set pad = 'qwt' where id = 291 and name = 'junyue' and whenn = '2013-1-6 14:44:00';
select * from sbtest where id = 291;
id	name	whenn	k	pad	whenn1	stat1
291	junyue	2013-01-06 14:44:00.000000	1	qwt	2013-01-07 14:44:00.000000	NULL
update sbtest set pad = 'qwt' where id = 296 and name = 'junyue' and whenn = '2013-1-6 14:44:00';
select * from sbtest where id = 296;
id	name	whenn	k	pad	whenn1	stat1
296	junyue	2013-01-06 14:44:00.000000	1	qwt	2013-01-07 14:44:00.000000	NULL
drop table sbtest;
