create database rowkey_database;
using database rowkey_database;
drop table if exists t;
create table if not exists t(id1 int,id2 bigint,id3 datetime,id4 varchar(30),id5 bool,id6 decimal(10,1),id7 double,id8 float,id9 int,col1 int,col2 bigint,col3 datetime,col4 varchar(30),col5 bool,col6 decimal(10,1),col7 double,col8 float,primary key(id1,id2,id3,id4,id5,id6,id7,id8,id9));
replace into t values(0,1,'1000-10-10 10:10:10','aaa',true,1.1,2.2,3.3,1,2,3,'1000-10-10 10:10:10','bbb',true,1.1,2.2,3.3);
replace into t values(1,1,'1000-10-10 10:10:10','aaa',true,1.1,2.2,3.3,1,2,3,'1000-10-10 10:10:10','bbb',true,1.1,2.2,3.3);
replace into t values(2,1,'1000-10-10 10:10:10','aaa',true,1.1,2.2,3.3,1,2,3,'1000-10-10 10:10:10','bbb',true,1.1,2.2,3.3);
update t set id1=2,id2=1,col1=0,col2=0,col3='1111-11-11 11:11:11',col4='000',col5=0,col6=0.0,col7=0.0,col8=0.0 where id1=0 and id2=1 and id3 ='1000-10-10 10:10:10' and id4='aaa' and id5=true and id6=1.1 and id7=2.2 and id8='3.3' and id9=1;
ERROR 25S03: YAO-119: Duplicated primary key, error code = -5024
select * from t;
id1	id2	id3	id4	id5	id6	id7	id8	id9	col1	col2	col3	col4	col5	col6	col7	col8
0	1	1000-10-10 10:10:10.000000	aaa	1	1.1	2.2	3.3	1	2	3	1000-10-10 10:10:10.000000	bbb	1	1.1	2.2	3.3
1	1	1000-10-10 10:10:10.000000	aaa	1	1.1	2.2	3.3	1	2	3	1000-10-10 10:10:10.000000	bbb	1	1.1	2.2	3.3
2	1	1000-10-10 10:10:10.000000	aaa	1	1.1	2.2	3.3	1	2	3	1000-10-10 10:10:10.000000	bbb	1	1.1	2.2	3.3
drop table t;
create table if not exists t(id1 int,id2 bigint,id3 datetime,id4 varchar(30),id5 bool,id6 decimal(10,1),id7 double,id8 float,id9 int,col1 int,col2 bigint,col3 datetime,col4 varchar(30),col5 bool,col6 decimal(10,1),col7 double,col8 float,primary key(id1,id2,id3,id4,id5,id6,id7,id8,id9));
replace into t values(0,1,'1000-10-10 10:10:10','aaa',true,1.1,2.2,3.3,1,2,3,'1000-10-10 10:10:10','bbb',true,1.1,2.2,3.3);
replace into t values(1,1,'1000-10-10 10:10:10','aaa',true,1.1,2.2,3.3,1,2,3,'1000-10-10 10:10:10','bbb',true,1.1,2.2,3.3);
replace into t values(2,1,'1000-10-10 10:10:10','aaa',true,1.1,2.2,3.3,1,2,3,'1000-10-10 10:10:10','bbb',true,1.1,2.2,3.3);
update t set id1=2,id2=1,id3='1000-10-10 10:10:10',id4='aaa',id5=true,id6=1.1,id7=2.2,id8='3.3',id9=1,col1=0,col2=0,col3='1111-11-11 11:11:11',col4='000',col5=0,col6=0.0,col7=0.0,col8=0.0 where id1=0 and id2=1 and id3 ='1000-10-10 10:10:10' and id4='aaa' and id5=true and id6=1.1 and id7=2.2 and id8='3.3' and id9=1;
ERROR 25S03: YAO-119: Duplicated primary key, error code = -5024
select * from t;
id1	id2	id3	id4	id5	id6	id7	id8	id9	col1	col2	col3	col4	col5	col6	col7	col8
0	1	1000-10-10 10:10:10.000000	aaa	1	1.1	2.2	3.3	1	2	3	1000-10-10 10:10:10.000000	bbb	1	1.1	2.2	3.3
1	1	1000-10-10 10:10:10.000000	aaa	1	1.1	2.2	3.3	1	2	3	1000-10-10 10:10:10.000000	bbb	1	1.1	2.2	3.3
2	1	1000-10-10 10:10:10.000000	aaa	1	1.1	2.2	3.3	1	2	3	1000-10-10 10:10:10.000000	bbb	1	1.1	2.2	3.3
drop table t;
create table if not exists t(id1 int,id2 bigint,id3 datetime,id4 varchar(30),id5 bool,id6 decimal(10,1),id7 double,id8 float,id9 int,col1 int,col2 bigint,col3 datetime,col4 varchar(30),col5 bool,col6 decimal(10,1),col7 double,col8 float,primary key(id1,id2,id3,id4,id5,id6,id7,id8,id9));
replace into t values(0,1,'1000-10-10 10:10:10','aaa',true,1.1,2.2,3.3,1,2,3,'1000-10-10 10:10:10','bbb',true,1.1,2.2,3.3);
replace into t values(1,1,'1000-10-10 10:10:10','aaa',true,1.1,2.2,3.3,1,2,3,'1000-10-10 10:10:10','bbb',true,1.1,2.2,3.3);
replace into t values(2,1,'1000-10-10 10:10:10','aaa',true,1.1,2.2,3.3,1,2,3,'1000-10-10 10:10:10','bbb',true,1.1,2.2,3.3);
update t set id1=9,id2=9,id3='1111-11-11 11:11:11',id4='000',id5=0,id6=0.0,id7=0.0,id8=0.0 ,id9=0,col1=0,col2=0,col3='1111-11-11 11:11:11',col4='000',col5=0,col6=0.0,col7=0.0,col8=0.0 where id1>=0;
ERROR 25S03: YAO-119: Duplicated primary key, error code = -5024
select * from t;
id1	id2	id3	id4	id5	id6	id7	id8	id9	col1	col2	col3	col4	col5	col6	col7	col8
0	1	1000-10-10 10:10:10.000000	aaa	1	1.1	2.2	3.3	1	2	3	1000-10-10 10:10:10.000000	bbb	1	1.1	2.2	3.3
1	1	1000-10-10 10:10:10.000000	aaa	1	1.1	2.2	3.3	1	2	3	1000-10-10 10:10:10.000000	bbb	1	1.1	2.2	3.3
2	1	1000-10-10 10:10:10.000000	aaa	1	1.1	2.2	3.3	1	2	3	1000-10-10 10:10:10.000000	bbb	1	1.1	2.2	3.3
drop table t;
create table if not exists t(id1 int,id2 bigint,id3 datetime,id4 varchar(30),id5 bool,id6 decimal(10,1),id7 double,id8 float,id9 int,col1 int,col2 bigint,col3 datetime,col4 varchar(30),col5 bool,col6 decimal(10,1),col7 double,col8 float,primary key(id1,id2,id3,id4,id5,id6,id7,id8,id9));
replace into t values(0,1,'1000-10-10 10:10:10','aaa',true,1.1,2.2,3.3,1,2,3,'1000-10-10 10:10:10','bbb',true,1.1,2.2,3.3);
replace into t values(1,1,'1000-10-10 10:10:10','aaa',true,1.1,2.2,3.3,1,2,3,'1000-10-10 10:10:10','bbb',true,1.1,2.2,3.3);
replace into t values(2,1,'1000-10-10 10:10:10','aaa',true,1.1,2.2,3.3,1,2,3,'1000-10-10 10:10:10','bbb',true,1.1,2.2,3.3);
update t set id1=9,id3='1111-11-11 11:11:11',id5=0,id7=0.0 ,id9=0,col2=0,col4='000',col6=0.0,col8=0.0 where id1>=0;
ERROR 25S03: YAO-119: Duplicated primary key, error code = -5024
select * from t;
id1	id2	id3	id4	id5	id6	id7	id8	id9	col1	col2	col3	col4	col5	col6	col7	col8
0	1	1000-10-10 10:10:10.000000	aaa	1	1.1	2.2	3.3	1	2	3	1000-10-10 10:10:10.000000	bbb	1	1.1	2.2	3.3
1	1	1000-10-10 10:10:10.000000	aaa	1	1.1	2.2	3.3	1	2	3	1000-10-10 10:10:10.000000	bbb	1	1.1	2.2	3.3
2	1	1000-10-10 10:10:10.000000	aaa	1	1.1	2.2	3.3	1	2	3	1000-10-10 10:10:10.000000	bbb	1	1.1	2.2	3.3
drop table t;
create table  t(id1 int primary key,col1 int);
replace into t values(0,0);
replace into t values(1,0);
replace into t values(2,0);
update t set id1=col1 where id1>=0;
ERROR 25S03: YAO-119: Duplicated primary key, error code = -5024
select * from t;
id1	col1
0	0
1	0
2	0
drop table t;
create table  t(id1 int primary key,col1 int);
replace into t values(0,0);
update t set id1=id1+1,id1=2,col1=1 where id1=0;
select * from t;
id1	col1
2	1
drop table t;
create table  t(id1 int primary key,col1 int);
replace into t values(0,0);
replace into t values(1,0);
replace into t values(2,0);
update t set id1=id1+10,id1=10 where id1>=0;
ERROR 25S03: YAO-119: Duplicated primary key, error code = -5024
select * from t;
id1	col1
0	0
1	0
2	0
drop table t;
