ALTER SYSTEM SET merge_delay_interval='6s' server_type=yaodatasvr;
ALTER SYSTEM SET major_freeze_wait_time='6s' server_type=yaoadminsvr;
ALTER SYSTEM SET  min_major_freeze_interval='5s' server_type=yaotxnsvr;
ALTER SYSTEM SET min_merge_interval='5s' server_type=yaodatasvr;
ALTER SYSTEM SET  max_merge_thread_num='20' server_type=yaodatasvr;
drop table if exists t1;
create table t1(c1 decimal(10,5) primary key, c2 decimal(10,5));
insert into t1 values(1234.56781, 1234.43211);
insert into t1 values(1234.56782, 1234.43212);
insert into t1 values(1234.56783, 1234.43213);
insert into t1 values(1234.56784, 1234.43214);
insert into t1 values(1234.56785, 1234.43215);
select * from t1;
c1	c2
1234.56781	1234.43211
1234.56782	1234.43212
1234.56783	1234.43213
1234.56784	1234.43214
1234.56785	1234.43215
select * from t1 where c1 = 1234.56781;
c1	c2
1234.56781	1234.43211
select * from t1 where c2 = 1234.43211;
c1	c2
1234.56781	1234.43211
select * from t1 where c1 between 1234.56781 and 1234.56784;
c1	c2
1234.56781	1234.43211
1234.56782	1234.43212
1234.56783	1234.43213
1234.56784	1234.43214
select * from t1 where c1 between 1234.56781 and 1234.56783;
c1	c2
1234.56781	1234.43211
1234.56782	1234.43212
1234.56783	1234.43213
create table t2(c1 decimal(10,3) primary key, c2 decimal(10,3), c3 decimal(10,3), c4 decimal(10,3));
replace into t2 values(1.23, 1.23, 1.23, 1.23), (2.34, 2.34, 2.34, 2.34), (3.45, 3.45, 3.45, 3.45), (4.56, 4.56, 4.56, 4.56);
select * from t2;
c1	c2	c3	c4
1.23	1.23	1.23	1.23
2.34	2.34	2.34	2.34
3.45	3.45	3.45	3.45
4.56	4.56	4.56	4.56
drop table if exists t2;
create table t2(c1 decimal(10,3) primary key, c2 decimal(10,3), c3 decimal(10,3), c4 decimal(10,3));
replace into t2 values(1.23, 1.23, 1.23, 1.23), (2.34, 2.34, 2.34, 2.34), (3.45, 3.45, 3.45, 3.45), (4.56, 4.56, 4.56, 4.56);
select * from t2;
c1	c2	c3	c4
1.23	1.23	1.23	1.23
2.34	2.34	2.34	2.34
3.45	3.45	3.45	3.45
4.56	4.56	4.56	4.56
delete from t2 where c1 > 1;
select * from t2;
c1	c2	c3	c4
replace into t2 values(1.23, 1.23, 1.23, 1.23), (2.34, 2.34, 2.34, 2.34), (3.45, 3.45, 3.45, 3.45), (4.56, 4.56, 4.56, 4.56);
select * from t2;
c1	c2	c3	c4
1.23	1.23	1.23	1.23
2.34	2.34	2.34	2.34
3.45	3.45	3.45	3.45
4.56	4.56	4.56	4.56
delete from t2 where c1 > 1.0;
select * from t2;
c1	c2	c3	c4
drop table if exists t2;
create table t2(c1 decimal(10,3) primary key, c2 decimal(10,3), c3 decimal(10,3), c4 decimal(10,3));
replace into t2 values(1.23, 1.23, 1.23, 1.23), (2.34, 2.34, 2.34, 2.34), (3.45, 3.45, 3.45, 3.45), (4.56, 4.56, 4.56, 4.56);
select * from t2;
c1	c2	c3	c4
1.23	1.23	1.23	1.23
2.34	2.34	2.34	2.34
3.45	3.45	3.45	3.45
4.56	4.56	4.56	4.56
delete from t2 where c2 > 1;
select * from t2;
c1	c2	c3	c4
replace into t2 values(1.23, 1.23, 1.23, 1.23), (2.34, 2.34, 2.34, 2.34), (3.45, 3.45, 3.45, 3.45), (4.56, 4.56, 4.56, 4.56);
select * from t2;
c1	c2	c3	c4
1.23	1.23	1.23	1.23
2.34	2.34	2.34	2.34
3.45	3.45	3.45	3.45
4.56	4.56	4.56	4.56
delete from t2 where c2 > 1.0;
select * from t2;
c1	c2	c3	c4
drop table if exists t2;
create table t2(c1 decimal(10,3) primary key, c2 decimal(10,3), c3 decimal(10,3), c4 decimal(10,3));
select * from t2;
c1	c2	c3	c4
create index i1 on t2(c2);
create index i2 on t2(c3);
merge
major_freeze...
merge: DONE
show index on t2;
index_name	status	index_type
__3005__idx__i1	1	0
__3005__idx__i2	1	0
delete from t2 where c2 > 3;
select * from t2;
c1	c2	c3	c4
delete from t2 where c2 > 2.0;
select * from t2;
c1	c2	c3	c4
delete from t2 where c2 = 2.34;
select * from t2;
c1	c2	c3	c4
delete from t2 where c2 = 1.2300;
select * from t2;
c1	c2	c3	c4
